Date|Sold to|Ship to|Ship to name|ContractType|Description|Volume(MMSCFD)|DemandPlan(BI)|MDCQ(BW)|Billing Type
10-31-2020|0010007766|0030000094|บริษัท อินโดรามา ปิโตรเคม จำกัด|152|Industrial-CoGen|0.4722634|663.15|0.71|AMR
10-31-2020|0010008289|0030015477|บริษัท ดี-รับเบอร์ โปรดักส์ จำกัด|151|Industrial|0.0000|663.15|0.032|AMR
10-31-2020|0010008928|0030018387|บริษัท หลุยส์ผลิตภัณท์กาวเทป จำกัด|151|Industrial|0.3187151|663.15|0.278|AMR
10-31-2020|0010009177|0030019562|บริษัท สยามโกชิ มานูแฟคเชอริ่ง จำกั|151|Industrial|0.1166091|663.15|0.078|AMR
10-31-2020|0010009180|0030019567|บริษัท ไทย มาลายา กลาส จำกัด|151|Industrial|2.5923461|663.15|2.708|AMR
10-31-2020|0010009584|0030020740|บริษัท เจลลี เบลลี แคนดี้ คอมปานี (ประเทศไทย) จำกัด|151|Industrial|0.0806234|663.15|0.082|AMR
10-31-2020|0010009598|0030053139|บมจ.เอเชียน อินซูเลเตอร์|151|Industrial|0.263942|663.15|0.264|AMR
10-31-2020|0010010220|0030023100|บริษัท เอส ไอ ดับบลิว (ไทยแลนด์) จำกัด|151|Industrial|0.1480039|663.15|0.097|AMR
10-31-2020|0010012320|0030000168|บริษัท พีทีที โกลบอล เคมิคอล จำกัด(มหาชน)|151|Industrial|0.0000353|663.15|1.62|AMR
10-31-2020|0010012320|0030021481|บริษัท พีทีที โกลบอล เคมิคอล จำกัด(มหาชน)|151|Industrial|21.68503|663.15|13.737|ADQ
10-31-2020|0010012440|0030033600|บริษัท นูทริกซ์ จำกัด (มหาชน)|151|Industrial|0.2191277|663.15|0.198|AMR
10-31-2020|0010021265|0030000095|บริษัท เอ็นเอส-สยามยูไนเต็ดสตีล จำกัด|151|Industrial|3.484007|663.15|1.533|AMR
10-31-2020|0010022812|0030020778|บริษัท โกลบอล เพาเวอร์ ซินเนอร์ยี่จำกัด (มหาชน)|152|Industrial-CoGen|22.5898449|663.15|20.861|FlowComp
10-31-2020|0010024039|0030050402|บริษัท สุเพิร์บ พาวเวอร์ จำกัด|152|Industrial-CoGen|0.0058269|663.15|0.343|AMR
10-31-2020|0010024055|0030057123|บจ.โอจีพี เอนเนอร์ยี่ โซลูชั่นส์ (สำหรับ บจ.ซึชิโยชิ สมบูรณ์ โคเตทแซนด์)|151|Industrial|0.1502993|663.15|0.084|AMR
10-31-2020|0010027295|0030059173|บมจ.ปตท. น้ำมันและการค้าปลีก|158|NG by Truck|0.16407|663.15|0.20|ADQ
10-31-2020|0010027315|0030057427|บริษัท นิชินโบะ สมบูรณ์ ออโตโมทีฟ จำกัด|151|Industrial|0.0031783|663.15|0.013|AMR
10-31-2020|0010027861|0030046657|บริษัท เอสซีจี เซรามิกส์ จำกัด (มหาชน)|151|Industrial|0.2785623|663.15|0.175|AMR
10-31-2020|0010027938|0030059837|บริษัท ราชบุรีกล๊าส อินดัสทรี จำกัด|151|Industrial|2.0220137|663.15|1.604|AMR
10-31-2020|0010000006|0030000006|บริษัท ธนอินเตอร์ จำกัด|151|Industrial|0.0000|663.15|0.011|AMR
10-31-2020|0010000007|0030000007|บริษัท บี เอ็น เอส เอส สตีลกรุ๊ป จำกัด|151|Industrial|0.6641282|663.15|0.261|AMR
10-31-2020|0010000016|0030000100|บริษัท ลิกซิล (ประเทศไทย) จำกัด (มหาชน)|151|Industrial|0.3288151|663.15|0.178|AMR
10-31-2020|0010000028|0030000028|บริษัท เฟอร์โร (ประเทศไทย) จำกัด|151|Industrial|0.3701686|663.15|0.404|AMR
10-31-2020|0010000030|0030000030|บริษัท ภัทราพอร์ซเลน จำกัด|151|Industrial|0.2731945|663.15|0.471|AMR
10-31-2020|0010000039|0030000039|บริษัท โสสุโก้ เซรามิค จำกัด|151|Industrial|2.3542897|663.15|1.763|AMR
10-31-2020|0010000041|0030000041|บริษัท สยามอุตสาหกรรมยิปซัม (สระบุรี) จำกัด|151|Industrial|3.8679484|663.15|2.401|AMR
10-31-2020|0010000054|0030000054|บริษัท บางกอก คริสตัล จำกัด|151|Industrial|0.8767933|663.15|0.841|AMR
10-31-2020|0010000068|0030000068|บริษัท เหล็กสยามยามาโตะ จำกัด|151|Industrial|2.8068123|663.15|2.302|AMR
10-31-2020|0010000082|0030000082|บริษัท สยามโทซู เซรามิกส์ จำกัด|151|Industrial|0.0421657|663.15|0.051|AMR
10-31-2020|0010000083|0030000083|บริษัท เอจีซี แฟลทกลาส (ประเทศไทย)จำกัด (มหาชน)|151|Industrial|3.2889286|663.15|3.096|AMR
10-31-2020|0010000092|0030000092|บริษัท ไทย-สแกนดิค สตีล จำกัด|151|Industrial|0.056115|663.15|0.059|AMR
10-31-2020|0010000093|0030000093|บริษัท จีซี-เอ็ม พีทีเอ จำกัด|151|Industrial|1.7079954|663.15|2.59|AMR
10-31-2020|0010000110|0030000114|บริษัท ระยอง กัลวาไนซิ่ง จำกัด|151|Industrial|0.0631779|663.15|0.059|AMR
10-31-2020|0010000123|0030000127|บริษัท สยามซานิทารีแวร์อินดัสทรี (หนองแค) จำกัด|151|Industrial|0.4678491|663.15|0.404|AMR
10-31-2020|0010000125|0030000129|บริษัท อาร์พีที เอเซีย จำกัด|151|Industrial|0.0255678|663.15|0.035|AMR
10-31-2020|0010000134|0030000139|บริษัท วันไทยอุตสาหกรรมการอาหาร จำกัด|151|Industrial|1.2907875|663.15|0.951|AMR
10-31-2020|0010000134|0030056618|บริษัท วันไทยอุตสาหกรรมการอาหาร จำกัด|151|Industrial|0.2680385|663.15|0.208|AMR
10-31-2020|0010000135|0030000140|บริษัท รอนเด็กซ์ (ประเทศไทย) จำกัด|151|Industrial|0.0000|663.15|0.023|AMR
10-31-2020|0010000149|0030000154|บริษัท เอเวอรี่ เดนนิสสัน (ประเทศไทย) จำกัด|151|Industrial|0.1907346|663.15|0.116|AMR
10-31-2020|0010000161|0030000167|บริษัท ไทยซัมซุง อิเลคโทรนิคส์ จำกัด|151|Industrial|0.0000|663.15|0.282|AMR
10-31-2020|0010000201|0030000021|บริษัท อดิตยา เบอร์ล่า เคมีคัลส์ (ประเทศไทย) จำกัด (ซัลไฟท์ส ดีวิชั่น)|151|Industrial|0.0653321|663.15|0.081|AMR
10-31-2020|0010000201|0030000234|บริษัท อดิตยา เบอร์ล่า เคมีคัลส์ (ประเทศไทย) จำกัด(คลออัลคาลีดีวิชั่น)|151|Industrial|0.038387|663.15|0.029|AMR
10-31-2020|0010000224|0030000250|บริษัท ออมโนวา เอ็นจิเนียร์ด เซอร์เฟสเซส (ประเทศไทย) จำกัด|151|Industrial|0.323412|663.15|0.233|AMR
10-31-2020|0010000225|0030000251|บริษัท ซีพีพีซี จำกัด (มหาชน)|151|Industrial|0.1273448|663.15|0.124|AMR
10-31-2020|0010001125|0030039301|บริษัท ไทยโพลีอะซีทัล จำกัด|151|Industrial|0.0635664|663.15|0.087|AMR
10-31-2020|0010001727|0030020317|บริษัท ไทยเซ็นทรัลเคมี จำกัด (มหาชน)|152|Industrial-CoGen|0.0000|663.15|0.275|AMR
10-31-2020|0010001913|0030020312|บริษัท เหล่าธงสิงห์ จำกัด|151|Industrial|0.0000|663.15|0.051|AMR
10-31-2020|0010006257|0030022426|บริษัท ออโต้อัลลายแอนซ์ (ประเทศไทย)จำกัด|151|Industrial|0.2446602|663.15|0.281|AMR
10-31-2020|0010006271|0030008801|บริษัท ริเวอร์โปร์ พัลพ แอนด์เพเพอร์ จำกัด|151|Industrial|0.0000|663.15|0.099|AMR
10-31-2020|0010006939|0030011133|บริษัท นิเด็ค ค็อมโปเน็นท์ เทคโนโลยี (ไทยแลนด์) จำกัด|151|Industrial|0.4708155|663.15|0.469|AMR
10-31-2020|0010007561|0030013097|บริษัท บางชันเยนเนอเรลเอเซมบลี จำกัด|151|Industrial|0.0095349|663.15|0.034|AMR
10-31-2020|0010007594|0030013168|บริษัท ไลอ้อน (ประเทศไทย) จำกัด|151|Industrial|0.5445879|663.15|0.503|AMR
10-31-2020|0010008509|0030044231|บริษัท ผลิตภัณฑ์ตราเพชร จำกัด (มหาชน)|151|Industrial|0.0000|663.15|0.351|AMR
10-31-2020|0010009040|0030022254|บริษัท ไทยเรยอน จำกัด (มหาชน)|151|Industrial|0.1007528|663.15|0.486|AMR
10-31-2020|0010009357|0030020016|บริษัท ซีพี-เมจิ จำกัด|152|Industrial-CoGen|0.2140423|663.15|0.264|AMR
10-31-2020|0010009841|0030021637|บริษัท โอวาริ เซกิ (ไทยแลนด์) จำกัด|151|Industrial|0.0008122|663.15|0.005|AMR
10-31-2020|0010010998|0030026291|บริษัท งามดีอุตสาหกรรม จำกัด|151|Industrial|0.1046021|663.15|0.071|AMR
10-31-2020|0010012118|0030062578|บริษัท พีทีที แอลเอ็นจี จำกัด|152|Industrial-CoGen|2.6225522|663.15|2.70|FlowComp
10-31-2020|0010012146|0030032044||151|Industrial|0.6338988|663.15|0.00|AMR
10-31-2020|0010012323|0030032849|บริษัท โตโยอิ๊งค์ (ประเทศไทย) จำกัด|151|Industrial|0.00807|663.15|0.01|ADQ
10-31-2020|0010021265|0030040855|บริษัท เอ็นเอส-สยามยูไนเต็ดสตีล จำกัด|151|Industrial|1.1872095|663.15|0.834|AMR
10-31-2020|0010021577|0030041863|บริษัท นำวัฒนา แพ็คแอนด์พริ้นท์ จำกัด|151|Industrial|0.4236351|663.15|0.485|AMR
10-31-2020|0010022868|0030047048|บริษัท ไออาร์พีซี คลีน พาวเวอร์ จำกัด|151|Industrial|2.5675905|663.15|2.325|AMR
10-31-2020|0010024055|0030064939|บริษัท โอจีพี เอนเนอร์ยี่ โซลูชั่นส์ จำกัด (สำหรับ บริษัท ยามาดะ สมบูรณ์ จำกัด)|151|Industrial|0.15315|663.15|0.191|ADQ
10-31-2020|0010024055|0030064940|บริษัท โอจีพี เอนเนอร์ยี่ โซลูชั่นส์ จำกัด (สำหรับ บริษัท คันไซ เรซิน(ประเทศไทย) จำกัด)|151|Industrial|0.05477|663.15|0.05|ADQ
10-31-2020|0010027591|0030024290|บริษัท ซีพีเอฟ ฟู้ด แอนด์ เบฟเวอร์เรจ จำกัด|152|Industrial-CoGen|0.0000|663.15|0.185|AMR
10-31-2020|0010028705|0030017241|บริษัท บีจี โฟลต กล๊าส จำกัด|151|Industrial|0.2920172|663.15|0.206|AMR
10-31-2020|0010029277|0030062577|บริษัท โรม เมคะเทค (ประเทศไทย) จำกัด|151|Industrial|0.01103|663.15|0.011|ADQ
10-31-2020|0010029951|0030064789|บริษัท สยามเพลเล็ทพาวเวอร์ จำกัด|152|Industrial-CoGen|0.0000|663.15|0.485|AMR
