Date|Sold to|Ship to|Ship to name|ContractType|Description|Volume(MMSCFD)|DemandPlan(BI)|MDCQ(BW)|Billing Type
10-31-2020|0010000011|0030000011|บริษัท อลูคอน จำกัด (มหาชน)|151|Industrial|1.0146972|663.15|1.16|AMR
10-31-2020|0010000026|0030000026|บริษัท บางกอกแคน แมนนูแฟคเจอริ่ง จำกัด|151|Industrial|0.283012|663.15|0.174|AMR
10-31-2020|0010000027|0030000027|บริษัท ฝาจีบ จำกัด (มหาชน)|152|Industrial-CoGen|0.0000|663.15|0.392|AMR
10-31-2020|0010000036|0030000036|บริษัท สยามฟูรูกาวา จำกัด|151|Industrial|0.2690273|663.15|0.205|AMR
10-31-2020|0010000037|0030000037|บริษัท สยามไฟเบอร์กลาส จำกัด|151|Industrial|0.3029294|663.15|0.294|AMR
10-31-2020|0010000049|0030000049|บริษัท ไทยผลิตภัณฑ์ยิบซั่ม จำกัด(มหาชน)|152|Industrial-CoGen|1.0678812|663.15|0.67|AMR
10-31-2020|0010000050|0030000050|บริษัท ไทยพลาสติกและเคมีภัณฑ์ จำกัด(มหาชน)|151|Industrial|5.5254792|663.15|5.366|AMR
10-31-2020|0010000057|0030000057|บริษัท พี เอส เมททอลเวอกส์ จำกัด|151|Industrial|0.0297702|663.15|0.018|AMR
10-31-2020|0010000071|0030000071|บริษัท เอสโซ่ (ประเทศไทย) จำกัด (มหาชน)|152|Industrial-CoGen|8.71507|663.15|8.662|ADQ
10-31-2020|0010000071|0030000071|บริษัท เอสโซ่ (ประเทศไทย) จำกัด (มหาชน)|151|Industrial|4.87337|663.15|6.001|ADQ
10-31-2020|0010000084|0030000084|บริษัท สยามอุตสาหกรรมวัสดุทนไฟ จำกัด|151|Industrial|1.2113648|663.15|0.914|AMR
10-31-2020|0010000085|0030000085|บริษัท บางกอกอินดัสเทรียลแก๊ส จำกัด|151|Industrial|0.0536077|663.15|0.043|AMR
10-31-2020|0010000106|0030000109|บริษัท ไมย์เออร์ อลูมิเนียม (ประเทศไทย) จำกัด|151|Industrial|0.4089442|663.15|0.271|AMR
10-31-2020|0010000107|0030000111|บริษัท จี สตีล จำกัด (มหาชน)|151|Industrial|3.1279642|663.15|1.99|AMR
10-31-2020|0010000122|0030000126|บริษัท บี เอ เอส เอฟ (ไทย) จำกัด|151|Industrial|0.0129604|663.15|0.482|AMR
10-31-2020|0010000130|0030000134|บริษัท กรีนสปอต จำกัด|151|Industrial|0.1659437|663.15|0.566|AMR
10-31-2020|0010000130|0030052374|บริษัท กรีนสปอต จำกัด|151|Industrial|0.1329245|663.15|0.209|AMR
10-31-2020|0010000144|0030000149|บริษัท เบอร์ลี่ ยุคเกอร์ เซลล็อกซ์จำกัด|151|Industrial|0.5263656|663.15|0.462|AMR
10-31-2020|0010000145|0030000150|บริษัท แสตนดาร์ดแคน จำกัด|151|Industrial|0.0000|663.15|0.292|AMR
10-31-2020|0010000154|0030000160|บริษัท แม็กซิออน วีลส์ (ประเทศไทย)จำกัด|151|Industrial|0.7953929|663.15|0.455|AMR
10-31-2020|0010000155|0030000161|บริษัท มาเล่ย์ เอ็นจิ่น คอมโพเน็นท์(ประเทศไทย) จำกัด|151|Industrial|0.0756087|663.15|0.063|AMR
10-31-2020|0010000195|0030033440|บริษัท ไทยลู้บเบส จำกัด (มหาชน)|151|Industrial|2.9254344|663.15|2.158|AMR
10-31-2020|0010000197|0030025358|บริษัท บางจาก คอร์ปอเรชั่น จำกัด (มหาชน)|152|Industrial-CoGen|5.5968855|663.15|7.329|AMR
10-31-2020|0010000206|0030000239|บริษัท เฮลซ์เทรดดิ้ง (ประเทศไทย) จำกัด|151|Industrial|0.012572|663.15|0.029|AMR
10-31-2020|0010000207|0030000240|บริษัท สตาร์ส เทคโนโลยี อินดัสเตรียล จำกัด|151|Industrial|0.1298168|663.15|0.241|AMR
10-31-2020|0010000228|0030000254|บริษัท ไทย เพ็ท เรซิน จำกัด|151|Industrial|1.0964154|663.15|1.064|AMR
10-31-2020|0010001217|0030021463|บริษัท แอมคอล อินเตอร์เนชั่นแนล (ไทยแลนด์) จำกัด|151|Industrial|0.0443199|663.15|0.069|AMR
10-31-2020|0010001431|0030053506|บริษัท คาราบาวตะวันแดง จำกัด|151|Industrial|0.212877|663.15|0.278|AMR
10-31-2020|0010001787|0030024766|บริษัท เพรซิเดนท์ เบเกอรี่ จำกัด(มหาชน)|151|Industrial|0.3197039|663.15|0.305|AMR
10-31-2020|0010002201|0030011779|บริษัท ควอลิตี้ คอฟฟี่ โปรดักท์ส จำกัด|151|Industrial|1.3631121|663.15|1.002|AMR
10-31-2020|0010006772|0030010740|บริษัท ไซเดน (ประเทศไทย) จำกัด|151|Industrial|0.0000|663.15|0.017|AMR
10-31-2020|0010006894|0030020321|บริษัท อาร์ต อุตสาหกรรม จำกัด|151|Industrial|0.0216125|663.15|0.021|AMR
10-31-2020|0010007330|0030013313|บริษัท โกรเวล แอบเบรซีพ (ไทยแลนด์)จำกัด|151|Industrial|0.0532545|663.15|0.033|AMR
10-31-2020|0010007489|0030043669|บจ.ไซมีส เมอร์ชานไดส์|151|Industrial|0.0000|663.15|0.002|AMR
10-31-2020|0010008022|0030033708|บริษัท สยามอุตสาหกรรมเกษตรอาหารจำกัด (มหาชน)|151|Industrial|0.0262388|663.15|0.165|AMR
10-31-2020|0010008739|0030000237|บริษัท สยามไฟเบอร์ซีเมนต์กรุ๊ป จำกัด|151|Industrial|0.100894|663.15|0.115|AMR
10-31-2020|0010008739|0030013343|บริษัท สยามไฟเบอร์ซีเมนต์กรุ๊ป จำกัด|151|Industrial|1.0679871|663.15|0.971|AMR
10-31-2020|0010009196|0030019599|บริษัท ราชราตัน ไทย ไวร์ จำกัด|151|Industrial|0.2421882|663.15|0.154|AMR
10-31-2020|0010009228|0030019659|บริษัท ไทย เอ็มเอฟซี จำกัด|151|Industrial|0.1542546|663.15|0.10|AMR
10-31-2020|0010009604|0030020797|บริษัท เจ.พี ยูไนเต็ด จำกัด|151|Industrial|0.0325601|663.15|0.017|AMR
10-31-2020|0010009784|0030021478|บริษัท แคททาเลอร์ (ประเทศไทย) จำกัด|151|Industrial|0.0828482|663.15|0.082|AMR
10-31-2020|0010010423|0030024015|บริษัท ศานติบรรจุภัณฑ์ จำกัด|151|Industrial|0.2079682|663.15|0.17|AMR
10-31-2020|0010011882|0030031074|บริษัท พีทีที อาซาฮี เคมิคอล จำกัด|151|Industrial|5.6873971|663.15|5.61|AMR
10-31-2020|0010012059|0030045449|บริษัท พีทีที เอ็มซีซี ไบโอเคม จำกัด|151|Industrial|0.4098977|663.15|0.388|AMR
10-31-2020|0010012320|0030021767|บริษัท พีทีที โกลบอล เคมิคอล จำกัด(มหาชน)|154|Commercial–CoGen|0.0000|663.15|0.082|AMR
10-31-2020|0010012320|0030026468|บริษัท พีทีที โกลบอล เคมิคอล จำกัด(มหาชน)|151|Industrial|10.6658163|663.15|9.364|AMR
10-31-2020|0010012320|0030040549|บริษัท พีทีที โกลบอล เคมิคอล จำกัด(มหาชน)|152|Industrial-CoGen|18.9482135|663.15|13.211|FlowComp
10-31-2020|0010021112|0030041494|บริษัท เจเอสอาร์ บีเอสที อิลาสโตเมอร์ จำกัด|151|Industrial|0.0903703|663.15|0.083|AMR
10-31-2020|0010021117|0030000123|บริษัท ซีพีเอฟ (ประเทศไทย) จำกัด(มหาชน)|152|Industrial-CoGen|1.3616995|663.15|1.503|AMR
10-31-2020|0010021842|0030023236|บริษัท คอทโก้ เมททอลเวอร์คส จำกัด|151|Industrial|0.1502287|663.15|0.233|AMR
10-31-2020|0010022869|0030045768|บริษัท ยามาโมริ (ประเทศไทย) จำกัด|151|Industrial|0.019423|663.15|0.021|AMR
10-31-2020|0010023379|0030049270|บริษัท ลาบิกซ์ จำกัด|151|Industrial|6.484132|663.15|6.407|AMR
10-31-2020|0010024055|0030064941|บริษัท โอจีพี เอนเนอร์ยี่ โซลูชั่นส์ จำกัด (สำหรับ บริษัท นิปปอน สตีลไพพ์ (ประเทศไทย) จำกัด โรงงาน 1)|151|Industrial|0.09033|663.15|0.059|ADQ
10-31-2020|0010024055|0030064942|บริษัท โอจีพี เอนเนอร์ยี่ โซลูชั่นส์ จำกัด (สำหรับ บริษัท นิปปอน สตีลไพพ์ (ประเทศไทย) จำกัด โรงงาน 2)|151|Industrial|0.08918|663.15|0.087|ADQ
10-31-2020|0010024871|0030053591|บริษัท เอ็นเอส-โอจี เอนเนอร์จี โซลูชั่นส์ (ไทยแลนด์) จำกัด|152|Industrial-CoGen|0.3036004|663.15|0.455|AMR
10-31-2020|0010027591|0030024290|บริษัท ซีพีเอฟ ฟู้ด แอนด์ เบฟเวอร์เรจ จำกัด|151|Industrial|0.8663755|663.15|0.672|AMR
10-31-2020|0010027600|0030058148|บริษัท เอเชีย แคน แมนูแฟคเจอริ่ง จำกัด|151|Industrial|0.1248374|663.15|0.111|AMR
10-31-2020|0010027807|0030064609|บริษัท เช่วเฉิน ซิลิก้า (ไทยแลนด์)จำกัด|151|Industrial|0.09834|663.15|0.05|ADQ
10-31-2020|0010030938|0030000014|บริษัท เอสซีจี รูฟฟิ่ง จำกัด|151|Industrial|0.68719|663.15|0.766|ADQ
10-31-2020|0010000004|0030000004|บริษัท ไทย คอปเปอร์ ร็อด จำกัด|151|Industrial|0.0000|663.15|0.167|AMR
10-31-2020|0010000005|0030000005|บริษัท ไทยเมทัลโพรเซสซิ่ง จำกัด|151|Industrial|0.1608231|663.15|0.287|AMR
10-31-2020|0010000019|0030000019|บริษัท ไดนาสตี้ เซรามิค จำกัด (มหาชน)|151|Industrial|4.3705119|663.15|4.576|AMR
10-31-2020|0010000022|0030000022|บริษัท ไทยบริดจสโตน จำกัด|151|Industrial|0.5743229|663.15|0.429|AMR
10-31-2020|0010000038|0030000102|บริษัท สหโมเสคอุตสาหกรรม จำกัด (มหาชน)|151|Industrial|2.2440019|663.15|1.419|AMR
10-31-2020|0010000058|0030000058|บริษัท พีคิว เคมิคอลส์ (ประเทศไทย)จำกัด|151|Industrial|0.1476154|663.15|0.154|AMR
10-31-2020|0010000061|0030000061|บริษัท ไมย์เออร์ อินดัสตรีส์ จำกัด|151|Industrial|0.5580075|663.15|0.315|AMR
10-31-2020|0010000077|0030000077||151|Industrial|1.8987301|663.15|1.736|AMR
10-31-2020|0010000078|0030000078|บริษัท ไทเท็กซ์ เอเซีย จำกัด|151|Industrial|0.1937717|663.15|0.127|AMR
10-31-2020|0010000096|0030000096|บริษัท ระยองโอเลฟินส์ จำกัด|151|Industrial|0.6491901|663.15|0.909|AMR
10-31-2020|0010000116|0030000120|บริษัท มิตซูบิชิ มอเตอร์ส (ประเทศไทย) จำกัด|151|Industrial|0.1694752|663.15|0.205|AMR
10-31-2020|0010000143|0030000148|บริษัท สยาม พุงซาน เมทัล จำกัด|151|Industrial|0.0538549|663.15|0.165|AMR
10-31-2020|0010000164|0030019231|บริษัท โกลว์ พลังงาน จำกัด (มหาชน)|151|Industrial|0.0000|663.15|0.187|ADQ
10-31-2020|0010000164|0030030778|บริษัท โกลว์ พลังงาน จำกัด (มหาชน)|152|Industrial-CoGen|54.1582326|663.15|45.787|FlowComp
10-31-2020|0010000216|0030049389|บริษัท ไออาร์พีซี จำกัด (มหาชน)|151|Industrial|1.3335183|663.15|7.741|AMR
10-31-2020|0010000220|0030000249|บริษัท เอเชีย ซิลิโคนส์ โมโนเมอร์จำกัด|151|Industrial|4.1463342|663.15|3.403|AMR
10-31-2020|0010001609|0030015621|บริษัท โตโยต้า มอเตอร์ ประเทศไทย จำกัด|152|Industrial-CoGen|0.0000|663.15|0.697|AMR
10-31-2020|0010002964|0030024050|บริษัท สยามบราเดอร์ จำกัด|151|Industrial|0.1219769|663.15|0.081|AMR
10-31-2020|0010003009|0030053395|บริษัท มิตซูบิชิ อีเล็คทริค คอนซูมเมอร์ โปรดักส์ (ประเทศไทย) จำกัด|158|NG by Truck|0.03207|663.15|0.016|ADQ
10-31-2020|0010006758|0030010658|บริษัท คอฟโค่ ไบโอเคมิคอล (ประเทศไทย) จำกัด|151|Industrial|0.6350289|663.15|0.745|AMR
10-31-2020|0010007306|0030012309||151|Industrial|0.4405155|663.15|0.351|AMR
10-31-2020|0010007812|0030013764|บริษัท กรุงเทพสลักภัณฑ์ จำกัด|151|Industrial|0.085744|663.15|0.097|AMR
10-31-2020|0010007875|0030013765|บริษัท วนชัย เคมีคอล อินดัสทรี่ส์จำกัด|151|Industrial|0.0771979|663.15|0.08|AMR
10-31-2020|0010008671|0030021639|บริษัท พีทีที ฟีนอล จำกัด|151|Industrial|0.331499|663.15|0.296|AMR
10-31-2020|0010009180|0030044623|บริษัท ไทย มาลายา กลาส จำกัด|151|Industrial|4.5458494|663.15|4.493|AMR
10-31-2020|0010010116|0030022714|บริษัท ยัสปาลแอนด์ซันส์ จำกัด|151|Industrial|0.0000|663.15|0.049|AMR
10-31-2020|0010012227|0030032353|บริษัท เอ็มทีพี เอชพี เจวี (ประเทศไทย) จำกัด|151|Industrial|6.6569622|663.15|6.816|AMR
10-31-2020|0010020698|0030038224|บริษัท สตาร์คอร์ จำกัด|151|Industrial|0.1285101|663.15|0.097|AMR
10-31-2020|0010020836|0030038183|บริษัท กรุงเทพ ซินธิติกส์ จำกัด|151|Industrial|0.0111594|663.15|0.015|AMR
10-31-2020|0010022333|0030043703|บริษัท เอเชียแปซิฟิกกลาส จำกัด|151|Industrial|2.45868|663.15|2.372|AMR
10-31-2020|0010022444|0030044003|บริษัท ทีวาย สตีล จำกัด|151|Industrial|0.3635648|663.15|0.153|AMR
10-31-2020|0010023667|0030000034|บริษัท สตาร์ ซานิทารี่แวร์ (ประเทศไทย) จำกัด|151|Industrial|0.0002118|663.15|0.088|AMR
10-31-2020|0010023967|0030050118|บริษัท โอซาก้า แก๊ส (ประเทศไทย) จำกัด|151|Industrial|0.196385|663.15|0.15|AMR
10-31-2020|0010026634|0030054698|บริษัท คานายามา คาเซอิ (ประเทศไทย)จำกัด|158|NG by Truck|0.58127|663.15|0.448|ADQ
10-31-2020|0010026674|0030017326|บริษัท ไทยเพรซิเดนท์ฟูดส์ จำกัด(มหาชน)|151|Industrial|0.7747692|663.15|0.617|AMR
10-31-2020|0010027860|0030059153|บริษัท เค.เอ็ม.เค.(ไทยแลนด์) จำกัด|151|Industrial|0.0429779|663.15|0.066|AMR
10-31-2020|0010027861|0030000017|บริษัท เอสซีจี เซรามิกส์ จำกัด (มหาชน)|151|Industrial|2.0723725|663.15|2.619|AMR
10-31-2020|0010000001|0030000001|บริษัท กระจกลายสยาม จำกัด|151|Industrial|0.29929|663.15|0.257|ADQ
10-31-2020|0010000015|0030000015|บริษัท โคห์เลอร์ (ประเทศไทย) จำกัด(มหาชน)|151|Industrial|2.3322534|663.15|2.145|AMR
10-31-2020|0010000027|0030000027|บริษัท ฝาจีบ จำกัด (มหาชน)|151|Industrial|0.2164791|663.15|0.379|AMR
10-31-2020|0010000038|0030000038|บริษัท สหโมเสคอุตสาหกรรม จำกัด (มหาชน)|151|Industrial|0.1866028|663.15|0.215|AMR
10-31-2020|0010000051|0030000051|บริษัท ไทยไวร์โพรดัคท์ จำกัด (มหาชน)|151|Industrial|0.0210828|663.15|0.038|AMR
10-31-2020|0010000067|0030000067|บริษัท มิลล์คอน บูรพา จำกัด|151|Industrial|0.7249048|663.15|1.234|AMR
10-31-2020|0010000091|0030000091|บริษัท สยาม เอ็นจีเค เทคโนเซรา จำกัด|151|Industrial|0.1107115|663.15|0.185|AMR
10-31-2020|0010000120|0030000124|บริษัท ลอยัล ไฮ่เหลียง คอปเปอร์ (ประเทศไทย) จำกัด|151|Industrial|0.0247202|663.15|0.023|AMR
10-31-2020|0010000140|0030000145|บริษัท สยามลวดเหล็กอุตสาหกรรม จำกัด|151|Industrial|0.0786105|663.15|0.07|AMR
10-31-2020|0010000141|0030000146|บริษัท สยามสตีล กัลวาไนซิ่ง จำกัด|151|Industrial|0.1775623|663.15|0.165|AMR
10-31-2020|0010000157|0030000163|บริษัท ไทยอะครีลิค จำกัด|151|Industrial|0.0000|663.15|0.005|AMR
10-31-2020|0010000158|0030000164|บริษัท นิวพลัสนิตติ้ง จำกัด (มหาชน)|151|Industrial|0.0000|663.15|0.004|AMR
10-31-2020|0010000216|0030030499|บริษัท ไออาร์พีซี จำกัด (มหาชน)|152|Industrial-CoGen|52.607747|663.15|53.008|FlowComp
10-31-2020|0010001488|0030016945|บริษัท โพลีเพล็กซ์ (ประเทศไทย) จำกัด (มหาชน)|151|Industrial|1.1138962|663.15|1.155|AMR
10-31-2020|0010001609|0030015621|บริษัท โตโยต้า มอเตอร์ ประเทศไทย จำกัด|151|Industrial|0.5846701|663.15|0.367|AMR
10-31-2020|0010002094|0030018793|บริษัท พ้อตเตอร์ส (ประเทศไทย) จำกัด|151|Industrial|0.0000|663.15|0.248|AMR
10-31-2020|0010002109|0030030514|บริษัท ลักกี้กลาส จำกัด|151|Industrial|0.0000|663.15|0.665|AMR
10-31-2020|0010006940|0030011137|บริษัท เอส ที บี เท็กซ์ไทล์ อินดัสตรี จำกัด|151|Industrial|0.0385636|663.15|0.027|AMR
10-31-2020|0010006972|0030011249|บริษัท สยาม ยามาโมริ จำกัด|151|Industrial|0.0167744|663.15|0.027|AMR
10-31-2020|0010008356|0030047608|บริษัท แสงไทยเมตัลดรัม จำกัด|151|Industrial|0.0277926|663.15|0.03|AMR
10-31-2020|0010008509|0030016162|บริษัท ผลิตภัณฑ์ตราเพชร จำกัด (มหาชน)|151|Industrial|0.0924538|663.15|0.078|AMR
10-31-2020|0010009070|0030018984|บริษัท โมเดอร์น ไดสตัฟส์ แอนด์พิคเมนท์ส จำกัด|151|Industrial|0.0000|663.15|0.182|AMR
10-31-2020|0010009085|0030056942|บจ.แดรี่ พลัส|151|Industrial|0.3514872|663.15|0.625|AMR
10-31-2020|0010009093|0030019105|บริษัท ยูเนียน ออโตพาร์ทส มานูแฟคเชอริ่ง จำกัด|151|Industrial|0.0527954|663.15|0.081|AMR
10-31-2020|0010010005|0030022294|บริษัท คอทโก้ เอ็นซีอาร์ เปเปอร์ จำกัด|151|Industrial|0.0000|663.15|0.027|AMR
10-31-2020|0010010061|0030022473|บริษัท แอมคอร์ เฟล็กซิเบิ้ล ระยองจำกัด|151|Industrial|0.0370804|663.15|0.033|AMR
10-31-2020|0010011735|0030030004|บริษัท เนเชอรัล ก๊าซ ไซลินเดอร์ (ประเทศไทย) จำกัด|151|Industrial|0.0000|663.15||AMR
10-31-2020|0010011784|0030030288|บริษัท สยามเลเทกซ์ สังเคราะห์ จำกัด|151|Industrial|1.3457372|663.15|0.993|AMR
10-31-2020|0010012506|0030000025|บริษัท ปทุมธานีกล๊าส อินดัสทรี จำกัด|151|Industrial|0.0000|663.15|2.712|AMR
10-31-2020|0010015560|0030040907|บริษัท ลินเด้ ไฮโค จำกัด|151|Industrial|1.0575693|663.15|1.777|AMR
10-31-2020|0010022812|0030014300|บริษัท โกลบอล เพาเวอร์ ซินเนอร์ยี่จำกัด (มหาชน)|152|Industrial-CoGen|62.6099945|663.15|61.63458|FlowComp
10-31-2020|0010026752|0030055984|บริษัท เซกิซุย คาเซอิ (ไทยแลนด์) จำกัด|151|Industrial|0.0428367|663.15|0.057|AMR
10-31-2020|0010027130|0030056963|บริษัท แคนาเดียน โซลาร์ แมนูแฟคเจอริ่ง (ประเทศไทย) จำกัด|158|NG by Truck|0.00018|663.15||ADQ
10-31-2020|0010000009|0030000009|บริษัท ล.ไลท์ติ้งกลาส จำกัด|151|Industrial|2.4311698|663.15|3.253|AMR
10-31-2020|0010000010|0030000010|บริษัท สยามกลาส อินดัสทรี จำกัด|151|Industrial|1.6711269|663.15|1.584|AMR
10-31-2020|0010000024|0030000024|บริษัท ไทล์ท้อป อินดัสตรี้ จำกัด (มหาชน)|151|Industrial|5.3389822|663.15|5.216|AMR
10-31-2020|0010000035|0030000035|บริษัท สยามซานิทารีแวร์อินดัสทรี จำกัด|151|Industrial|0.7393485|663.15|0.634|AMR
10-31-2020|0010000049|0030000049|บริษัท ไทยผลิตภัณฑ์ยิบซั่ม จำกัด(มหาชน)|151|Industrial|2.2807998|663.15|1.368|AMR
10-31-2020|0010000056|0030000056|บริษัท โอเอสซี สยามซิลิกา จำกัด|151|Industrial|0.0000|663.15|1.602|AMR
10-31-2020|0010000056|0030000059|บริษัท โอเอสซี สยามซิลิกา จำกัด|151|Industrial|1.5213219|663.15|1.365|AMR
10-31-2020|0010000068|0030025580|บริษัท เหล็กสยามยามาโตะ จำกัด|151|Industrial|1.9134917|663.15|1.915|AMR
10-31-2020|0010000083|0030021634|บริษัท เอจีซี แฟลทกลาส (ประเทศไทย)จำกัด (มหาชน)|151|Industrial|4.5806697|663.15|3.587|AMR
10-31-2020|0010000097|0030000097|บริษัท สายไฟฟ้าบางกอกเคเบิ้ล จำกัด|151|Industrial|0.1829654|663.15|0.241|AMR
10-31-2020|0010000098|0030000098|บริษัท อีโอซีโพลิเมอร์ส (ไทยแลนด์)จำกัด|151|Industrial|0.0000|663.15|0.025|AMR
10-31-2020|0010000111|0030000115|บริษัท อิวอนิก ยูไนเต็ด ซิลิกา (สยาม) จำกัด|151|Industrial|0.9454451|663.15|0.646|AMR
10-31-2020|0010000113|0030000117|บริษัท คาร์ดิแนล เฮลท์ 222 (ประเทศไทย) จำกัด|151|Industrial|2.4772908|663.15|1.694|AMR
10-31-2020|0010000129|0030000133|บริษัท ทีพีซี เพสต์ เรซิน จำกัด|151|Industrial|0.3500039|663.15|0.274|AMR
10-31-2020|0010000137|0030000142|บริษัท วาลเมท จำกัด|151|Industrial|0.0032489|663.15|0.005|AMR
10-31-2020|0010000139|0030000144|บริษัท ยูเนี่ยนไพโอเนียร์ จำกัด(มหาชน)|151|Industrial|0.1198227|663.15|0.121|AMR
10-31-2020|0010000150|0030000155|บริษัท บริดจสโตน เมตัลฟา(ประเทศไทย) จำกัด|151|Industrial|0.2692392|663.15|0.20|AMR
10-31-2020|0010000151|0030000156|บริษัท มิตซูบิชิ อีเล็คทริค ออโตเมชั่น (ประเทศไทย) จำกัด|151|Industrial|0.1160794|663.15|0.177|AMR
10-31-2020|0010000159|0030000165|บริษัท ไทย-เยอรมัน สเปเชียลตี้ กลาสจำกัด|151|Industrial|0.0430133|663.15|0.035|AMR
10-31-2020|0010000160|0030000166|บริษัท คอนวูด จำกัด|151|Industrial|0.2701221|663.15|0.204|AMR
