Date|Sold to|Ship to|Ship to name|ContractType|Description|Volume(MMSCFD)|DemandPlan(BI)|MDCQ(BW)|Billing Type
10-31-2020|0010000197|0030025358|บริษัท บางจาก คอร์ปอเรชั่น จำกัด (มหาชน)|151|Industrial|21.0092373|663.15|23.00|FlowComp
10-31-2020|0010000221|0030011437|บริษัท วีนิไทย จำกัด (มหาชน)|151|Industrial|2.4414817|663.15|2.707|AMR
10-31-2020|0010000916|0030044950|บริษัท ดาน่า สไปเซอร์ (ประเทศไทย) จำกัด|151|Industrial|0.0661091|663.15|0.058|AMR
10-31-2020|0010000925|0030022478|บริษัท ไทยสตีลโปรไฟล์ จำกัด (มหาชน)|151|Industrial|1.494624|663.15|1.044|AMR
10-31-2020|0010001714|0030016192|บริษัท ออลเน็กซ์ (ประเทศไทย) จำกัด|151|Industrial|0.1510762|663.15|0.118|AMR
10-31-2020|0010001727|0030020317|บริษัท ไทยเซ็นทรัลเคมี จำกัด (มหาชน)|151|Industrial|0.0000|663.15|0.312|AMR
10-31-2020|0010001922|0030022692|บริษัท ฟู้ดแอนด์ดริ๊งส์ จำกัด (มหาชน)|151|Industrial|0.1809|663.15|0.164|ADQ
10-31-2020|0010006548|0030009620|บริษัท อีเลคโทรลักซ์ ประเทศไทย จำกัด|151|Industrial|0.0192111|663.15|0.03|AMR
10-31-2020|0010006616|0030010020|บริษัท บริดจสโตน คาร์บอน แบล็ค (ประเทศไทย) จำกัด|151|Industrial|0.148922|663.15|0.201|AMR
10-31-2020|0010006922|0030020406|บริษัท อายิโนะโมะโต๊ะ (ประเทศไทย)จำกัด|151|Industrial|0.0247556|663.15|1.134|AMR
10-31-2020|0010007512|0030040636|บริษัท คราวน์ เบ็บแคน แอนด์ โคลสเชอร์ส (ประเทศไทย) จำกัด|151|Industrial|0.0922773|663.15|0.148|AMR
10-31-2020|0010008114|0030024767|บริษัท ทุนเท็กซ์ เท็กซ์ไทล์ (ประเทศไทย) จำกัด|151|Industrial|0.2806459|663.15|0.182|AMR
10-31-2020|0010008206|0030015236|บริษัท เอ็นเนซอล จำกัด|152|Industrial-CoGen|1.8419088|663.15|0.00003|AMR
10-31-2020|0010008739|0030038490|บริษัท สยามไฟเบอร์ซีเมนต์กรุ๊ป จำกัด|151|Industrial|0.0020835|663.15|0.019|AMR
10-31-2020|0010009176|0030019559|บริษัท พูแรค (ประเทศไทย) จำกัด|151|Industrial|1.9625085|663.15|2.264|AMR
10-31-2020|0010009582|0030020738|บริษัท คอทโก้ พลาสติกส์ จำกัด|151|Industrial|0.0000|663.15|0.047|AMR
10-31-2020|0010010156|0030022920|บริษัท ไทยเคมีภัณฑ์ จำกัด|151|Industrial|0.3919578|663.15|0.204|AMR
10-31-2020|0010010216|0030023098|บริษัท สยามพรีเสิร์ฟ ฟู้ดส์ จำกัด|151|Industrial|0.1392811|663.15|0.08|AMR
10-31-2020|0010011029|0030026047|บริษัท เอ็น ซี อาร์ รับเบอร์อินดัสตรี้ จำกัด|151|Industrial|0.0733133|663.15|0.063|AMR
10-31-2020|0010011163|0030026631|บริษัท ไทย อกริ เพาเวอร์ จำกัด|152|Industrial-CoGen|0.0744787|663.15|0.065|AMR
10-31-2020|0010012320|0030000072|บริษัท พีทีที โกลบอล เคมิคอล จำกัด(มหาชน)|152|Industrial-CoGen|9.2952|663.15|12.079|ADQ
10-31-2020|0010012320|0030000072|บริษัท พีทีที โกลบอล เคมิคอล จำกัด(มหาชน)|151|Industrial|29.90842|663.15|27.537|ADQ/AMR
10-31-2020|0010012361|0030033177|บริษัท โตโต้ (ประเทศไทย) จำกัด|151|Industrial|0.8503426|663.15|0.733|AMR
10-31-2020|0010012393|0030033336|บริษัท จรุงไทยไวร์แอนด์เคเบิ้ล จำกัด (มหาชน)|151|Industrial|0.0000|663.15|0.092|AMR
10-31-2020|0010021117|0030022988|บริษัท ซีพีเอฟ (ประเทศไทย) จำกัด(มหาชน)|151|Industrial|0.6103439|663.15|0.459|AMR
10-31-2020|0010021151|0030040140|บริษัท คนอฟ ยิปซั่ม (ประเทศไทย) จำกัด|151|Industrial|0.1160794|663.15|0.424|AMR
10-31-2020|0010022317|0030043685|บริษัท ไซมีส อีโคไลท์ จำกัด|151|Industrial|0.0924185|663.15|0.034|AMR
10-31-2020|0010023651|0030048793|บริษัท ไคฮาระ (ประเทศไทย) จำกัด|151|Industrial|0.0995168|663.15|0.178|AMR
10-31-2020|0010025332|0030052476|บริษัท ไอที ฟอร์จิ้ง (ประเทศไทย) จำกัด|151|Industrial|0.0000|663.15|0.103|AMR
10-31-2020|0010025615|0030053102|บริษัท เอ็นจีเค เซรามิคส์ (ประเทศไทย) จำกัด|151|Industrial|0.1379039|663.15|0.403|AMR
10-31-2020|0010026111|0030055031|บริษัท กบินทร์บุรีกล๊าส อินดัสทรีจำกัด|151|Industrial|0.0000|663.15|3.278|AMR
10-31-2020|0010026153|0030054741|บริษัท นิคเคอิ เอ็มซี อลูมินัม (ประเทศไทย) จำกัด|151|Industrial|0.1912291|663.15|0.162|AMR
10-31-2020|0010027861|0030000018|บริษัท เอสซีจี เซรามิกส์ จำกัด (มหาชน)|151|Industrial|2.5970077|663.15|2.489|AMR
10-31-2020|0010000003|0030000003|บริษัท เขาช่องอุตสาหกรรม 1979 จำกัด|151|Industrial|0.4488498|663.15|0.461|AMR
10-31-2020|0010000016|0030000016|บริษัท ลิกซิล (ประเทศไทย) จำกัด (มหาชน)|151|Industrial|0.6733453|663.15|0.478|AMR
10-31-2020|0010000031|0030000031|บริษัท วิลเลรอย แอนด์ บอค (ประเทศไทย) จำกัด|151|Industrial|0.452805|663.15|0.459|AMR
10-31-2020|0010000032|0030000032|บริษัท รอยัลปอร์ซเลน จำกัด (มหาชน)|151|Industrial|0.876758|663.15|0.753|AMR
10-31-2020|0010000043|0030000043|บริษัท ไทย จีซีไอ เรซิท็อป จำกัด|151|Industrial|0.2293336|663.15|0.221|AMR
10-31-2020|0010000053|0030020331|บริษัท ไทยอาซาฮีเคมีภัณฑ์ จำกัด|151|Industrial|0.6567121|663.15|0.338|AMR
10-31-2020|0010000063|0030000075|บริษัท สยามมิชลิน จำกัด|151|Industrial|0.0800937|663.15|0.052|AMR
10-31-2020|0010000064|0030000243|บริษัท ลี่ไท่ อัลลอย จำกัด|151|Industrial|0.2676854|663.15|0.189|AMR
10-31-2020|0010000065|0030000065|บริษัท สยามโพลีสไตรีน จำกัด|151|Industrial|0.1158322|663.15|0.045|AMR
10-31-2020|0010000074|0030000074|บริษัท ไทยเบเวอร์เรจแคน จำกัด|151|Industrial|0.4270959|663.15|0.45|AMR
10-31-2020|0010000076|0030000076|บริษัท สยามสไตรีนโมโนเมอร์ จำกัด|151|Industrial|3.5000752|663.15|2.137|AMR
10-31-2020|0010000088|0030000088|บริษัท ไทยฟิล์มอินดัสตรี่ จำกัด (มหาชน)|151|Industrial|0.0000|663.15|0.016|AMR
10-31-2020|0010000089|0030000089|บริษัท ธนเสริมอุตสาหกรรมฝาขวด จำกัด|151|Industrial|0.0771979|663.15|0.063|AMR
10-31-2020|0010000101|0030000103|บริษัท ร็อควูล (ประเทศไทย) จำกัด|151|Industrial|0.008193|663.15|0.155|AMR
10-31-2020|0010000104|0030000107|บริษัท สยามโพลิเอททีลีน จำกัด|151|Industrial|1.7139636|663.15|1.855|AMR
10-31-2020|0010000116|0030034491|บริษัท มิตซูบิชิ มอเตอร์ส (ประเทศไทย) จำกัด|151|Industrial|0.1203878|663.15|0.095|AMR
10-31-2020|0010000117|0030000121|บริษัท ไทยซิลิเกตเคมิคัล จำกัด|151|Industrial|1.0873396|663.15|0.761|AMR
10-31-2020|0010000133|0030000138|บริษัท เอ.เจ. พลาสท์ จำกัด (มหาชน)|151|Industrial|0.8057401|663.15|0.766|AMR
10-31-2020|0010000146|0030000151|บริษัท จีเอฟพีที จำกัด (มหาชน)|151|Industrial|0.4440117|663.15|0.386|AMR
10-31-2020|0010000147|0030000152|บริษัท แมคคีย์ ฟู้ด เซอร์วิสเซส (ประเทศไทย) จำกัด|151|Industrial|0.3134532|663.15|0.274|AMR
10-31-2020|0010000156|0030000162|บริษัท เวลโกรว์กล๊าส อินดัสทรี จำกัด|151|Industrial|1.8822381|663.15|1.727|AMR
10-31-2020|0010000191|0030043704|บริษัท ศักดิ์ไชยสิทธิ จำกัด|151|Industrial|0.2876735|663.15|0.722|AMR
10-31-2020|0010000192|0030043881|บริษัท แอร์ ลิควิด (ประเทศไทย) จำกัด|151|Industrial|2.8692134|663.15|2.53|AMR
10-31-2020|0010000205|0030000238|บริษัท ไทยอาซาคาวา จำกัด|151|Industrial|0.0592933|663.15|0.045|AMR
10-31-2020|0010000227|0030000253|บริษัท จี เจ สตีล จำกัด (มหาชน)|151|Industrial|2.8470711|663.15|2.135|AMR
10-31-2020|0010001196|0030029791|บริษัท ไทยคูน เวิลด์ไวด์ กรุ๊ป (ประเทศไทย) จำกัด (มหาชน)|151|Industrial|1.7796489|663.15|1.247|AMR
10-31-2020|0010001747|0030042303|บริษัท สุนทรเมทัลอินดัสทรี้ส์ จำกัด|151|Industrial|0.4945823|663.15|0.35|AMR
10-31-2020|0010001998|0030025768|บริษัท อินโดรามา โพลีเอสเตอร์ อินดัสตรี้ส์ จำกัด (มหาชน)|151|Industrial|1.7875594|663.15|1.611|AMR
10-31-2020|0010002048|0030021234|บริษัท ด๊อกเตอร์ บู จำกัด|151|Industrial|0.283012|663.15|0.181|AMR
10-31-2020|0010006748|0030010640|บริษัท ยูเนี่ยนโชจิรุชิ จำกัด|151|Industrial|0.0116891|663.15|0.014|AMR
10-31-2020|0010006755|0030027897|บริษัท ปูนซิเมนต์ไทย (ท่าหลวง) จำกัด|151|Industrial|0.0000|663.15|0.03|AMR
10-31-2020|0010007112|0030011636|บริษัท ไทยซัมมิท อีสเทิร์น ซีบอร์ดโอโตพาร์ท อินดัสตรี จำกัด|151|Industrial|0.042201|663.15|0.031|AMR
10-31-2020|0010007151|0030011752|บริษัท เอ็มซีแอลเอส เอเชีย จำกัด|151|Industrial|0.4866012|663.15|0.789|AMR
10-31-2020|0010007766|0030013680|บริษัท อินโดรามา ปิโตรเคม จำกัด|152|Industrial-CoGen|4.0252401|663.15|3.50|AMR
10-31-2020|0010008206|0030033172|บริษัท เอ็นเนซอล จำกัด|152|Industrial-CoGen|1.4746359|663.15|1.259|AMR
10-31-2020|0010008288|0030015470|บริษัท อุตสาหกรรมทำเครื่องแก้วไทยจำกัด (มหาชน)|151|Industrial|4.7398684|663.15|6.285|AMR
10-31-2020|0010008758|0030016949|บริษัท คล็อกเนอร์ เพนทาพลาสท์ (ไทยแลนด์) จำกัด|151|Industrial|0.0000|663.15|0.022|AMR
10-31-2020|0010008926|0030018384|บริษัท อินเตอร์เนชั่นแนล แลบบอราทอรีส์ จำกัด|151|Industrial|0.0071335|663.15|0.016|AMR
10-31-2020|0010009357|0030020016|บริษัท ซีพี-เมจิ จำกัด|151|Industrial|0.299292|663.15|0.452|AMR
10-31-2020|0010009390|0030020154|บริษัท อัลวา อะลูมิเนียม จำกัด|151|Industrial|0.0003884|663.15|0.215|AMR
10-31-2020|0010010605|0030024817|บริษัท มาบตาพุดโอเลฟินส์ จำกัด|151|Industrial|3.0685295|663.15|2.216|AMR
10-31-2020|0010010925|0030025431|บริษัท เน็กซ์ แคน อินโนเวชั่น จำกัด|151|Industrial|0.0688283|663.15|0.351|AMR
10-31-2020|0010012320|0030021767|บริษัท พีทีที โกลบอล เคมิคอล จำกัด(มหาชน)|153|Commercial|0.0000|663.15|0.013|AMR
10-31-2020|0010021117|0030022988|บริษัท ซีพีเอฟ (ประเทศไทย) จำกัด(มหาชน)|152|Industrial-CoGen|0.0000|663.15|0.068|AMR
10-31-2020|0010022812|0030020778|บริษัท โกลบอล เพาเวอร์ ซินเนอร์ยี่จำกัด (มหาชน)|151|Industrial|4.7075056|663.15|3.903|FlowComp
10-31-2020|0010022812|0030024457|บริษัท โกลบอล เพาเวอร์ ซินเนอร์ยี่จำกัด (มหาชน)|151|Industrial|3.5934826|663.15|4.787|AMR
10-31-2020|0010022812|0030063296|บริษัท โกลบอล เพาเวอร์ ซินเนอร์ยี่จำกัด (มหาชน)|152|Industrial-CoGen|12.1870404|663.15|10.384|FlowComp
10-31-2020|0010027459|0030011637|บริษัท โอสถสภา จำกัด (มหาชน)|151|Industrial|1.4688796|663.15|2.599|AMR
10-31-2020|0010027591|0030000157|บริษัท ซีพีเอฟ ฟู้ด แอนด์ เบฟเวอร์เรจ จำกัด|151|Industrial|0.3212931|663.15|0.261|AMR
10-31-2020|0010000012|0030000012|บริษัท อีสเทิร์นไชน่าแวร์ จำกัด|151|Industrial|0.3008812|663.15|0.264|AMR
10-31-2020|0010000013|0030000013|บริษัท ทาทา สตีล การผลิต (ประเทศไทย) จำกัด (มหาชน)|151|Industrial|3.4365087|663.15|1.855|AMR
10-31-2020|0010000033|0030000104|บริษัท โรแยล ซีรามิค อุตสาหกรรม จำกัด (มหาชน)|151|Industrial|1.6918566|663.15|1.724|AMR
10-31-2020|0010000052|0030000052|บริษัท ไทยออยล์ จำกัด (มหาชน)|151|Industrial|18.7672172|663.15|11.421|AMR/FlowComp
10-31-2020|0010000053|0030000053|บริษัท ไทยอาซาฮีเคมีภัณฑ์ จำกัด|151|Industrial|0.0000|663.15|0.156|AMR
10-31-2020|0010000062|0030000062|บริษัท สตาร์ ปิโตรเลียม รีไฟน์นิ่งจำกัด (มหาชน)|152|Industrial-CoGen|9.85231|663.15|10.70|ADQ
10-31-2020|0010000062|0030000062|บริษัท สตาร์ ปิโตรเลียม รีไฟน์นิ่งจำกัด (มหาชน)|151|Industrial|12.7964639|663.15|13.259|ADQ/AMR
10-31-2020|0010000073|0030000073|บริษัท ไฟน์ เม็ททัล เทคโนโลยีส์จำกัด (มหาชน)|151|Industrial|0.1106056|663.15|0.311|AMR
10-31-2020|0010000086|0030000086|บริษัท สยามคอมเพรสเซอร์อุตสาหกรรม จำกัด|151|Industrial|0.1436955|663.15|0.128|AMR
10-31-2020|0010000099|0030000099|บริษัท เกรท วอลล์ มอเตอร์ แมนูแฟคเจอริ่ง (ประเทศไทย) จำกัด|151|Industrial|0.0000|663.15|0.161|AMR
10-31-2020|0010000114|0030000118|บริษัท อิเมอร์สัน อิเล็คทริค (ประเทศไทย) จำกัด|151|Industrial|0.1007881|663.15|0.116|AMR
10-31-2020|0010000128|0030000132|บริษัท เซกิซุย เอส-เล็ค (ประเทศไทย)จำกัด|151|Industrial|0.0780808|663.15|0.048|AMR
10-31-2020|0010000136|0030000141|บริษัท ยูเนี่ยนไทย-นิจิบัน จำกัด|151|Industrial|0.3631057|663.15|0.329|AMR
10-31-2020|0010000148|0030000153|บริษัท เคนไซซีรามิคส์ อินดัสตรี้ จำกัด|151|Industrial|0.1992102|663.15|0.185|AMR
10-31-2020|0010000178|0030016267|บริษัท โกลว์ เอสพีพี 11 จำกัด|152|Industrial-CoGen|1.0367689|663.15|1.361|AMR
10-31-2020|0010000201|0030020965|บริษัท อดิตยา เบอร์ล่า เคมีคัลส์ (ประเทศไทย) จำกัด (แอดวานซ์ แมททีเรียลส์)|151|Industrial|0.0688989|663.15|0.075|AMR
10-31-2020|0010000225|0030011191|บริษัท ซีพีพีซี จำกัด (มหาชน) (Coating Plant)|151|Industrial|0.0082636|663.15|0.007|AMR
10-31-2020|0010000226|0030000252|บริษัท ซัมมิท โชว่าแมนูแฟคเจอริ่งจำกัด|151|Industrial|0.0785752|663.15|0.079|AMR
10-31-2020|0010001131|0030044478|บริษัท นอริตาเก้ เอสซีจี พลาสเตอร์จำกัด|151|Industrial|0.1788336|663.15|0.165|AMR
10-31-2020|0010001146|0030042053|บริษัท เคลล็อก (ประเทศไทย) จำกัด|151|Industrial|0.1205997|663.15|0.184|AMR
10-31-2020|0010001740|0030022424|บริษัท โรงงานเหล็กกรุงเทพฯ จำกัด|151|Industrial|1.827465|663.15|1.37|AMR
10-31-2020|0010001741|0030022479|บริษัท อลูมิเนียม ฉื่อ จิ้น ฮั้ว จำกัด|151|Industrial|0.5741463|663.15|0.457|AMR
10-31-2020|0010002092|0030016062|บริษัท สยามแผ่นเหล็กวิลาส จำกัด|151|Industrial|0.0640961|663.15|0.115|AMR
10-31-2020|0010006733|0030023785|บริษัท เดลี่ฟู้ดส์ จำกัด|151|Industrial|0.094608|663.15|0.062|AMR
10-31-2020|0010007060|0030011444|บริษัท สยามร่วมมิตร จำกัด|151|Industrial|0.0656147|663.15|0.087|AMR
10-31-2020|0010007982|0030014211|บริษัท จีซี ไกลคอล จำกัด|151|Industrial|0.159799|663.15|0.136|AMR
10-31-2020|0010008606|0030016564|บริษัท ซังโกะ ไดคาชติ้ง (ประเทศไทย)จำกัด (มหาชน)|151|Industrial|0.2137245|663.15|0.141|AMR
10-31-2020|0010008657|0030016715|บริษัท คิริว (ประเทศไทย) จำกัด|151|Industrial|0.004273|663.15|0.018|AMR
10-31-2020|0010009151|0030019200|บริษัท ไทย เกลซ อุตสาหกรรม จำกัด|151|Industrial|0.3925582|663.15|0.177|AMR
10-31-2020|0010009392|0030020182|บริษัท มิตร สตีล จำกัด|151|Industrial|0.0000|663.15|0.046|AMR
10-31-2020|0010009442|0030020288|บริษัท อายิโนะโมะโต๊ะเซลส์ (ประเทศไทย) จำกัด|151|Industrial|0.0000|663.15|0.052|AMR
10-31-2020|0010010355|0030023468|บริษัท เคียวเด็น (ประเทศไทย) จำกัด|151|Industrial|0.0651909|663.15|0.031|AMR
10-31-2020|0010010358|0030023471|บริษัท เซ้าท์ ซิตี้ ปิโตรเคม จำกัด|151|Industrial|0.204578|663.15|0.134|AMR
10-31-2020|0010011367|0030027987|บริษัท มิลลิเมด จำกัด|151|Industrial|0.0375748|663.15|0.035|AMR
10-31-2020|0010012320|0030000055|บริษัท พีทีที โกลบอล เคมิคอล จำกัด(มหาชน)|151|Industrial|0.0009181|663.15|0.004|AMR
10-31-2020|0010012320|0030000069|บริษัท พีทีที โกลบอล เคมิคอล จำกัด(มหาชน)|151|Industrial|8.7639784|663.15|2.666|AMR
10-31-2020|0010012326|0030032885|บริษัท สายไฟฟ้าไทย-ยาซากิ จำกัด|151|Industrial|0.0008122|663.15|0.136|AMR
10-31-2020|0010021117|0030000123|บริษัท ซีพีเอฟ (ประเทศไทย) จำกัด(มหาชน)|151|Industrial|0.7709199|663.15|0.535|AMR
10-31-2020|0010021910|0030042490|บริษัท คาเนมิทสึ พูลเล่ย์ จำกัด|151|Industrial|0.0143377|663.15|0.006|AMR
10-31-2020|0010022253|0030043488|บริษัท ที.ที.เซรามิค จำกัด (มหาชน)|151|Industrial|1.2377449|663.15|0.68|AMR
10-31-2020|0010023436|0030052175|บริษัท ซันโทรี่ เป๊ปซี่โค เบเวอเรจ(ประเทศไทย) จำกัด|151|Industrial|0.136915|663.15|0.158|AMR
10-31-2020|0010023548|0030000131|บริษัท โคเวสโตร (ประเทศไทย) จำกัด|151|Industrial|0.417561|663.15|0.477|AMR
10-31-2020|0010026372|0030024061|บริษัท เคมีแมน จำกัด (มหาชน)|151|Industrial|1.2960494|663.15|1.217|AMR
10-31-2020|0010027861|0030000246|บริษัท เอสซีจี เซรามิกส์ จำกัด (มหาชน)|151|Industrial|2.6145591|663.15|2.165|AMR
10-31-2020|0010000008|0030000008|บริษัท ไมโครไฟเบอร์อุตสาหกรรม จำกัด|151|Industrial|0.134443|663.15|0.244|AMR
10-31-2020|0010000022|0030000022|บริษัท ไทยบริดจสโตน จำกัด|152|Industrial-CoGen|1.9033917|663.15|1.328|AMR
10-31-2020|0010000023|0030000023|บริษัท ไทยเปอร์อ๊อกไซด์ จำกัด|151|Industrial|1.3750837|663.15|1.573|AMR
10-31-2020|0010000046|0030000046|บริษัท ไทยแทฟฟิต้า จำกัด|151|Industrial|0.0000|663.15|0.006|AMR
10-31-2020|0010000047|0030000047|บริษัท โพสโค-ไทยน๊อคซ์ จำกัด (มหาชน)|151|Industrial|0.4384673|663.15|1.214|AMR
10-31-2020|0010000063|0030000063|บริษัท สยามมิชลิน จำกัด|151|Industrial|0.0000|663.15|0.20|AMR
10-31-2020|0010000080|0030000080|บริษัท เอ็นเอส บลูสโคป (ประเทศไทย)จำกัด|151|Industrial|0.4280141|663.15|0.985|AMR
10-31-2020|0010000108|0030000112|บริษัท ยูนิตี้ อินดัสเตรียล จำกัด|151|Industrial|0.0000|663.15|0.015|AMR
10-31-2020|0010000109|0030000113|บริษัท ระยองไวร์ อินดัสตรีส์ จำกัด(มหาชน)|151|Industrial|0.0053325|663.15|0.01|AMR
10-31-2020|0010000131|0030000136|บริษัท การ์เดียนอินดัสทรีส์ ระยองจำกัด|151|Industrial|3.6444417|663.15|3.046|AMR
10-31-2020|0010000132|0030000137|บริษัท การ์เดียนอินดัสทรีส์ คอร์ปจำกัด|151|Industrial|3.7085025|663.15|3.624|AMR
10-31-2020|0010000153|0030000159|บริษัท เกทส์ ยูนิทตะ (ประเทศไทย) จำกัด|151|Industrial|0.0919241|663.15|0.082|AMR
10-31-2020|0010000202|0030042681|บริษัท สมบูรณ์ โซมิค แมนูแฟคเจอริ่งจำกัด|151|Industrial|0.0034961|663.15|0.005|AMR
10-31-2020|0010000934|0030046753|บริษัท ฮอนด้า ออโตโมบิล (ประเทศไทย) จำกัด|151|Industrial|0.1161147|663.15|0.211|AMR
10-31-2020|0010001013|0030023306|บริษัท เนสท์เล่ (ไทย) จำกัด|151|Industrial|0.0336195|663.15|0.033|AMR
10-31-2020|0010001827|0030021652|บริษัท กรไทย จำกัด|151|Industrial|0.9393357|663.15|0.749|AMR
10-31-2020|0010001879|0030026184|บริษัท เอ็ชเอ็มซี โปลีเมอส์ จำกัด|151|Industrial|0.3021172|663.15|1.062|AMR
10-31-2020|0010003880|0030008767|บริษัท กังวาลเท็กซ์ไทล์ จำกัด|152|Industrial-CoGen|0.0000|663.15|0.848|AMR
10-31-2020|0010006922|0030011105|บริษัท อายิโนะโมะโต๊ะ (ประเทศไทย)จำกัด|151|Industrial|0.0000|663.15|0.069|AMR
10-31-2020|0010006922|0030020406|บริษัท อายิโนะโมะโต๊ะ (ประเทศไทย)จำกัด|152|Industrial-CoGen|0.0000|663.15||AMR
10-31-2020|0010007765|0030013679|บริษัท เอ.พี.ซี อุตสาหกรรม จำกัด|151|Industrial|0.0000|663.15|0.011|AMR
