Date|Sold to|Ship to|Ship to name|ContractType|Description|Volume(MMSCFD)|DemandPlan(BI)|MDCQ(BW)|Billing Type
06-30-2019|0010006758|0030010658|บริษัท คอฟโค่ ไบโอเคมิคอล (ประเทศไทย) จำกัด|151|Industrial|0.6865177|653.2|0.618|AMR
06-30-2019|0010007151|0030011752|บริษัท เอ็มซีแอลเอส เอเชีย จำกัด|151|Industrial|1.1021364|653.2|0.883|AMR
06-30-2019|0010007594|0030013168|บริษัท ไลอ้อน (ประเทศไทย) จำกัด|151|Industrial|0.4572194|653.2|0.531|AMR
06-30-2019|0010008206|0030033172|บริษัท เอ็นเนซอล จำกัด|152|Industrial-CoGen|0.0000|653.2|0.983|AMR
06-30-2019|0010008288|0030015470|บริษัท อุตสาหกรรมทำเครื่องแก้วไทยจำกัด (มหาชน)|151|Industrial|6.352726|653.2|6.709|AMR
06-30-2019|0010008509|0030044231|บริษัท ผลิตภัณฑ์ตราเพชร จำกัด (มหาชน)|151|Industrial|0.4032232|653.2|0.347|AMR
06-30-2019|0010008606|0030016564|บริษัท ซังโกะ ไดคาชติ้ง (ประเทศไทย)จำกัด (มหาชน)|151|Industrial|0.0000|653.2|0.179|AMR
06-30-2019|0010009070|0030018984|บริษัท โมเดอร์น ไดสตัฟส์ แอนด์พิคเมนท์ส จำกัด|151|Industrial|0.0000|653.2|0.163|AMR
06-30-2019|0010009085|0030056942|บจ.แดรี่ พลัส|151|Industrial|0.0000|653.2|1.677|AMR
06-30-2019|0010009357|0030020016|บริษัท ซีพี-เมจิ จำกัด|152|Industrial-CoGen|0.3918872|653.2|0.13|AMR
06-30-2019|0010009357|0030020016|บริษัท ซีพี-เมจิ จำกัด|151|Industrial|0.3917106|653.2|0.552|AMR
06-30-2019|0010010116|0030022714|บริษัท ยัสปาลแอนด์ซันส์ จำกัด|151|Industrial|0.0011653|653.2|0.084|AMR
06-30-2019|0010011029|0030026047|บริษัท เอ็น ซี อาร์ รับเบอร์อินดัสตรี้ จำกัด|151|Industrial|0.0841902|653.2|0.063|AMR
06-30-2019|0010011163|0030026631|บริษัท ไทย อกริ เพาเวอร์ จำกัด|152|Industrial-CoGen|0.0340433|653.2|0.432|AMR
06-30-2019|0010012320|0030021481|บริษัท พีทีที โกลบอล เคมิคอล จำกัด(มหาชน)|151|Industrial|26.49436|653.2|21.825|ADQ
06-30-2019|0010020698|0030038224|บริษัท สตาร์คอร์ จำกัด|151|Industrial|0.1815881|653.2|0.169|AMR
06-30-2019|0010020836|0030038183|บริษัท กรุงเทพ ซินธิติกส์ จำกัด|151|Industrial|0.0227073|653.2|0.025|AMR
06-30-2019|0010022253|0030043488|บริษัท ที.ที.เซรามิค จำกัด (มหาชน)|151|Industrial|0.8543685|653.2|0.718|AMR
06-30-2019|0010023436|0030052175|บริษัท ซันโทรี่ เป๊ปซี่โค เบเวอเรจ(ประเทศไทย) จำกัด|151|Industrial|0.1295343|653.2|0.149|AMR
06-30-2019|0010023548|0030000131|บริษัท โคเวสโตร (ประเทศไทย) จำกัด|151|Industrial|0.4873781|653.2|0.447|AMR
06-30-2019|0010026752|0030055984|บริษัท เซกิซุย คาเซอิ (ไทยแลนด์) จำกัด|151|Industrial|0.0111947|653.2|0.057|AMR
06-30-2019|0010027130|0030056963|บริษัท แคนาเดียน โซลาร์ แมนูแฟคเจอริ่ง (ประเทศไทย) จำกัด|158|NG by Truck|0.01504|653.2|0.05|ADQ
06-30-2019|0010027938|0030059837|บริษัท ราชบุรีกล๊าส อินดัสทรี จำกัด|151|Industrial|1.8411671|653.2|1.50|AMR
06-30-2019|0010000008|0030000008|บริษัท ไมโครไฟเบอร์อุตสาหกรรม จำกัด|151|Industrial|0.165414|653.2|0.292|AMR
06-30-2019|0010000023|0030000023|บริษัท ไทยเปอร์อ๊อกไซด์ จำกัด|151|Industrial|-0.0866622|653.2|0.976|AMR
06-30-2019|0010000038|0030000038|บริษัท สหโมเสคอุตสาหกรรม จำกัด (มหาชน)|151|Industrial|0.0971507|653.2|0.486|AMR
06-30-2019|0010000051|0030000051|บริษัท ไทยไวร์โพรดัคท์ จำกัด (มหาชน)|151|Industrial|0.0254265|653.2|0.034|AMR
06-30-2019|0010000063|0030000063|บริษัท สยามมิชลิน จำกัด|151|Industrial|0.0000|653.2|0.20|AMR
06-30-2019|0010000063|0030000075|บริษัท สยามมิชลิน จำกัด|151|Industrial|0.0827423|653.2|0.075|AMR
06-30-2019|0010000076|0030000076|บริษัท สยามสไตรีนโมโนเมอร์ จำกัด|151|Industrial|3.2764625|653.2|3.297|AMR
06-30-2019|0010000077|0030000077||151|Industrial|1.6721157|653.2|1.636|AMR
06-30-2019|0010000085|0030000085|บริษัท บางกอกอินดัสเทรียลแก๊ส จำกัด|151|Industrial|0.0412122|653.2|0.044|AMR
06-30-2019|0010000086|0030000086|บริษัท สยามคอมเพรสเซอร์อุตสาหกรรม จำกัด|151|Industrial|0.1395283|653.2|0.154|AMR
06-30-2019|0010000104|0030000107|บริษัท สยามโพลิเอททีลีน จำกัด|151|Industrial|1.8611906|653.2|1.741|AMR
06-30-2019|0010000122|0030000126|บริษัท บี เอ เอส เอฟ (ไทย) จำกัด|151|Industrial|0.1598696|653.2|0.494|AMR
06-30-2019|0010000123|0030000127|บริษัท สยามซานิทารีแวร์อินดัสทรี (หนองแค) จำกัด|151|Industrial|0.4105333|653.2|0.536|AMR
06-30-2019|0010000136|0030000141|บริษัท ยูเนี่ยนไทย-นิจิบัน จำกัด|151|Industrial|0.1213766|653.2|0.363|AMR
06-30-2019|0010000146|0030000151|บริษัท จีเอฟพีที จำกัด (มหาชน)|151|Industrial|0.4033998|653.2|0.477|AMR
06-30-2019|0010000147|0030000152|บริษัท แมคคีย์ ฟู้ด เซอร์วิสเซส (ประเทศไทย) จำกัด|151|Industrial|0.3346067|653.2|0.257|AMR
06-30-2019|0010000158|0030000164|บริษัท นิวพลัสนิตติ้ง จำกัด (มหาชน)|151|Industrial|0.0000|653.2|0.007|AMR
06-30-2019|0010000201|0030000021|บริษัท อดิตยา เบอร์ล่า เคมีคัลส์ (ประเทศไทย) จำกัด (ซัลไฟท์ส ดีวิชั่น)|151|Industrial|0.0866622|653.2|0.082|AMR
06-30-2019|0010000207|0030000240|บริษัท สตาร์ส เทคโนโลยี อินดัสเตรียล จำกัด|151|Industrial|0.1030482|653.2|0.297|AMR
06-30-2019|0010000216|0030030499|บริษัท ไออาร์พีซี จำกัด (มหาชน)|152|Industrial-CoGen|51.8327991|653.2|51.063|FlowComp
06-30-2019|0010009228|0030019659|บริษัท ไทย เอ็มเอฟซี จำกัด|151|Industrial|0.1266031|653.2|0.138|AMR
06-30-2019|0010010061|0030022473|บริษัท แอมคอร์ เฟล็กซิเบิ้ล ระยองจำกัด|151|Industrial|0.0235902|653.2|0.019|AMR
06-30-2019|0010010998|0030026291|บริษัท งามดีอุตสาหกรรม จำกัด|151|Industrial|0.024473|653.2|0.079|AMR
06-30-2019|0010012320|0030000055|บริษัท พีทีที โกลบอล เคมิคอล จำกัด(มหาชน)|151|Industrial|0.002472|653.2|0.003|AMR
06-30-2019|0010012393|0030033336|บริษัท จรุงไทยไวร์แอนด์เคเบิ้ล จำกัด (มหาชน)|151|Industrial|0.0000|653.2|0.114|AMR
06-30-2019|0010021151|0030040140|บริษัท คนอฟ ยิปซั่ม (ประเทศไทย) จำกัด|151|Industrial|0.0000|653.2|0.543|AMR
06-30-2019|0010022812|0030014300|บริษัท โกลบอล เพาเวอร์ ซินเนอร์ยี่จำกัด (มหาชน)|152|Industrial-CoGen|0.0000|653.2|56.401|FlowComp
06-30-2019|0010024039|0030050402|บริษัท สุเพิร์บ พาวเวอร์ จำกัด|152|Industrial-CoGen|0.0000|653.2|0.438|AMR
06-30-2019|0010027459|0030011637|บริษัท โอสถสภา จำกัด (มหาชน)|151|Industrial|2.5177615|653.2|2.427|AMR
06-30-2019|0010027591|0030000157|บริษัท ซีพีเอฟ ฟู้ด แอนด์ เบฟเวอร์เรจ จำกัด|151|Industrial|0.1203524|653.2|0.20|AMR
06-30-2019|0010028705|0030017241|บริษัท บีจี โฟลต กล๊าส จำกัด|151|Industrial|0.2809284|653.2|0.183|AMR
06-30-2019|0010029277|0030062577|บริษัท โรม เมคะเทค (ประเทศไทย) จำกัด|151|Industrial|0.0000|653.2||ADQ
