Date|Sold to|Ship to|Ship to name|ContractType|Description|Volume(MMSCFD)|DemandPlan(BI)|MDCQ(BW)|Billing Type
06-30-2019|0010000011|0030000011|บริษัท อลูคอน จำกัด (มหาชน)|151|Industrial|0.8835031|653.2|1.262|AMR
06-30-2019|0010000024|0030000024|บริษัท ไทล์ท้อป อินดัสตรี้ จำกัด (มหาชน)|151|Industrial|5.5646785|653.2|4.513|AMR
06-30-2019|0010000037|0030000037|บริษัท สยามไฟเบอร์กลาส จำกัด|151|Industrial|0.363247|653.2|0.343|AMR
06-30-2019|0010000052|0030000052|บริษัท ไทยออยล์ จำกัด (มหาชน)|151|Industrial|14.1873996|653.2|21.586|AMR/FlowComp
06-30-2019|0010000053|0030000053|บริษัท ไทยอาซาฮีเคมีภัณฑ์ จำกัด|151|Industrial|0.1932067|653.2|0.15|AMR
06-30-2019|0010000068|0030025580|บริษัท เหล็กสยามยามาโตะ จำกัด|151|Industrial|0.0000|653.2|2.492|AMR
06-30-2019|0010000070|0030000070|บริษัท ทานิโอบิส จำกัด|151|Industrial|0.208957|653.2|0.168|AMR
06-30-2019|0010000084|0030000084|บริษัท สยามอุตสาหกรรมวัสดุทนไฟ จำกัด|151|Industrial|1.1027368|653.2|1.211|AMR
06-30-2019|0010000110|0030000114|บริษัท ระยอง กัลวาไนซิ่ง จำกัด|151|Industrial|0.047357|653.2|0.071|AMR
06-30-2019|0010000128|0030000132|บริษัท เซกิซุย เอส-เล็ค (ประเทศไทย)จำกัด|151|Industrial|0.064308|653.2|0.072|AMR
06-30-2019|0010000145|0030000150|บริษัท แสตนดาร์ดแคน จำกัด|151|Industrial|0.1985039|653.2|0.236|AMR
06-30-2019|0010000164|0030019231|บริษัท โกลว์ พลังงาน จำกัด (มหาชน)|151|Industrial|0.0000|653.2|0.187|ADQ
06-30-2019|0010000164|0030030778|บริษัท โกลว์ พลังงาน จำกัด (มหาชน)|152|Industrial-CoGen|0.0000|653.2|55.739|FlowComp
06-30-2019|0010000216|0030049389|บริษัท ไออาร์พีซี จำกัด (มหาชน)|151|Industrial|7.3870583|653.2|8.233|AMR
06-30-2019|0010001013|0030023306|บริษัท เนสท์เล่ (ไทย) จำกัด|151|Industrial|0.0176926|653.2|0.032|AMR
06-30-2019|0010001125|0030039301|บริษัท ไทยโพลีอะซีทัล จำกัด|151|Industrial|0.0831308|653.2|0.081|AMR
06-30-2019|0010001741|0030022479|บริษัท อลูมิเนียม ฉื่อ จิ้น ฮั้ว จำกัด|151|Industrial|0.3864487|653.2|0.397|AMR
06-30-2019|0010002092|0030016062|บริษัท สยามแผ่นเหล็กวิลาส จำกัด|151|Industrial|0.0082989|653.2|0.126|AMR
06-30-2019|0010006548|0030009620|บริษัท อีเลคโทรลักซ์ ประเทศไทย จำกัด|151|Industrial|0.0167391|653.2|0.036|AMR
06-30-2019|0010006922|0030020406|บริษัท อายิโนะโมะโต๊ะ (ประเทศไทย)จำกัด|151|Industrial|3.5144836|653.2|1.299|AMR
06-30-2019|0010007306|0030012309||151|Industrial|0.3869431|653.2|0.343|AMR
06-30-2019|0010007330|0030013313|บริษัท โกรเวล แอบเบรซีพ (ไทยแลนด์)จำกัด|151|Industrial|0.047357|653.2|0.052|AMR
06-30-2019|0010007982|0030014211|บริษัท จีซี ไกลคอล จำกัด|151|Industrial|0.0000|653.2|0.275|AMR
06-30-2019|0010008657|0030016715|บริษัท คิริว (ประเทศไทย) จำกัด|151|Industrial|0.0223895|653.2|0.035|AMR
06-30-2019|0010009093|0030019105|บริษัท ยูเนียน ออโตพาร์ทส มานูแฟคเชอริ่ง จำกัด|151|Industrial|0.0775863|653.2|0.101|AMR
06-30-2019|0010009390|0030020154|บริษัท อัลวา อะลูมิเนียม จำกัด|151|Industrial|0.0000|653.2|0.273|AMR
06-30-2019|0010010156|0030022920|บริษัท ไทยเคมีภัณฑ์ จำกัด|151|Industrial|0.141965|653.2|0.249|AMR
06-30-2019|0010010216|0030023098|บริษัท สยามพรีเสิร์ฟ ฟู้ดส์ จำกัด|151|Industrial|0.1448608|653.2|0.15|AMR
06-30-2019|0010011367|0030027987|บริษัท มิลลิเมด จำกัด|151|Industrial|0.0133489|653.2|0.035|AMR
06-30-2019|0010012320|0030000072|บริษัท พีทีที โกลบอล เคมิคอล จำกัด(มหาชน)|152|Industrial-CoGen|17.51229|653.2|17.936|ADQ
06-30-2019|0010012320|0030000072|บริษัท พีทีที โกลบอล เคมิคอล จำกัด(มหาชน)|151|Industrial|-17.5122857|653.2|19.767|ADQ/AMR
06-30-2019|0010012440|0030033600|บริษัท นูทริกซ์ จำกัด (มหาชน)|151|Industrial|0.2600221|653.2|0.199|AMR
06-30-2019|0010012506|0030000025|บริษัท ปทุมธานีกล๊าส อินดัสทรี จำกัด|151|Industrial|2.5978552|653.2|2.842|AMR
06-30-2019|0010021265|0030000095|บริษัท เอ็นเอส-สยามยูไนเต็ดสตีล จำกัด|151|Industrial|0.416784|653.2|2.057|AMR
06-30-2019|0010022812|0030024457|บริษัท โกลบอล เพาเวอร์ ซินเนอร์ยี่จำกัด (มหาชน)|151|Industrial|3.5780854|653.2|3.569|AMR
06-30-2019|0010024055|0030064940|บริษัท โอจีพี เอนเนอร์ยี่ โซลูชั่นส์ จำกัด (สำหรับ บริษัท คันไซ เรซิน(ประเทศไทย) จำกัด)|151|Industrial|0.0000|653.2||ADQ
06-30-2019|0010024055|0030064941|บริษัท โอจีพี เอนเนอร์ยี่ โซลูชั่นส์ จำกัด (สำหรับ บริษัท นิปปอน สตีลไพพ์ (ประเทศไทย) จำกัด โรงงาน 1)|151|Industrial|0.0000|653.2||ADQ
06-30-2019|0010027591|0030024290|บริษัท ซีพีเอฟ ฟู้ด แอนด์ เบฟเวอร์เรจ จำกัด|152|Industrial-CoGen|0.0000|653.2|0.231|AMR
06-30-2019|0010000009|0030000009|บริษัท ล.ไลท์ติ้งกลาส จำกัด|151|Industrial|3.7445235|653.2|3.919|AMR
06-30-2019|0010000010|0030000010|บริษัท สยามกลาส อินดัสทรี จำกัด|151|Industrial|1.8005552|653.2|2.202|AMR
06-30-2019|0010000026|0030000026|บริษัท บางกอกแคน แมนนูแฟคเจอริ่ง จำกัด|151|Industrial|0.2572675|653.2|0.231|AMR
06-30-2019|0010000027|0030000027|บริษัท ฝาจีบ จำกัด (มหาชน)|152|Industrial-CoGen|0.0033195|653.2|0.41|AMR
06-30-2019|0010000038|0030000102|บริษัท สหโมเสคอุตสาหกรรม จำกัด (มหาชน)|151|Industrial|1.4051012|653.2|1.78|AMR
06-30-2019|0010000039|0030000039|บริษัท โสสุโก้ เซรามิค จำกัด|151|Industrial|1.8822381|653.2|1.988|AMR
06-30-2019|0010000053|0030020331|บริษัท ไทยอาซาฮีเคมีภัณฑ์ จำกัด|151|Industrial|0.5203621|653.2|0.446|AMR
06-30-2019|0010000068|0030000068|บริษัท เหล็กสยามยามาโตะ จำกัด|151|Industrial|0.5802558|653.2|2.984|AMR
06-30-2019|0010000088|0030000088|บริษัท ไทยฟิล์มอินดัสตรี่ จำกัด (มหาชน)|151|Industrial|0.0000|653.2|0.012|AMR
06-30-2019|0010000108|0030000112|บริษัท ยูนิตี้ อินดัสเตรียล จำกัด|151|Industrial|0.0561503|653.2|0.015|AMR
06-30-2019|0010000109|0030000113|บริษัท ระยองไวร์ อินดัสตรีส์ จำกัด(มหาชน)|151|Industrial|0.0208003|653.2|0.04|AMR
06-30-2019|0010000133|0030000138|บริษัท เอ.เจ. พลาสท์ จำกัด (มหาชน)|151|Industrial|0.5730163|653.2|0.616|AMR
06-30-2019|0010000150|0030000155|บริษัท บริดจสโตน เมตัลฟา(ประเทศไทย) จำกัด|151|Industrial|0.3871903|653.2|0.314|AMR
06-30-2019|0010000178|0030016267|บริษัท โกลว์ เอสพีพี 11 จำกัด|152|Industrial-CoGen|0.0000|653.2|0.0078|AMR
06-30-2019|0010000220|0030000249|บริษัท เอเชีย ซิลิโคนส์ โมโนเมอร์จำกัด|151|Industrial|3.7396148|653.2|3.666|AMR
06-30-2019|0010001146|0030042053|บริษัท เคลล็อก (ประเทศไทย) จำกัด|151|Industrial|0.0237667|653.2|0.166|AMR
06-30-2019|0010001196|0030029791|บริษัท ไทยคูน เวิลด์ไวด์ กรุ๊ป (ประเทศไทย) จำกัด (มหาชน)|151|Industrial|0.3283207|653.2|1.625|AMR
06-30-2019|0010001827|0030021652|บริษัท กรไทย จำกัด|151|Industrial|0.6394785|653.2|0.634|AMR
06-30-2019|0010002964|0030024050|บริษัท สยามบราเดอร์ จำกัด|151|Industrial|0.011336|653.2|0.096|AMR
06-30-2019|0010003009|0030053395|บริษัท มิตซูบิชิ อีเล็คทริค คอนซูมเมอร์ โปรดักส์ (ประเทศไทย) จำกัด|158|NG by Truck|0.03057|653.2|0.025|ADQ
06-30-2019|0010006894|0030020321|บริษัท อาร์ต อุตสาหกรรม จำกัด|151|Industrial|0.0725717|653.2|0.038|AMR
06-30-2019|0010007060|0030011444|บริษัท สยามร่วมมิตร จำกัด|151|Industrial|0.0198468|653.2|0.106|AMR
06-30-2019|0010007112|0030011636|บริษัท ไทยซัมมิท อีสเทิร์น ซีบอร์ดโอโตพาร์ท อินดัสตรี จำกัด|151|Industrial|0.0000|653.2|0.038|AMR
06-30-2019|0010007765|0030013679|บริษัท เอ.พี.ซี อุตสาหกรรม จำกัด|151|Industrial|0.0000|653.2|0.009|AMR
06-30-2019|0010007766|0030000094|บริษัท อินโดรามา ปิโตรเคม จำกัด|152|Industrial-CoGen|0.0000|653.2|0.036|AMR
06-30-2019|0010008356|0030047608|บริษัท แสงไทยเมตัลดรัม จำกัด|151|Industrial|0.0000|653.2|0.035|AMR
06-30-2019|0010008739|0030013343|บริษัท สยามไฟเบอร์ซีเมนต์กรุ๊ป จำกัด|151|Industrial|0.7001139|653.2||AMR
06-30-2019|0010009177|0030019562|บริษัท สยามโกชิ มานูแฟคเชอริ่ง จำกั|151|Industrial|0.0189639|653.2|0.097|AMR
06-30-2019|0010009442|0030020288|บริษัท อายิโนะโมะโต๊ะเซลส์ (ประเทศไทย) จำกัด|151|Industrial|0.0000|653.2|0.051|AMR
06-30-2019|0010010220|0030023100|บริษัท เอส ไอ ดับบลิว (ไทยแลนด์) จำกัด|151|Industrial|0.0735958|653.2|0.075|AMR
06-30-2019|0010011784|0030030288|บริษัท สยามเลเทกซ์ สังเคราะห์ จำกัด|151|Industrial|0.0000|653.2|1.213|AMR
06-30-2019|0010012323|0030032849|บริษัท โตโยอิ๊งค์ (ประเทศไทย) จำกัด|151|Industrial|0.00983|653.2|0.009|ADQ
06-30-2019|0010020998|0030039159||151|Industrial|0.00054|653.2|0.009|ADQ
06-30-2019|0010021265|0030040855|บริษัท เอ็นเอส-สยามยูไนเต็ดสตีล จำกัด|151|Industrial|1.5236527|653.2|1.35|AMR
06-30-2019|0010021577|0030041863|บริษัท นำวัฒนา แพ็คแอนด์พริ้นท์ จำกัด|151|Industrial|0.2936064|653.2|0.159|AMR
06-30-2019|0010022868|0030047048|บริษัท ไออาร์พีซี คลีน พาวเวอร์ จำกัด|151|Industrial|2.6547472|653.2|2.07|AMR
06-30-2019|0010024871|0030053591|บริษัท เอ็นเอส-โอจี เอนเนอร์จี โซลูชั่นส์ (ไทยแลนด์) จำกัด|152|Industrial-CoGen|0.0038493|653.2|0.87|AMR
06-30-2019|0010025332|0030052476|บริษัท ไอที ฟอร์จิ้ง (ประเทศไทย) จำกัด|151|Industrial|0.0858853|653.2|0.141|AMR
06-30-2019|0010027591|0030024290|บริษัท ซีพีเอฟ ฟู้ด แอนด์ เบฟเวอร์เรจ จำกัด|151|Industrial|0.2615759|653.2|0.725|AMR
06-30-2019|0010027807|0030064609|บริษัท เช่วเฉิน ซิลิก้า (ไทยแลนด์)จำกัด|151|Industrial|0.0000|653.2||ADQ
06-30-2019|0010000006|0030000006|บริษัท ธนอินเตอร์ จำกัด|151|Industrial|0.0000|653.2|0.011|AMR
06-30-2019|0010000022|0030000022|บริษัท ไทยบริดจสโตน จำกัด|151|Industrial|1.5882786|653.2|1.53|AMR
06-30-2019|0010000022|0030000022|บริษัท ไทยบริดจสโตน จำกัด|152|Industrial-CoGen|0.0000|653.2|1.024|AMR
06-30-2019|0010000031|0030000031|บริษัท วิลเลรอย แอนด์ บอค (ประเทศไทย) จำกัด|151|Industrial|0.7805608|653.2|0.634|AMR
06-30-2019|0010000032|0030000032|บริษัท รอยัลปอร์ซเลน จำกัด (มหาชน)|151|Industrial|0.8565933|653.2|0.956|AMR
06-30-2019|0010000047|0030000047|บริษัท โพสโค-ไทยน๊อคซ์ จำกัด (มหาชน)|151|Industrial|0.8269643|653.2|1.419|AMR
06-30-2019|0010000057|0030000057|บริษัท พี เอส เมททอลเวอกส์ จำกัด|151|Industrial|0.0000|653.2|0.033|AMR
06-30-2019|0010000058|0030000058|บริษัท พีคิว เคมิคอลส์ (ประเทศไทย)จำกัด|151|Industrial|0.1944074|653.2|0.118|AMR
06-30-2019|0010000074|0030000074|บริษัท ไทยเบเวอร์เรจแคน จำกัด|151|Industrial|0.5304621|653.2|0.54|AMR
06-30-2019|0010000096|0030000096|บริษัท ระยองโอเลฟินส์ จำกัด|151|Industrial|0.405448|653.2|0.302|AMR
06-30-2019|0010000097|0030000097|บริษัท สายไฟฟ้าบางกอกเคเบิ้ล จำกัด|151|Industrial|0.1311941|653.2|0.302|AMR
06-30-2019|0010000116|0030034491|บริษัท มิตซูบิชิ มอเตอร์ส (ประเทศไทย) จำกัด|151|Industrial|0.0000|653.2|0.139|AMR
06-30-2019|0010000117|0030000121|บริษัท ไทยซิลิเกตเคมิคัล จำกัด|151|Industrial|0.7686244|653.2|0.807|AMR
06-30-2019|0010000137|0030000142|บริษัท วาลเมท จำกัด|151|Industrial|0.0000|653.2|0.011|AMR
06-30-2019|0010000139|0030000144|บริษัท ยูเนี่ยนไพโอเนียร์ จำกัด(มหาชน)|151|Industrial|0.0408944|653.2|0.108|AMR
06-30-2019|0010000159|0030000165|บริษัท ไทย-เยอรมัน สเปเชียลตี้ กลาสจำกัด|151|Industrial|0.0165625|653.2|0.039|AMR
06-30-2019|0010000160|0030000166|บริษัท คอนวูด จำกัด|151|Industrial|0.3045539|653.2|0.24|AMR
06-30-2019|0010000202|0030042681|บริษัท สมบูรณ์ โซมิค แมนูแฟคเจอริ่งจำกัด|151|Industrial|0.0000|653.2|0.012|AMR
06-30-2019|0010000916|0030044950|บริษัท ดาน่า สไปเซอร์ (ประเทศไทย) จำกัด|151|Industrial|0.090335|653.2|0.103|AMR
06-30-2019|0010000925|0030022478|บริษัท ไทยสตีลโปรไฟล์ จำกัด (มหาชน)|151|Industrial|1.4810632|653.2|0.646|AMR
06-30-2019|0010001727|0030020317|บริษัท ไทยเซ็นทรัลเคมี จำกัด (มหาชน)|152|Industrial-CoGen|0.3656837|653.2|0.231|AMR
06-30-2019|0010001740|0030022424|บริษัท โรงงานเหล็กกรุงเทพฯ จำกัด|151|Industrial|0.6782894|653.2|1.486|AMR
06-30-2019|0010002201|0030011779|บริษัท ควอลิตี้ คอฟฟี่ โปรดักท์ส จำกัด|151|Industrial|1.032178|653.2|0.884|AMR
06-30-2019|0010006922|0030011105|บริษัท อายิโนะโมะโต๊ะ (ประเทศไทย)จำกัด|151|Industrial|0.0000|653.2|0.069|AMR
06-30-2019|0010006922|0030020406|บริษัท อายิโนะโมะโต๊ะ (ประเทศไทย)จำกัด|152|Industrial-CoGen|0.0000|653.2|2.255|AMR
06-30-2019|0010007812|0030013764|บริษัท กรุงเทพสลักภัณฑ์ จำกัด|151|Industrial|0.0000|653.2|0.061|AMR
06-30-2019|0010007875|0030013765|บริษัท วนชัย เคมีคอล อินดัสทรี่ส์จำกัด|151|Industrial|0.1072154|653.2|0.141|AMR
06-30-2019|0010009040|0030022254|บริษัท ไทยเรยอน จำกัด (มหาชน)|151|Industrial|1.259534|653.2|1.152|AMR
06-30-2019|0010009584|0030020740|บริษัท เจลลี เบลลี แคนดี้ คอมปานี (ประเทศไทย) จำกัด|151|Industrial|0.0645552|653.2|0.082|AMR
06-30-2019|0010009598|0030053139|บมจ.เอเชียน อินซูเลเตอร์|151|Industrial|0.0000|653.2|0.307|AMR
06-30-2019|0010011538|0030028841|บริษัท ผลิตไฟฟ้าและพลังงานร่วม จำกัด|154|Commercial–CoGen|0.0000|653.2||ADQ
06-30-2019|0010011735|0030030004|บริษัท เนเชอรัล ก๊าซ ไซลินเดอร์ (ประเทศไทย) จำกัด|151|Industrial|0.0000|653.2|0.004|AMR
06-30-2019|0010015560|0030040907|บริษัท ลินเด้ ไฮโค จำกัด|151|Industrial|0.9958039|653.2|1.734|AMR
06-30-2019|0010022812|0030020778|บริษัท โกลบอล เพาเวอร์ ซินเนอร์ยี่จำกัด (มหาชน)|152|Industrial-CoGen|22.636902|653.2|21.808|FlowComp
06-30-2019|0010022812|0030020778|บริษัท โกลบอล เพาเวอร์ ซินเนอร์ยี่จำกัด (มหาชน)|151|Industrial|0.8635132|653.2|2.46|FlowComp
06-30-2019|0010027295|0030059173|บมจ.ปตท. น้ำมันและการค้าปลีก|158|NG by Truck|0.14304|653.2|0.20|ADQ
06-30-2019|0010000003|0030000003|บริษัท เขาช่องอุตสาหกรรม 1979 จำกัด|151|Industrial|0.0000|653.2|0.524|AMR
06-30-2019|0010000004|0030000004|บริษัท ไทย คอปเปอร์ ร็อด จำกัด|151|Industrial|0.0000|653.2|0.196|AMR
06-30-2019|0010000015|0030000015|บริษัท โคห์เลอร์ (ประเทศไทย) จำกัด(มหาชน)|151|Industrial|2.2025425|653.2|2.465|AMR
06-30-2019|0010000030|0030000030|บริษัท ภัทราพอร์ซเลน จำกัด|151|Industrial|0.53696|653.2|0.558|AMR
06-30-2019|0010000041|0030000041|บริษัท สยามอุตสาหกรรมยิปซัม (สระบุรี) จำกัด|151|Industrial|2.3367736|653.2|2.714|AMR
06-30-2019|0010000054|0030000054|บริษัท บางกอก คริสตัล จำกัด|151|Industrial|0.0000|653.2|0.817|AMR
06-30-2019|0010000056|0030000056|บริษัท โอเอสซี สยามซิลิกา จำกัด|151|Industrial|2.133361|653.2|1.604|AMR
06-30-2019|0010000067|0030000067|บริษัท มิลล์คอน บูรพา จำกัด|151|Industrial|1.5411688|653.2|1.345|AMR
06-30-2019|0010000082|0030000082|บริษัท สยามโทซู เซรามิกส์ จำกัด|151|Industrial|0.0000|653.2|0.057|AMR
06-30-2019|0010000089|0030000089|บริษัท ธนเสริมอุตสาหกรรมฝาขวด จำกัด|151|Industrial|0.0000|653.2|0.063|AMR
06-30-2019|0010000091|0030000091|บริษัท สยาม เอ็นจีเค เทคโนเซรา จำกัด|151|Industrial|0.1964203|653.2|0.215|AMR
06-30-2019|0010000099|0030000099|บริษัท เกรท วอลล์ มอเตอร์ แมนูแฟคเจอริ่ง (ประเทศไทย) จำกัด|151|Industrial|0.0000|653.2|0.456|AMR
06-30-2019|0010000101|0030000103|บริษัท ร็อควูล (ประเทศไทย) จำกัด|151|Industrial|0.039729|653.2|0.171|AMR
06-30-2019|0010000116|0030000120|บริษัท มิตซูบิชิ มอเตอร์ส (ประเทศไทย) จำกัด|151|Industrial|0.0000706|653.2|0.322|AMR
06-30-2019|0010000129|0030000133|บริษัท ทีพีซี เพสต์ เรซิน จำกัด|151|Industrial|0.317691|653.2|0.258|AMR
06-30-2019|0010000130|0030000134|บริษัท กรีนสปอต จำกัด|151|Industrial|0.0000|653.2|0.56|AMR
06-30-2019|0010000140|0030000145|บริษัท สยามลวดเหล็กอุตสาหกรรม จำกัด|151|Industrial|0.0655087|653.2|0.075|AMR
06-30-2019|0010000148|0030000153|บริษัท เคนไซซีรามิคส์ อินดัสตรี้ จำกัด|151|Industrial|0.1839542|653.2|0.25|AMR
06-30-2019|0010000149|0030000154|บริษัท เอเวอรี่ เดนนิสสัน (ประเทศไทย) จำกัด|151|Industrial|0.0060034|653.2|0.075|AMR
06-30-2019|0010000156|0030000162|บริษัท เวลโกรว์กล๊าส อินดัสทรี จำกัด|151|Industrial|1.9034976|653.2|1.774|AMR
06-30-2019|0010000195|0030033440|บริษัท ไทยลู้บเบส จำกัด (มหาชน)|151|Industrial|3.8960942|653.2|5.225|AMR
06-30-2019|0010000197|0030025358|บริษัท บางจาก คอร์ปอเรชั่น จำกัด (มหาชน)|152|Industrial-CoGen|8.0149889|653.2|6.90|AMR
06-30-2019|0010000203|0030000236|บริษัท สิงห์ คาเมดะ (ประเทศไทย) จำกัด|151|Industrial|0.0445318|653.2|0.248|AMR
06-30-2019|0010000205|0030000238|บริษัท ไทยอาซาคาวา จำกัด|151|Industrial|0.0727835|653.2|0.065|AMR
06-30-2019|0010000225|0030000251|บริษัท ซีพีพีซี จำกัด (มหาชน)|151|Industrial|0.1549255|653.2|0.13|AMR
06-30-2019|0010000934|0030046753|บริษัท ฮอนด้า ออโตโมบิล (ประเทศไทย) จำกัด|151|Industrial|0.0538902|653.2|0.33|AMR
06-30-2019|0010001609|0030015621|บริษัท โตโยต้า มอเตอร์ ประเทศไทย จำกัด|151|Industrial|0.0269804|653.2|0.487|AMR
06-30-2019|0010001747|0030042303|บริษัท สุนทรเมทัลอินดัสทรี้ส์ จำกัด|151|Industrial|0.1649549|653.2|0.381|AMR
06-30-2019|0010001787|0030024766|บริษัท เพรซิเดนท์ เบเกอรี่ จำกัด(มหาชน)|151|Industrial|0.3199158|653.2|0.301|AMR
06-30-2019|0010002094|0030018793|บริษัท พ้อตเตอร์ส (ประเทศไทย) จำกัด|151|Industrial|0.2733357|653.2|0.193|AMR
06-30-2019|0010002109|0030030514|บริษัท ลักกี้กลาส จำกัด|151|Industrial|0.8155929|653.2|0.755|AMR
06-30-2019|0010006748|0030010640|บริษัท ยูเนี่ยนโชจิรุชิ จำกัด|151|Industrial|0.0032842|653.2|0.015|AMR
06-30-2019|0010006939|0030011133|บริษัท นิเด็ค ค็อมโปเน็นท์ เทคโนโลยี (ไทยแลนด์) จำกัด|151|Industrial|0.2516525|653.2|0.476|AMR
06-30-2019|0010006940|0030011137|บริษัท เอส ที บี เท็กซ์ไทล์ อินดัสตรี จำกัด|151|Industrial|0.0000|653.2|0.033|AMR
06-30-2019|0010007512|0030040636|บริษัท คราวน์ เบ็บแคน แอนด์ โคลสเชอร์ส (ประเทศไทย) จำกัด|151|Industrial|0.1538308|653.2|0.149|AMR
06-30-2019|0010007561|0030013097|บริษัท บางชันเยนเนอเรลเอเซมบลี จำกัด|151|Industrial|0.0000|653.2|0.015|AMR
