Date|Sold to|Ship to|Ship to name|ContractType|Description|Volume(MMSCFD)|DemandPlan(BI)|MDCQ(BW)|Billing Type
01-27-2020|0010008289|0030015477|บริษัท ดี-รับเบอร์ โปรดักส์ จำกัด|151|Industrial|0.024579|652.19|0.033|AMR
01-27-2020|0010009085|0030056942|บจ.แดรี่ พลัส|151|Industrial|0.6694607|652.19|0.663|AMR
01-27-2020|0010009093|0030019105|บริษัท ยูเนียน ออโตพาร์ทส มานูแฟคเชอริ่ง จำกัด|151|Industrial|0.130629|652.19|0.099|AMR
01-27-2020|0010009604|0030020797|บริษัท เจ.พี ยูไนเต็ด จำกัด|151|Industrial|0.0551615|652.19|0.034|AMR
01-27-2020|0010009784|0030021478|บริษัท แคททาเลอร์ (ประเทศไทย) จำกัด|151|Industrial|0.1615294|652.19|0.114|AMR
01-27-2020|0010010423|0030024015|บริษัท ศานติบรรจุภัณฑ์ จำกัด|151|Industrial|0.1974091|652.19|0.168|AMR
01-27-2020|0010012320|0030000072|บริษัท พีทีที โกลบอล เคมิคอล จำกัด(มหาชน)|152|Industrial-CoGen|12.35544|652.19|10.296|ADQ
01-27-2020|0010012320|0030000072|บริษัท พีทีที โกลบอล เคมิคอล จำกัด(มหาชน)|151|Industrial|29.609868|652.19|23.146|ADQ/AMR
01-27-2020|0010012320|0030000168|บริษัท พีทีที โกลบอล เคมิคอล จำกัด(มหาชน)|151|Industrial|7.1398554|652.19|0.339|AMR
01-27-2020|0010020698|0030038224|บริษัท สตาร์คอร์ จำกัด|151|Industrial|0.1372682|652.19|0.105|AMR
01-27-2020|0010020836|0030038183|บริษัท กรุงเทพ ซินธิติกส์ จำกัด|151|Industrial|0.0234842|652.19|0.024|AMR
01-27-2020|0010022812|0030014300|บริษัท โกลบอล เพาเวอร์ ซินเนอร์ยี่จำกัด (มหาชน)|152|Industrial-CoGen|44.8597813|652.19|49.65038|FlowComp
01-27-2020|0010025615|0030053102|บริษัท เอ็นจีเค เซรามิคส์ (ประเทศไทย) จำกัด|151|Industrial|0.3977141|652.19|0.368|AMR
01-27-2020|0010026111|0030055031|บริษัท กบินทร์บุรีกล๊าส อินดัสทรีจำกัด|151|Industrial|3.2531901|652.19|3.016|AMR
01-27-2020|0010026153|0030054741|บริษัท นิคเคอิ เอ็มซี อลูมินัม (ประเทศไทย) จำกัด|151|Industrial|0.266414|652.19|0.225|AMR
01-27-2020|0010027861|0030046657|บริษัท เอสซีจี เซรามิกส์ จำกัด (มหาชน)|151|Industrial|0.2683917|652.19|0.245|AMR
01-27-2020|0010027938|0030059837|บริษัท ราชบุรีกล๊าส อินดัสทรี จำกัด|151|Industrial|1.8783182|652.19|1.515|AMR
01-27-2020|0010000009|0030000009|บริษัท ล.ไลท์ติ้งกลาส จำกัด|151|Industrial|3.4168737|652.19|3.884|AMR
01-27-2020|0010000010|0030000010|บริษัท สยามกลาส อินดัสทรี จำกัด|151|Industrial|1.6303384|652.19|1.76|AMR
01-27-2020|0010000024|0030000024|บริษัท ไทล์ท้อป อินดัสตรี้ จำกัด (มหาชน)|151|Industrial|5.3901179|652.19|4.432|AMR
01-27-2020|0010000038|0030000038|บริษัท สหโมเสคอุตสาหกรรม จำกัด (มหาชน)|151|Industrial|0.2229063|652.19|0.26|AMR
01-27-2020|0010000049|0030000049|บริษัท ไทยผลิตภัณฑ์ยิบซั่ม จำกัด(มหาชน)|152|Industrial-CoGen|0.0000|652.19|0.952|AMR
01-27-2020|0010000050|0030000050|บริษัท ไทยพลาสติกและเคมีภัณฑ์ จำกัด(มหาชน)|151|Industrial|5.4670333|652.19|5.017|AMR
01-27-2020|0010000056|0030000059|บริษัท โอเอสซี สยามซิลิกา จำกัด|151|Industrial|1.6066422|652.19|1.536|AMR
01-27-2020|0010000068|0030000068|บริษัท เหล็กสยามยามาโตะ จำกัด|151|Industrial|2.6248003|652.19|2.44|AMR
01-27-2020|0010000068|0030025580|บริษัท เหล็กสยามยามาโตะ จำกัด|151|Industrial|2.474501|652.19|2.074|AMR
01-27-2020|0010000089|0030000089|บริษัท ธนเสริมอุตสาหกรรมฝาขวด จำกัด|151|Industrial|0.0875098|652.19|0.072|AMR
01-27-2020|0010000114|0030000118|บริษัท อิเมอร์สัน อิเล็คทริค (ประเทศไทย) จำกัด|151|Industrial|0.1277685|652.19|0.134|AMR
01-27-2020|0010000128|0030000132|บริษัท เซกิซุย เอส-เล็ค (ประเทศไทย)จำกัด|151|Industrial|0.0911472|652.19|0.066|AMR
01-27-2020|0010000139|0030000144|บริษัท ยูเนี่ยนไพโอเนียร์ จำกัด(มหาชน)|151|Industrial|0.0893815|652.19|0.107|AMR
01-27-2020|0010000149|0030000154|บริษัท เอเวอรี่ เดนนิสสัน (ประเทศไทย) จำกัด|151|Industrial|0.1139958|652.19|0.081|AMR
01-27-2020|0010000150|0030000155|บริษัท บริดจสโตน เมตัลฟา(ประเทศไทย) จำกัด|151|Industrial|0.26147|652.19|0.291|AMR
01-27-2020|0010000178|0030016267|บริษัท โกลว์ เอสพีพี 11 จำกัด|152|Industrial-CoGen|1.4226526|652.19|1.124|AMR
01-27-2020|0010000201|0030000021|บริษัท อดิตยา เบอร์ล่า เคมีคัลส์ (ประเทศไทย) จำกัด (ซัลไฟท์ส ดีวิชั่น)|151|Industrial|0.0815063|652.19|0.084|AMR
01-27-2020|0010000201|0030000234|บริษัท อดิตยา เบอร์ล่า เคมีคัลส์ (ประเทศไทย) จำกัด(คลออัลคาลีดีวิชั่น)|151|Industrial|0.0301234|652.19|0.023|AMR
01-27-2020|0010000225|0030000251|บริษัท ซีพีพีซี จำกัด (มหาชน)|151|Industrial|0.114914|652.19|0.139|AMR
01-27-2020|0010001125|0030039301|บริษัท ไทยโพลีอะซีทัล จำกัด|151|Industrial|0.0851084|652.19|0.08|AMR
01-27-2020|0010001131|0030044478|บริษัท นอริตาเก้ เอสซีจี พลาสเตอร์จำกัด|151|Industrial|0.1747371|652.19|0.165|AMR
01-27-2020|0010001714|0030016192|บริษัท ออลเน็กซ์ (ประเทศไทย) จำกัด|151|Industrial|0.1477213|652.19|0.12|AMR
01-27-2020|0010001727|0030020317|บริษัท ไทยเซ็นทรัลเคมี จำกัด (มหาชน)|151|Industrial|0.0000|652.19|0.262|AMR
01-27-2020|0010001998|0030025768|บริษัท อินโดรามา โพลีเอสเตอร์ อินดัสตรี้ส์ จำกัด (มหาชน)|151|Industrial|1.2234071|652.19|1.63|AMR
01-27-2020|0010002048|0030021234|บริษัท ด๊อกเตอร์ บู จำกัด|151|Industrial|0.1684511|652.19|0.189|AMR
01-27-2020|0010006748|0030010640|บริษัท ยูเนี่ยนโชจิรุชิ จำกัด|151|Industrial|0.0083342|652.19|0.014|AMR
01-27-2020|0010006755|0030027897|บริษัท ปูนซิเมนต์ไทย (ท่าหลวง) จำกัด|151|Industrial|0.0050146|652.19|0.03|AMR
01-27-2020|0010007151|0030011752|บริษัท เอ็มซีแอลเอส เอเชีย จำกัด|151|Industrial|1.108705|652.19|0.964|AMR
01-27-2020|0010007766|0030013680|บริษัท อินโดรามา ปิโตรเคม จำกัด|152|Industrial-CoGen|3.8918918|652.19|3.55|AMR
01-27-2020|0010008114|0030024767|บริษัท ทุนเท็กซ์ เท็กซ์ไทล์ (ประเทศไทย) จำกัด|151|Industrial|0.2036598|652.19|0.252|AMR
01-27-2020|0010008206|0030015236|บริษัท เอ็นเนซอล จำกัด|152|Industrial-CoGen|1.7609322|652.19|0.001|AMR
01-27-2020|0010008739|0030000237|บริษัท สยามไฟเบอร์ซีเมนต์กรุ๊ป จำกัด|151|Industrial|0.1279098|652.19|0.105|AMR
01-27-2020|0010008739|0030013343|บริษัท สยามไฟเบอร์ซีเมนต์กรุ๊ป จำกัด|151|Industrial|1.0810182|652.19|0.861|AMR
01-27-2020|0010009151|0030019200|บริษัท ไทย เกลซ อุตสาหกรรม จำกัด|151|Industrial|0.1771738|652.19|0.275|AMR
01-27-2020|0010009390|0030020154|บริษัท อัลวา อะลูมิเนียม จำกัด|151|Industrial|0.2339952|652.19|0.218|AMR
01-27-2020|0010009841|0030021637|บริษัท โอวาริ เซกิ (ไทยแลนด์) จำกัด|151|Industrial|0.005509|652.19|0.006|AMR
01-27-2020|0010010605|0030024817|บริษัท มาบตาพุดโอเลฟินส์ จำกัด|151|Industrial|5.4641375|652.19|2.748|AMR
01-27-2020|0010010925|0030025431|บริษัท เน็กซ์ แคน อินโนเวชั่น จำกัด|151|Industrial|0.4102861|652.19|0.367|AMR
01-27-2020|0010011784|0030030288|บริษัท สยามเลเทกซ์ สังเคราะห์ จำกัด|151|Industrial|1.0528724|652.19|1.032|AMR
01-27-2020|0010012320|0030026468|บริษัท พีทีที โกลบอล เคมิคอล จำกัด(มหาชน)|151|Industrial|10.5303844|652.19|3.196|AMR
01-27-2020|0010012320|0030040549|บริษัท พีทีที โกลบอล เคมิคอล จำกัด(มหาชน)|152|Industrial-CoGen|0.0000|652.19|14.452|FlowComp
01-27-2020|0010021117|0030022988|บริษัท ซีพีเอฟ (ประเทศไทย) จำกัด(มหาชน)|151|Industrial|0.4330641|652.19|0.484|AMR
01-27-2020|0010021151|0030040140|บริษัท คนอฟ ยิปซั่ม (ประเทศไทย) จำกัด|151|Industrial|0.0095349|652.19|0.483|AMR
01-27-2020|0010022333|0030043703|บริษัท เอเชียแปซิฟิกกลาส จำกัด|151|Industrial|2.4819877|652.19|2.171|AMR
01-27-2020|0010022444|0030044003|บริษัท ทีวาย สตีล จำกัด|151|Industrial|0.0000|652.19|0.175|AMR
01-27-2020|0010022868|0030047048|บริษัท ไออาร์พีซี คลีน พาวเวอร์ จำกัด|151|Industrial|4.0413083|652.19|1.776|AMR
01-27-2020|0010024055|0030064942|บริษัท โอจีพี เอนเนอร์ยี่ โซลูชั่นส์ จำกัด (สำหรับ บริษัท นิปปอน สตีลไพพ์ (ประเทศไทย) จำกัด โรงงาน 2)|151|Industrial|0.0000|652.19||ADQ
01-27-2020|0010024871|0030053591|บริษัท เอ็นเอส-โอจี เอนเนอร์จี โซลูชั่นส์ (ไทยแลนด์) จำกัด|152|Industrial-CoGen|0.8618905|652.19|0.775|AMR
01-27-2020|0010025332|0030052476|บริษัท ไอที ฟอร์จิ้ง (ประเทศไทย) จำกัด|151|Industrial|0.1485689|652.19|0.134|AMR
01-27-2020|0010027459|0030011637|บริษัท โอสถสภา จำกัด (มหาชน)|151|Industrial|2.6251888|652.19|2.506|AMR
01-27-2020|0010027591|0030000157|บริษัท ซีพีเอฟ ฟู้ด แอนด์ เบฟเวอร์เรจ จำกัด|151|Industrial|0.1414|652.19|0.004|AMR
01-27-2020|0010028705|0030017241|บริษัท บีจี โฟลต กล๊าส จำกัด|151|Industrial|0.2137245|652.19|0.24|AMR
01-27-2020|0010029277|0030062577|บริษัท โรม เมคะเทค (ประเทศไทย) จำกัด|151|Industrial|0.00649|652.19|0.03|ADQ
01-27-2020|0010029951|0030064789|บริษัท สยามเพลเล็ทพาวเวอร์ จำกัด|152|Industrial-CoGen|0.7342632|652.19|0.819|AMR
01-27-2020|0010030938|0030000014|บริษัท เอสซีจี รูฟฟิ่ง จำกัด|151|Industrial|0.0000|652.19||ADQ
