Date|Sold to|Ship to|Ship to name|ContractType|Description|Volume(MMSCFD)|DemandPlan(BI)|MDCQ(BW)|Billing Type
01-27-2020|0010002109|0030030514|บริษัท ลักกี้กลาส จำกัด|151|Industrial|0.8421143|652.19|0.704|AMR
01-27-2020|0010006758|0030010658|บริษัท คอฟโค่ ไบโอเคมิคอล (ประเทศไทย) จำกัด|151|Industrial|0.8595951|652.19|0.784|AMR
01-27-2020|0010006939|0030011133|บริษัท นิเด็ค ค็อมโปเน็นท์ เทคโนโลยี (ไทยแลนด์) จำกัด|151|Industrial|0.5283079|652.19|0.463|AMR
01-27-2020|0010007561|0030013097|บริษัท บางชันเยนเนอเรลเอเซมบลี จำกัด|151|Industrial|0.0184342|652.19|0.015|AMR
01-27-2020|0010007594|0030013168|บริษัท ไลอ้อน (ประเทศไทย) จำกัด|151|Industrial|0.4814453|652.19|0.567|AMR
01-27-2020|0010008671|0030021639|บริษัท พีทีที ฟีนอล จำกัด|151|Industrial|0.0021541|652.19|0.265|AMR
01-27-2020|0010009180|0030044623|บริษัท ไทย มาลายา กลาส จำกัด|151|Industrial|4.5083805|652.19|4.463|AMR
01-27-2020|0010009196|0030019599|บริษัท ราชราตัน ไทย ไวร์ จำกัด|151|Industrial|0.2327945|652.19|0.171|AMR
01-27-2020|0010010156|0030022920|บริษัท ไทยเคมีภัณฑ์ จำกัด|151|Industrial|0.0468979|652.19|0.289|AMR
01-27-2020|0010010216|0030023098|บริษัท สยามพรีเสิร์ฟ ฟู้ดส์ จำกัด|151|Industrial|0.1441899|652.19|0.144|AMR
01-27-2020|0010012227|0030032353|บริษัท เอ็มทีพี เอชพี เจวี (ประเทศไทย) จำกัด|151|Industrial|7.0127931|652.19|7.239|AMR
01-27-2020|0010012440|0030033600|บริษัท นูทริกซ์ จำกัด (มหาชน)|151|Industrial|0.2007993|652.19|0.208|AMR
01-27-2020|0010012506|0030000025|บริษัท ปทุมธานีกล๊าส อินดัสทรี จำกัด|151|Industrial|2.7785605|652.19|2.627|AMR
01-27-2020|0010021265|0030040855|บริษัท เอ็นเอส-สยามยูไนเต็ดสตีล จำกัด|151|Industrial|0.0000|652.19|1.156|AMR
01-27-2020|0010021577|0030041863|บริษัท นำวัฒนา แพ็คแอนด์พริ้นท์ จำกัด|151|Industrial|0.4847648|652.19|0.57|AMR
01-27-2020|0010023667|0030000034|บริษัท สตาร์ ซานิทารี่แวร์ (ประเทศไทย) จำกัด|151|Industrial|0.1100052|652.19|0.103|AMR
01-27-2020|0010023967|0030050118|บริษัท โอซาก้า แก๊ส (ประเทศไทย) จำกัด|151|Industrial|0.2379504|652.19|0.197|AMR
01-27-2020|0010027591|0030024290|บริษัท ซีพีเอฟ ฟู้ด แอนด์ เบฟเวอร์เรจ จำกัด|152|Industrial-CoGen|0.2352665|652.19|0.197|AMR
01-27-2020|0010000001|0030000001|บริษัท กระจกลายสยาม จำกัด|151|Industrial|0.32706|652.19|0.328|ADQ
01-27-2020|0010000012|0030000012|บริษัท อีสเทิร์นไชน่าแวร์ จำกัด|151|Industrial|0.2907812|652.19|0.292|AMR
01-27-2020|0010000013|0030000013|บริษัท ทาทา สตีล การผลิต (ประเทศไทย) จำกัด (มหาชน)|151|Industrial|2.3673915|652.19|2.172|AMR
01-27-2020|0010000026|0030000026|บริษัท บางกอกแคน แมนนูแฟคเจอริ่ง จำกัด|151|Industrial|0.1012472|652.19|0.265|AMR
01-27-2020|0010000027|0030000027|บริษัท ฝาจีบ จำกัด (มหาชน)|152|Industrial-CoGen|0.0006003|652.19|0.372|AMR
01-27-2020|0010000035|0030000035|บริษัท สยามซานิทารีแวร์อินดัสทรี จำกัด|151|Industrial|0.6242579|652.19|0.889|AMR
01-27-2020|0010000036|0030000036|บริษัท สยามฟูรูกาวา จำกัด|151|Industrial|0.210193|652.19|0.248|AMR
01-27-2020|0010000051|0030000051|บริษัท ไทยไวร์โพรดัคท์ จำกัด (มหาชน)|151|Industrial|0.0510297|652.19|0.039|AMR
01-27-2020|0010000064|0030000243|บริษัท ลี่ไท่ อัลลอย จำกัด|151|Industrial|0.247556|652.19|0.246|AMR
01-27-2020|0010000065|0030000065|บริษัท สยามโพลีสไตรีน จำกัด|151|Industrial|0.044108|652.19|0.072|AMR
01-27-2020|0010000076|0030000076|บริษัท สยามสไตรีนโมโนเมอร์ จำกัด|151|Industrial|0.2226591|652.19|3.23|AMR
01-27-2020|0010000098|0030000098|บริษัท อีโอซีโพลิเมอร์ส (ไทยแลนด์)จำกัด|151|Industrial|0.0458384|652.19|0.029|AMR
01-27-2020|0010000120|0030000124|บริษัท ลอยัล ไฮ่เหลียง คอปเปอร์ (ประเทศไทย) จำกัด|151|Industrial|0.0029311|652.19|0.025|AMR
01-27-2020|0010000140|0030000145|บริษัท สยามลวดเหล็กอุตสาหกรรม จำกัด|151|Industrial|0.0000|652.19|0.074|AMR
01-27-2020|0010000141|0030000146|บริษัท สยามสตีล กัลวาไนซิ่ง จำกัด|151|Industrial|0.1424948|652.19|0.152|AMR
01-27-2020|0010000156|0030000162|บริษัท เวลโกรว์กล๊าส อินดัสทรี จำกัด|151|Industrial|1.8045811|652.19|1.841|AMR
01-27-2020|0010000157|0030000163|บริษัท ไทยอะครีลิค จำกัด|151|Industrial|0.0000|652.19|0.005|AMR
01-27-2020|0010000202|0030042681|บริษัท สมบูรณ์ โซมิค แมนูแฟคเจอริ่งจำกัด|151|Industrial|0.0098528|652.19|0.007|AMR
01-27-2020|0010000203|0030000236|บริษัท สิงห์ คาเมดะ (ประเทศไทย) จำกัด|151|Industrial|0.2801515|652.19|0.211|AMR
01-27-2020|0010000228|0030000254|บริษัท ไทย เพ็ท เรซิน จำกัด|151|Industrial|1.0960623|652.19|1.084|AMR
01-27-2020|0010001217|0030021463|บริษัท แอมคอล อินเตอร์เนชั่นแนล (ไทยแลนด์) จำกัด|151|Industrial|0.0446024|652.19|0.074|AMR
01-27-2020|0010001431|0030053506|บริษัท คาราบาวตะวันแดง จำกัด|151|Industrial|0.285484|652.19|0.24|AMR
01-27-2020|0010001488|0030016945|บริษัท โพลีเพล็กซ์ (ประเทศไทย) จำกัด (มหาชน)|151|Industrial|1.1711413|652.19|1.11|AMR
01-27-2020|0010001827|0030021652|บริษัท กรไทย จำกัด|151|Industrial|0.8578646|652.19|0.708|AMR
01-27-2020|0010001879|0030026184|บริษัท เอ็ชเอ็มซี โปลีเมอส์ จำกัด|151|Industrial|1.8829444|652.19|0.623|AMR
01-27-2020|0010006733|0030023785|บริษัท เดลี่ฟู้ดส์ จำกัด|151|Industrial|0.0687577|652.19|0.066|AMR
01-27-2020|0010007306|0030012309||151|Industrial|0.1653787|652.19|0.31|AMR
01-27-2020|0010007982|0030014211|บริษัท จีซี ไกลคอล จำกัด|151|Industrial|0.1139958|652.19|0.112|AMR
01-27-2020|0010008356|0030047608|บริษัท แสงไทยเมตัลดรัม จำกัด|151|Industrial|0.0215419|652.19|0.034|AMR
01-27-2020|0010008509|0030016162|บริษัท ผลิตภัณฑ์ตราเพชร จำกัด (มหาชน)|151|Industrial|0.0845787|652.19|0.128|AMR
01-27-2020|0010008758|0030016949|บริษัท คล็อกเนอร์ เพนทาพลาสท์ (ไทยแลนด์) จำกัด|151|Industrial|0.0138786|652.19|0.02|AMR
01-27-2020|0010008926|0030018384|บริษัท อินเตอร์เนชั่นแนล แลบบอราทอรีส์ จำกัด|151|Industrial|0.0247202|652.19|0.017|AMR
01-27-2020|0010009180|0030019567|บริษัท ไทย มาลายา กลาส จำกัด|151|Industrial|2.6716629|652.19|2.676|AMR
01-27-2020|0010009584|0030020740|บริษัท เจลลี เบลลี แคนดี้ คอมปานี (ประเทศไทย) จำกัด|151|Industrial|0.1009647|652.19|0.086|AMR
01-27-2020|0010009598|0030053139|บมจ.เอเชียน อินซูเลเตอร์|151|Industrial|0.4134998|652.19|0.314|AMR
01-27-2020|0010010355|0030023468|บริษัท เคียวเด็น (ประเทศไทย) จำกัด|151|Industrial|0.0581633|652.19|0.033|AMR
01-27-2020|0010010358|0030023471|บริษัท เซ้าท์ ซิตี้ ปิโตรเคม จำกัด|151|Industrial|0.1944074|652.19|0.12|AMR
01-27-2020|0010011735|0030030004|บริษัท เนเชอรัล ก๊าซ ไซลินเดอร์ (ประเทศไทย) จำกัด|151|Industrial|0.0000|652.19||AMR
01-27-2020|0010012320|0030000055|บริษัท พีทีที โกลบอล เคมิคอล จำกัด(มหาชน)|151|Industrial|0.0238374|652.19|0.002|AMR
01-27-2020|0010012320|0030000069|บริษัท พีทีที โกลบอล เคมิคอล จำกัด(มหาชน)|151|Industrial|0.5940285|652.19|3.922|AMR
01-27-2020|0010012393|0030033336|บริษัท จรุงไทยไวร์แอนด์เคเบิ้ล จำกัด (มหาชน)|151|Industrial|0.3224232|652.19|0.134|AMR
01-27-2020|0010021112|0030041494|บริษัท เจเอสอาร์ บีเอสที อิลาสโตเมอร์ จำกัด|151|Industrial|0.2013997|652.19|0.178|AMR
01-27-2020|0010021117|0030000123|บริษัท ซีพีเอฟ (ประเทศไทย) จำกัด(มหาชน)|152|Industrial-CoGen|1.3198162|652.19|1.161|AMR
01-27-2020|0010021842|0030023236|บริษัท คอทโก้ เมททอลเวอร์คส จำกัด|151|Industrial|0.1933126|652.19|0.199|AMR
01-27-2020|0010022812|0030024457|บริษัท โกลบอล เพาเวอร์ ซินเนอร์ยี่จำกัด (มหาชน)|151|Industrial|3.5636063|652.19|3.999|AMR
01-27-2020|0010022812|0030063296|บริษัท โกลบอล เพาเวอร์ ซินเนอร์ยี่จำกัด (มหาชน)|152|Industrial-CoGen|12.0777368|652.19|5.966|FlowComp
01-27-2020|0010024055|0030064939|บริษัท โอจีพี เอนเนอร์ยี่ โซลูชั่นส์ จำกัด (สำหรับ บริษัท ยามาดะ สมบูรณ์ จำกัด)|151|Industrial|0.0000|652.19||ADQ
01-27-2020|0010024055|0030064940|บริษัท โอจีพี เอนเนอร์ยี่ โซลูชั่นส์ จำกัด (สำหรับ บริษัท คันไซ เรซิน(ประเทศไทย) จำกัด)|151|Industrial|0.06286|652.19|0.10|ADQ
01-27-2020|0010024055|0030064941|บริษัท โอจีพี เอนเนอร์ยี่ โซลูชั่นส์ จำกัด (สำหรับ บริษัท นิปปอน สตีลไพพ์ (ประเทศไทย) จำกัด โรงงาน 1)|151|Industrial|0.07782|652.19|0.11|ADQ
01-27-2020|0010027295|0030059173|บมจ.ปตท. น้ำมันและการค้าปลีก|158|NG by Truck|0.14094|652.19|0.20|ADQ
01-27-2020|0010027315|0030057427|บริษัท นิชินโบะ สมบูรณ์ ออโตโมทีฟ จำกัด|151|Industrial|0.0224601|652.19|0.014|AMR
01-27-2020|0010027861|0030000246|บริษัท เอสซีจี เซรามิกส์ จำกัด (มหาชน)|151|Industrial|2.547779|652.19|2.35|AMR
01-27-2020|0010000004|0030000004|บริษัท ไทย คอปเปอร์ ร็อด จำกัด|151|Industrial|0.1774563|652.19|0.17|AMR
01-27-2020|0010000005|0030000005|บริษัท ไทยเมทัลโพรเซสซิ่ง จำกัด|151|Industrial|0.6517327|652.19|0.364|AMR
01-27-2020|0010000016|0030000016|บริษัท ลิกซิล (ประเทศไทย) จำกัด (มหาชน)|151|Industrial|0.6330866|652.19|0.766|AMR
01-27-2020|0010000031|0030000031|บริษัท วิลเลรอย แอนด์ บอค (ประเทศไทย) จำกัด|151|Industrial|0.6099201|652.19|0.651|AMR
01-27-2020|0010000032|0030000032|บริษัท รอยัลปอร์ซเลน จำกัด (มหาชน)|151|Industrial|1.0794644|652.19|1.053|AMR
01-27-2020|0010000043|0030000043|บริษัท ไทย จีซีไอ เรซิท็อป จำกัด|151|Industrial|0.2381976|652.19|0.263|AMR
01-27-2020|0010000061|0030000061|บริษัท ไมย์เออร์ อินดัสตรีส์ จำกัด|151|Industrial|0.3539239|652.19|0.397|AMR
01-27-2020|0010000070|0030000070|บริษัท ทานิโอบิส จำกัด|151|Industrial|0.1620591|652.19|0.124|AMR
01-27-2020|0010000083|0030000083|บริษัท เอจีซี แฟลทกลาส (ประเทศไทย)จำกัด (มหาชน)|151|Industrial|2.9285421|652.19|2.992|AMR
01-27-2020|0010000093|0030000093|บริษัท จีซี-เอ็ม พีทีเอ จำกัด|151|Industrial|1.6839814|652.19|2.60|AMR
01-27-2020|0010000111|0030000115|บริษัท อิวอนิก ยูไนเต็ด ซิลิกา (สยาม) จำกัด|151|Industrial|0.5680016|652.19|0.683|AMR
01-27-2020|0010000113|0030000117|บริษัท คาร์ดิแนล เฮลท์ 222 (ประเทศไทย) จำกัด|151|Industrial|1.1029133|652.19|1.512|AMR
01-27-2020|0010000129|0030000133|บริษัท ทีพีซี เพสต์ เรซิน จำกัด|151|Industrial|0.3085798|652.19|0.292|AMR
01-27-2020|0010000130|0030000134|บริษัท กรีนสปอต จำกัด|151|Industrial|0.7661524|652.19|0.628|AMR
01-27-2020|0010000143|0030000148|บริษัท สยาม พุงซาน เมทัล จำกัด|151|Industrial|0.0893815|652.19|0.202|AMR
01-27-2020|0010000144|0030000149|บริษัท เบอร์ลี่ ยุคเกอร์ เซลล็อกซ์จำกัด|151|Industrial|0.5273544|652.19|0.45|AMR
01-27-2020|0010000151|0030000156|บริษัท มิตซูบิชิ อีเล็คทริค ออโตเมชั่น (ประเทศไทย) จำกัด|151|Industrial|0.2126298|652.19|0.202|AMR
01-27-2020|0010000164|0030019231|บริษัท โกลว์ พลังงาน จำกัด (มหาชน)|151|Industrial|0.0000|652.19|0.187|ADQ
01-27-2020|0010000164|0030030778|บริษัท โกลว์ พลังงาน จำกัด (มหาชน)|152|Industrial-CoGen|56.5002258|652.19|48.75|FlowComp
01-27-2020|0010000205|0030000238|บริษัท ไทยอาซาคาวา จำกัด|151|Industrial|0.0685458|652.19|0.059|AMR
01-27-2020|0010000227|0030000253|บริษัท จี เจ สตีล จำกัด (มหาชน)|151|Industrial|2.0013193|652.19|2.002|AMR
01-27-2020|0010001146|0030042053|บริษัท เคลล็อก (ประเทศไทย) จำกัด|151|Industrial|0.0874745|652.19|0.172|AMR
01-27-2020|0010001747|0030042303|บริษัท สุนทรเมทัลอินดัสทรี้ส์ จำกัด|151|Industrial|0.0001059|652.19|0.383|AMR
01-27-2020|0010002092|0030016062|บริษัท สยามแผ่นเหล็กวิลาส จำกัด|151|Industrial|0.2047899|652.19|0.08|AMR
01-27-2020|0010006548|0030009620|บริษัท อีเลคโทรลักซ์ ประเทศไทย จำกัด|151|Industrial|0.0369391|652.19|0.033|AMR
01-27-2020|0010006616|0030010020|บริษัท บริดจสโตน คาร์บอน แบล็ค (ประเทศไทย) จำกัด|151|Industrial|0.375148|652.19|0.207|AMR
01-27-2020|0010006922|0030011105|บริษัท อายิโนะโมะโต๊ะ (ประเทศไทย)จำกัด|151|Industrial|0.0003531|652.19|0.069|AMR
01-27-2020|0010006922|0030020406|บริษัท อายิโนะโมะโต๊ะ (ประเทศไทย)จำกัด|152|Industrial-CoGen|0.0000|652.19|0.813|AMR
01-27-2020|0010007512|0030040636|บริษัท คราวน์ เบ็บแคน แอนด์ โคลสเชอร์ส (ประเทศไทย) จำกัด|151|Industrial|0.1738189|652.19|0.149|AMR
01-27-2020|0010008206|0030033172|บริษัท เอ็นเนซอล จำกัด|152|Industrial-CoGen|1.3532946|652.19|1.232|AMR
01-27-2020|0010008288|0030015470|บริษัท อุตสาหกรรมทำเครื่องแก้วไทยจำกัด (มหาชน)|151|Industrial|6.3003543|652.19|6.385|AMR
01-27-2020|0010009040|0030022254|บริษัท ไทยเรยอน จำกัด (มหาชน)|151|Industrial|0.0000|652.19|1.072|AMR
01-27-2020|0010009070|0030018984|บริษัท โมเดอร์น ไดสตัฟส์ แอนด์พิคเมนท์ส จำกัด|151|Industrial|0.000565|652.19|0.157|AMR
01-27-2020|0010009582|0030020738|บริษัท คอทโก้ พลาสติกส์ จำกัด|151|Industrial|0.0000|652.19|0.059|AMR
01-27-2020|0010010998|0030026291|บริษัท งามดีอุตสาหกรรม จำกัด|151|Industrial|0.0945021|652.19|0.073|AMR
01-27-2020|0010011882|0030031074|บริษัท พีทีที อาซาฮี เคมิคอล จำกัด|151|Industrial|5.1134979|652.19|4.68|AMR
01-27-2020|0010012059|0030045449|บริษัท พีทีที เอ็มซีซี ไบโอเคม จำกัด|151|Industrial|0.0000|652.19|0.389|AMR
01-27-2020|0010012323|0030032849|บริษัท โตโยอิ๊งค์ (ประเทศไทย) จำกัด|151|Industrial|0.00724|652.19|0.009|ADQ
01-27-2020|0010020998|0030039159||151|Industrial|0.0000|652.19|0.003|ADQ
01-27-2020|0010022317|0030043685|บริษัท ไซมีส อีโคไลท์ จำกัด|151|Industrial|0.0000|652.19|0.034|AMR
01-27-2020|0010024039|0030050402|บริษัท สุเพิร์บ พาวเวอร์ จำกัด|152|Industrial-CoGen|0.3583382|652.19|0.402|AMR
01-27-2020|0010024055|0030057123|บจ.โอจีพี เอนเนอร์ยี่ โซลูชั่นส์ (สำหรับ บจ.ซึชิโยชิ สมบูรณ์ โคเตทแซนด์)|151|Industrial|0.1449668|652.19|0.114|AMR
01-27-2020|0010027591|0030024290|บริษัท ซีพีเอฟ ฟู้ด แอนด์ เบฟเวอร์เรจ จำกัด|151|Industrial|0.6509205|652.19|0.721|AMR
01-27-2020|0010027600|0030058148|บริษัท เอเชีย แคน แมนูแฟคเจอริ่ง จำกัด|151|Industrial|0.1133955|652.19|0.116|AMR
01-27-2020|0010027807|0030064609|บริษัท เช่วเฉิน ซิลิก้า (ไทยแลนด์)จำกัด|151|Industrial|0.05882|652.19|1.00|ADQ
01-27-2020|0010000011|0030000011|บริษัท อลูคอน จำกัด (มหาชน)|151|Industrial|1.2174742|652.19|1.085|AMR
01-27-2020|0010000022|0030000022|บริษัท ไทยบริดจสโตน จำกัด|152|Industrial-CoGen|1.9634973|652.19|1.43|AMR
01-27-2020|0010000023|0030000023|บริษัท ไทยเปอร์อ๊อกไซด์ จำกัด|151|Industrial|1.618402|652.19|1.41|AMR
01-27-2020|0010000033|0030000104|บริษัท โรแยล ซีรามิค อุตสาหกรรม จำกัด (มหาชน)|151|Industrial|1.8764112|652.19|1.91|AMR
01-27-2020|0010000046|0030000046|บริษัท ไทยแทฟฟิต้า จำกัด|151|Industrial|0.0000|652.19|0.006|AMR
01-27-2020|0010000047|0030000047|บริษัท โพสโค-ไทยน๊อคซ์ จำกัด (มหาชน)|151|Industrial|1.1658088|652.19|1.304|AMR
01-27-2020|0010000053|0030020331|บริษัท ไทยอาซาฮีเคมีภัณฑ์ จำกัด|151|Industrial|0.4658715|652.19|0.38|AMR
01-27-2020|0010000062|0030000062|บริษัท สตาร์ ปิโตรเลียม รีไฟน์นิ่งจำกัด (มหาชน)|152|Industrial-CoGen|12.82194|652.19|11.249|ADQ
01-27-2020|0010000062|0030000062|บริษัท สตาร์ ปิโตรเลียม รีไฟน์นิ่งจำกัด (มหาชน)|151|Industrial|15.7214981|652.19|8.753|ADQ/AMR
01-27-2020|0010000073|0030000073|บริษัท ไฟน์ เม็ททัล เทคโนโลยีส์จำกัด (มหาชน)|151|Industrial|0.164743|652.19|0.322|AMR
01-27-2020|0010000074|0030000074|บริษัท ไทยเบเวอร์เรจแคน จำกัด|151|Industrial|0.4468015|652.19|0.483|AMR
01-27-2020|0010000086|0030000086|บริษัท สยามคอมเพรสเซอร์อุตสาหกรรม จำกัด|151|Industrial|0.1567972|652.19|0.144|AMR
01-27-2020|0010000088|0030000088|บริษัท ไทยฟิล์มอินดัสตรี่ จำกัด (มหาชน)|151|Industrial|0.0000|652.19|0.016|AMR
01-27-2020|0010000106|0030000109|บริษัท ไมย์เออร์ อลูมิเนียม (ประเทศไทย) จำกัด|151|Industrial|0.2488626|652.19|0.292|AMR
01-27-2020|0010000107|0030000111|บริษัท จี สตีล จำกัด (มหาชน)|151|Industrial|2.5696035|652.19|1.491|AMR
01-27-2020|0010000116|0030034491|บริษัท มิตซูบิชิ มอเตอร์ส (ประเทศไทย) จำกัด|151|Industrial|0.1613881|652.19|0.147|AMR
01-27-2020|0010000117|0030000121|บริษัท ไทยซิลิเกตเคมิคัล จำกัด|151|Industrial|0.6215034|652.19|0.714|AMR
01-27-2020|0010000132|0030000137|บริษัท การ์เดียนอินดัสทรีส์ คอร์ปจำกัด|151|Industrial|3.8540344|652.19|3.698|AMR
01-27-2020|0010000146|0030000151|บริษัท จีเอฟพีที จำกัด (มหาชน)|151|Industrial|0.4517103|652.19|0.505|AMR
01-27-2020|0010000147|0030000152|บริษัท แมคคีย์ ฟู้ด เซอร์วิสเซส (ประเทศไทย) จำกัด|151|Industrial|0.2882385|652.19|0.289|AMR
01-27-2020|0010000159|0030000165|บริษัท ไทย-เยอรมัน สเปเชียลตี้ กลาสจำกัด|151|Industrial|0.0484164|652.19|0.039|AMR
01-27-2020|0010000160|0030000166|บริษัท คอนวูด จำกัด|151|Industrial|0.3895564|652.19|0.255|AMR
01-27-2020|0010000201|0030020965|บริษัท อดิตยา เบอร์ล่า เคมีคัลส์ (ประเทศไทย) จำกัด (แอดวานซ์ แมททีเรียลส์)|151|Industrial|0.0000|652.19|0.072|AMR
01-27-2020|0010000225|0030011191|บริษัท ซีพีพีซี จำกัด (มหาชน) (Coating Plant)|151|Industrial|0.0185049|652.19|0.009|AMR
01-27-2020|0010000226|0030000252|บริษัท ซัมมิท โชว่าแมนูแฟคเจอริ่งจำกัด|151|Industrial|0.1162206|652.19|0.102|AMR
01-27-2020|0010001727|0030020317|บริษัท ไทยเซ็นทรัลเคมี จำกัด (มหาชน)|152|Industrial-CoGen|0.0000|652.19|0.176|AMR
01-27-2020|0010001922|0030022692|บริษัท ฟู้ดแอนด์ดริ๊งส์ จำกัด (มหาชน)|151|Industrial|0.13843|652.19|0.169|ADQ
01-27-2020|0010006271|0030008801|บริษัท ริเวอร์โปร์ พัลพ แอนด์เพเพอร์ จำกัด|151|Industrial|0.1619178|652.19|0.113|AMR
01-27-2020|0010006922|0030020406|บริษัท อายิโนะโมะโต๊ะ (ประเทศไทย)จำกัด|151|Industrial|3.0460694|652.19|2.499|AMR
01-27-2020|0010007330|0030013313|บริษัท โกรเวล แอบเบรซีพ (ไทยแลนด์)จำกัด|151|Industrial|0.0382811|652.19|0.042|AMR
01-27-2020|0010007489|0030043669|บจ.ไซมีส เมอร์ชานไดส์|151|Industrial|0.0000|652.19|0.001|AMR
