Date|Sold to|Ship to|Ship to name|ContractType|Description|Volume(MMSCFD)|DemandPlan(BI)|MDCQ(BW)|Billing Type
01-27-2020|0010000008|0030000008|บริษัท ไมโครไฟเบอร์อุตสาหกรรม จำกัด|151|Industrial|0.219834|652.19|0.267|AMR
01-27-2020|0010000016|0030000100|บริษัท ลิกซิล (ประเทศไทย) จำกัด (มหาชน)|151|Industrial|0.3177969|652.19|0.452|AMR
01-27-2020|0010000019|0030000019|บริษัท ไดนาสตี้ เซรามิค จำกัด (มหาชน)|151|Industrial|5.1135685|652.19|3.925|AMR
01-27-2020|0010000030|0030000030|บริษัท ภัทราพอร์ซเลน จำกัด|151|Industrial|0.4160424|652.19|0.56|AMR
01-27-2020|0010000041|0030000041|บริษัท สยามอุตสาหกรรมยิปซัม (สระบุรี) จำกัด|151|Industrial|1.6486314|652.19|2.884|AMR
01-27-2020|0010000052|0030000052|บริษัท ไทยออยล์ จำกัด (มหาชน)|151|Industrial|17.3712497|652.19|23.334|AMR/FlowComp
01-27-2020|0010000053|0030000053|บริษัท ไทยอาซาฮีเคมีภัณฑ์ จำกัด|151|Industrial|0.227921|652.19|0.184|AMR
01-27-2020|0010000063|0030000063|บริษัท สยามมิชลิน จำกัด|151|Industrial|0.0000|652.19|0.20|AMR
01-27-2020|0010000063|0030000075|บริษัท สยามมิชลิน จำกัด|151|Industrial|0.078222|652.19|0.077|AMR
01-27-2020|0010000071|0030000071|บริษัท เอสโซ่ (ประเทศไทย) จำกัด (มหาชน)|152|Industrial-CoGen|7.48323|652.19|7.404|ADQ
01-27-2020|0010000071|0030000071|บริษัท เอสโซ่ (ประเทศไทย) จำกัด (มหาชน)|151|Industrial|7.89903|652.19|4.749|ADQ
01-27-2020|0010000084|0030000084|บริษัท สยามอุตสาหกรรมวัสดุทนไฟ จำกัด|151|Industrial|0.9810423|652.19|1.128|AMR
01-27-2020|0010000085|0030000085|บริษัท บางกอกอินดัสเทรียลแก๊ส จำกัด|151|Industrial|0.0359503|652.19|0.042|AMR
01-27-2020|0010000099|0030000099|บริษัท เกรท วอลล์ มอเตอร์ แมนูแฟคเจอริ่ง (ประเทศไทย) จำกัด|151|Industrial|0.3015875|652.19|0.259|AMR
01-27-2020|0010000116|0030000120|บริษัท มิตซูบิชิ มอเตอร์ส (ประเทศไทย) จำกัด|151|Industrial|0.3489445|652.19|0.301|AMR
01-27-2020|0010000130|0030052374|บริษัท กรีนสปอต จำกัด|151|Industrial|0.2800808|652.19|0.233|AMR
01-27-2020|0010000131|0030000136|บริษัท การ์เดียนอินดัสทรีส์ ระยองจำกัด|151|Industrial|2.9793246|652.19|3.212|AMR
01-27-2020|0010000145|0030000150|บริษัท แสตนดาร์ดแคน จำกัด|151|Industrial|0.3224232|652.19|0.281|AMR
01-27-2020|0010000154|0030000160|บริษัท แม็กซิออน วีลส์ (ประเทศไทย)จำกัด|151|Industrial|0.5218453|652.19|0.764|AMR
01-27-2020|0010000155|0030000161|บริษัท มาเล่ย์ เอ็นจิ่น คอมโพเน็นท์(ประเทศไทย) จำกัด|151|Industrial|0.0744787|652.19|0.084|AMR
01-27-2020|0010000191|0030043704|บริษัท ศักดิ์ไชยสิทธิ จำกัด|151|Industrial|0.211535|652.19|0.752|AMR
01-27-2020|0010000192|0030043881|บริษัท แอร์ ลิควิด (ประเทศไทย) จำกัด|151|Industrial|3.0210313|652.19|2.547|AMR
01-27-2020|0010000216|0030049389|บริษัท ไออาร์พีซี จำกัด (มหาชน)|151|Industrial|12.1145312|652.19|8.175|AMR
01-27-2020|0010000220|0030000249|บริษัท เอเชีย ซิลิโคนส์ โมโนเมอร์จำกัด|151|Industrial|3.5251486|652.19|3.736|AMR
01-27-2020|0010000934|0030046753|บริษัท ฮอนด้า ออโตโมบิล (ประเทศไทย) จำกัด|151|Industrial|0.3576319|652.19|0.292|AMR
01-27-2020|0010001013|0030023306|บริษัท เนสท์เล่ (ไทย) จำกัด|151|Industrial|0.0399762|652.19|0.032|AMR
01-27-2020|0010001609|0030015621|บริษัท โตโยต้า มอเตอร์ ประเทศไทย จำกัด|152|Industrial-CoGen|0.436525|652.19|0.939|AMR
01-27-2020|0010001913|0030020312|บริษัท เหล่าธงสิงห์ จำกัด|151|Industrial|0.0000|652.19|0.065|AMR
01-27-2020|0010003880|0030008767|บริษัท กังวาลเท็กซ์ไทล์ จำกัด|152|Industrial-CoGen|2.0584585|652.19|1.275|AMR
01-27-2020|0010006257|0030022426|บริษัท ออโต้อัลลายแอนซ์ (ประเทศไทย)จำกัด|151|Industrial|0.4677785|652.19|0.443|AMR
01-27-2020|0010006772|0030010740|บริษัท ไซเดน (ประเทศไทย) จำกัด|151|Industrial|0.0246143|652.19|0.018|AMR
01-27-2020|0010006894|0030020321|บริษัท อาร์ต อุตสาหกรรม จำกัด|151|Industrial|0.0002825|652.19|0.028|AMR
01-27-2020|0010007765|0030013679|บริษัท เอ.พี.ซี อุตสาหกรรม จำกัด|151|Industrial|0.0000|652.19|0.011|AMR
01-27-2020|0010007766|0030000094|บริษัท อินโดรามา ปิโตรเคม จำกัด|152|Industrial-CoGen|0.5580075|652.19|0.08|AMR
01-27-2020|0010008606|0030016564|บริษัท ซังโกะ ไดคาชติ้ง (ประเทศไทย)จำกัด (มหาชน)|151|Industrial|0.2296514|652.19|0.183|AMR
01-27-2020|0010008657|0030016715|บริษัท คิริว (ประเทศไทย) จำกัด|151|Industrial|0.0366919|652.19|0.035|AMR
01-27-2020|0010009357|0030020016|บริษัท ซีพี-เมจิ จำกัด|152|Industrial-CoGen|0.2829413|652.19|0.345|AMR
01-27-2020|0010009357|0030020016|บริษัท ซีพี-เมจิ จำกัด|151|Industrial|0.4773134|652.19|0.458|AMR
01-27-2020|0010010220|0030023100|บริษัท เอส ไอ ดับบลิว (ไทยแลนด์) จำกัด|151|Industrial|0.0864857|652.19|0.104|AMR
01-27-2020|0010011367|0030027987|บริษัท มิลลิเมด จำกัด|151|Industrial|0.0395524|652.19|0.031|AMR
01-27-2020|0010012320|0030021481|บริษัท พีทีที โกลบอล เคมิคอล จำกัด(มหาชน)|151|Industrial|19.63006|652.19|23.712|ADQ
01-27-2020|0010021117|0030022988|บริษัท ซีพีเอฟ (ประเทศไทย) จำกัด(มหาชน)|152|Industrial-CoGen|0.0000|652.19|0.068|AMR
01-27-2020|0010022812|0030020778|บริษัท โกลบอล เพาเวอร์ ซินเนอร์ยี่จำกัด (มหาชน)|152|Industrial-CoGen|22.4525395|652.19|21.691|FlowComp
01-27-2020|0010022812|0030020778|บริษัท โกลบอล เพาเวอร์ ซินเนอร์ยี่จำกัด (มหาชน)|151|Industrial|1.6962596|652.19|2.354|FlowComp
01-27-2020|0010023651|0030048793|บริษัท ไคฮาระ (ประเทศไทย) จำกัด|151|Industrial|0.38772|652.19|0.273|AMR
01-27-2020|0010026372|0030024061|บริษัท เคมีแมน จำกัด (มหาชน)|151|Industrial|1.5216044|652.19|1.504|AMR
01-27-2020|0010027860|0030059153|บริษัท เค.เอ็ม.เค.(ไทยแลนด์) จำกัด|151|Industrial|0.0355619|652.19|0.058|AMR
01-27-2020|0010027861|0030000017|บริษัท เอสซีจี เซรามิกส์ จำกัด (มหาชน)|151|Industrial|3.886983|652.19|3.112|AMR
01-27-2020|0010000083|0030021634|บริษัท เอจีซี แฟลทกลาส (ประเทศไทย)จำกัด (มหาชน)|151|Industrial|4.0246751|652.19|3.834|AMR
01-27-2020|0010000096|0030000096|บริษัท ระยองโอเลฟินส์ จำกัด|151|Industrial|0.3232707|652.19|0.657|AMR
01-27-2020|0010000097|0030000097|บริษัท สายไฟฟ้าบางกอกเคเบิ้ล จำกัด|151|Industrial|0.0000|652.19|0.203|AMR
01-27-2020|0010000110|0030000114|บริษัท ระยอง กัลวาไนซิ่ง จำกัด|151|Industrial|0.0520538|652.19|0.063|AMR
01-27-2020|0010000133|0030000138|บริษัท เอ.เจ. พลาสท์ จำกัด (มหาชน)|151|Industrial|0.7791129|652.19|0.687|AMR
01-27-2020|0010000153|0030000159|บริษัท เกทส์ ยูนิทตะ (ประเทศไทย) จำกัด|151|Industrial|0.0971507|652.19|0.081|AMR
01-27-2020|0010000195|0030033440|บริษัท ไทยลู้บเบส จำกัด (มหาชน)|151|Industrial|2.3338425|652.19|4.343|AMR
01-27-2020|0010000197|0030025358|บริษัท บางจาก คอร์ปอเรชั่น จำกัด (มหาชน)|152|Industrial-CoGen|8.2021569|652.19|7.329|AMR
01-27-2020|0010000221|0030011437|บริษัท วีนิไทย จำกัด (มหาชน)|151|Industrial|2.4396454|652.19|2.544|AMR
01-27-2020|0010000224|0030000250|บริษัท ออมโนวา เอ็นจิเนียร์ด เซอร์เฟสเซส (ประเทศไทย) จำกัด|151|Industrial|0.2375973|652.19|0.243|AMR
01-27-2020|0010001605|0030051931||151|Industrial|0.3295214|652.19|0.223|AMR
01-27-2020|0010001609|0030015621|บริษัท โตโยต้า มอเตอร์ ประเทศไทย จำกัด|151|Industrial|0.1743486|652.19|0.478|AMR
01-27-2020|0010002201|0030011779|บริษัท ควอลิตี้ คอฟฟี่ โปรดักท์ส จำกัด|151|Industrial|0.4189029|652.19|0.888|AMR
01-27-2020|0010002964|0030024050|บริษัท สยามบราเดอร์ จำกัด|151|Industrial|0.1073566|652.19|0.082|AMR
01-27-2020|0010006940|0030011137|บริษัท เอส ที บี เท็กซ์ไทล์ อินดัสตรี จำกัด|151|Industrial|0.0424482|652.19|0.04|AMR
01-27-2020|0010006972|0030011249|บริษัท สยาม ยามาโมริ จำกัด|151|Industrial|0.0247909|652.19|0.024|AMR
01-27-2020|0010008022|0030033708|บริษัท สยามอุตสาหกรรมเกษตรอาหารจำกัด (มหาชน)|151|Industrial|0.3256015|652.19|0.08|AMR
01-27-2020|0010008739|0030038490|บริษัท สยามไฟเบอร์ซีเมนต์กรุ๊ป จำกัด|151|Industrial|0.0330192|652.19|0.013|AMR
01-27-2020|0010009228|0030019659|บริษัท ไทย เอ็มเอฟซี จำกัด|151|Industrial|0.1365266|652.19|0.124|AMR
01-27-2020|0010010116|0030022714|บริษัท ยัสปาลแอนด์ซันส์ จำกัด|151|Industrial|0.1025892|652.19|0.083|AMR
01-27-2020|0010012118|0030062578|บริษัท พีทีที แอลเอ็นจี จำกัด|152|Industrial-CoGen|2.8063793|652.19|1.536|FlowComp
01-27-2020|0010012146|0030032044||151|Industrial|0.5769009|652.19|0.704|AMR
01-27-2020|0010012326|0030032885|บริษัท สายไฟฟ้าไทย-ยาซากิ จำกัด|151|Industrial|0.1916528|652.19|0.109|AMR
01-27-2020|0010012361|0030033177|บริษัท โตโต้ (ประเทศไทย) จำกัด|151|Industrial|0.6451289|652.19|0.752|AMR
01-27-2020|0010015560|0030040907|บริษัท ลินเด้ ไฮโค จำกัด|151|Industrial|1.8073004|652.19|1.466|AMR
01-27-2020|0010021265|0030000095|บริษัท เอ็นเอส-สยามยูไนเต็ดสตีล จำกัด|151|Industrial|2.3121946|652.19|1.685|AMR
01-27-2020|0010023436|0030052175|บริษัท ซันโทรี่ เป๊ปซี่โค เบเวอเรจ(ประเทศไทย) จำกัด|151|Industrial|0.2359021|652.19|0.165|AMR
01-27-2020|0010023548|0030000131|บริษัท โคเวสโตร (ประเทศไทย) จำกัด|151|Industrial|0.482646|652.19|0.48|AMR
01-27-2020|0010026634|0030054698|บริษัท คานายามา คาเซอิ (ประเทศไทย)จำกัด|158|NG by Truck|0.49311|652.19|0.59|ADQ
01-27-2020|0010026674|0030017326|บริษัท ไทยเพรซิเดนท์ฟูดส์ จำกัด(มหาชน)|151|Industrial|0.4543589|652.19|0.633|AMR
01-27-2020|0010027861|0030000018|บริษัท เอสซีจี เซรามิกส์ จำกัด (มหาชน)|151|Industrial|3.3861146|652.19|2.504|AMR
01-27-2020|0010000003|0030000003|บริษัท เขาช่องอุตสาหกรรม 1979 จำกัด|151|Industrial|0.4385379|652.19|0.507|AMR
01-27-2020|0010000015|0030000015|บริษัท โคห์เลอร์ (ประเทศไทย) จำกัด(มหาชน)|151|Industrial|2.3179862|652.19|2.332|AMR
01-27-2020|0010000027|0030000027|บริษัท ฝาจีบ จำกัด (มหาชน)|151|Industrial|0.5113215|652.19|0.423|AMR
01-27-2020|0010000028|0030000028|บริษัท เฟอร์โร (ประเทศไทย) จำกัด|151|Industrial|0.45729|652.19|0.431|AMR
01-27-2020|0010000037|0030000037|บริษัท สยามไฟเบอร์กลาส จำกัด|151|Industrial|0.2137598|652.19|0.287|AMR
01-27-2020|0010000049|0030000049|บริษัท ไทยผลิตภัณฑ์ยิบซั่ม จำกัด(มหาชน)|151|Industrial|0.0000|652.19|1.92|AMR
01-27-2020|0010000054|0030000054|บริษัท บางกอก คริสตัล จำกัด|151|Industrial|0.8392538|652.19|0.842|AMR
01-27-2020|0010000056|0030000056|บริษัท โอเอสซี สยามซิลิกา จำกัด|151|Industrial|1.3577442|652.19|1.843|AMR
01-27-2020|0010000067|0030000067|บริษัท มิลล์คอน บูรพา จำกัด|151|Industrial|0.8011845|652.19|1.024|AMR
01-27-2020|0010000080|0030000080|บริษัท เอ็นเอส บลูสโคป (ประเทศไทย)จำกัด|151|Industrial|0.8672584|652.19|0.759|AMR
01-27-2020|0010000082|0030000082|บริษัท สยามโทซู เซรามิกส์ จำกัด|151|Industrial|0.0372216|652.19|0.047|AMR
01-27-2020|0010000091|0030000091|บริษัท สยาม เอ็นจีเค เทคโนเซรา จำกัด|151|Industrial|0.1864263|652.19|0.191|AMR
01-27-2020|0010000092|0030000092|บริษัท ไทย-สแกนดิค สตีล จำกัด|151|Industrial|0.044779|652.19|0.065|AMR
01-27-2020|0010000108|0030000112|บริษัท ยูนิตี้ อินดัสเตรียล จำกัด|151|Industrial|0.0106297|652.19|0.019|AMR
01-27-2020|0010000109|0030000113|บริษัท ระยองไวร์ อินดัสตรีส์ จำกัด(มหาชน)|151|Industrial|0.0121482|652.19|0.013|AMR
01-27-2020|0010000122|0030000126|บริษัท บี เอ เอส เอฟ (ไทย) จำกัด|151|Industrial|0.2658843|652.19|0.518|AMR
01-27-2020|0010000123|0030000127|บริษัท สยามซานิทารีแวร์อินดัสทรี (หนองแค) จำกัด|151|Industrial|0.3108046|652.19|0.532|AMR
01-27-2020|0010000136|0030000141|บริษัท ยูเนี่ยนไทย-นิจิบัน จำกัด|151|Industrial|0.3727113|652.19|0.365|AMR
01-27-2020|0010000137|0030000142|บริษัท วาลเมท จำกัด|151|Industrial|0.0000|652.19|0.006|AMR
01-27-2020|0010000148|0030000153|บริษัท เคนไซซีรามิคส์ อินดัสตรี้ จำกัด|151|Industrial|0.1433776|652.19|0.246|AMR
01-27-2020|0010000161|0030000167|บริษัท ไทยซัมซุง อิเลคโทรนิคส์ จำกัด|151|Industrial|0.3270494|652.19|0.277|AMR
01-27-2020|0010000197|0030025358|บริษัท บางจาก คอร์ปอเรชั่น จำกัด (มหาชน)|151|Industrial|21.7276661|652.19|23.00|FlowComp
01-27-2020|0010000206|0030000239|บริษัท เฮลซ์เทรดดิ้ง (ประเทศไทย) จำกัด|151|Industrial|0.0207297|652.19|0.028|AMR
01-27-2020|0010000207|0030000240|บริษัท สตาร์ส เทคโนโลยี อินดัสเตรียล จำกัด|151|Industrial|0.2755252|652.19|0.278|AMR
01-27-2020|0010001196|0030029791|บริษัท ไทยคูน เวิลด์ไวด์ กรุ๊ป (ประเทศไทย) จำกัด (มหาชน)|151|Industrial|0.3749361|652.19|1.16|AMR
01-27-2020|0010001787|0030024766|บริษัท เพรซิเดนท์ เบเกอรี่ จำกัด(มหาชน)|151|Industrial|0.2968906|652.19|0.317|AMR
01-27-2020|0010003009|0030053395|บริษัท มิตซูบิชิ อีเล็คทริค คอนซูมเมอร์ โปรดักส์ (ประเทศไทย) จำกัด|158|NG by Truck|0.01613|652.19|0.019|ADQ
01-27-2020|0010007060|0030011444|บริษัท สยามร่วมมิตร จำกัด|151|Industrial|0.0858853|652.19|0.098|AMR
01-27-2020|0010007112|0030011636|บริษัท ไทยซัมมิท อีสเทิร์น ซีบอร์ดโอโตพาร์ท อินดัสตรี จำกัด|151|Industrial|0.0770566|652.19|0.041|AMR
01-27-2020|0010007812|0030013764|บริษัท กรุงเทพสลักภัณฑ์ จำกัด|151|Industrial|0.0861678|652.19|0.068|AMR
01-27-2020|0010007875|0030013765|บริษัท วนชัย เคมีคอล อินดัสทรี่ส์จำกัด|151|Industrial|0.1198227|652.19|0.126|AMR
01-27-2020|0010008509|0030044231|บริษัท ผลิตภัณฑ์ตราเพชร จำกัด (มหาชน)|151|Industrial|0.4070372|652.19|0.348|AMR
01-27-2020|0010008928|0030018387|บริษัท หลุยส์ผลิตภัณท์กาวเทป จำกัด|151|Industrial|0.298162|652.19|0.342|AMR
01-27-2020|0010009176|0030019559|บริษัท พูแรค (ประเทศไทย) จำกัด|151|Industrial|2.658208|652.19|2.261|AMR
01-27-2020|0010009177|0030019562|บริษัท สยามโกชิ มานูแฟคเชอริ่ง จำกั|151|Industrial|0.0988105|652.19|0.087|AMR
01-27-2020|0010009392|0030020182|บริษัท มิตร สตีล จำกัด|151|Industrial|0.0000|652.19|0.046|AMR
01-27-2020|0010009442|0030020288|บริษัท อายิโนะโมะโต๊ะเซลส์ (ประเทศไทย) จำกัด|151|Industrial|0.0093583|652.19|0.051|AMR
01-27-2020|0010010005|0030022294|บริษัท คอทโก้ เอ็นซีอาร์ เปเปอร์ จำกัด|151|Industrial|0.0325601|652.19|0.026|AMR
01-27-2020|0010010061|0030022473|บริษัท แอมคอร์ เฟล็กซิเบิ้ล ระยองจำกัด|151|Industrial|0.0287461|652.19|0.027|AMR
01-27-2020|0010011029|0030026047|บริษัท เอ็น ซี อาร์ รับเบอร์อินดัสตรี้ จำกัด|151|Industrial|0.0691814|652.19|0.069|AMR
01-27-2020|0010011163|0030026631|บริษัท ไทย อกริ เพาเวอร์ จำกัด|152|Industrial-CoGen|0.0775157|652.19|0.317|AMR
01-27-2020|0010012320|0030021767|บริษัท พีทีที โกลบอล เคมิคอล จำกัด(มหาชน)|153|Commercial|0.019529|652.19|0.013|AMR
01-27-2020|0010012320|0030021767|บริษัท พีทีที โกลบอล เคมิคอล จำกัด(มหาชน)|154|Commercial–CoGen|0.0936545|652.19|0.079|AMR
01-27-2020|0010021117|0030000123|บริษัท ซีพีเอฟ (ประเทศไทย) จำกัด(มหาชน)|151|Industrial|0.4940879|652.19|0.438|AMR
01-27-2020|0010021910|0030042490|บริษัท คาเนมิทสึ พูลเล่ย์ จำกัด|151|Industrial|0.0082283|652.19|0.008|AMR
01-27-2020|0010022253|0030043488|บริษัท ที.ที.เซรามิค จำกัด (มหาชน)|151|Industrial|1.0906945|652.19|0.821|AMR
01-27-2020|0010022869|0030045768|บริษัท ยามาโมริ (ประเทศไทย) จำกัด|151|Industrial|0.033337|652.19|0.022|AMR
01-27-2020|0010023379|0030049270|บริษัท ลาบิกซ์ จำกัด|151|Industrial|0.0000|652.19|6.47|AMR
01-27-2020|0010026752|0030055984|บริษัท เซกิซุย คาเซอิ (ไทยแลนด์) จำกัด|151|Industrial|0.0646965|652.19|0.059|AMR
01-27-2020|0010027130|0030056963|บริษัท แคนาเดียน โซลาร์ แมนูแฟคเจอริ่ง (ประเทศไทย) จำกัด|158|NG by Truck|0.00277|652.19|0.009|ADQ
01-27-2020|0010000006|0030000006|บริษัท ธนอินเตอร์ จำกัด|151|Industrial|0.0112653|652.19|0.008|AMR
01-27-2020|0010000007|0030000007|บริษัท บี เอ็น เอส เอส สตีลกรุ๊ป จำกัด|151|Industrial|0.0000|652.19|0.681|AMR
01-27-2020|0010000022|0030000022|บริษัท ไทยบริดจสโตน จำกัด|151|Industrial|0.5541582|652.19|0.735|AMR
01-27-2020|0010000038|0030000102|บริษัท สหโมเสคอุตสาหกรรม จำกัด (มหาชน)|151|Industrial|2.5381734|652.19|1.394|AMR
01-27-2020|0010000039|0030000039|บริษัท โสสุโก้ เซรามิค จำกัด|151|Industrial|2.6335231|652.19|1.97|AMR
01-27-2020|0010000057|0030000057|บริษัท พี เอส เมททอลเวอกส์ จำกัด|151|Industrial|0.000565|652.19|0.026|AMR
01-27-2020|0010000058|0030000058|บริษัท พีคิว เคมิคอลส์ (ประเทศไทย)จำกัด|151|Industrial|0.0950318|652.19|0.148|AMR
01-27-2020|0010000077|0030000077||151|Industrial|0.9983465|652.19|1.589|AMR
01-27-2020|0010000078|0030000078|บริษัท ไทเท็กซ์ เอเซีย จำกัด|151|Industrial|0.104708|652.19|0.132|AMR
01-27-2020|0010000101|0030000103|บริษัท ร็อควูล (ประเทศไทย) จำกัด|151|Industrial|0.0470744|652.19|0.156|AMR
01-27-2020|0010000104|0030000107|บริษัท สยามโพลิเอททีลีน จำกัด|151|Industrial|1.9624378|652.19|1.738|AMR
01-27-2020|0010000125|0030000129|บริษัท อาร์พีที เอเซีย จำกัด|151|Industrial|0.0275101|652.19|0.036|AMR
01-27-2020|0010000134|0030000139|บริษัท วันไทยอุตสาหกรรมการอาหาร จำกัด|151|Industrial|1.0480343|652.19|1.087|AMR
01-27-2020|0010000134|0030056618|บริษัท วันไทยอุตสาหกรรมการอาหาร จำกัด|151|Industrial|0.2409875|652.19|0.225|AMR
01-27-2020|0010000135|0030000140|บริษัท รอนเด็กซ์ (ประเทศไทย) จำกัด|151|Industrial|0.0030723|652.19|0.03|AMR
01-27-2020|0010000158|0030000164|บริษัท นิวพลัสนิตติ้ง จำกัด (มหาชน)|151|Industrial|0.0117951|652.19|0.007|AMR
01-27-2020|0010000216|0030030499|บริษัท ไออาร์พีซี จำกัด (มหาชน)|152|Industrial-CoGen|52.5759327|652.19|50.675|FlowComp
01-27-2020|0010000916|0030044950|บริษัท ดาน่า สไปเซอร์ (ประเทศไทย) จำกัด|151|Industrial|0.1138545|652.19|0.079|AMR
01-27-2020|0010000925|0030022478|บริษัท ไทยสตีลโปรไฟล์ จำกัด (มหาชน)|151|Industrial|0.6167359|652.19|1.001|AMR
01-27-2020|0010001740|0030022424|บริษัท โรงงานเหล็กกรุงเทพฯ จำกัด|151|Industrial|1.142148|652.19|1.24|AMR
01-27-2020|0010001741|0030022479|บริษัท อลูมิเนียม ฉื่อ จิ้น ฮั้ว จำกัด|151|Industrial|0.5183491|652.19|0.327|AMR
01-27-2020|0010002094|0030018793|บริษัท พ้อตเตอร์ส (ประเทศไทย) จำกัด|151|Industrial|0.219834|652.19|0.185|AMR
