Date|Sold to|Ship to|Ship to name|ContractType|Description|Volume(MMSCFD)|DemandPlan(BI)|MDCQ(BW)|Billing Type
03-22-2021|0010000067|0030000067|บริษัท มิลล์คอน บูรพา จำกัด|151|Industrial|0.5993964|603.88||AMR
03-22-2021|0010000068|0030000068|บริษัท เหล็กสยามยามาโตะ จำกัด|151|Industrial|3.1498946|603.88||AMR
03-22-2021|0010000083|0030021634|บริษัท เอจีซี แฟลทกลาส (ประเทศไทย)จำกัด (มหาชน)|151|Industrial|0.0000|603.88||AMR
03-22-2021|0010000096|0030000096|บริษัท ระยองโอเลฟินส์ จำกัด|151|Industrial|4.9828335|603.88||AMR
03-22-2021|0010000097|0030000097|บริษัท สายไฟฟ้าบางกอกเคเบิ้ล จำกัด|151|Industrial|0.1888277|603.88||AMR
03-22-2021|0010000114|0030000118|บริษัท อิเมอร์สัน อิเล็คทริค (ประเทศไทย) จำกัด|151|Industrial|0.1272035|603.88||AMR
03-22-2021|0010000128|0030000132|บริษัท เซกิซุย เอส-เล็ค (ประเทศไทย)จำกัด|151|Industrial|0.0646259|603.88||AMR
03-22-2021|0010000139|0030000144|บริษัท ยูเนี่ยนไพโอเนียร์ จำกัด(มหาชน)|151|Industrial|0.0827776|603.88||AMR
03-22-2021|0010000140|0030000145|บริษัท สยามลวดเหล็กอุตสาหกรรม จำกัด|151|Industrial|0.0676629|603.88||AMR
03-22-2021|0010000150|0030000155|บริษัท บริดจสโตน เมตัลฟา(ประเทศไทย) จำกัด|151|Industrial|0.1731126|603.88||AMR
03-22-2021|0010000151|0030000156|บริษัท มิตซูบิชิ อีเล็คทริค ออโตเมชั่น (ประเทศไทย) จำกัด|151|Industrial|0.2026004|603.88||AMR
03-22-2021|0010000191|0030043704|บริษัท ศักดิ์ไชยสิทธิ จำกัด|151|Industrial|0.8653867|603.88||AMR
03-22-2021|0010000207|0030000240|บริษัท สตาร์ส เทคโนโลยี อินดัสเตรียล จำกัด|151|Industrial|0.3365137|603.88||AMR
03-22-2021|0010001125|0030039301|บริษัท ไทยโพลีอะซีทัล จำกัด|151|Industrial|0.0821773|603.88||AMR
03-22-2021|0010001131|0030044478|บริษัท นอริตาเก้ เอสซีจี พลาสเตอร์จำกัด|151|Industrial|0.1820472|603.88||AMR
03-22-2021|0010001740|0030022424|บริษัท โรงงานเหล็กกรุงเทพฯ จำกัด|151|Industrial|1.8870763|603.88||AMR
03-22-2021|0010001741|0030022479|บริษัท อลูมิเนียม ฉื่อ จิ้น ฮั้ว จำกัด|151|Industrial|0.5725925|603.88||AMR
03-22-2021|0010002201|0030011779|บริษัท ควอลิตี้ คอฟฟี่ โปรดักท์ส จำกัด|151|Industrial|1.661945|603.88||AMR
03-22-2021|0010006733|0030023785|บริษัท เดลี่ฟู้ดส์ จำกัด|151|Industrial|0.0737017|603.88||AMR
03-22-2021|0010007112|0030011636|บริษัท ไทยซัมมิท อีสเทิร์น ซีบอร์ดโอโตพาร์ท อินดัสตรี จำกัด|151|Industrial|0.078787|603.88||AMR
03-22-2021|0010007982|0030014211|บริษัท จีซี ไกลคอล จำกัด|151|Industrial|0.1624123|603.88||AMR
03-22-2021|0010008509|0030016162|บริษัท ผลิตภัณฑ์ตราเพชร จำกัด (มหาชน)|151|Industrial|0.0814356|603.88||AMR
03-22-2021|0010009040|0030022254|บริษัท ไทยเรยอน จำกัด (มหาชน)|151|Industrial|0.7177712|603.88||AMR
03-22-2021|0010009390|0030020154|บริษัท อัลวา อะลูมิเนียม จำกัด|151|Industrial|0.3174791|603.88||AMR
03-22-2021|0010009392|0030020182|บริษัท มิตร สตีล จำกัด|151|Industrial|0.0000|603.88||AMR
03-22-2021|0010010156|0030022920|บริษัท ไทยเคมีภัณฑ์ จำกัด|151|Industrial|0.4431994|603.88||AMR
03-22-2021|0010011163|0030026631|บริษัท ไทย อกริ เพาเวอร์ จำกัด|152|Industrial-CoGen|0.0894874|603.88||AMR
03-22-2021|0010012320|0030000072|บริษัท พีทีที โกลบอล เคมิคอล จำกัด(มหาชน)|151|Industrial|34.4030631|603.88||ADQ/AMR
03-22-2021|0010012320|0030000168|บริษัท พีทีที โกลบอล เคมิคอล จำกัด(มหาชน)|151|Industrial|4.3626367|603.88||AMR
03-22-2021|0010020698|0030038224|บริษัท สตาร์คอร์ จำกัด|151|Industrial|0.2331123|603.88||AMR
03-22-2021|0010021265|0030040855|บริษัท เอ็นเอส-สยามยูไนเต็ดสตีล จำกัด|151|Industrial|1.3877264|603.88||AMR
03-22-2021|0010021577|0030041863|บริษัท นำวัฒนา แพ็คแอนด์พริ้นท์ จำกัด|151|Industrial|0.3515931|603.88||AMR
03-22-2021|0010022812|0030063296|บริษัท โกลบอล เพาเวอร์ ซินเนอร์ยี่จำกัด (มหาชน)|152|Industrial-CoGen|12.1277979|603.88||FlowComp
03-22-2021|0010022868|0030047048|บริษัท ไออาร์พีซี คลีน พาวเวอร์ จำกัด|151|Industrial|2.7765123|603.88||AMR
03-22-2021|0010026111|0030055031|บริษัท กบินทร์บุรีกล๊าส อินดัสทรีจำกัด|151|Industrial|2.9225033|603.88||AMR
03-22-2021|0010026153|0030054741|บริษัท นิคเคอิ เอ็มซี อลูมินัม (ประเทศไทย) จำกัด|151|Industrial|0.2297574|603.88||AMR
03-22-2021|0010027861|0030000018|บริษัท เอสซีจี เซรามิกส์ จำกัด (มหาชน)|151|Industrial|2.6857182|603.88||AMR
03-22-2021|0010000033|0030000104|บริษัท โรแยล ซีรามิค อุตสาหกรรม จำกัด (มหาชน)|151|Industrial|1.0254329|603.88||AMR
03-22-2021|0010000049|0030000049|บริษัท ไทยผลิตภัณฑ์ยิบซั่ม จำกัด(มหาชน)|152|Industrial-CoGen|0.5700145|603.88||AMR
03-22-2021|0010000061|0030000061|บริษัท ไมย์เออร์ อินดัสตรีส์ จำกัด|151|Industrial|0.4865306|603.88||AMR
03-22-2021|0010000073|0030000073|บริษัท ไฟน์ เม็ททัล เทคโนโลยีส์จำกัด (มหาชน)|151|Industrial|0.4913334|603.88||AMR
03-22-2021|0010000074|0030000074|บริษัท ไทยเบเวอร์เรจแคน จำกัด|151|Industrial|0.5234344|603.88||AMR
03-22-2021|0010000088|0030000088|บริษัท ไทยฟิล์มอินดัสตรี่ จำกัด (มหาชน)|151|Industrial|0.0000|603.88||AMR
03-22-2021|0010000106|0030000109|บริษัท ไมย์เออร์ อลูมิเนียม (ประเทศไทย) จำกัด|151|Industrial|0.4170312|603.88||AMR
03-22-2021|0010000107|0030000111|บริษัท จี สตีล จำกัด (มหาชน)|151|Industrial|2.8092137|603.88||AMR
03-22-2021|0010000122|0030000126|บริษัท บี เอ เอส เอฟ (ไทย) จำกัด|151|Industrial|0.0003531|603.88||AMR
03-22-2021|0010000135|0030000140|บริษัท รอนเด็กซ์ (ประเทศไทย) จำกัด|151|Industrial|0.0437549|603.88||AMR
03-22-2021|0010000136|0030000141|บริษัท ยูเนี่ยนไทย-นิจิบัน จำกัด|151|Industrial|0.3491917|603.88||AMR
03-22-2021|0010000149|0030000154|บริษัท เอเวอรี่ เดนนิสสัน (ประเทศไทย) จำกัด|151|Industrial|0.2117822|603.88||AMR
03-22-2021|0010000164|0030019231|บริษัท โกลว์ พลังงาน จำกัด (มหาชน)|151|Industrial|0.0000|603.88||ADQ
03-22-2021|0010000226|0030000252|บริษัท ซัมมิท โชว่าแมนูแฟคเจอริ่งจำกัด|151|Industrial|0.0000|603.88||AMR
03-22-2021|0010000227|0030000253|บริษัท จี เจ สตีล จำกัด (มหาชน)|151|Industrial|1.6908678|603.88||AMR
03-22-2021|0010001431|0030053506|บริษัท คาราบาวตะวันแดง จำกัด|151|Industrial|0.3206574|603.88||AMR
03-22-2021|0010001488|0030016945|บริษัท โพลีเพล็กซ์ (ประเทศไทย) จำกัด (มหาชน)|151|Industrial|1.1658088|603.88||AMR
03-22-2021|0010001879|0030026184|บริษัท เอ็ชเอ็มซี โปลีเมอส์ จำกัด|151|Industrial|0.1965263|603.88||AMR
03-22-2021|0010006271|0030008801|บริษัท ริเวอร์โปร์ พัลพ แอนด์เพเพอร์ จำกัด|151|Industrial|0.1475448|603.88||AMR
03-22-2021|0010006548|0030009620|บริษัท อีเลคโทรลักซ์ ประเทศไทย จำกัด|151|Industrial|0.0365507|603.88||AMR
03-22-2021|0010006939|0030011133|บริษัท นิเด็ค ค็อมโปเน็นท์ เทคโนโลยี (ไทยแลนด์) จำกัด|151|Industrial|0.4025875|603.88||AMR
03-22-2021|0010007765|0030013679|บริษัท เอ.พี.ซี อุตสาหกรรม จำกัด|151|Industrial|0.0000|603.88||AMR
03-22-2021|0010008356|0030047608|บริษัท แสงไทยเมตัลดรัม จำกัด|151|Industrial|0.0606706|603.88||AMR
03-22-2021|0010008928|0030018387|บริษัท หลุยส์ผลิตภัณท์กาวเทป จำกัด|151|Industrial|0.2075798|603.88||AMR
03-22-2021|0010009228|0030019659|บริษัท ไทย เอ็มเอฟซี จำกัด|151|Industrial|0.1724769|603.88||AMR
03-22-2021|0010009357|0030020016|บริษัท ซีพี-เมจิ จำกัด|152|Industrial-CoGen|0.0000|603.88||AMR
03-22-2021|0010010005|0030022294|บริษัท คอทโก้ เอ็นซีอาร์ เปเปอร์ จำกัด|151|Industrial|0.017622|603.88||AMR
03-22-2021|0010011029|0030026047|บริษัท เอ็น ซี อาร์ รับเบอร์อินดัสตรี้ จำกัด|151|Industrial|0.0724657|603.88||AMR
03-22-2021|0010012320|0030000055|บริษัท พีทีที โกลบอล เคมิคอล จำกัด(มหาชน)|151|Industrial|0.0015538|603.88||AMR
03-22-2021|0010012320|0030000069|บริษัท พีทีที โกลบอล เคมิคอล จำกัด(มหาชน)|151|Industrial|5.9363304|603.88||AMR
03-22-2021|0010012320|0030000072|บริษัท พีทีที โกลบอล เคมิคอล จำกัด(มหาชน)|152|Industrial-CoGen|11.72585|603.88||ADQ
03-22-2021|0010012440|0030033600|บริษัท นูทริกซ์ จำกัด (มหาชน)|151|Industrial|0.2371382|603.88||AMR
03-22-2021|0010022317|0030043685|บริษัท ไซมีส อีโคไลท์ จำกัด|151|Industrial|0.0000|603.88||AMR
03-22-2021|0010023548|0030000131|บริษัท โคเวสโตร (ประเทศไทย) จำกัด|151|Industrial|0.3596095|603.88||AMR
03-22-2021|0010026634|0030054698|บริษัท คานายามา คาเซอิ (ประเทศไทย)จำกัด|158|NG by Truck|0.63889|603.88||ADQ
03-22-2021|0010026674|0030017326|บริษัท ไทยเพรซิเดนท์ฟูดส์ จำกัด(มหาชน)|151|Industrial|0.4820809|603.88||AMR
03-22-2021|0010027861|0030000246|บริษัท เอสซีจี เซรามิกส์ จำกัด (มหาชน)|151|Industrial|2.8000319|603.88||AMR
03-22-2021|0010000003|0030000003|บริษัท เขาช่องอุตสาหกรรม 1979 จำกัด|151|Industrial|0.4217634|603.88||AMR
03-22-2021|0010000011|0030000011|บริษัท อลูคอน จำกัด (มหาชน)|151|Industrial|1.1659501|603.88||AMR
03-22-2021|0010000019|0030000019|บริษัท ไดนาสตี้ เซรามิค จำกัด (มหาชน)|151|Industrial|4.6937827|603.88||AMR
03-22-2021|0010000022|0030000022|บริษัท ไทยบริดจสโตน จำกัด|151|Industrial|0.594311|603.88||AMR
03-22-2021|0010000031|0030000031|บริษัท วิลเลรอย แอนด์ บอค (ประเทศไทย) จำกัด|151|Industrial|0.6529334|603.88||AMR
03-22-2021|0010000039|0030000039|บริษัท โสสุโก้ เซรามิค จำกัด|151|Industrial|2.5292388|603.88||AMR
03-22-2021|0010000041|0030000041|บริษัท สยามอุตสาหกรรมยิปซัม (สระบุรี) จำกัด|151|Industrial|1.2180393|603.88||AMR
03-22-2021|0010000056|0030000056|บริษัท โอเอสซี สยามซิลิกา จำกัด|151|Industrial|1.2782508|603.88||AMR
03-22-2021|0010000068|0030025580|บริษัท เหล็กสยามยามาโตะ จำกัด|151|Industrial|2.4328296|603.88||AMR
03-22-2021|0010000080|0030000080|บริษัท เอ็นเอส บลูสโคป (ประเทศไทย)จำกัด|151|Industrial|1.2174742|603.88||AMR
03-22-2021|0010000093|0030000093|บริษัท จีซี-เอ็ม พีทีเอ จำกัด|151|Industrial|3.4500343|603.88||AMR
03-22-2021|0010000111|0030000115|บริษัท อิวอนิก ยูไนเต็ด ซิลิกา (สยาม) จำกัด|151|Industrial|0.7869527|603.88||AMR
03-22-2021|0010000113|0030000117|บริษัท คาร์ดิแนล เฮลท์ 222 (ประเทศไทย) จำกัด|151|Industrial|2.4302163|603.88||AMR
03-22-2021|0010000129|0030000133|บริษัท ทีพีซี เพสต์ เรซิน จำกัด|151|Industrial|0.2781032|603.88||AMR
03-22-2021|0010000141|0030000146|บริษัท สยามสตีล กัลวาไนซิ่ง จำกัด|151|Industrial|0.1574682|603.88||AMR
03-22-2021|0010000157|0030000163|บริษัท ไทยอะครีลิค จำกัด|151|Industrial|0.0000|603.88||AMR
03-22-2021|0010000197|0030025358|บริษัท บางจาก คอร์ปอเรชั่น จำกัด (มหาชน)|152|Industrial-CoGen|7.1561354|603.88||AMR
03-22-2021|0010000197|0030025358|บริษัท บางจาก คอร์ปอเรชั่น จำกัด (มหาชน)|151|Industrial|21.25444|603.88||FlowComp
03-22-2021|0010000221|0030011437|บริษัท วีนิไทย จำกัด (มหาชน)|151|Industrial|2.3502992|603.88||AMR
03-22-2021|0010000934|0030046753|บริษัท ฮอนด้า ออโตโมบิล (ประเทศไทย) จำกัด|151|Industrial|0.3199511|603.88||AMR
03-22-2021|0010001727|0030020317|บริษัท ไทยเซ็นทรัลเคมี จำกัด (มหาชน)|152|Industrial-CoGen|0.4976194|603.88||AMR
03-22-2021|0010002048|0030021234|บริษัท ด๊อกเตอร์ บู จำกัด|151|Industrial|0.3367962|603.88||AMR
03-22-2021|0010002092|0030016062|บริษัท สยามแผ่นเหล็กวิลาส จำกัด|151|Industrial|0.2031301|603.88||AMR
03-22-2021|0010006758|0030010658|บริษัท คอฟโค่ ไบโอเคมิคอล (ประเทศไทย) จำกัด|151|Industrial|0.64806|603.88||AMR
03-22-2021|0010006772|0030010740|บริษัท ไซเดน (ประเทศไทย) จำกัด|151|Industrial|0.0382811|603.88||AMR
03-22-2021|0010007151|0030011752|บริษัท เอ็มซีแอลเอส เอเชีย จำกัด|151|Industrial|0.7518146|603.88||AMR
03-22-2021|0010008022|0030033708|บริษัท สยามอุตสาหกรรมเกษตรอาหารจำกัด (มหาชน)|151|Industrial|0.2145368|603.88||AMR
03-22-2021|0010008671|0030021639|บริษัท พีทีที ฟีนอล จำกัด|151|Industrial|0.3314284|603.88||AMR
03-22-2021|0010009085|0030056942|บจ.แดรี่ พลัส|151|Industrial|0.564011|603.88||AMR
03-22-2021|0010009357|0030020016|บริษัท ซีพี-เมจิ จำกัด|151|Industrial|0.4899208|603.88||AMR
03-22-2021|0010010061|0030022473|บริษัท แอมคอร์ เฟล็กซิเบิ้ล ระยองจำกัด|151|Industrial|0.0300174|603.88||AMR
03-22-2021|0010010116|0030022714|บริษัท ยัสปาลแอนด์ซันส์ จำกัด|151|Industrial|0.0788577|603.88||AMR
03-22-2021|0010011367|0030027987|บริษัท มิลลิเมด จำกัด|151|Industrial|0.0368332|603.88||AMR
03-22-2021|0010012320|0030021481|บริษัท พีทีที โกลบอล เคมิคอล จำกัด(มหาชน)|151|Industrial|31.81136|603.88||ADQ
03-22-2021|0010012506|0030000025|บริษัท ปทุมธานีกล๊าส อินดัสทรี จำกัด|151|Industrial|2.7876364|603.88||AMR
03-22-2021|0010015560|0030040907|บริษัท ลินเด้ ไฮโค จำกัด|151|Industrial|2.0593414|603.88||AMR
03-22-2021|0010021265|0030000095|บริษัท เอ็นเอส-สยามยูไนเต็ดสตีล จำกัด|151|Industrial|3.4361203|603.88||AMR
03-22-2021|0010022812|0030020778|บริษัท โกลบอล เพาเวอร์ ซินเนอร์ยี่จำกัด (มหาชน)|151|Industrial|5.8301666|603.88||FlowComp
03-22-2021|0010022812|0030024457|บริษัท โกลบอล เพาเวอร์ ซินเนอร์ยี่จำกัด (มหาชน)|151|Industrial|3.6419343|603.88||AMR
03-22-2021|0010024055|0030057123|บจ.โอจีพี เอนเนอร์ยี่ โซลูชั่นส์ (สำหรับ บจ.ซึชิโยชิ สมบูรณ์ โคเตทแซนด์)|151|Industrial|0.1250493|603.88||AMR
03-22-2021|0010024055|0030064939|บริษัท โอจีพี เอนเนอร์ยี่ โซลูชั่นส์ จำกัด (สำหรับ บริษัท ยามาดะ สมบูรณ์ จำกัด)|151|Industrial|0.19286|603.88||ADQ
03-22-2021|0010027295|0030059173|บมจ.ปตท. น้ำมันและการค้าปลีก|158|NG by Truck|0.1455|603.88||ADQ
03-22-2021|0010027315|0030057427|บริษัท นิชินโบะ สมบูรณ์ ออโตโมทีฟ จำกัด|151|Industrial|0.0121835|603.88||AMR
03-22-2021|0010028705|0030017241|บริษัท บีจี โฟลต กล๊าส จำกัด|151|Industrial|0.2543011|603.88||AMR
03-22-2021|0010029277|0030062577|บริษัท โรม เมคะเทค (ประเทศไทย) จำกัด|151|Industrial|0.01923|603.88||ADQ
03-22-2021|0010000006|0030000006|บริษัท ธนอินเตอร์ จำกัด|151|Industrial|0.0132783|603.88||AMR
03-22-2021|0010000007|0030000007|บริษัท บี เอ็น เอส เอส สตีลกรุ๊ป จำกัด|151|Industrial|1.1009004|603.88||AMR
03-22-2021|0010000015|0030000015|บริษัท โคห์เลอร์ (ประเทศไทย) จำกัด(มหาชน)|151|Industrial|2.7194437|603.88||AMR
03-22-2021|0010000026|0030000026|บริษัท บางกอกแคน แมนนูแฟคเจอริ่ง จำกัด|151|Industrial|0.1537602|603.88||AMR
03-22-2021|0010000027|0030000027|บริษัท ฝาจีบ จำกัด (มหาชน)|152|Industrial-CoGen|0.4623047|603.88||AMR
03-22-2021|0010000038|0030000038|บริษัท สหโมเสคอุตสาหกรรม จำกัด (มหาชน)|151|Industrial|0.2530651|603.88||AMR
03-22-2021|0010000038|0030000102|บริษัท สหโมเสคอุตสาหกรรม จำกัด (มหาชน)|151|Industrial|1.854163|603.88||AMR
03-22-2021|0010000052|0030000052|บริษัท ไทยออยล์ จำกัด (มหาชน)|151|Industrial|24.9579046|603.88||AMR/FlowComp
03-22-2021|0010000062|0030000062|บริษัท สตาร์ ปิโตรเลียม รีไฟน์นิ่งจำกัด (มหาชน)|152|Industrial-CoGen|11.22056|603.88||ADQ
03-22-2021|0010000062|0030000062|บริษัท สตาร์ ปิโตรเลียม รีไฟน์นิ่งจำกัด (มหาชน)|151|Industrial|10.768376|603.88||ADQ/AMR
03-22-2021|0010000063|0030000063|บริษัท สยามมิชลิน จำกัด|151|Industrial|0.0000|603.88||AMR
03-22-2021|0010000076|0030000076|บริษัท สยามสไตรีนโมโนเมอร์ จำกัด|151|Industrial|3.437886|603.88||AMR
03-22-2021|0010000089|0030000089|บริษัท ธนเสริมอุตสาหกรรมฝาขวด จำกัด|151|Industrial|0.0506765|603.88||AMR
03-22-2021|0010000091|0030000091|บริษัท สยาม เอ็นจีเค เทคโนเซรา จำกัด|151|Industrial|0.1109587|603.88||AMR
03-22-2021|0010000108|0030000112|บริษัท ยูนิตี้ อินดัสเตรียล จำกัด|151|Industrial|0.0299821|603.88||AMR
03-22-2021|0010000109|0030000113|บริษัท ระยองไวร์ อินดัสตรีส์ จำกัด(มหาชน)|151|Industrial|0.0294171|603.88||AMR
03-22-2021|0010000123|0030000127|บริษัท สยามซานิทารีแวร์อินดัสทรี (หนองแค) จำกัด|151|Industrial|0.2711109|603.88||AMR
03-22-2021|0010000125|0030000129|บริษัท อาร์พีที เอเซีย จำกัด|151|Industrial|0.0226367|603.88||AMR
03-22-2021|0010000137|0030000142|บริษัท วาลเมท จำกัด|151|Industrial|0.0000|603.88||AMR
03-22-2021|0010000153|0030000159|บริษัท เกทส์ ยูนิทตะ (ประเทศไทย) จำกัด|151|Industrial|0.1349021|603.88||AMR
03-22-2021|0010000164|0030030778|บริษัท โกลว์ พลังงาน จำกัด (มหาชน)|152|Industrial-CoGen|0.0000|603.88||FlowComp
03-22-2021|0010000178|0030016267|บริษัท โกลว์ เอสพีพี 11 จำกัด|152|Industrial-CoGen|2.2351026|603.88||AMR
03-22-2021|0010000220|0030000249|บริษัท เอเชีย ซิลิโคนส์ โมโนเมอร์จำกัด|151|Industrial|3.9562705|603.88||AMR
03-22-2021|0010001013|0030023306|บริษัท เนสท์เล่ (ไทย) จำกัด|151|Industrial|0.0474982|603.88||AMR
03-22-2021|0010001609|0030015621|บริษัท โตโยต้า มอเตอร์ ประเทศไทย จำกัด|152|Industrial-CoGen|0.6700964|603.88||AMR
03-22-2021|0010001998|0030025768|บริษัท อินโดรามา โพลีเอสเตอร์ อินดัสตรี้ส์ จำกัด (มหาชน)|151|Industrial|1.8170825|603.88||AMR
03-22-2021|0010006257|0030022426|บริษัท ออโต้อัลลายแอนซ์ (ประเทศไทย)จำกัด|151|Industrial|0.4768543|603.88||AMR
03-22-2021|0010006922|0030011105|บริษัท อายิโนะโมะโต๊ะ (ประเทศไทย)จำกัด|151|Industrial|0.0000|603.88||AMR
03-22-2021|0010007489|0030043669|บจ.ไซมีส เมอร์ชานไดส์|151|Industrial|0.0000|603.88||AMR
03-22-2021|0010007512|0030040636|บริษัท คราวน์ เบ็บแคน แอนด์ โคลสเชอร์ส (ประเทศไทย) จำกัด|151|Industrial|0.154749|603.88||AMR
03-22-2021|0010008206|0030033172|บริษัท เอ็นเนซอล จำกัด|152|Industrial-CoGen|1.3909047|603.88||AMR
03-22-2021|0010008739|0030000237|บริษัท สยามไฟเบอร์ซีเมนต์กรุ๊ป จำกัด|151|Industrial|0.1641427|603.88||AMR
03-22-2021|0010009093|0030019105|บริษัท ยูเนียน ออโตพาร์ทส มานูแฟคเชอริ่ง จำกัด|151|Industrial|0.1245549|603.88||AMR
