Date|Sold to|Ship to|Ship to name|ContractType|Description|Volume(MMSCFD)|DemandPlan(BI)|MDCQ(BW)|Billing Type
03-22-2021|0010009151|0030019200|บริษัท ไทย เกลซ อุตสาหกรรม จำกัด|151|Industrial|0.3756071|603.88||AMR
03-22-2021|0010009442|0030020288|บริษัท อายิโนะโมะโต๊ะเซลส์ (ประเทศไทย) จำกัด|151|Industrial|0.017516|603.88||AMR
03-22-2021|0010010216|0030023098|บริษัท สยามพรีเสิร์ฟ ฟู้ดส์ จำกัด|151|Industrial|0.1880154|603.88||AMR
03-22-2021|0010010220|0030023100|บริษัท เอส ไอ ดับบลิว (ไทยแลนด์) จำกัด|151|Industrial|0.1428126|603.88||AMR
03-22-2021|0010012059|0030045449|บริษัท พีทีที เอ็มซีซี ไบโอเคม จำกัด|151|Industrial|0.5885547|603.88||AMR
03-22-2021|0010012118|0030062578|บริษัท พีทีที แอลเอ็นจี จำกัด|152|Industrial-CoGen|2.6225278|603.88||FlowComp
03-22-2021|0010012323|0030032849|บริษัท โตโยอิ๊งค์ (ประเทศไทย) จำกัด|151|Industrial|0.01144|603.88||ADQ
03-22-2021|0010021117|0030000123|บริษัท ซีพีเอฟ (ประเทศไทย) จำกัด(มหาชน)|152|Industrial-CoGen|1.7941633|603.88||AMR
03-22-2021|0010021117|0030000123|บริษัท ซีพีเอฟ (ประเทศไทย) จำกัด(มหาชน)|151|Industrial|0.4734288|603.88||AMR
03-22-2021|0010022333|0030043703|บริษัท เอเชียแปซิฟิกกลาส จำกัด|151|Industrial|2.4319821|603.88||AMR
03-22-2021|0010022444|0030044003|บริษัท ทีวาย สตีล จำกัด|151|Industrial|0.1209528|603.88||AMR
03-22-2021|0010023651|0030048793|บริษัท ไคฮาระ (ประเทศไทย) จำกัด|151|Industrial|0.1129717|603.88||AMR
03-22-2021|0010023667|0030000034|บริษัท สตาร์ ซานิทารี่แวร์ (ประเทศไทย) จำกัด|151|Industrial|0.0778689|603.88||AMR
03-22-2021|0010026752|0030055984|บริษัท เซกิซุย คาเซอิ (ไทยแลนด์) จำกัด|151|Industrial|0.0447437|603.88||AMR
03-22-2021|0010027130|0030056963|บริษัท แคนาเดียน โซลาร์ แมนูแฟคเจอริ่ง (ประเทศไทย) จำกัด|158|NG by Truck|0.00018|603.88||ADQ
03-22-2021|0010027861|0030046657|บริษัท เอสซีจี เซรามิกส์ จำกัด (มหาชน)|151|Industrial|0.0000|603.88||AMR
03-22-2021|0010027938|0030059837|บริษัท ราชบุรีกล๊าส อินดัสทรี จำกัด|151|Industrial|2.0746679|603.88||AMR
03-22-2021|0010000032|0030000032|บริษัท รอยัลปอร์ซเลน จำกัด (มหาชน)|151|Industrial|1.0454563|603.88||AMR
03-22-2021|0010000047|0030000047|บริษัท โพสโค-ไทยน๊อคซ์ จำกัด (มหาชน)|151|Industrial|1.351882|603.88||AMR
03-22-2021|0010000049|0030000049|บริษัท ไทยผลิตภัณฑ์ยิบซั่ม จำกัด(มหาชน)|151|Industrial|1.2677624|603.88||AMR
03-22-2021|0010000058|0030000058|บริษัท พีคิว เคมิคอลส์ (ประเทศไทย)จำกัด|151|Industrial|0.0962325|603.88||AMR
03-22-2021|0010000071|0030000071|บริษัท เอสโซ่ (ประเทศไทย) จำกัด (มหาชน)|151|Industrial|7.94436|603.88||ADQ
03-22-2021|0010000085|0030000085|บริษัท บางกอกอินดัสเทรียลแก๊ส จำกัด|151|Industrial|0.0451675|603.88||AMR
03-22-2021|0010000086|0030000086|บริษัท สยามคอมเพรสเซอร์อุตสาหกรรม จำกัด|151|Industrial|0.1662616|603.88||AMR
03-22-2021|0010000104|0030000107|บริษัท สยามโพลิเอททีลีน จำกัด|151|Industrial|2.6315101|603.88||AMR
03-22-2021|0010000120|0030000124|บริษัท ลอยัล ไฮ่เหลียง คอปเปอร์ (ประเทศไทย) จำกัด|151|Industrial|0.033443|603.88||AMR
03-22-2021|0010000134|0030000139|บริษัท วันไทยอุตสาหกรรมการอาหาร จำกัด|151|Industrial|1.0318955|603.88||AMR
03-22-2021|0010000134|0030056618|บริษัท วันไทยอุตสาหกรรมการอาหาร จำกัด|151|Industrial|0.4029407|603.88||AMR
03-22-2021|0010000148|0030000153|บริษัท เคนไซซีรามิคส์ อินดัสตรี้ จำกัด|151|Industrial|0.1943721|603.88||AMR
03-22-2021|0010000160|0030000166|บริษัท คอนวูด จำกัด|151|Industrial|0.2656018|603.88||AMR
03-22-2021|0010000161|0030000167|บริษัท ไทยซัมซุง อิเลคโทรนิคส์ จำกัด|151|Industrial|0.3444948|603.88||AMR
03-22-2021|0010000202|0030042681|บริษัท สมบูรณ์ โซมิค แมนูแฟคเจอริ่งจำกัด|151|Industrial|0.01123|603.88||AMR
03-22-2021|0010000225|0030011191|บริษัท ซีพีพีซี จำกัด (มหาชน) (Coating Plant)|151|Industrial|0.0105944|603.88||AMR
03-22-2021|0010001196|0030029791|บริษัท ไทยคูน เวิลด์ไวด์ กรุ๊ป (ประเทศไทย) จำกัด (มหาชน)|151|Industrial|1.8778591|603.88||AMR
03-22-2021|0010001217|0030021463|บริษัท แอมคอล อินเตอร์เนชั่นแนล (ไทยแลนด์) จำกัด|151|Industrial|0.0577748|603.88||AMR
03-22-2021|0010001787|0030024766|บริษัท เพรซิเดนท์ เบเกอรี่ จำกัด(มหาชน)|151|Industrial|0.2801868|603.88||AMR
03-22-2021|0010001827|0030021652|บริษัท กรไทย จำกัด|151|Industrial|0.9147919|603.88||AMR
03-22-2021|0010003009|0030053395|บริษัท มิตซูบิชิ อีเล็คทริค คอนซูมเมอร์ โปรดักส์ (ประเทศไทย) จำกัด|158|NG by Truck|0.0307|603.88||ADQ
03-22-2021|0010003880|0030008767|บริษัท กังวาลเท็กซ์ไทล์ จำกัด|152|Industrial-CoGen|2.6758301|603.88||AMR
03-22-2021|0010006922|0030020406|บริษัท อายิโนะโมะโต๊ะ (ประเทศไทย)จำกัด|151|Industrial|0.0191758|603.88||AMR
03-22-2021|0010007561|0030013097|บริษัท บางชันเยนเนอเรลเอเซมบลี จำกัด|151|Industrial|0.0189993|603.88||AMR
03-22-2021|0010007594|0030013168|บริษัท ไลอ้อน (ประเทศไทย) จำกัด|151|Industrial|0.4646355|603.88||AMR
03-22-2021|0010008509|0030044231|บริษัท ผลิตภัณฑ์ตราเพชร จำกัด (มหาชน)|151|Industrial|0.3791033|603.88||AMR
03-22-2021|0010009176|0030019559|บริษัท พูแรค (ประเทศไทย) จำกัด|151|Industrial|1.8447339|603.88||AMR
03-22-2021|0010009604|0030020797|บริษัท เจ.พี ยูไนเต็ด จำกัด|151|Industrial|0.0444258|603.88||AMR
03-22-2021|0010009784|0030021478|บริษัท แคททาเลอร์ (ประเทศไทย) จำกัด|151|Industrial|0.1066857|603.88||AMR
03-22-2021|0010010605|0030024817|บริษัท มาบตาพุดโอเลฟินส์ จำกัด|151|Industrial|6.0175189|603.88||AMR
03-22-2021|0010012326|0030032885|บริษัท สายไฟฟ้าไทย-ยาซากิ จำกัด|151|Industrial|0.2133714|603.88||AMR
03-22-2021|0010021117|0030022988|บริษัท ซีพีเอฟ (ประเทศไทย) จำกัด(มหาชน)|152|Industrial-CoGen|0.0000|603.88||AMR
03-22-2021|0010022812|0030014300|บริษัท โกลบอล เพาเวอร์ ซินเนอร์ยี่จำกัด (มหาชน)|152|Industrial-CoGen|61.1911929|603.88||FlowComp
03-22-2021|0010023967|0030050118|บริษัท โอซาก้า แก๊ส (ประเทศไทย) จำกัด|151|Industrial|0.2533123|603.88||AMR
03-22-2021|0010024039|0030050402|บริษัท สุเพิร์บ พาวเวอร์ จำกัด|152|Industrial-CoGen|0.2844599|603.88||AMR
03-22-2021|0010027459|0030011637|บริษัท โอสถสภา จำกัด (มหาชน)|151|Industrial|2.2322421|603.88||AMR
03-22-2021|0010027591|0030000157|บริษัท ซีพีเอฟ ฟู้ด แอนด์ เบฟเวอร์เรจ จำกัด|151|Industrial|0.2500987|603.88||AMR
03-22-2021|0010029951|0030064789|บริษัท สยามเพลเล็ทพาวเวอร์ จำกัด|152|Industrial-CoGen|0.7435863|603.88||AMR
03-22-2021|0010030938|0030000014|บริษัท เอสซีจี รูฟฟิ่ง จำกัด|151|Industrial|0.85164|603.88||ADQ
