Date|Sold to|Ship to|Ship to name|ContractType|Description|Volume(MMSCFD)|DemandPlan(BI)|MDCQ(BW)|Billing Type
08-22-2019|0010000008|0030000008|บริษัท ไมโครไฟเบอร์อุตสาหกรรม จำกัด|151|Industrial|0.3196333|650|0.291|AMR
08-22-2019|0010000023|0030000023|บริษัท ไทยเปอร์อ๊อกไซด์ จำกัด|151|Industrial|1.1498113|650|0.908|AMR
08-22-2019|0010000049|0030000049|บริษัท ไทยผลิตภัณฑ์ยิบซั่ม จำกัด(มหาชน)|151|Industrial|2.4722408|650|1.568|AMR
08-22-2019|0010000068|0030025580|บริษัท เหล็กสยามยามาโตะ จำกัด|151|Industrial|0.8787003|650|2.307|AMR
08-22-2019|0010000070|0030000070|บริษัท ทานิโอบิส จำกัด|151|Industrial|0.1437308|650|0.157|AMR
08-22-2019|0010000088|0030000088|บริษัท ไทยฟิล์มอินดัสตรี่ จำกัด (มหาชน)|151|Industrial|0.0000|650|0.016|AMR
08-22-2019|0010000096|0030000096|บริษัท ระยองโอเลฟินส์ จำกัด|151|Industrial|0.1513941|650|0.717|AMR
08-22-2019|0010000097|0030000097|บริษัท สายไฟฟ้าบางกอกเคเบิ้ล จำกัด|151|Industrial|0.0000|650|0.199|AMR
08-22-2019|0010000113|0030000117|บริษัท คาร์ดิแนล เฮลท์ 222 (ประเทศไทย) จำกัด|151|Industrial|1.4185914|650|1.493|AMR
08-22-2019|0010000114|0030000118|บริษัท อิเมอร์สัน อิเล็คทริค (ประเทศไทย) จำกัด|151|Industrial|0.1841308|650|0.147|AMR
08-22-2019|0010000130|0030052374|บริษัท กรีนสปอต จำกัด|151|Industrial|0.3068141|650|0.251|AMR
08-22-2019|0010000131|0030000136|บริษัท การ์เดียนอินดัสทรีส์ ระยองจำกัด|151|Industrial|3.5356724|650|3.364|AMR
08-22-2019|0010000143|0030000148|บริษัท สยาม พุงซาน เมทัล จำกัด|151|Industrial|0.3041301|650|0.18|AMR
08-22-2019|0010000144|0030000149|บริษัท เบอร์ลี่ ยุคเกอร์ เซลล็อกซ์จำกัด|151|Industrial|0.5218806|650|0.462|AMR
08-22-2019|0010000156|0030000162|บริษัท เวลโกรว์กล๊าส อินดัสทรี จำกัด|151|Industrial|1.8059937|650|1.801|AMR
08-22-2019|0010000157|0030000163|บริษัท ไทยอะครีลิค จำกัด|151|Industrial|0.0000|650|0.004|AMR
08-22-2019|0010000191|0030043704|บริษัท ศักดิ์ไชยสิทธิ จำกัด|151|Industrial|0.8041863|650|0.623|AMR
08-22-2019|0010000192|0030043881|บริษัท แอร์ ลิควิด (ประเทศไทย) จำกัด|151|Industrial|2.5656129|650|2.561|AMR
08-22-2019|0010000220|0030000249|บริษัท เอเชีย ซิลิโคนส์ โมโนเมอร์จำกัด|151|Industrial|3.8013449|650|3.544|AMR
08-22-2019|0010000934|0030046753|บริษัท ฮอนด้า ออโตโมบิล (ประเทศไทย) จำกัด|151|Industrial|0.3606337|650|0.304|AMR
08-22-2019|0010001609|0030015621|บริษัท โตโยต้า มอเตอร์ ประเทศไทย จำกัด|152|Industrial-CoGen|1.4519992|650|0.802|AMR
08-22-2019|0010001714|0030016192|บริษัท ออลเน็กซ์ (ประเทศไทย) จำกัด|151|Industrial|0.1421769|650|0.14|AMR
08-22-2019|0010002092|0030016062|บริษัท สยามแผ่นเหล็กวิลาส จำกัด|151|Industrial|0.0000|650|0.119|AMR
08-22-2019|0010006748|0030010640|บริษัท ยูเนี่ยนโชจิรุชิ จำกัด|151|Industrial|0.023237|650|0.013|AMR
08-22-2019|0010007060|0030011444|บริษัท สยามร่วมมิตร จำกัด|151|Industrial|0.0477101|650|0.094|AMR
08-22-2019|0010007112|0030011636|บริษัท ไทยซัมมิท อีสเทิร์น ซีบอร์ดโอโตพาร์ท อินดัสตรี จำกัด|151|Industrial|0.051736|650|0.039|AMR
08-22-2019|0010007765|0030013679|บริษัท เอ.พี.ซี อุตสาหกรรม จำกัด|151|Industrial|0.0000|650|0.019|AMR
08-22-2019|0010007766|0030000094|บริษัท อินโดรามา ปิโตรเคม จำกัด|152|Industrial-CoGen|0.0000|650|0.054|AMR
08-22-2019|0010008288|0030015470|บริษัท อุตสาหกรรมทำเครื่องแก้วไทยจำกัด (มหาชน)|151|Industrial|6.2959047|650|6.401|AMR
08-22-2019|0010008289|0030015477|บริษัท ดี-รับเบอร์ โปรดักส์ จำกัด|151|Industrial|0.0472157|650|0.031|AMR
08-22-2019|0010008739|0030013343|บริษัท สยามไฟเบอร์ซีเมนต์กรุ๊ป จำกัด|151|Industrial|0.6296611|650||AMR
08-22-2019|0010009177|0030019562|บริษัท สยามโกชิ มานูแฟคเชอริ่ง จำกั|151|Industrial|0.1134308|650|0.094|AMR
08-22-2019|0010009392|0030020182|บริษัท มิตร สตีล จำกัด|151|Industrial|0.0000|650|0.046|AMR
08-22-2019|0010009442|0030020288|บริษัท อายิโนะโมะโต๊ะเซลส์ (ประเทศไทย) จำกัด|151|Industrial|0.0574217|650|0.057|AMR
08-22-2019|0010010156|0030022920|บริษัท ไทยเคมีภัณฑ์ จำกัด|151|Industrial|0.4584201|650|0.264|AMR
08-22-2019|0010010216|0030023098|บริษัท สยามพรีเสิร์ฟ ฟู้ดส์ จำกัด|151|Industrial|0.1656965|650|0.146|AMR
08-22-2019|0010010998|0030026291|บริษัท งามดีอุตสาหกรรม จำกัด|151|Industrial|0.1252259|650|0.065|AMR
08-22-2019|0010011538|0030028841|บริษัท ผลิตไฟฟ้าและพลังงานร่วม จำกัด|154|Commercial–CoGen|0.0000|650||ADQ
08-22-2019|0010011735|0030030004|บริษัท เนเชอรัล ก๊าซ ไซลินเดอร์ (ประเทศไทย) จำกัด|151|Industrial|0.0000|650|0.004|AMR
08-22-2019|0010012320|0030021481|บริษัท พีทีที โกลบอล เคมิคอล จำกัด(มหาชน)|151|Industrial|25.79677|650|26.055|ADQ
08-22-2019|0010012440|0030033600|บริษัท นูทริกซ์ จำกัด (มหาชน)|151|Industrial|0.22725|650|0.208|AMR
08-22-2019|0010012506|0030000025|บริษัท ปทุมธานีกล๊าส อินดัสทรี จำกัด|151|Industrial|2.5910395|650|2.674|AMR
08-22-2019|0010021265|0030040855|บริษัท เอ็นเอส-สยามยูไนเต็ดสตีล จำกัด|151|Industrial|1.5079023|650|1.275|AMR
08-22-2019|0010021577|0030041863|บริษัท นำวัฒนา แพ็คแอนด์พริ้นท์ จำกัด|151|Industrial|0.6807261|650|0.278|AMR
08-22-2019|0010022812|0030020778|บริษัท โกลบอล เพาเวอร์ ซินเนอร์ยี่จำกัด (มหาชน)|152|Industrial-CoGen|22.1098132|650|21.505|FlowComp
08-22-2019|0010022812|0030020778|บริษัท โกลบอล เพาเวอร์ ซินเนอร์ยี่จำกัด (มหาชน)|151|Industrial|1.3336483|650|2.424|FlowComp
08-22-2019|0010024055|0030064940|บริษัท โอจีพี เอนเนอร์ยี่ โซลูชั่นส์ จำกัด (สำหรับ บริษัท คันไซ เรซิน(ประเทศไทย) จำกัด)|151|Industrial|0.0000|650||ADQ
08-22-2019|0010024055|0030064941|บริษัท โอจีพี เอนเนอร์ยี่ โซลูชั่นส์ จำกัด (สำหรับ บริษัท นิปปอน สตีลไพพ์ (ประเทศไทย) จำกัด โรงงาน 1)|151|Industrial|0.0000|650||ADQ
08-22-2019|0010027459|0030011637|บริษัท โอสถสภา จำกัด (มหาชน)|151|Industrial|2.2990929|650|2.438|AMR
08-22-2019|0010027591|0030000157|บริษัท ซีพีเอฟ ฟู้ด แอนด์ เบฟเวอร์เรจ จำกัด|151|Industrial|0.3050836|650|0.209|AMR
08-22-2019|0010000011|0030000011|บริษัท อลูคอน จำกัด (มหาชน)|151|Industrial|1.3444659|650|1.203|AMR
08-22-2019|0010000024|0030000024|บริษัท ไทล์ท้อป อินดัสตรี้ จำกัด (มหาชน)|151|Industrial|4.484755|650|5.749|AMR
08-22-2019|0010000035|0030000035|บริษัท สยามซานิทารีแวร์อินดัสทรี จำกัด|151|Industrial|1.0305888|650|0.887|AMR
08-22-2019|0010000036|0030000036|บริษัท สยามฟูรูกาวา จำกัด|151|Industrial|0.287285|650|0.25|AMR
08-22-2019|0010000043|0030000043|บริษัท ไทย จีซีไอ เรซิท็อป จำกัด|151|Industrial|0.2284507|650|0.289|AMR
08-22-2019|0010000046|0030000046|บริษัท ไทยแทฟฟิต้า จำกัด|151|Industrial|0.0000|650|0.006|AMR
08-22-2019|0010000054|0030000054|บริษัท บางกอก คริสตัล จำกัด|151|Industrial|0.0000|650|0.834|AMR
08-22-2019|0010000056|0030000056|บริษัท โอเอสซี สยามซิลิกา จำกัด|151|Industrial|2.2500407|650|1.855|AMR
08-22-2019|0010000064|0030000243|บริษัท ลี่ไท่ อัลลอย จำกัด|151|Industrial|0.2884857|650|0.203|AMR
08-22-2019|0010000065|0030000065|บริษัท สยามโพลีสไตรีน จำกัด|151|Industrial|0.0556559|650|0.066|AMR
08-22-2019|0010000082|0030000082|บริษัท สยามโทซู เซรามิกส์ จำกัด|151|Industrial|0.0233077|650|0.056|AMR
08-22-2019|0010000098|0030000098|บริษัท อีโอซีโพลิเมอร์ส (ไทยแลนด์)จำกัด|151|Industrial|0.0201293|650|0.031|AMR
08-22-2019|0010000116|0030034491|บริษัท มิตซูบิชิ มอเตอร์ส (ประเทศไทย) จำกัด|151|Industrial|0.1909112|650|0.132|AMR
08-22-2019|0010000117|0030000121|บริษัท ไทยซิลิเกตเคมิคัล จำกัด|151|Industrial|0.6824212|650|0.731|AMR
08-22-2019|0010000134|0030000139|บริษัท วันไทยอุตสาหกรรมการอาหาร จำกัด|151|Industrial|1.2783921|650|1.068|AMR
08-22-2019|0010000148|0030000153|บริษัท เคนไซซีรามิคส์ อินดัสตรี้ จำกัด|151|Industrial|0.2339598|650|0.203|AMR
08-22-2019|0010000149|0030000154|บริษัท เอเวอรี่ เดนนิสสัน (ประเทศไทย) จำกัด|151|Industrial|0.0685105|650|0.067|AMR
08-22-2019|0010000201|0030000234|บริษัท อดิตยา เบอร์ล่า เคมีคัลส์ (ประเทศไทย) จำกัด(คลออัลคาลีดีวิชั่น)|151|Industrial|0.0216125|650|0.024|AMR
08-22-2019|0010000201|0030020965|บริษัท อดิตยา เบอร์ล่า เคมีคัลส์ (ประเทศไทย) จำกัด (แอดวานซ์ แมททีเรียลส์)|151|Industrial|0.0469332|650|0.075|AMR
08-22-2019|0010000225|0030000251|บริษัท ซีพีพีซี จำกัด (มหาชน)|151|Industrial|0.1421416|650|0.142|AMR
08-22-2019|0010001146|0030042053|บริษัท เคลล็อก (ประเทศไทย) จำกัด|151|Industrial|0.1476507|650|0.178|AMR
08-22-2019|0010001196|0030029791|บริษัท ไทยคูน เวิลด์ไวด์ กรุ๊ป (ประเทศไทย) จำกัด (มหาชน)|151|Industrial|1.6413919|650|1.55|AMR
08-22-2019|0010001879|0030026184|บริษัท เอ็ชเอ็มซี โปลีเมอส์ จำกัด|151|Industrial|0.62281|650|0.491|AMR
08-22-2019|0010001913|0030020312|บริษัท เหล่าธงสิงห์ จำกัด|151|Industrial|0.1992808|650|0.105|AMR
08-22-2019|0010006257|0030022426|บริษัท ออโต้อัลลายแอนซ์ (ประเทศไทย)จำกัด|151|Industrial|0.624611|650|0.482|AMR
08-22-2019|0010006271|0030008801|บริษัท ริเวอร์โปร์ พัลพ แอนด์เพเพอร์ จำกัด|151|Industrial|0.1563028|650|0.12|AMR
08-22-2019|0010006972|0030011249|บริษัท สยาม ยามาโมริ จำกัด|151|Industrial|0.0275454|650|0.024|AMR
08-22-2019|0010008114|0030024767|บริษัท ทุนเท็กซ์ เท็กซ์ไทล์ (ประเทศไทย) จำกัด|151|Industrial|0.2836476|650|0.191|AMR
08-22-2019|0010008206|0030015236|บริษัท เอ็นเนซอล จำกัด|152|Industrial-CoGen|1.805358|650|1.27|AMR
08-22-2019|0010009040|0030022254|บริษัท ไทยเรยอน จำกัด (มหาชน)|151|Industrial|1.1847728|650|0.905|AMR
08-22-2019|0010009582|0030020738|บริษัท คอทโก้ พลาสติกส์ จำกัด|151|Industrial|0.123107|650|0.067|AMR
08-22-2019|0010011367|0030027987|บริษัท มิลลิเมด จำกัด|151|Industrial|0.0354912|650|0.03|AMR
08-22-2019|0010012320|0030000072|บริษัท พีทีที โกลบอล เคมิคอล จำกัด(มหาชน)|152|Industrial-CoGen|12.11417|650|16.255|ADQ
08-22-2019|0010012320|0030000072|บริษัท พีทีที โกลบอล เคมิคอล จำกัด(มหาชน)|151|Industrial|44.2128037|650|22.844|ADQ/AMR
08-22-2019|0010012320|0030000168|บริษัท พีทีที โกลบอล เคมิคอล จำกัด(มหาชน)|151|Industrial|0.0010947|650|0.459|AMR
08-22-2019|0010021117|0030000123|บริษัท ซีพีเอฟ (ประเทศไทย) จำกัด(มหาชน)|151|Industrial|0.5289435|650|0.447|AMR
08-22-2019|0010022868|0030047048|บริษัท ไออาร์พีซี คลีน พาวเวอร์ จำกัด|151|Industrial|0.0000|650|2.145|AMR
08-22-2019|0010026752|0030055984|บริษัท เซกิซุย คาเซอิ (ไทยแลนด์) จำกัด|151|Industrial|0.1112413|650|0.063|AMR
08-22-2019|0010027130|0030056963|บริษัท แคนาเดียน โซลาร์ แมนูแฟคเจอริ่ง (ประเทศไทย) จำกัด|158|NG by Truck|0.01713|650|0.01|ADQ
08-22-2019|0010000076|0030000076|บริษัท สยามสไตรีนโมโนเมอร์ จำกัด|151|Industrial|3.1849974|650|3.276|AMR
08-22-2019|0010000091|0030000091|บริษัท สยาม เอ็นจีเค เทคโนเซรา จำกัด|151|Industrial|0.2371382|650|0.181|AMR
08-22-2019|0010000092|0030000092|บริษัท ไทย-สแกนดิค สตีล จำกัด|151|Industrial|0.0720419|650|0.067|AMR
08-22-2019|0010000111|0030000115|บริษัท อิวอนิก ยูไนเต็ด ซิลิกา (สยาม) จำกัด|151|Industrial|0.4360659|650|0.942|AMR
08-22-2019|0010000129|0030000133|บริษัท ทีพีซี เพสต์ เรซิน จำกัด|151|Industrial|0.3086151|650|0.28|AMR
08-22-2019|0010000130|0030000134|บริษัท กรีนสปอต จำกัด|151|Industrial|0.9323787|650|0.591|AMR
08-22-2019|0010000135|0030000140|บริษัท รอนเด็กซ์ (ประเทศไทย) จำกัด|151|Industrial|0.0587283|650|0.03|AMR
08-22-2019|0010000136|0030000141|บริษัท ยูเนี่ยนไทย-นิจิบัน จำกัด|151|Industrial|0.3891326|650|0.363|AMR
08-22-2019|0010000150|0030000155|บริษัท บริดจสโตน เมตัลฟา(ประเทศไทย) จำกัด|151|Industrial|0.3589739|650|0.307|AMR
08-22-2019|0010000161|0030000167|บริษัท ไทยซัมซุง อิเลคโทรนิคส์ จำกัด|151|Industrial|0.3768784|650|0.311|AMR
08-22-2019|0010000203|0030000236|บริษัท สิงห์ คาเมดะ (ประเทศไทย) จำกัด|151|Industrial|0.2276385|650|0.229|AMR
08-22-2019|0010000205|0030000238|บริษัท ไทยอาซาคาวา จำกัด|151|Industrial|0.0692874|650|0.068|AMR
08-22-2019|0010000225|0030011191|บริษัท ซีพีพีซี จำกัด (มหาชน) (Coating Plant)|151|Industrial|0.0151853|650|0.01|AMR
08-22-2019|0010000226|0030000252|บริษัท ซัมมิท โชว่าแมนูแฟคเจอริ่งจำกัด|151|Industrial|0.1224007|650|0.109|AMR
08-22-2019|0010001609|0030015621|บริษัท โตโยต้า มอเตอร์ ประเทศไทย จำกัด|151|Industrial|0.67723|650|0.506|AMR
08-22-2019|0010001827|0030021652|บริษัท กรไทย จำกัด|151|Industrial|1.0219014|650|0.806|AMR
08-22-2019|0010003880|0030008767|บริษัท กังวาลเท็กซ์ไทล์ จำกัด|152|Industrial-CoGen|1.9676291|650|1.367|AMR
08-22-2019|0010006922|0030011105|บริษัท อายิโนะโมะโต๊ะ (ประเทศไทย)จำกัด|151|Industrial|0.0000|650|0.069|AMR
08-22-2019|0010006922|0030020406|บริษัท อายิโนะโมะโต๊ะ (ประเทศไทย)จำกัด|152|Industrial-CoGen|0.0000|650|0.813|AMR
08-22-2019|0010022812|0030014300|บริษัท โกลบอล เพาเวอร์ ซินเนอร์ยี่จำกัด (มหาชน)|152|Industrial-CoGen|67.5502216|650|47.697|FlowComp
08-22-2019|0010024039|0030050402|บริษัท สุเพิร์บ พาวเวอร์ จำกัด|152|Industrial-CoGen|0.6230219|650|0.382|AMR
08-22-2019|0010024055|0030057123|บจ.โอจีพี เอนเนอร์ยี่ โซลูชั่นส์ (สำหรับ บจ.ซึชิโยชิ สมบูรณ์ โคเตทแซนด์)|151|Industrial|0.1737483|650|0.13|AMR
08-22-2019|0010027295|0030059173|บมจ.ปตท. น้ำมันและการค้าปลีก|158|NG by Truck|0.1520|650|0.139|ADQ
08-22-2019|0010027315|0030057427|บริษัท นิชินโบะ สมบูรณ์ ออโตโมทีฟ จำกัด|151|Industrial|0.0129604|650|0.003|AMR
08-22-2019|0010027861|0030000246|บริษัท เอสซีจี เซรามิกส์ จำกัด (มหาชน)|151|Industrial|2.8489427|650|2.495|AMR
08-22-2019|0010027861|0030046657|บริษัท เอสซีจี เซรามิกส์ จำกัด (มหาชน)|151|Industrial|0.2615053|650|0.244|AMR
08-22-2019|0010000004|0030000004|บริษัท ไทย คอปเปอร์ ร็อด จำกัด|151|Industrial|0.3154662|650|0.198|AMR
08-22-2019|0010000005|0030000005|บริษัท ไทยเมทัลโพรเซสซิ่ง จำกัด|151|Industrial|0.6435044|650|0.404|AMR
08-22-2019|0010000016|0030000016|บริษัท ลิกซิล (ประเทศไทย) จำกัด (มหาชน)|151|Industrial|0.9178996|650|0.847|AMR
08-22-2019|0010000016|0030000100|บริษัท ลิกซิล (ประเทศไทย) จำกัด (มหาชน)|151|Industrial|0.5972068|650|0.376|AMR
08-22-2019|0010000030|0030000030|บริษัท ภัทราพอร์ซเลน จำกัด|151|Industrial|0.6067065|650|0.664|AMR
08-22-2019|0010000038|0030000038|บริษัท สหโมเสคอุตสาหกรรม จำกัด (มหาชน)|151|Industrial|0.2842833|650|0.40|AMR
08-22-2019|0010000051|0030000051|บริษัท ไทยไวร์โพรดัคท์ จำกัด (มหาชน)|151|Industrial|0.0578807|650|0.038|AMR
08-22-2019|0010000061|0030000061|บริษัท ไมย์เออร์ อินดัสตรีส์ จำกัด|151|Industrial|0.5690963|650|0.383|AMR
08-22-2019|0010000074|0030000074|บริษัท ไทยเบเวอร์เรจแคน จำกัด|151|Industrial|0.6023628|650|0.541|AMR
08-22-2019|0010000089|0030000089|บริษัท ธนเสริมอุตสาหกรรมฝาขวด จำกัด|151|Industrial|0.073172|650|0.057|AMR
08-22-2019|0010000106|0030000109|บริษัท ไมย์เออร์ อลูมิเนียม (ประเทศไทย) จำกัด|151|Industrial|0.4178082|650|0.23|AMR
08-22-2019|0010000107|0030000111|บริษัท จี สตีล จำกัด (มหาชน)|151|Industrial|0.1368091|650|1.969|AMR
08-22-2019|0010000122|0030000126|บริษัท บี เอ เอส เอฟ (ไทย) จำกัด|151|Industrial|0.5807502|650|0.446|AMR
08-22-2019|0010000123|0030000127|บริษัท สยามซานิทารีแวร์อินดัสทรี (หนองแค) จำกัด|151|Industrial|0.7705314|650|0.533|AMR
08-22-2019|0010000141|0030000146|บริษัท สยามสตีล กัลวาไนซิ่ง จำกัด|151|Industrial|0.1500874|650|0.186|AMR
08-22-2019|0010000155|0030000161|บริษัท มาเล่ย์ เอ็นจิ่น คอมโพเน็นท์(ประเทศไทย) จำกัด|151|Industrial|0.094043|650|0.089|AMR
08-22-2019|0010000195|0030033440|บริษัท ไทยลู้บเบส จำกัด (มหาชน)|151|Industrial|4.0764464|650|5.14|AMR
08-22-2019|0010000207|0030000240|บริษัท สตาร์ส เทคโนโลยี อินดัสเตรียล จำกัด|151|Industrial|0.396584|650|0.262|AMR
08-22-2019|0010000216|0030030499|บริษัท ไออาร์พีซี จำกัด (มหาชน)|152|Industrial-CoGen|60.4830092|650|50.907|FlowComp
08-22-2019|0010001013|0030023306|บริษัท เนสท์เล่ (ไทย) จำกัด|151|Industrial|0.0324188|650|0.037|AMR
08-22-2019|0010001125|0030039301|บริษัท ไทยโพลีอะซีทัล จำกัด|151|Industrial|0.0663916|650|0.081|AMR
08-22-2019|0010001727|0030020317|บริษัท ไทยเซ็นทรัลเคมี จำกัด (มหาชน)|152|Industrial-CoGen|0.0000|650|0.337|AMR
08-22-2019|0010001740|0030022424|บริษัท โรงงานเหล็กกรุงเทพฯ จำกัด|151|Industrial|2.2483456|650|1.244|AMR
08-22-2019|0010002094|0030018793|บริษัท พ้อตเตอร์ส (ประเทศไทย) จำกัด|151|Industrial|0.2945952|650|0.26|AMR
08-22-2019|0010002109|0030030514|บริษัท ลักกี้กลาส จำกัด|151|Industrial|0.8386181|650|0.623|AMR
08-22-2019|0010006772|0030010740|บริษัท ไซเดน (ประเทศไทย) จำกัด|151|Industrial|0.019529|650|0.018|AMR
08-22-2019|0010007306|0030012309||151|Industrial|0.2448015|650|0.297|AMR
08-22-2019|0010007330|0030013313|บริษัท โกรเวล แอบเบรซีพ (ไทยแลนด์)จำกัด|151|Industrial|0.044108|650|0.041|AMR
08-22-2019|0010007766|0030013680|บริษัท อินโดรามา ปิโตรเคม จำกัด|152|Industrial-CoGen|4.3549381|650|3.70|AMR
08-22-2019|0010008356|0030047608|บริษัท แสงไทยเมตัลดรัม จำกัด|151|Industrial|0.0489108|650|0.03|AMR
08-22-2019|0010008926|0030018384|บริษัท อินเตอร์เนชั่นแนล แลบบอราทอรีส์ จำกัด|151|Industrial|0.0249674|650|0.016|AMR
08-22-2019|0010008928|0030018387|บริษัท หลุยส์ผลิตภัณท์กาวเทป จำกัด|151|Industrial|0.2773263|650|0.299|AMR
08-22-2019|0010009180|0030044623|บริษัท ไทย มาลายา กลาส จำกัด|151|Industrial|4.4354203|650|4.443|AMR
08-22-2019|0010009196|0030019599|บริษัท ราชราตัน ไทย ไวร์ จำกัด|151|Industrial|0.224107|650|0.177|AMR
08-22-2019|0010009584|0030020740|บริษัท เจลลี เบลลี แคนดี้ คอมปานี (ประเทศไทย) จำกัด|151|Industrial|0.0974685|650|0.083|AMR
