Date|Sold to|Ship to|Ship to name|ContractType|Description|Volume(MMSCFD)|DemandPlan(BI)|MDCQ(BW)|Billing Type
08-26-2019|0010000003|0030000003|บริษัท เขาช่องอุตสาหกรรม 1979 จำกัด|151|Industrial|0.4153008|650|0.455|AMR
08-26-2019|0010000015|0030000015|บริษัท โคห์เลอร์ (ประเทศไทย) จำกัด(มหาชน)|151|Industrial|2.5622933|650|2.341|AMR
08-26-2019|0010000026|0030000026|บริษัท บางกอกแคน แมนนูแฟคเจอริ่ง จำกัด|151|Industrial|0.3191742|650|0.281|AMR
08-26-2019|0010000027|0030000027|บริษัท ฝาจีบ จำกัด (มหาชน)|152|Industrial-CoGen|0.655688|650|0.38|AMR
08-26-2019|0010000037|0030000037|บริษัท สยามไฟเบอร์กลาส จำกัด|151|Industrial|0.3797036|650|0.34|AMR
08-26-2019|0010000049|0030000049|บริษัท ไทยผลิตภัณฑ์ยิบซั่ม จำกัด(มหาชน)|151|Industrial|2.4493922|650|1.568|AMR
08-26-2019|0010000057|0030000057|บริษัท พี เอส เมททอลเวอกส์ จำกัด|151|Industrial|0.000565|650|0.017|AMR
08-26-2019|0010000058|0030000058|บริษัท พีคิว เคมิคอลส์ (ประเทศไทย)จำกัด|151|Industrial|0.1256143|650|0.159|AMR
08-26-2019|0010000068|0030025580|บริษัท เหล็กสยามยามาโตะ จำกัด|151|Industrial|2.3101817|650|2.307|AMR
08-26-2019|0010000070|0030000070|บริษัท ทานิโอบิส จำกัด|151|Industrial|0.1937011|650|0.157|AMR
08-26-2019|0010000082|0030000082|บริษัท สยามโทซู เซรามิกส์ จำกัด|151|Industrial|0.0403647|650|0.056|AMR
08-26-2019|0010000096|0030000096|บริษัท ระยองโอเลฟินส์ จำกัด|151|Industrial|0.3810456|650|0.717|AMR
08-26-2019|0010000097|0030000097|บริษัท สายไฟฟ้าบางกอกเคเบิ้ล จำกัด|151|Industrial|0.0000|650|0.199|AMR
08-26-2019|0010000113|0030000117|บริษัท คาร์ดิแนล เฮลท์ 222 (ประเทศไทย) จำกัด|151|Industrial|1.3006757|650|1.493|AMR
08-26-2019|0010000114|0030000118|บริษัท อิเมอร์สัน อิเล็คทริค (ประเทศไทย) จำกัด|151|Industrial|0.1460262|650|0.147|AMR
08-26-2019|0010000130|0030052374|บริษัท กรีนสปอต จำกัด|151|Industrial|0.2517938|650|0.251|AMR
08-26-2019|0010000131|0030000136|บริษัท การ์เดียนอินดัสทรีส์ ระยองจำกัด|151|Industrial|3.4825591|650|3.364|AMR
08-26-2019|0010000146|0030000151|บริษัท จีเอฟพีที จำกัด (มหาชน)|151|Industrial|0.6896254|650|0.463|AMR
08-26-2019|0010000147|0030000152|บริษัท แมคคีย์ ฟู้ด เซอร์วิสเซส (ประเทศไทย) จำกัด|151|Industrial|0.2777854|650|0.262|AMR
08-26-2019|0010000159|0030000165|บริษัท ไทย-เยอรมัน สเปเชียลตี้ กลาสจำกัด|151|Industrial|0.0482751|650|0.038|AMR
08-26-2019|0010000160|0030000166|บริษัท คอนวูด จำกัด|151|Industrial|0.2721703|650|0.258|AMR
08-26-2019|0010000201|0030000234|บริษัท อดิตยา เบอร์ล่า เคมีคัลส์ (ประเทศไทย) จำกัด(คลออัลคาลีดีวิชั่น)|151|Industrial|0.0212241|650|0.024|AMR
08-26-2019|0010000201|0030020965|บริษัท อดิตยา เบอร์ล่า เคมีคัลส์ (ประเทศไทย) จำกัด (แอดวานซ์ แมททีเรียลส์)|151|Industrial|0.047357|650|0.075|AMR
08-26-2019|0010000227|0030000253|บริษัท จี เจ สตีล จำกัด (มหาชน)|151|Industrial|1.9215787|650|1.779|AMR
08-26-2019|0010001146|0030042053|บริษัท เคลล็อก (ประเทศไทย) จำกัด|151|Industrial|0.1177392|650|0.178|AMR
08-26-2019|0010001196|0030029791|บริษัท ไทยคูน เวิลด์ไวด์ กรุ๊ป (ประเทศไทย) จำกัด (มหาชน)|151|Industrial|1.1624892|650|1.55|AMR
08-26-2019|0010001827|0030021652|บริษัท กรไทย จำกัด|151|Industrial|0.8852335|650|0.806|AMR
08-26-2019|0010003880|0030008767|บริษัท กังวาลเท็กซ์ไทล์ จำกัด|152|Industrial-CoGen|1.9562224|650|1.367|AMR
08-26-2019|0010006972|0030011249|บริษัท สยาม ยามาโมริ จำกัด|151|Industrial|0.0256384|650|0.024|AMR
08-26-2019|0010007765|0030013679|บริษัท เอ.พี.ซี อุตสาหกรรม จำกัด|151|Industrial|0.0000|650|0.019|AMR
08-26-2019|0010007766|0030000094|บริษัท อินโดรามา ปิโตรเคม จำกัด|152|Industrial-CoGen|0.0998699|650|0.054|AMR
08-26-2019|0010008356|0030047608|บริษัท แสงไทยเมตัลดรัม จำกัด|151|Industrial|0.0456265|650|0.03|AMR
08-26-2019|0010008926|0030018384|บริษัท อินเตอร์เนชั่นแนล แลบบอราทอรีส์ จำกัด|151|Industrial|0.0272982|650|0.016|AMR
08-26-2019|0010008928|0030018387|บริษัท หลุยส์ผลิตภัณท์กาวเทป จำกัด|151|Industrial|0.2075444|650|0.299|AMR
08-26-2019|0010009228|0030019659|บริษัท ไทย เอ็มเอฟซี จำกัด|151|Industrial|0.1556318|650|0.149|AMR
08-26-2019|0010009841|0030021637|บริษัท โอวาริ เซกิ (ไทยแลนด์) จำกัด|151|Industrial|0.0083695|650|0.006|AMR
08-26-2019|0010010605|0030024817|บริษัท มาบตาพุดโอเลฟินส์ จำกัด|151|Industrial|3.5775556|650|2.422|AMR
08-26-2019|0010010925|0030025431|บริษัท เน็กซ์ แคน อินโนเวชั่น จำกัด|151|Industrial|0.401634|650|0.367|AMR
08-26-2019|0010012227|0030032353|บริษัท เอ็มทีพี เอชพี เจวี (ประเทศไทย) จำกัด|151|Industrial|8.1830163|650|7.922|AMR
08-26-2019|0010012320|0030026468|บริษัท พีทีที โกลบอล เคมิคอล จำกัด(มหาชน)|151|Industrial|2.625542|650|2.531|AMR
08-26-2019|0010021117|0030000123|บริษัท ซีพีเอฟ (ประเทศไทย) จำกัด(มหาชน)|151|Industrial|0.5027753|650|0.447|AMR
08-26-2019|0010022444|0030044003|บริษัท ทีวาย สตีล จำกัด|151|Industrial|0.1422476|650|0.247|AMR
08-26-2019|0010023436|0030052175|บริษัท ซันโทรี่ เป๊ปซี่โค เบเวอเรจ(ประเทศไทย) จำกัด|151|Industrial|0.1692986|650|0.167|AMR
08-26-2019|0010023548|0030000131|บริษัท โคเวสโตร (ประเทศไทย) จำกัด|151|Industrial|0.5972068|650|0.517|AMR
08-26-2019|0010027459|0030011637|บริษัท โอสถสภา จำกัด (มหาชน)|151|Industrial|2.3620943|650|2.438|AMR
08-26-2019|0010027591|0030000157|บริษัท ซีพีเอฟ ฟู้ด แอนด์ เบฟเวอร์เรจ จำกัด|151|Industrial|0.2379151|650|0.209|AMR
08-26-2019|0010000006|0030000006|บริษัท ธนอินเตอร์ จำกัด|151|Industrial|0.0103472|650|0.005|AMR
08-26-2019|0010000007|0030000007|บริษัท บี เอ็น เอส เอส สตีลกรุ๊ป จำกัด|151|Industrial|0.5948408|650|0.351|AMR
08-26-2019|0010000022|0030000022|บริษัท ไทยบริดจสโตน จำกัด|151|Industrial|0.7471177|650|1.324|AMR
08-26-2019|0010000022|0030000022|บริษัท ไทยบริดจสโตน จำกัด|152|Industrial-CoGen|1.9530088|650|0.436|AMR
08-26-2019|0010000035|0030000035|บริษัท สยามซานิทารีแวร์อินดัสทรี จำกัด|151|Industrial|0.7038219|650|0.887|AMR
08-26-2019|0010000036|0030000036|บริษัท สยามฟูรูกาวา จำกัด|151|Industrial|0.2370675|650|0.25|AMR
08-26-2019|0010000047|0030000047|บริษัท โพสโค-ไทยน๊อคซ์ จำกัด (มหาชน)|151|Industrial|1.4064079|650|1.308|AMR
08-26-2019|0010000056|0030000059|บริษัท โอเอสซี สยามซิลิกา จำกัด|151|Industrial|1.7229688|650|1.617|AMR
08-26-2019|0010000062|0030000062|บริษัท สตาร์ ปิโตรเลียม รีไฟน์นิ่งจำกัด (มหาชน)|152|Industrial-CoGen|14.99727|650|13.688|ADQ
08-26-2019|0010000062|0030000062|บริษัท สตาร์ ปิโตรเลียม รีไฟน์นิ่งจำกัด (มหาชน)|151|Industrial|0.0000|650|11.212|ADQ/AMR
08-26-2019|0010000077|0030000077||151|Industrial|1.9359165|650|1.675|AMR
08-26-2019|0010000078|0030000078|บริษัท ไทเท็กซ์ เอเซีย จำกัด|151|Industrial|0.0956322|650|0.162|AMR
08-26-2019|0010000080|0030000080|บริษัท เอ็นเอส บลูสโคป (ประเทศไทย)จำกัด|151|Industrial|1.3095397|650|1.06|AMR
08-26-2019|0010000093|0030000093|บริษัท จีซี-เอ็ม พีทีเอ จำกัด|151|Industrial|2.7892609|650|2.794|AMR
08-26-2019|0010000110|0030000114|บริษัท ระยอง กัลวาไนซิ่ง จำกัด|151|Industrial|0.0580926|650|0.071|AMR
08-26-2019|0010000122|0030000126|บริษัท บี เอ เอส เอฟ (ไทย) จำกัด|151|Industrial|0.6008089|650|0.446|AMR
08-26-2019|0010000123|0030000127|บริษัท สยามซานิทารีแวร์อินดัสทรี (หนองแค) จำกัด|151|Industrial|0.4601152|650|0.533|AMR
08-26-2019|0010000141|0030000146|บริษัท สยามสตีล กัลวาไนซิ่ง จำกัด|151|Industrial|0.1579273|650|0.186|AMR
08-26-2019|0010000155|0030000161|บริษัท มาเล่ย์ เอ็นจิ่น คอมโพเน็นท์(ประเทศไทย) จำกัด|151|Industrial|0.0727129|650|0.089|AMR
08-26-2019|0010000191|0030043704|บริษัท ศักดิ์ไชยสิทธิ จำกัด|151|Industrial|0.0169863|650|0.623|AMR
08-26-2019|0010000192|0030043881|บริษัท แอร์ ลิควิด (ประเทศไทย) จำกัด|151|Industrial|2.439151|650|2.561|AMR
08-26-2019|0010000216|0030049389|บริษัท ไออาร์พีซี จำกัด (มหาชน)|151|Industrial|8.2024747|650|7.866|AMR
08-26-2019|0010001609|0030015621|บริษัท โตโยต้า มอเตอร์ ประเทศไทย จำกัด|151|Industrial|0.5851998|650|0.506|AMR
08-26-2019|0010002201|0030011779|บริษัท ควอลิตี้ คอฟฟี่ โปรดักท์ส จำกัด|151|Industrial|0.6839397|650|0.886|AMR
08-26-2019|0010006939|0030011133|บริษัท นิเด็ค ค็อมโปเน็นท์ เทคโนโลยี (ไทยแลนด์) จำกัด|151|Industrial|0.4671428|650|0.408|AMR
08-26-2019|0010006940|0030011137|บริษัท เอส ที บี เท็กซ์ไทล์ อินดัสตรี จำกัด|151|Industrial|0.0505353|650|0.035|AMR
08-26-2019|0010008022|0030033708|บริษัท สยามอุตสาหกรรมเกษตรอาหารจำกัด (มหาชน)|151|Industrial|0.0000|650|0.30|AMR
08-26-2019|0010009040|0030022254|บริษัท ไทยเรยอน จำกัด (มหาชน)|151|Industrial|1.1897169|650|0.905|AMR
08-26-2019|0010009180|0030019567|บริษัท ไทย มาลายา กลาส จำกัด|151|Industrial|2.6415748|650|2.719|AMR
08-26-2019|0010009604|0030020797|บริษัท เจ.พี ยูไนเต็ด จำกัด|151|Industrial|0.0447084|650|0.031|AMR
08-26-2019|0010009784|0030021478|บริษัท แคททาเลอร์ (ประเทศไทย) จำกัด|151|Industrial|0.1368091|650|0.119|AMR
08-26-2019|0010010423|0030024015|บริษัท ศานติบรรจุภัณฑ์ จำกัด|151|Industrial|0.1621651|650|0.182|AMR
08-26-2019|0010011882|0030031074|บริษัท พีทีที อาซาฮี เคมิคอล จำกัด|151|Industrial|4.6207872|650|4.404|AMR
08-26-2019|0010012059|0030045449|บริษัท พีทีที เอ็มซีซี ไบโอเคม จำกัด|151|Industrial|0.5030225|650|0.322|AMR
08-26-2019|0010012323|0030032849|บริษัท โตโยอิ๊งค์ (ประเทศไทย) จำกัด|151|Industrial|0.0091|650|0.009|ADQ
08-26-2019|0010020698|0030038224|บริษัท สตาร์คอร์ จำกัด|151|Industrial|0.2585389|650|0.127|AMR
08-26-2019|0010020836|0030038183|บริษัท กรุงเทพ ซินธิติกส์ จำกัด|151|Industrial|0.0251087|650|0.024|AMR
08-26-2019|0010021842|0030023236|บริษัท คอทโก้ เมททอลเวอร์คส จำกัด|151|Industrial|0.1938777|650|0.119|AMR
08-26-2019|0010021910|0030042490|บริษัท คาเนมิทสึ พูลเล่ย์ จำกัด|151|Industrial|0.0058269|650|0.008|AMR
08-26-2019|0010022868|0030047048|บริษัท ไออาร์พีซี คลีน พาวเวอร์ จำกัด|151|Industrial|0.0000|650|2.145|AMR
08-26-2019|0010024055|0030064940|บริษัท โอจีพี เอนเนอร์ยี่ โซลูชั่นส์ จำกัด (สำหรับ บริษัท คันไซ เรซิน(ประเทศไทย) จำกัด)|151|Industrial|0.0000|650||ADQ
08-26-2019|0010024055|0030064941|บริษัท โอจีพี เอนเนอร์ยี่ โซลูชั่นส์ จำกัด (สำหรับ บริษัท นิปปอน สตีลไพพ์ (ประเทศไทย) จำกัด โรงงาน 1)|151|Industrial|0.0000|650||ADQ
08-26-2019|0010027591|0030024290|บริษัท ซีพีเอฟ ฟู้ด แอนด์ เบฟเวอร์เรจ จำกัด|152|Industrial-CoGen|0.0039199|650|0.197|AMR
08-26-2019|0010000009|0030000009|บริษัท ล.ไลท์ติ้งกลาส จำกัด|151|Industrial|3.892139|650|4.026|AMR
08-26-2019|0010000010|0030000010|บริษัท สยามกลาส อินดัสทรี จำกัด|151|Industrial|1.8630623|650|1.975|AMR
08-26-2019|0010000023|0030000023|บริษัท ไทยเปอร์อ๊อกไซด์ จำกัด|151|Industrial|1.5486202|650|0.908|AMR
08-26-2019|0010000033|0030000104|บริษัท โรแยล ซีรามิค อุตสาหกรรม จำกัด (มหาชน)|151|Industrial|2.4450132|650|2.088|AMR
08-26-2019|0010000043|0030000043|บริษัท ไทย จีซีไอ เรซิท็อป จำกัด|151|Industrial|0.3186798|650|0.289|AMR
08-26-2019|0010000046|0030000046|บริษัท ไทยแทฟฟิต้า จำกัด|151|Industrial|0.0000|650|0.006|AMR
08-26-2019|0010000054|0030000054|บริษัท บางกอก คริสตัล จำกัด|151|Industrial|0.0000|650|0.834|AMR
08-26-2019|0010000056|0030000056|บริษัท โอเอสซี สยามซิลิกา จำกัด|151|Industrial|1.4362488|650|1.855|AMR
08-26-2019|0010000064|0030000243|บริษัท ลี่ไท่ อัลลอย จำกัด|151|Industrial|0.2007287|650|0.203|AMR
08-26-2019|0010000065|0030000065|บริษัท สยามโพลีสไตรีน จำกัด|151|Industrial|0.0606706|650|0.066|AMR
08-26-2019|0010000076|0030000076|บริษัท สยามสไตรีนโมโนเมอร์ จำกัด|151|Industrial|3.2323191|650|3.276|AMR
08-26-2019|0010000089|0030000089|บริษัท ธนเสริมอุตสาหกรรมฝาขวด จำกัด|151|Industrial|0.0904056|650|0.057|AMR
08-26-2019|0010000108|0030000112|บริษัท ยูนิตี้ อินดัสเตรียล จำกัด|151|Industrial|0.037716|650|0.017|AMR
08-26-2019|0010000109|0030000113|บริษัท ระยองไวร์ อินดัสตรีส์ จำกัด(มหาชน)|151|Industrial|0.0312888|650|0.028|AMR
08-26-2019|0010000129|0030000133|บริษัท ทีพีซี เพสต์ เรซิน จำกัด|151|Industrial|0.3105574|650|0.28|AMR
08-26-2019|0010000130|0030000134|บริษัท กรีนสปอต จำกัด|151|Industrial|0.8051751|650|0.591|AMR
08-26-2019|0010000140|0030000145|บริษัท สยามลวดเหล็กอุตสาหกรรม จำกัด|151|Industrial|0.0000|650|0.068|AMR
08-26-2019|0010000153|0030000159|บริษัท เกทส์ ยูนิทตะ (ประเทศไทย) จำกัด|151|Industrial|0.092807|650|0.088|AMR
08-26-2019|0010000154|0030000160|บริษัท แม็กซิออน วีลส์ (ประเทศไทย)จำกัด|151|Industrial|0.7747338|650|0.788|AMR
08-26-2019|0010000197|0030025358|บริษัท บางจาก คอร์ปอเรชั่น จำกัด (มหาชน)|152|Industrial-CoGen|8.1890904|650|6.90|AMR
08-26-2019|0010000197|0030025358|บริษัท บางจาก คอร์ปอเรชั่น จำกัด (มหาชน)|151|Industrial|26.4623323|650|23.481|FlowComp
08-26-2019|0010000220|0030000249|บริษัท เอเชีย ซิลิโคนส์ โมโนเมอร์จำกัด|151|Industrial|3.7338938|650|3.544|AMR
08-26-2019|0010000934|0030046753|บริษัท ฮอนด้า ออโตโมบิล (ประเทศไทย) จำกัด|151|Industrial|0.3169141|650|0.304|AMR
08-26-2019|0010001727|0030020317|บริษัท ไทยเซ็นทรัลเคมี จำกัด (มหาชน)|151|Industrial|0.0000|650|0.29|AMR
08-26-2019|0010001998|0030025768|บริษัท อินโดรามา โพลีเอสเตอร์ อินดัสตรี้ส์ จำกัด (มหาชน)|151|Industrial|1.8301843|650|1.849|AMR
08-26-2019|0010002048|0030021234|บริษัท ด๊อกเตอร์ บู จำกัด|151|Industrial|0.1884392|650|0.217|AMR
08-26-2019|0010006548|0030009620|บริษัท อีเลคโทรลักซ์ ประเทศไทย จำกัด|151|Industrial|0.0464035|650|0.035|AMR
08-26-2019|0010006922|0030020406|บริษัท อายิโนะโมะโต๊ะ (ประเทศไทย)จำกัด|151|Industrial|3.0209253|650|2.212|AMR
08-26-2019|0010007512|0030040636|บริษัท คราวน์ เบ็บแคน แอนด์ โคลสเชอร์ส (ประเทศไทย) จำกัด|151|Industrial|0.0683692|650|0.148|AMR
08-26-2019|0010007561|0030013097|บริษัท บางชันเยนเนอเรลเอเซมบลี จำกัด|151|Industrial|0.001801|650|0.015|AMR
08-26-2019|0010008114|0030024767|บริษัท ทุนเท็กซ์ เท็กซ์ไทล์ (ประเทศไทย) จำกัด|151|Industrial|0.2175738|650|0.191|AMR
08-26-2019|0010008206|0030015236|บริษัท เอ็นเนซอล จำกัด|152|Industrial-CoGen|1.8249224|650|1.27|AMR
08-26-2019|0010008671|0030021639|บริษัท พีทีที ฟีนอล จำกัด|151|Industrial|0.2668731|650|0.262|AMR
08-26-2019|0010008739|0030000237|บริษัท สยามไฟเบอร์ซีเมนต์กรุ๊ป จำกัด|151|Industrial|0.099658|650||AMR
08-26-2019|0010009151|0030019200|บริษัท ไทย เกลซ อุตสาหกรรม จำกัด|151|Industrial|0.3573141|650|0.307|AMR
08-26-2019|0010009176|0030019559|บริษัท พูแรค (ประเทศไทย) จำกัด|151|Industrial|2.5877199|650|2.128|AMR
08-26-2019|0010009392|0030020182|บริษัท มิตร สตีล จำกัด|151|Industrial|0.0000|650|0.046|AMR
08-26-2019|0010009442|0030020288|บริษัท อายิโนะโมะโต๊ะเซลส์ (ประเทศไทย) จำกัด|151|Industrial|0.0359856|650|0.057|AMR
08-26-2019|0010010156|0030022920|บริษัท ไทยเคมีภัณฑ์ จำกัด|151|Industrial|0.3981732|650|0.264|AMR
08-26-2019|0010010216|0030023098|บริษัท สยามพรีเสิร์ฟ ฟู้ดส์ จำกัด|151|Industrial|0.1688042|650|0.146|AMR
08-26-2019|0010011367|0030027987|บริษัท มิลลิเมด จำกัด|151|Industrial|0.027722|650|0.03|AMR
08-26-2019|0010012320|0030000055|บริษัท พีทีที โกลบอล เคมิคอล จำกัด(มหาชน)|151|Industrial|0.0024013|650|0.002|AMR
08-26-2019|0010012320|0030000069|บริษัท พีทีที โกลบอล เคมิคอล จำกัด(มหาชน)|151|Industrial|0.0000|650|6.038|AMR
08-26-2019|0010012393|0030033336|บริษัท จรุงไทยไวร์แอนด์เคเบิ้ล จำกัด (มหาชน)|151|Industrial|0.0000|650|0.056|AMR
08-26-2019|0010021117|0030022988|บริษัท ซีพีเอฟ (ประเทศไทย) จำกัด(มหาชน)|152|Industrial-CoGen|0.0000|650|0.261|AMR
08-26-2019|0010021117|0030022988|บริษัท ซีพีเอฟ (ประเทศไทย) จำกัด(มหาชน)|151|Industrial|0.435854|650|0.45|AMR
08-26-2019|0010022317|0030043685|บริษัท ไซมีส อีโคไลท์ จำกัด|151|Industrial|0.0910059|650|0.074|AMR
08-26-2019|0010022333|0030043703|บริษัท เอเชียแปซิฟิกกลาส จำกัด|151|Industrial|2.3646016|650|2.025|AMR
08-26-2019|0010022869|0030045768|บริษัท ยามาโมริ (ประเทศไทย) จำกัด|151|Industrial|0.035915|650|0.021|AMR
08-26-2019|0010023379|0030049270|บริษัท ลาบิกซ์ จำกัด|151|Industrial|6.494903|650|6.464|AMR
08-26-2019|0010024871|0030053591|บริษัท เอ็นเอส-โอจี เอนเนอร์จี โซลูชั่นส์ (ไทยแลนด์) จำกัด|152|Industrial-CoGen|0.8656692|650|0.814|AMR
08-26-2019|0010025332|0030052476|บริษัท ไอที ฟอร์จิ้ง (ประเทศไทย) จำกัด|151|Industrial|0.1385395|650|0.134|AMR
08-26-2019|0010027591|0030024290|บริษัท ซีพีเอฟ ฟู้ด แอนด์ เบฟเวอร์เรจ จำกัด|151|Industrial|0.751638|650|0.753|AMR
08-26-2019|0010027600|0030058148|บริษัท เอเชีย แคน แมนูแฟคเจอริ่ง จำกัด|151|Industrial|0.1210587|650|0.125|AMR
08-26-2019|0010027807|0030064609|บริษัท เช่วเฉิน ซิลิก้า (ไทยแลนด์)จำกัด|151|Industrial|0.0000|650||ADQ
08-26-2019|0010000071|0030000071|บริษัท เอสโซ่ (ประเทศไทย) จำกัด (มหาชน)|152|Industrial-CoGen|11.32803|650|10.502|ADQ
08-26-2019|0010000085|0030000085|บริษัท บางกอกอินดัสเทรียลแก๊ส จำกัด|151|Industrial|0.0460856|650|0.043|AMR
08-26-2019|0010000086|0030000086|บริษัท สยามคอมเพรสเซอร์อุตสาหกรรม จำกัด|151|Industrial|0.1426713|650|0.151|AMR
08-26-2019|0010000106|0030000109|บริษัท ไมย์เออร์ อลูมิเนียม (ประเทศไทย) จำกัด|151|Industrial|0.3203396|650|0.23|AMR
08-26-2019|0010000107|0030000111|บริษัท จี สตีล จำกัด (มหาชน)|151|Industrial|2.2588341|650|1.969|AMR
08-26-2019|0010000128|0030000132|บริษัท เซกิซุย เอส-เล็ค (ประเทศไทย)จำกัด|151|Industrial|0.0758912|650|0.07|AMR
08-26-2019|0010000137|0030000142|บริษัท วาลเมท จำกัด|151|Industrial|0.0034961|650|0.006|AMR
