Date|Sold to|Ship to|Ship to name|ContractType|Description|Volume(MMSCFD)|DemandPlan(BI)|MDCQ(BW)|Billing Type
08-22-2019|0010009598|0030053139|บมจ.เอเชียน อินซูเลเตอร์|151|Industrial|0.0000|650|0.30|AMR
08-22-2019|0010010220|0030023100|บริษัท เอส ไอ ดับบลิว (ไทยแลนด์) จำกัด|151|Industrial|0.1003996|650|0.082|AMR
08-22-2019|0010011784|0030030288|บริษัท สยามเลเทกซ์ สังเคราะห์ จำกัด|151|Industrial|1.3539655|650|1.129|AMR
08-22-2019|0010012320|0030021767|บริษัท พีทีที โกลบอล เคมิคอล จำกัด(มหาชน)|153|Commercial|0.0233077|650|0.015|AMR
08-22-2019|0010012320|0030021767|บริษัท พีทีที โกลบอล เคมิคอล จำกัด(มหาชน)|154|Commercial–CoGen|0.1252965|650|0.073|AMR
08-22-2019|0010021112|0030041494|บริษัท เจเอสอาร์ บีเอสที อิลาสโตเมอร์ จำกัด|151|Industrial|0.2333595|650|0.125|AMR
08-22-2019|0010021117|0030000123|บริษัท ซีพีเอฟ (ประเทศไทย) จำกัด(มหาชน)|152|Industrial-CoGen|1.2983802|650|1.361|AMR
08-22-2019|0010021842|0030023236|บริษัท คอทโก้ เมททอลเวอร์คส จำกัด|151|Industrial|0.2135479|650|0.119|AMR
08-22-2019|0010021910|0030042490|บริษัท คาเนมิทสึ พูลเล่ย์ จำกัด|151|Industrial|0.0108416|650|0.008|AMR
08-22-2019|0010023436|0030052175|บริษัท ซันโทรี่ เป๊ปซี่โค เบเวอเรจ(ประเทศไทย) จำกัด|151|Industrial|0.152171|650|0.167|AMR
08-22-2019|0010023548|0030000131|บริษัท โคเวสโตร (ประเทศไทย) จำกัด|151|Industrial|0.554017|650|0.517|AMR
08-22-2019|0010026372|0030024061|บริษัท เคมีแมน จำกัด (มหาชน)|151|Industrial|1.5316691|650|1.12|AMR
08-22-2019|0010027861|0030000018|บริษัท เอสซีจี เซรามิกส์ จำกัด (มหาชน)|151|Industrial|2.4181034|650|2.695|AMR
08-22-2019|0010000009|0030000009|บริษัท ล.ไลท์ติ้งกลาส จำกัด|151|Industrial|3.8943285|650|4.026|AMR
08-22-2019|0010000010|0030000010|บริษัท สยามกลาส อินดัสทรี จำกัด|151|Industrial|1.8241808|650|1.975|AMR
08-22-2019|0010000022|0030000022|บริษัท ไทยบริดจสโตน จำกัด|151|Industrial|0.7404433|650|1.324|AMR
08-22-2019|0010000022|0030000022|บริษัท ไทยบริดจสโตน จำกัด|152|Industrial-CoGen|1.9386004|650|0.436|AMR
08-22-2019|0010000033|0030000104|บริษัท โรแยล ซีรามิค อุตสาหกรรม จำกัด (มหาชน)|151|Industrial|2.2075925|650|2.088|AMR
08-22-2019|0010000047|0030000047|บริษัท โพสโค-ไทยน๊อคซ์ จำกัด (มหาชน)|151|Industrial|1.411811|650|1.308|AMR
08-22-2019|0010000056|0030000059|บริษัท โอเอสซี สยามซิลิกา จำกัด|151|Industrial|1.4644652|650|1.617|AMR
08-22-2019|0010000067|0030000067|บริษัท มิลล์คอน บูรพา จำกัด|151|Industrial|0.5602677|650|1.26|AMR
08-22-2019|0010000077|0030000077||151|Industrial|1.4226526|650|1.675|AMR
08-22-2019|0010000078|0030000078|บริษัท ไทเท็กซ์ เอเซีย จำกัด|151|Industrial|0.179893|650|0.162|AMR
08-22-2019|0010000080|0030000080|บริษัท เอ็นเอส บลูสโคป (ประเทศไทย)จำกัด|151|Industrial|1.0441497|650|1.06|AMR
08-22-2019|0010000099|0030000099|บริษัท เกรท วอลล์ มอเตอร์ แมนูแฟคเจอริ่ง (ประเทศไทย) จำกัด|151|Industrial|0.5822687|650|0.434|AMR
08-22-2019|0010000101|0030000103|บริษัท ร็อควูล (ประเทศไทย) จำกัด|151|Industrial|0.236785|650|0.127|AMR
08-22-2019|0010000116|0030000120|บริษัท มิตซูบิชิ มอเตอร์ส (ประเทศไทย) จำกัด|151|Industrial|0.4576785|650|0.296|AMR
08-22-2019|0010000133|0030000138|บริษัท เอ.เจ. พลาสท์ จำกัด (มหาชน)|151|Industrial|0.7018443|650|0.648|AMR
08-22-2019|0010000145|0030000150|บริษัท แสตนดาร์ดแคน จำกัด|151|Industrial|0.3371847|650|0.26|AMR
08-22-2019|0010000158|0030000164|บริษัท นิวพลัสนิตติ้ง จำกัด (มหาชน)|151|Industrial|0.0082989|650|0.007|AMR
08-22-2019|0010000201|0030000021|บริษัท อดิตยา เบอร์ล่า เคมีคัลส์ (ประเทศไทย) จำกัด (ซัลไฟท์ส ดีวิชั่น)|151|Industrial|0.0720419|650|0.08|AMR
08-22-2019|0010000216|0030049389|บริษัท ไออาร์พีซี จำกัด (มหาชน)|151|Industrial|9.0274614|650|7.866|AMR
08-22-2019|0010000916|0030044950|บริษัท ดาน่า สไปเซอร์ (ประเทศไทย) จำกัด|151|Industrial|0.0772332|650|0.105|AMR
08-22-2019|0010000925|0030022478|บริษัท ไทยสตีลโปรไฟล์ จำกัด (มหาชน)|151|Industrial|1.4543652|650|0.899|AMR
08-22-2019|0010001727|0030020317|บริษัท ไทยเซ็นทรัลเคมี จำกัด (มหาชน)|151|Industrial|0.0000|650|0.29|AMR
08-22-2019|0010001998|0030025768|บริษัท อินโดรามา โพลีเอสเตอร์ อินดัสตรี้ส์ จำกัด (มหาชน)|151|Industrial|1.8316675|650|1.849|AMR
08-22-2019|0010002048|0030021234|บริษัท ด๊อกเตอร์ บู จำกัด|151|Industrial|0.1478626|650|0.217|AMR
08-22-2019|0010006616|0030010020|บริษัท บริดจสโตน คาร์บอน แบล็ค (ประเทศไทย) จำกัด|151|Industrial|0.1637895|650|0.201|AMR
08-22-2019|0010006733|0030023785|บริษัท เดลี่ฟู้ดส์ จำกัด|151|Industrial|0.0892049|650|0.05|AMR
08-22-2019|0010006922|0030020406|บริษัท อายิโนะโมะโต๊ะ (ประเทศไทย)จำกัด|151|Industrial|2.516702|650|2.212|AMR
08-22-2019|0010007512|0030040636|บริษัท คราวน์ เบ็บแคน แอนด์ โคลสเชอร์ส (ประเทศไทย) จำกัด|151|Industrial|0.071371|650|0.148|AMR
08-22-2019|0010007561|0030013097|บริษัท บางชันเยนเนอเรลเอเซมบลี จำกัด|151|Industrial|0.0034255|650|0.015|AMR
08-22-2019|0010008022|0030033708|บริษัท สยามอุตสาหกรรมเกษตรอาหารจำกัด (มหาชน)|151|Industrial|0.0000|650|0.30|AMR
08-22-2019|0010008509|0030044231|บริษัท ผลิตภัณฑ์ตราเพชร จำกัด (มหาชน)|151|Industrial|0.3631763|650|0.369|AMR
08-22-2019|0010008606|0030016564|บริษัท ซังโกะ ไดคาชติ้ง (ประเทศไทย)จำกัด (มหาชน)|151|Industrial|0.2055315|650|0.174|AMR
08-22-2019|0010009070|0030018984|บริษัท โมเดอร์น ไดสตัฟส์ แอนด์พิคเมนท์ส จำกัด|151|Industrial|0.111665|650|0.189|AMR
08-22-2019|0010009085|0030056942|บจ.แดรี่ พลัส|151|Industrial|0.0000|650|0.659|AMR
08-22-2019|0010009228|0030019659|บริษัท ไทย เอ็มเอฟซี จำกัด|151|Industrial|0.1334542|650|0.149|AMR
08-22-2019|0010009841|0030021637|บริษัท โอวาริ เซกิ (ไทยแลนด์) จำกัด|151|Industrial|0.0097468|650|0.006|AMR
08-22-2019|0010010423|0030024015|บริษัท ศานติบรรจุภัณฑ์ จำกัด|151|Industrial|0.1721591|650|0.182|AMR
08-22-2019|0010011882|0030031074|บริษัท พีทีที อาซาฮี เคมิคอล จำกัด|151|Industrial|4.6447659|650|4.404|AMR
08-22-2019|0010012059|0030045449|บริษัท พีทีที เอ็มซีซี ไบโอเคม จำกัด|151|Industrial|0.6011621|650|0.322|AMR
08-22-2019|0010012320|0030026468|บริษัท พีทีที โกลบอล เคมิคอล จำกัด(มหาชน)|151|Industrial|0.4728638|650|2.531|AMR
08-22-2019|0010020998|0030039159||151|Industrial|0.00003|650|0.011|ADQ
08-22-2019|0010021265|0030000095|บริษัท เอ็นเอส-สยามยูไนเต็ดสตีล จำกัด|151|Industrial|1.727701|650|1.977|AMR
08-22-2019|0010022444|0030044003|บริษัท ทีวาย สตีล จำกัด|151|Industrial|0.1281923|650|0.247|AMR
08-22-2019|0010023667|0030000034|บริษัท สตาร์ ซานิทารี่แวร์ (ประเทศไทย) จำกัด|151|Industrial|0.1022713|650|0.092|AMR
08-22-2019|0010023967|0030050118|บริษัท โอซาก้า แก๊ส (ประเทศไทย) จำกัด|151|Industrial|0.2413406|650|0.194|AMR
08-22-2019|0010026634|0030054698|บริษัท คานายามา คาเซอิ (ประเทศไทย)จำกัด|158|NG by Truck|0.52053|650|0.661|ADQ
08-22-2019|0010026674|0030017326|บริษัท ไทยเพรซิเดนท์ฟูดส์ จำกัด(มหาชน)|151|Industrial|0.819195|650|0.586|AMR
08-22-2019|0010027861|0030000017|บริษัท เอสซีจี เซรามิกส์ จำกัด (มหาชน)|151|Industrial|3.5685504|650|4.00|AMR
08-22-2019|0010000006|0030000006|บริษัท ธนอินเตอร์ จำกัด|151|Industrial|0.0000|650|0.005|AMR
08-22-2019|0010000007|0030000007|บริษัท บี เอ็น เอส เอส สตีลกรุ๊ป จำกัด|151|Industrial|0.7942629|650|0.351|AMR
08-22-2019|0010000019|0030000019|บริษัท ไดนาสตี้ เซรามิค จำกัด (มหาชน)|151|Industrial|4.0326562|650|4.982|AMR
08-22-2019|0010000031|0030000031|บริษัท วิลเลรอย แอนด์ บอค (ประเทศไทย) จำกัด|151|Industrial|0.7072474|650|0.613|AMR
08-22-2019|0010000032|0030000032|บริษัท รอยัลปอร์ซเลน จำกัด (มหาชน)|151|Industrial|1.0619836|650|0.99|AMR
08-22-2019|0010000041|0030000041|บริษัท สยามอุตสาหกรรมยิปซัม (สระบุรี) จำกัด|151|Industrial|3.4128832|650|2.897|AMR
08-22-2019|0010000053|0030020331|บริษัท ไทยอาซาฮีเคมีภัณฑ์ จำกัด|151|Industrial|0.5669421|650|0.396|AMR
08-22-2019|0010000062|0030000062|บริษัท สตาร์ ปิโตรเลียม รีไฟน์นิ่งจำกัด (มหาชน)|152|Industrial-CoGen|14.99727|650|13.688|ADQ
08-22-2019|0010000062|0030000062|บริษัท สตาร์ ปิโตรเลียม รีไฟน์นิ่งจำกัด (มหาชน)|151|Industrial|22.6666554|650|11.212|ADQ/AMR
08-22-2019|0010000071|0030000071|บริษัท เอสโซ่ (ประเทศไทย) จำกัด (มหาชน)|151|Industrial|4.72587|650|5.127|ADQ
08-22-2019|0010000073|0030000073|บริษัท ไฟน์ เม็ททัล เทคโนโลยีส์จำกัด (มหาชน)|151|Industrial|0.6550523|650|0.326|AMR
08-22-2019|0010000084|0030000084|บริษัท สยามอุตสาหกรรมวัสดุทนไฟ จำกัด|151|Industrial|1.2100228|650|1.261|AMR
08-22-2019|0010000104|0030000107|บริษัท สยามโพลิเอททีลีน จำกัด|151|Industrial|1.4779555|650|1.79|AMR
08-22-2019|0010000128|0030000132|บริษัท เซกิซุย เอส-เล็ค (ประเทศไทย)จำกัด|151|Industrial|0.0655793|650|0.07|AMR
08-22-2019|0010000137|0030000142|บริษัท วาลเมท จำกัด|151|Industrial|0.0065332|650|0.006|AMR
08-22-2019|0010000139|0030000144|บริษัท ยูเนี่ยนไพโอเนียร์ จำกัด(มหาชน)|151|Industrial|0.1335601|650|0.116|AMR
08-22-2019|0010000151|0030000156|บริษัท มิตซูบิชิ อีเล็คทริค ออโตเมชั่น (ประเทศไทย) จำกัด|151|Industrial|0.2341364|650|0.216|AMR
08-22-2019|0010000164|0030019231|บริษัท โกลว์ พลังงาน จำกัด (มหาชน)|151|Industrial|0.0000|650|0.187|ADQ
08-22-2019|0010000164|0030030778|บริษัท โกลว์ พลังงาน จำกัด (มหาชน)|152|Industrial-CoGen|54.3615287|650|53.967|FlowComp
08-22-2019|0010000202|0030042681|บริษัท สมบูรณ์ โซมิค แมนูแฟคเจอริ่งจำกัด|151|Industrial|0.0102765|650|0.01|AMR
08-22-2019|0010000227|0030000253|บริษัท จี เจ สตีล จำกัด (มหาชน)|151|Industrial|1.8987301|650|1.779|AMR
08-22-2019|0010001217|0030021463|บริษัท แอมคอล อินเตอร์เนชั่นแนล (ไทยแลนด์) จำกัด|151|Industrial|0.0513475|650|0.082|AMR
08-22-2019|0010001431|0030053506|บริษัท คาราบาวตะวันแดง จำกัด|151|Industrial|0.2981266|650|0.238|AMR
08-22-2019|0010001747|0030042303|บริษัท สุนทรเมทัลอินดัสทรี้ส์ จำกัด|151|Industrial|0.4978666|650|0.378|AMR
08-22-2019|0010001787|0030024766|บริษัท เพรซิเดนท์ เบเกอรี่ จำกัด(มหาชน)|151|Industrial|0.3277557|650|0.281|AMR
08-22-2019|0010002964|0030024050|บริษัท สยามบราเดอร์ จำกัด|151|Industrial|0.1236014|650|0.08|AMR
08-22-2019|0010003009|0030053395|บริษัท มิตซูบิชิ อีเล็คทริค คอนซูมเมอร์ โปรดักส์ (ประเทศไทย) จำกัด|158|NG by Truck|0.01667|650|0.022|ADQ
08-22-2019|0010006894|0030020321|บริษัท อาร์ต อุตสาหกรรม จำกัด|151|Industrial|0.116821|650|0.021|AMR
08-22-2019|0010007489|0030043669|บจ.ไซมีส เมอร์ชานไดส์|151|Industrial|0.0000|650|0.003|AMR
08-22-2019|0010007875|0030013765|บริษัท วนชัย เคมีคอล อินดัสทรี่ส์จำกัด|151|Industrial|0.0373276|650|0.117|AMR
08-22-2019|0010008509|0030016162|บริษัท ผลิตภัณฑ์ตราเพชร จำกัด (มหาชน)|151|Industrial|0.0960912|650|0.087|AMR
08-22-2019|0010008739|0030038490|บริษัท สยามไฟเบอร์ซีเมนต์กรุ๊ป จำกัด|151|Industrial|0.0175514|650||AMR
08-22-2019|0010008758|0030016949|บริษัท คล็อกเนอร์ เพนทาพลาสท์ (ไทยแลนด์) จำกัด|151|Industrial|0.0186461|650|0.021|AMR
08-22-2019|0010009180|0030019567|บริษัท ไทย มาลายา กลาส จำกัด|151|Industrial|2.6515689|650|2.719|AMR
08-22-2019|0010009604|0030020797|บริษัท เจ.พี ยูไนเต็ด จำกัด|151|Industrial|0.0598231|650|0.031|AMR
08-22-2019|0010009784|0030021478|บริษัท แคททาเลอร์ (ประเทศไทย) จำกัด|151|Industrial|0.1601168|650|0.119|AMR
08-22-2019|0010010355|0030023468|บริษัท เคียวเด็น (ประเทศไทย) จำกัด|151|Industrial|0.0371157|650|0.033|AMR
08-22-2019|0010010358|0030023471|บริษัท เซ้าท์ ซิตี้ ปิโตรเคม จำกัด|151|Industrial|0.0763856|650|0.12|AMR
08-22-2019|0010012118|0030062578|บริษัท พีทีที แอลเอ็นจี จำกัด|152|Industrial-CoGen|0.0000|650|4.30|FlowComp
08-22-2019|0010012146|0030032044||151|Industrial|0.5739345|650|0.797|AMR
08-22-2019|0010012326|0030032885|บริษัท สายไฟฟ้าไทย-ยาซากิ จำกัด|151|Industrial|0.2158434|650|0.066|AMR
08-22-2019|0010012361|0030033177|บริษัท โตโต้ (ประเทศไทย) จำกัด|151|Industrial|0.8599482|650|0.714|AMR
08-22-2019|0010020698|0030038224|บริษัท สตาร์คอร์ จำกัด|151|Industrial|0.2900749|650|0.127|AMR
08-22-2019|0010020836|0030038183|บริษัท กรุงเทพ ซินธิติกส์ จำกัด|151|Industrial|0.0240493|650|0.024|AMR
08-22-2019|0010022253|0030043488|บริษัท ที.ที.เซรามิค จำกัด (มหาชน)|151|Industrial|1.0209479|650|0.836|AMR
08-22-2019|0010022869|0030045768|บริษัท ยามาโมริ (ประเทศไทย) จำกัด|151|Industrial|0.0293818|650|0.021|AMR
08-22-2019|0010023379|0030049270|บริษัท ลาบิกซ์ จำกัด|151|Industrial|6.4843792|650|6.464|AMR
08-22-2019|0010024871|0030053591|บริษัท เอ็นเอส-โอจี เอนเนอร์จี โซลูชั่นส์ (ไทยแลนด์) จำกัด|152|Industrial-CoGen|1.1615357|650|0.814|AMR
08-22-2019|0010025332|0030052476|บริษัท ไอที ฟอร์จิ้ง (ประเทศไทย) จำกัด|151|Industrial|0.1623416|650|0.134|AMR
08-22-2019|0010027591|0030024290|บริษัท ซีพีเอฟ ฟู้ด แอนด์ เบฟเวอร์เรจ จำกัด|151|Industrial|0.694287|650|0.753|AMR
08-22-2019|0010027600|0030058148|บริษัท เอเชีย แคน แมนูแฟคเจอริ่ง จำกัด|151|Industrial|0.1195402|650|0.125|AMR
08-22-2019|0010027807|0030064609|บริษัท เช่วเฉิน ซิลิก้า (ไทยแลนด์)จำกัด|151|Industrial|0.0000|650||ADQ
08-22-2019|0010000003|0030000003|บริษัท เขาช่องอุตสาหกรรม 1979 จำกัด|151|Industrial|0.5169012|650|0.455|AMR
08-22-2019|0010000015|0030000015|บริษัท โคห์เลอร์ (ประเทศไทย) จำกัด(มหาชน)|151|Industrial|2.4686034|650|2.341|AMR
08-22-2019|0010000027|0030000027|บริษัท ฝาจีบ จำกัด (มหาชน)|151|Industrial|0.4794676|650|0.501|AMR
08-22-2019|0010000028|0030000028|บริษัท เฟอร์โร (ประเทศไทย) จำกัด|151|Industrial|0.4756536|650|0.551|AMR
08-22-2019|0010000038|0030000102|บริษัท สหโมเสคอุตสาหกรรม จำกัด (มหาชน)|151|Industrial|1.5032055|650|2.111|AMR
08-22-2019|0010000039|0030000039|บริษัท โสสุโก้ เซรามิค จำกัด|151|Industrial|1.1227249|650|2.211|AMR
08-22-2019|0010000052|0030000052|บริษัท ไทยออยล์ จำกัด (มหาชน)|151|Industrial|22.0055748|650|16.473|AMR/FlowComp
08-22-2019|0010000053|0030000053|บริษัท ไทยอาซาฮีเคมีภัณฑ์ จำกัด|151|Industrial|0.2814934|650|0.211|AMR
08-22-2019|0010000063|0030000063|บริษัท สยามมิชลิน จำกัด|151|Industrial|0.0000|650|0.20|AMR
08-22-2019|0010000063|0030000075|บริษัท สยามมิชลิน จำกัด|151|Industrial|0.0767741|650|0.07|AMR
08-22-2019|0010000071|0030000071|บริษัท เอสโซ่ (ประเทศไทย) จำกัด (มหาชน)|152|Industrial-CoGen|11.32803|650|10.502|ADQ
08-22-2019|0010000085|0030000085|บริษัท บางกอกอินดัสเทรียลแก๊ส จำกัด|151|Industrial|0.0491227|650|0.043|AMR
08-22-2019|0010000086|0030000086|บริษัท สยามคอมเพรสเซอร์อุตสาหกรรม จำกัด|151|Industrial|0.1733598|650|0.151|AMR
08-22-2019|0010000108|0030000112|บริษัท ยูนิตี้ อินดัสเตรียล จำกัด|151|Industrial|0.0449909|650|0.017|AMR
08-22-2019|0010000109|0030000113|บริษัท ระยองไวร์ อินดัสตรีส์ จำกัด(มหาชน)|151|Industrial|0.0153618|650|0.028|AMR
08-22-2019|0010000125|0030000129|บริษัท อาร์พีที เอเซีย จำกัด|151|Industrial|0.0470391|650|0.019|AMR
08-22-2019|0010000140|0030000145|บริษัท สยามลวดเหล็กอุตสาหกรรม จำกัด|151|Industrial|0.0000|650|0.068|AMR
08-22-2019|0010000153|0030000159|บริษัท เกทส์ ยูนิทตะ (ประเทศไทย) จำกัด|151|Industrial|0.1003643|650|0.088|AMR
08-22-2019|0010000154|0030000160|บริษัท แม็กซิออน วีลส์ (ประเทศไทย)จำกัด|151|Industrial|0.8944154|650|0.788|AMR
08-22-2019|0010000178|0030016267|บริษัท โกลว์ เอสพีพี 11 จำกัด|152|Industrial-CoGen|2.3501226|650|1.41318|AMR
08-22-2019|0010000206|0030000239|บริษัท เฮลซ์เทรดดิ้ง (ประเทศไทย) จำกัด|151|Industrial|0.0443552|650|0.035|AMR
08-22-2019|0010000228|0030000254|บริษัท ไทย เพ็ท เรซิน จำกัด|151|Industrial|1.0315423|650|1.072|AMR
08-22-2019|0010001488|0030016945|บริษัท โพลีเพล็กซ์ (ประเทศไทย) จำกัด (มหาชน)|151|Industrial|1.0980046|650|1.071|AMR
08-22-2019|0010001605|0030051931||151|Industrial|0.2377738|650|0.261|AMR
08-22-2019|0010001922|0030022692|บริษัท ฟู้ดแอนด์ดริ๊งส์ จำกัด (มหาชน)|151|Industrial|0.17107|650|0.156|ADQ
08-22-2019|0010006548|0030009620|บริษัท อีเลคโทรลักซ์ ประเทศไทย จำกัด|151|Industrial|0.0428367|650|0.035|AMR
08-22-2019|0010007151|0030011752|บริษัท เอ็มซีแอลเอส เอเชีย จำกัด|151|Industrial|0.9985231|650|0.865|AMR
08-22-2019|0010007982|0030014211|บริษัท จีซี ไกลคอล จำกัด|151|Industrial|0.1251552|650|0.113|AMR
08-22-2019|0010008671|0030021639|บริษัท พีทีที ฟีนอล จำกัด|151|Industrial|0.26147|650|0.262|AMR
08-22-2019|0010008739|0030000237|บริษัท สยามไฟเบอร์ซีเมนต์กรุ๊ป จำกัด|151|Industrial|0.0929482|650||AMR
08-22-2019|0010009151|0030019200|บริษัท ไทย เกลซ อุตสาหกรรม จำกัด|151|Industrial|0.3364078|650|0.307|AMR
08-22-2019|0010009176|0030019559|บริษัท พูแรค (ประเทศไทย) จำกัด|151|Industrial|2.4597747|650|2.128|AMR
08-22-2019|0010009390|0030020154|บริษัท อัลวา อะลูมิเนียม จำกัด|151|Industrial|0.2818819|650|0.215|AMR
08-22-2019|0010010116|0030022714|บริษัท ยัสปาลแอนด์ซันส์ จำกัด|151|Industrial|0.1077451|650|0.087|AMR
08-22-2019|0010011029|0030026047|บริษัท เอ็น ซี อาร์ รับเบอร์อินดัสตรี้ จำกัด|151|Industrial|0.0775157|650|0.066|AMR
08-22-2019|0010011163|0030026631|บริษัท ไทย อกริ เพาเวอร์ จำกัด|152|Industrial-CoGen|0.5435991|650|0.378|AMR
08-22-2019|0010012320|0030000055|บริษัท พีทีที โกลบอล เคมิคอล จำกัด(มหาชน)|151|Industrial|0.0022954|650|0.002|AMR
08-22-2019|0010012320|0030000069|บริษัท พีทีที โกลบอล เคมิคอล จำกัด(มหาชน)|151|Industrial|5.4020543|650|6.038|AMR
08-22-2019|0010012393|0030033336|บริษัท จรุงไทยไวร์แอนด์เคเบิ้ล จำกัด (มหาชน)|151|Industrial|0.0000|650|0.056|AMR
08-22-2019|0010021117|0030022988|บริษัท ซีพีเอฟ (ประเทศไทย) จำกัด(มหาชน)|152|Industrial-CoGen|0.0000|650|0.261|AMR
