Date|Sold to|Ship to|Ship to name|ContractType|Description|Volume(MMSCFD)|DemandPlan(BI)|MDCQ(BW)|Billing Type
12-26-2019|0010010358|0030023471|บริษัท เซ้าท์ ซิตี้ ปิโตรเคม จำกัด|151|Industrial|0.1658025|627.65|0.12|AMR
12-26-2019|0010011882|0030031074|บริษัท พีทีที อาซาฮี เคมิคอล จำกัด|151|Industrial|0.7655167|627.65|4.404|AMR
12-26-2019|0010012059|0030045449|บริษัท พีทีที เอ็มซีซี ไบโอเคม จำกัด|151|Industrial|0.3937589|627.65|0.322|AMR
12-26-2019|0010012320|0030021767|บริษัท พีทีที โกลบอล เคมิคอล จำกัด(มหาชน)|153|Commercial|0.0158563|627.65|0.015|AMR
12-26-2019|0010012320|0030021767|บริษัท พีทีที โกลบอล เคมิคอล จำกัด(มหาชน)|154|Commercial–CoGen|0.1166797|627.65|0.073|AMR
12-26-2019|0010021112|0030041494|บริษัท เจเอสอาร์ บีเอสที อิลาสโตเมอร์ จำกัด|151|Industrial|0.1750902|627.65|0.125|AMR
12-26-2019|0010021117|0030000123|บริษัท ซีพีเอฟ (ประเทศไทย) จำกัด(มหาชน)|152|Industrial-CoGen|1.2631008|627.65|1.361|AMR
12-26-2019|0010022444|0030044003|บริษัท ทีวาย สตีล จำกัด|151|Industrial|0.4132173|627.65|0.247|AMR
12-26-2019|0010023436|0030052175|บริษัท ซันโทรี่ เป๊ปซี่โค เบเวอเรจ(ประเทศไทย) จำกัด|151|Industrial|0.0923479|627.65|0.167|AMR
12-26-2019|0010023548|0030000131|บริษัท โคเวสโตร (ประเทศไทย) จำกัด|151|Industrial|0.4682022|627.65|0.517|AMR
12-26-2019|0010027295|0030059173|บมจ.ปตท. น้ำมันและการค้าปลีก|158|NG by Truck|0.13919|627.65|0.139|ADQ
12-26-2019|0010027315|0030057427|บริษัท นิชินโบะ สมบูรณ์ ออโตโมทีฟ จำกัด|151|Industrial|0.020659|627.65|0.003|AMR
12-26-2019|0010027938|0030059837|บริษัท ราชบุรีกล๊าส อินดัสทรี จำกัด|151|Industrial|1.7830745|627.65|1.485|AMR
12-26-2019|0010000008|0030000008|บริษัท ไมโครไฟเบอร์อุตสาหกรรม จำกัด|151|Industrial|0.1507937|627.65|0.291|AMR
12-26-2019|0010000022|0030000022|บริษัท ไทยบริดจสโตน จำกัด|152|Industrial-CoGen|1.9148689|627.65|0.436|AMR
12-26-2019|0010000023|0030000023|บริษัท ไทยเปอร์อ๊อกไซด์ จำกัด|151|Industrial|1.6143055|627.65|0.908|AMR
12-26-2019|0010000037|0030000037|บริษัท สยามไฟเบอร์กลาส จำกัด|151|Industrial|0.2927588|627.65|0.34|AMR
12-26-2019|0010000049|0030000049|บริษัท ไทยผลิตภัณฑ์ยิบซั่ม จำกัด(มหาชน)|152|Industrial-CoGen|0.3233413|627.65|0.783|AMR
12-26-2019|0010000050|0030000050|บริษัท ไทยพลาสติกและเคมีภัณฑ์ จำกัด(มหาชน)|151|Industrial|5.2789119|627.65|5.273|AMR
12-26-2019|0010000063|0030000063|บริษัท สยามมิชลิน จำกัด|151|Industrial|0.0000|627.65|0.20|AMR
12-26-2019|0010000063|0030000075|บริษัท สยามมิชลิน จำกัด|151|Industrial|0.0781161|627.65|0.07|AMR
12-26-2019|0010000071|0030000071|บริษัท เอสโซ่ (ประเทศไทย) จำกัด (มหาชน)|151|Industrial|7.98984|627.65|5.127|ADQ
12-26-2019|0010000073|0030000073|บริษัท ไฟน์ เม็ททัล เทคโนโลยีส์จำกัด (มหาชน)|151|Industrial|0.1729007|627.65|0.326|AMR
12-26-2019|0010000085|0030000085|บริษัท บางกอกอินดัสเทรียลแก๊ส จำกัด|151|Industrial|0.0366919|627.65|0.043|AMR
12-26-2019|0010000086|0030000086|บริษัท สยามคอมเพรสเซอร์อุตสาหกรรม จำกัด|151|Industrial|0.0608825|627.65|0.151|AMR
12-26-2019|0010000108|0030000112|บริษัท ยูนิตี้ อินดัสเตรียล จำกัด|151|Industrial|0.0000|627.65|0.017|AMR
12-26-2019|0010000109|0030000113|บริษัท ระยองไวร์ อินดัสตรีส์ จำกัด(มหาชน)|151|Industrial|0.0000|627.65|0.028|AMR
12-26-2019|0010000128|0030000132|บริษัท เซกิซุย เอส-เล็ค (ประเทศไทย)จำกัด|151|Industrial|0.0000|627.65|0.07|AMR
12-26-2019|0010000137|0030000142|บริษัท วาลเมท จำกัด|151|Industrial|0.0000|627.65|0.006|AMR
12-26-2019|0010000139|0030000144|บริษัท ยูเนี่ยนไพโอเนียร์ จำกัด(มหาชน)|151|Industrial|0.1151612|627.65|0.116|AMR
12-26-2019|0010000149|0030000154|บริษัท เอเวอรี่ เดนนิสสัน (ประเทศไทย) จำกัด|151|Industrial|0.164849|627.65|0.067|AMR
12-26-2019|0010000150|0030000155|บริษัท บริดจสโตน เมตัลฟา(ประเทศไทย) จำกัด|151|Industrial|0.0646259|627.65|0.307|AMR
12-26-2019|0010000158|0030000164|บริษัท นิวพลัสนิตติ้ง จำกัด (มหาชน)|151|Industrial|0.0000|627.65|0.007|AMR
12-26-2019|0010000201|0030000234|บริษัท อดิตยา เบอร์ล่า เคมีคัลส์ (ประเทศไทย) จำกัด(คลออัลคาลีดีวิชั่น)|151|Industrial|0.0231664|627.65|0.024|AMR
12-26-2019|0010000201|0030020965|บริษัท อดิตยา เบอร์ล่า เคมีคัลส์ (ประเทศไทย) จำกัด (แอดวานซ์ แมททีเรียลส์)|151|Industrial|0.0805175|627.65|0.075|AMR
12-26-2019|0010000220|0030000249|บริษัท เอเชีย ซิลิโคนส์ โมโนเมอร์จำกัด|151|Industrial|3.4871853|627.65|3.544|AMR
12-26-2019|0010001013|0030023306|บริษัท เนสท์เล่ (ไทย) จำกัด|151|Industrial|0.0486636|627.65|0.037|AMR
12-26-2019|0010001125|0030039301|บริษัท ไทยโพลีอะซีทัล จำกัด|151|Industrial|0.086521|627.65|0.081|AMR
12-26-2019|0010001609|0030015621|บริษัท โตโยต้า มอเตอร์ ประเทศไทย จำกัด|152|Industrial-CoGen|1.3126473|627.65|0.802|AMR
12-26-2019|0010001714|0030016192|บริษัท ออลเน็กซ์ (ประเทศไทย) จำกัด|151|Industrial|0.0000|627.65|0.14|AMR
12-26-2019|0010001998|0030025768|บริษัท อินโดรามา โพลีเอสเตอร์ อินดัสตรี้ส์ จำกัด (มหาชน)|151|Industrial|1.8138689|627.65|1.849|AMR
12-26-2019|0010002048|0030021234|บริษัท ด๊อกเตอร์ บู จำกัด|151|Industrial|0.0694993|627.65|0.217|AMR
12-26-2019|0010006894|0030020321|บริษัท อาร์ต อุตสาหกรรม จำกัด|151|Industrial|0.0789283|627.65|0.021|AMR
12-26-2019|0010007594|0030013168|บริษัท ไลอ้อน (ประเทศไทย) จำกัด|151|Industrial|0.6574537|627.65|0.555|AMR
12-26-2019|0010008509|0030044231|บริษัท ผลิตภัณฑ์ตราเพชร จำกัด (มหาชน)|151|Industrial|0.0000|627.65|0.369|AMR
12-26-2019|0010008606|0030016564|บริษัท ซังโกะ ไดคาชติ้ง (ประเทศไทย)จำกัด (มหาชน)|151|Industrial|0.0000|627.65|0.174|AMR
12-26-2019|0010009093|0030019105|บริษัท ยูเนียน ออโตพาร์ทส มานูแฟคเชอริ่ง จำกัด|151|Industrial|0.0928776|627.65|0.10|AMR
12-26-2019|0010009357|0030020016|บริษัท ซีพี-เมจิ จำกัด|152|Industrial-CoGen|0.3941826|627.65|0.307|AMR
12-26-2019|0010009357|0030020016|บริษัท ซีพี-เมจิ จำกัด|151|Industrial|0.4608215|627.65|0.498|AMR
12-26-2019|0010010116|0030022714|บริษัท ยัสปาลแอนด์ซันส์ จำกัด|151|Industrial|0.0011653|627.65|0.087|AMR
12-26-2019|0010011367|0030027987|บริษัท มิลลิเมด จำกัด|151|Industrial|0.0420244|627.65|0.03|AMR
12-26-2019|0010012320|0030000072|บริษัท พีทีที โกลบอล เคมิคอล จำกัด(มหาชน)|152|Industrial-CoGen|12.26097|627.65|16.255|ADQ
12-26-2019|0010012320|0030000072|บริษัท พีทีที โกลบอล เคมิคอล จำกัด(มหาชน)|151|Industrial|36.5322938|627.65|22.844|ADQ/AMR
12-26-2019|0010012320|0030000168|บริษัท พีทีที โกลบอล เคมิคอล จำกัด(มหาชน)|151|Industrial|0.0104178|627.65|0.459|AMR
12-26-2019|0010012326|0030032885|บริษัท สายไฟฟ้าไทย-ยาซากิ จำกัด|151|Industrial|0.188757|627.65|0.066|AMR
12-26-2019|0010012361|0030033177|บริษัท โตโต้ (ประเทศไทย) จำกัด|151|Industrial|0.5940991|627.65|0.714|AMR
12-26-2019|0010021117|0030022988|บริษัท ซีพีเอฟ (ประเทศไทย) จำกัด(มหาชน)|152|Industrial-CoGen|0.0000|627.65|0.261|AMR
12-26-2019|0010021117|0030022988|บริษัท ซีพีเอฟ (ประเทศไทย) จำกัด(มหาชน)|151|Industrial|0.496454|627.65|0.45|AMR
12-26-2019|0010022812|0030014300|บริษัท โกลบอล เพาเวอร์ ซินเนอร์ยี่จำกัด (มหาชน)|152|Industrial-CoGen|57.0445101|627.65|49.94|FlowComp
12-26-2019|0010023667|0030000034|บริษัท สตาร์ ซานิทารี่แวร์ (ประเทศไทย) จำกัด|151|Industrial|0.0941136|627.65|0.092|AMR
12-26-2019|0010023967|0030050118|บริษัท โอซาก้า แก๊ส (ประเทศไทย) จำกัด|151|Industrial|0.1530892|627.65|0.194|AMR
12-26-2019|0010026752|0030055984|บริษัท เซกิซุย คาเซอิ (ไทยแลนด์) จำกัด|151|Industrial|0.0755028|627.65|0.063|AMR
12-26-2019|0010027130|0030056963|บริษัท แคนาเดียน โซลาร์ แมนูแฟคเจอริ่ง (ประเทศไทย) จำกัด|158|NG by Truck|0.01134|627.65|0.01|ADQ
12-26-2019|0010028705|0030017241|บริษัท บีจี โฟลต กล๊าส จำกัด|151|Industrial|0.3964428|627.65|0.184|AMR
12-26-2019|0010029277|0030062577|บริษัท โรม เมคะเทค (ประเทศไทย) จำกัด|151|Industrial|0.01208|627.65|0.018|ADQ
12-26-2019|0010029951|0030064789|บริษัท สยามเพลเล็ทพาวเวอร์ จำกัด|152|Industrial-CoGen|0.0000|627.65|0.819|AMR
