Date|Sold to|Ship to|Ship to name|ContractType|Description|Volume(MMSCFD)|DemandPlan(BI)|MDCQ(BW)|Billing Type
12-26-2019|0010000006|0030000006|บริษัท ธนอินเตอร์ จำกัด|151|Industrial|0.0000|627.65|0.005|AMR
12-26-2019|0010000007|0030000007|บริษัท บี เอ็น เอส เอส สตีลกรุ๊ป จำกัด|151|Industrial|0.0000|627.65|0.351|AMR
12-26-2019|0010000019|0030000019|บริษัท ไดนาสตี้ เซรามิค จำกัด (มหาชน)|151|Industrial|4.2791175|627.65|4.982|AMR
12-26-2019|0010000031|0030000031|บริษัท วิลเลรอย แอนด์ บอค (ประเทศไทย) จำกัด|151|Industrial|0.0253912|627.65|0.613|AMR
12-26-2019|0010000032|0030000032|บริษัท รอยัลปอร์ซเลน จำกัด (มหาชน)|151|Industrial|0.9882112|627.65|0.99|AMR
12-26-2019|0010000043|0030000043|บริษัท ไทย จีซีไอ เรซิท็อป จำกัด|151|Industrial|0.2482623|627.65|0.289|AMR
12-26-2019|0010000046|0030000046|บริษัท ไทยแทฟฟิต้า จำกัด|151|Industrial|0.0000|627.65|0.006|AMR
12-26-2019|0010000054|0030000054|บริษัท บางกอก คริสตัล จำกัด|151|Industrial|0.8154517|627.65|0.834|AMR
12-26-2019|0010000056|0030000056|บริษัท โอเอสซี สยามซิลิกา จำกัด|151|Industrial|2.0180938|627.65|1.855|AMR
12-26-2019|0010000065|0030000065|บริษัท สยามโพลีสไตรีน จำกัด|151|Industrial|0.0881101|627.65|0.066|AMR
12-26-2019|0010000067|0030000067|บริษัท มิลล์คอน บูรพา จำกัด|151|Industrial|1.1309885|627.65|1.26|AMR
12-26-2019|0010000077|0030000077||151|Industrial|1.6067129|627.65|1.675|AMR
12-26-2019|0010000078|0030000078|บริษัท ไทเท็กซ์ เอเซีย จำกัด|151|Industrial|0.0889577|627.65|0.162|AMR
12-26-2019|0010000080|0030000080|บริษัท เอ็นเอส บลูสโคป (ประเทศไทย)จำกัด|151|Industrial|0.9185|627.65|1.06|AMR
12-26-2019|0010000091|0030000091|บริษัท สยาม เอ็นจีเค เทคโนเซรา จำกัด|151|Industrial|0.245649|627.65|0.181|AMR
12-26-2019|0010000092|0030000092|บริษัท ไทย-สแกนดิค สตีล จำกัด|151|Industrial|0.0402587|627.65|0.067|AMR
12-26-2019|0010000113|0030000117|บริษัท คาร์ดิแนล เฮลท์ 222 (ประเทศไทย) จำกัด|151|Industrial|1.2287043|627.65|1.493|AMR
12-26-2019|0010000123|0030000127|บริษัท สยามซานิทารีแวร์อินดัสทรี (หนองแค) จำกัด|151|Industrial|0.4427403|627.65|0.533|AMR
12-26-2019|0010000125|0030000129|บริษัท อาร์พีที เอเซีย จำกัด|151|Industrial|0.0246496|627.65|0.019|AMR
12-26-2019|0010000134|0030000139|บริษัท วันไทยอุตสาหกรรมการอาหาร จำกัด|151|Industrial|1.1604057|627.65|1.068|AMR
12-26-2019|0010000146|0030000151|บริษัท จีเอฟพีที จำกัด (มหาชน)|151|Industrial|0.4353949|627.65|0.463|AMR
12-26-2019|0010000147|0030000152|บริษัท แมคคีย์ ฟู้ด เซอร์วิสเซส (ประเทศไทย) จำกัด|151|Industrial|0.3090036|627.65|0.262|AMR
12-26-2019|0010000159|0030000165|บริษัท ไทย-เยอรมัน สเปเชียลตี้ กลาสจำกัด|151|Industrial|0.0500409|627.65|0.038|AMR
12-26-2019|0010000160|0030000166|บริษัท คอนวูด จำกัด|151|Industrial|0.009429|627.65|0.258|AMR
12-26-2019|0010000201|0030000021|บริษัท อดิตยา เบอร์ล่า เคมีคัลส์ (ประเทศไทย) จำกัด (ซัลไฟท์ส ดีวิชั่น)|151|Industrial|0.0820713|627.65|0.08|AMR
12-26-2019|0010000216|0030049389|บริษัท ไออาร์พีซี จำกัด (มหาชน)|151|Industrial|8.3866409|627.65|7.866|AMR
12-26-2019|0010000916|0030044950|บริษัท ดาน่า สไปเซอร์ (ประเทศไทย) จำกัด|151|Industrial|0.0740549|627.65|0.105|AMR
12-26-2019|0010000925|0030022478|บริษัท ไทยสตีลโปรไฟล์ จำกัด (มหาชน)|151|Industrial|1.2775799|627.65|0.899|AMR
12-26-2019|0010001609|0030015621|บริษัท โตโยต้า มอเตอร์ ประเทศไทย จำกัด|151|Industrial|0.6098495|627.65|0.506|AMR
12-26-2019|0010001827|0030021652|บริษัท กรไทย จำกัด|151|Industrial|0.8055989|627.65|0.806|AMR
12-26-2019|0010002201|0030011779|บริษัท ควอลิตี้ คอฟฟี่ โปรดักท์ส จำกัด|151|Industrial|0.172936|627.65|0.886|AMR
12-26-2019|0010006616|0030010020|บริษัท บริดจสโตน คาร์บอน แบล็ค (ประเทศไทย) จำกัด|151|Industrial|0.1594458|627.65|0.201|AMR
12-26-2019|0010006733|0030023785|บริษัท เดลี่ฟู้ดส์ จำกัด|151|Industrial|0.0000|627.65|0.05|AMR
12-26-2019|0010006939|0030011133|บริษัท นิเด็ค ค็อมโปเน็นท์ เทคโนโลยี (ไทยแลนด์) จำกัด|151|Industrial|0.5298617|627.65|0.408|AMR
12-26-2019|0010006940|0030011137|บริษัท เอส ที บี เท็กซ์ไทล์ อินดัสตรี จำกัด|151|Industrial|0.0328426|627.65|0.035|AMR
12-26-2019|0010007489|0030043669|บจ.ไซมีส เมอร์ชานไดส์|151|Industrial|0.0000|627.65|0.003|AMR
12-26-2019|0010008206|0030033172|บริษัท เอ็นเนซอล จำกัด|152|Industrial-CoGen|1.3127886|627.65|1.186|AMR
12-26-2019|0010008657|0030016715|บริษัท คิริว (ประเทศไทย) จำกัด|151|Industrial|0.0001059|627.65|0.035|AMR
12-26-2019|0010009151|0030019200|บริษัท ไทย เกลซ อุตสาหกรรม จำกัด|151|Industrial|0.1771032|627.65|0.307|AMR
12-26-2019|0010009176|0030019559|บริษัท พูแรค (ประเทศไทย) จำกัด|151|Industrial|2.3001523|627.65|2.128|AMR
12-26-2019|0010009390|0030020154|บริษัท อัลวา อะลูมิเนียม จำกัด|151|Industrial|0.2960078|627.65|0.215|AMR
12-26-2019|0010010156|0030022920|บริษัท ไทยเคมีภัณฑ์ จำกัด|151|Industrial|0.0614828|627.65|0.264|AMR
12-26-2019|0010010216|0030023098|บริษัท สยามพรีเสิร์ฟ ฟู้ดส์ จำกัด|151|Industrial|0.058022|627.65|0.146|AMR
12-26-2019|0010010998|0030026291|บริษัท งามดีอุตสาหกรรม จำกัด|151|Industrial|0.1267091|627.65|0.065|AMR
12-26-2019|0010012227|0030032353|บริษัท เอ็มทีพี เอชพี เจวี (ประเทศไทย) จำกัด|151|Industrial|7.1398201|627.65|7.922|AMR
12-26-2019|0010012323|0030032849|บริษัท โตโยอิ๊งค์ (ประเทศไทย) จำกัด|151|Industrial|0.00861|627.65|0.009|ADQ
12-26-2019|0010020998|0030039159||151|Industrial|0.0000|627.65|0.011|ADQ
12-26-2019|0010021151|0030040140|บริษัท คนอฟ ยิปซั่ม (ประเทศไทย) จำกัด|151|Industrial|0.0000|627.65|0.437|AMR
12-26-2019|0010022812|0030020778|บริษัท โกลบอล เพาเวอร์ ซินเนอร์ยี่จำกัด (มหาชน)|152|Industrial-CoGen|21.8336127|627.65|21.505|FlowComp
12-26-2019|0010022812|0030020778|บริษัท โกลบอล เพาเวอร์ ซินเนอร์ยี่จำกัด (มหาชน)|151|Industrial|3.9542529|627.65|2.424|FlowComp
12-26-2019|0010024055|0030064940|บริษัท โอจีพี เอนเนอร์ยี่ โซลูชั่นส์ จำกัด (สำหรับ บริษัท คันไซ เรซิน(ประเทศไทย) จำกัด)|151|Industrial|0.0000|627.65|0.023|ADQ
12-26-2019|0010024055|0030064941|บริษัท โอจีพี เอนเนอร์ยี่ โซลูชั่นส์ จำกัด (สำหรับ บริษัท นิปปอน สตีลไพพ์ (ประเทศไทย) จำกัด โรงงาน 1)|151|Industrial|0.0098|627.65|0.021|ADQ
12-26-2019|0010027459|0030011637|บริษัท โอสถสภา จำกัด (มหาชน)|151|Industrial|2.581222|627.65|2.438|AMR
12-26-2019|0010027591|0030000157|บริษัท ซีพีเอฟ ฟู้ด แอนด์ เบฟเวอร์เรจ จำกัด|151|Industrial|0.3126763|627.65|0.209|AMR
12-26-2019|0010000011|0030000011|บริษัท อลูคอน จำกัด (มหาชน)|151|Industrial|1.4471257|627.65|1.203|AMR
12-26-2019|0010000026|0030000026|บริษัท บางกอกแคน แมนนูแฟคเจอริ่ง จำกัด|151|Industrial|0.3174438|627.65|0.281|AMR
12-26-2019|0010000027|0030000027|บริษัท ฝาจีบ จำกัด (มหาชน)|152|Industrial-CoGen|0.711344|627.65|0.38|AMR
12-26-2019|0010000038|0030000038|บริษัท สหโมเสคอุตสาหกรรม จำกัด (มหาชน)|151|Industrial|0.0000|627.65|0.40|AMR
12-26-2019|0010000051|0030000051|บริษัท ไทยไวร์โพรดัคท์ จำกัด (มหาชน)|151|Industrial|0.0000|627.65|0.038|AMR
12-26-2019|0010000061|0030000061|บริษัท ไมย์เออร์ อินดัสตรีส์ จำกัด|151|Industrial|0.3426232|627.65|0.383|AMR
12-26-2019|0010000068|0030000068|บริษัท เหล็กสยามยามาโตะ จำกัด|151|Industrial|1.6912562|627.65|2.882|AMR
12-26-2019|0010000084|0030000084|บริษัท สยามอุตสาหกรรมวัสดุทนไฟ จำกัด|151|Industrial|1.2082924|627.65|1.261|AMR
12-26-2019|0010000096|0030000096|บริษัท ระยองโอเลฟินส์ จำกัด|151|Industrial|1.6060066|627.65|0.717|AMR
12-26-2019|0010000097|0030000097|บริษัท สายไฟฟ้าบางกอกเคเบิ้ล จำกัด|151|Industrial|0.0000|627.65|0.199|AMR
12-26-2019|0010000111|0030000115|บริษัท อิวอนิก ยูไนเต็ด ซิลิกา (สยาม) จำกัด|151|Industrial|0.6741223|627.65|0.942|AMR
12-26-2019|0010000117|0030000121|บริษัท ไทยซิลิเกตเคมิคัล จำกัด|151|Industrial|0.7401254|627.65|0.731|AMR
12-26-2019|0010000120|0030000124|บริษัท ลอยัล ไฮ่เหลียง คอปเปอร์ (ประเทศไทย) จำกัด|151|Industrial|0.0260622|627.65|0.029|AMR
12-26-2019|0010000133|0030000138|บริษัท เอ.เจ. พลาสท์ จำกัด (มหาชน)|151|Industrial|0.6715443|627.65|0.648|AMR
12-26-2019|0010000141|0030000146|บริษัท สยามสตีล กัลวาไนซิ่ง จำกัด|151|Industrial|0.1656612|627.65|0.186|AMR
12-26-2019|0010000155|0030000161|บริษัท มาเล่ย์ เอ็นจิ่น คอมโพเน็นท์(ประเทศไทย) จำกัด|151|Industrial|0.0531133|627.65|0.089|AMR
12-26-2019|0010000191|0030043704|บริษัท ศักดิ์ไชยสิทธิ จำกัด|151|Industrial|0.0146202|627.65|0.623|AMR
12-26-2019|0010000192|0030043881|บริษัท แอร์ ลิควิด (ประเทศไทย) จำกัด|151|Industrial|2.554736|627.65|2.561|AMR
12-26-2019|0010000207|0030000240|บริษัท สตาร์ส เทคโนโลยี อินดัสเตรียล จำกัด|151|Industrial|0.3557249|627.65|0.262|AMR
12-26-2019|0010000216|0030030499|บริษัท ไออาร์พีซี จำกัด (มหาชน)|152|Industrial-CoGen|49.78402|627.65|50.907|FlowComp
12-26-2019|0010000228|0030000254|บริษัท ไทย เพ็ท เรซิน จำกัด|151|Industrial|1.0711301|627.65|1.072|AMR
12-26-2019|0010001488|0030016945|บริษัท โพลีเพล็กซ์ (ประเทศไทย) จำกัด (มหาชน)|151|Industrial|1.1664092|627.65|1.071|AMR
12-26-2019|0010001605|0030051931||151|Industrial|0.2615053|627.65|0.261|AMR
12-26-2019|0010001879|0030026184|บริษัท เอ็ชเอ็มซี โปลีเมอส์ จำกัด|151|Industrial|1.5858066|627.65|0.491|AMR
12-26-2019|0010001913|0030020312|บริษัท เหล่าธงสิงห์ จำกัด|151|Industrial|0.2102284|627.65|0.105|AMR
12-26-2019|0010002964|0030024050|บริษัท สยามบราเดอร์ จำกัด|151|Industrial|0.0908294|627.65|0.08|AMR
12-26-2019|0010003009|0030053395|บริษัท มิตซูบิชิ อีเล็คทริค คอนซูมเมอร์ โปรดักส์ (ประเทศไทย) จำกัด|158|NG by Truck|0.01763|627.65|0.022|ADQ
12-26-2019|0010006755|0030027897|บริษัท ปูนซิเมนต์ไทย (ท่าหลวง) จำกัด|151|Industrial|0.0000|627.65|0.03|AMR
12-26-2019|0010006758|0030010658|บริษัท คอฟโค่ ไบโอเคมิคอล (ประเทศไทย) จำกัด|151|Industrial|0.6249289|627.65|0.722|AMR
12-26-2019|0010007060|0030011444|บริษัท สยามร่วมมิตร จำกัด|151|Industrial|0.1619885|627.65|0.094|AMR
12-26-2019|0010007112|0030011636|บริษัท ไทยซัมมิท อีสเทิร์น ซีบอร์ดโอโตพาร์ท อินดัสตรี จำกัด|151|Industrial|0.0000|627.65|0.039|AMR
12-26-2019|0010007766|0030013680|บริษัท อินโดรามา ปิโตรเคม จำกัด|152|Industrial-CoGen|0.0000|627.65|3.70|AMR
12-26-2019|0010008288|0030015470|บริษัท อุตสาหกรรมทำเครื่องแก้วไทยจำกัด (มหาชน)|151|Industrial|6.0901965|627.65|6.401|AMR
12-26-2019|0010008289|0030015477|บริษัท ดี-รับเบอร์ โปรดักส์ จำกัด|151|Industrial|0.0334077|627.65|0.031|AMR
12-26-2019|0010008739|0030000237|บริษัท สยามไฟเบอร์ซีเมนต์กรุ๊ป จำกัด|151|Industrial|0.1481451|627.65|0.122|AMR
12-26-2019|0010009180|0030019567|บริษัท ไทย มาลายา กลาส จำกัด|151|Industrial|2.6065073|627.65|2.719|AMR
12-26-2019|0010009841|0030021637|บริษัท โอวาริ เซกิ (ไทยแลนด์) จำกัด|151|Industrial|0.002366|627.65|0.006|AMR
12-26-2019|0010011784|0030030288|บริษัท สยามเลเทกซ์ สังเคราะห์ จำกัด|151|Industrial|0.7494132|627.65|1.129|AMR
12-26-2019|0010015560|0030040907|บริษัท ลินเด้ ไฮโค จำกัด|151|Industrial|1.7463119|627.65|1.505|AMR
12-26-2019|0010022253|0030043488|บริษัท ที.ที.เซรามิค จำกัด (มหาชน)|151|Industrial|0.0015185|627.65|0.836|AMR
12-26-2019|0010024039|0030050402|บริษัท สุเพิร์บ พาวเวอร์ จำกัด|152|Industrial-CoGen|0.4645648|627.65|0.382|AMR
12-26-2019|0010024055|0030057123|บจ.โอจีพี เอนเนอร์ยี่ โซลูชั่นส์ (สำหรับ บจ.ซึชิโยชิ สมบูรณ์ โคเตทแซนด์)|151|Industrial|0.0000|627.65|0.13|AMR
12-26-2019|0010027591|0030024290|บริษัท ซีพีเอฟ ฟู้ด แอนด์ เบฟเวอร์เรจ จำกัด|152|Industrial-CoGen|0.3141948|627.65|0.197|AMR
12-26-2019|0010000004|0030000004|บริษัท ไทย คอปเปอร์ ร็อด จำกัด|151|Industrial|0.0000|627.65|0.198|AMR
12-26-2019|0010000005|0030000005|บริษัท ไทยเมทัลโพรเซสซิ่ง จำกัด|151|Industrial|0.6062827|627.65|0.404|AMR
12-26-2019|0010000022|0030000022|บริษัท ไทยบริดจสโตน จำกัด|151|Industrial|0.5422925|627.65|1.324|AMR
12-26-2019|0010000041|0030000041|บริษัท สยามอุตสาหกรรมยิปซัม (สระบุรี) จำกัด|151|Industrial|2.6649532|627.65|2.897|AMR
12-26-2019|0010000062|0030000062|บริษัท สตาร์ ปิโตรเลียม รีไฟน์นิ่งจำกัด (มหาชน)|152|Industrial-CoGen|8.4959|627.65|13.688|ADQ
12-26-2019|0010000062|0030000062|บริษัท สตาร์ ปิโตรเลียม รีไฟน์นิ่งจำกัด (มหาชน)|151|Industrial|14.4409378|627.65|11.212|ADQ/AMR
12-26-2019|0010000083|0030000083|บริษัท เอจีซี แฟลทกลาส (ประเทศไทย)จำกัด (มหาชน)|151|Industrial|2.9703194|627.65|2.947|AMR
12-26-2019|0010000083|0030021634|บริษัท เอจีซี แฟลทกลาส (ประเทศไทย)จำกัด (มหาชน)|151|Industrial|4.2975164|627.65|3.778|AMR
12-26-2019|0010000099|0030000099|บริษัท เกรท วอลล์ มอเตอร์ แมนูแฟคเจอริ่ง (ประเทศไทย) จำกัด|151|Industrial|0.0000|627.65|0.434|AMR
12-26-2019|0010000101|0030000103|บริษัท ร็อควูล (ประเทศไทย) จำกัด|151|Industrial|0.1699343|627.65|0.127|AMR
12-26-2019|0010000129|0030000133|บริษัท ทีพีซี เพสต์ เรซิน จำกัด|151|Industrial|0.3040595|627.65|0.28|AMR
12-26-2019|0010000130|0030000134|บริษัท กรีนสปอต จำกัด|151|Industrial|0.5486138|627.65|0.591|AMR
12-26-2019|0010000145|0030000150|บริษัท แสตนดาร์ดแคน จำกัด|151|Industrial|0.3166316|627.65|0.26|AMR
12-26-2019|0010000164|0030030778|บริษัท โกลว์ พลังงาน จำกัด (มหาชน)|152|Industrial-CoGen|53.5694377|627.65|53.967|FlowComp
12-26-2019|0010000178|0030016267|บริษัท โกลว์ เอสพีพี 11 จำกัด|152|Industrial-CoGen|1.7121272|627.65|0.89051|AMR
12-26-2019|0010000225|0030011191|บริษัท ซีพีพีซี จำกัด (มหาชน) (Coating Plant)|151|Industrial|0.0065332|627.65|0.01|AMR
12-26-2019|0010000226|0030000252|บริษัท ซัมมิท โชว่าแมนูแฟคเจอริ่งจำกัด|151|Industrial|0.106615|627.65|0.109|AMR
12-26-2019|0010001741|0030022479|บริษัท อลูมิเนียม ฉื่อ จิ้น ฮั้ว จำกัด|151|Industrial|0.3159959|627.65|0.441|AMR
12-26-2019|0010006548|0030009620|บริษัท อีเลคโทรลักซ์ ประเทศไทย จำกัด|151|Industrial|0.0294524|627.65|0.035|AMR
12-26-2019|0010006922|0030011105|บริษัท อายิโนะโมะโต๊ะ (ประเทศไทย)จำกัด|151|Industrial|0.000459|627.65|0.069|AMR
12-26-2019|0010006922|0030020406|บริษัท อายิโนะโมะโต๊ะ (ประเทศไทย)จำกัด|152|Industrial-CoGen|0.0000|627.65|0.813|AMR
12-26-2019|0010007512|0030040636|บริษัท คราวน์ เบ็บแคน แอนด์ โคลสเชอร์ส (ประเทศไทย) จำกัด|151|Industrial|0.1643546|627.65|0.148|AMR
12-26-2019|0010007561|0030013097|บริษัท บางชันเยนเนอเรลเอเซมบลี จำกัด|151|Industrial|0.0262388|627.65|0.015|AMR
12-26-2019|0010008114|0030024767|บริษัท ทุนเท็กซ์ เท็กซ์ไทล์ (ประเทศไทย) จำกัด|151|Industrial|0.2953015|627.65|0.191|AMR
12-26-2019|0010008206|0030015236|บริษัท เอ็นเนซอล จำกัด|152|Industrial-CoGen|0.0000|627.65|0.00535|AMR
12-26-2019|0010008739|0030038490|บริษัท สยามไฟเบอร์ซีเมนต์กรุ๊ป จำกัด|151|Industrial|0.0006356|627.65|0.018|AMR
12-26-2019|0010008758|0030016949|บริษัท คล็อกเนอร์ เพนทาพลาสท์ (ไทยแลนด์) จำกัด|151|Industrial|0.0174454|627.65|0.021|AMR
12-26-2019|0010009177|0030019562|บริษัท สยามโกชิ มานูแฟคเชอริ่ง จำกั|151|Industrial|0.1126538|627.65|0.094|AMR
12-26-2019|0010009392|0030020182|บริษัท มิตร สตีล จำกัด|151|Industrial|0.0000|627.65|0.046|AMR
12-26-2019|0010009442|0030020288|บริษัท อายิโนะโมะโต๊ะเซลส์ (ประเทศไทย) จำกัด|151|Industrial|0.0439668|627.65|0.057|AMR
12-26-2019|0010010220|0030023100|บริษัท เอส ไอ ดับบลิว (ไทยแลนด์) จำกัด|151|Industrial|0.1271329|627.65|0.082|AMR
12-26-2019|0010011538|0030028841|บริษัท ผลิตไฟฟ้าและพลังงานร่วม จำกัด|154|Commercial–CoGen|0.0000|627.65||ADQ
12-26-2019|0010011735|0030030004|บริษัท เนเชอรัล ก๊าซ ไซลินเดอร์ (ประเทศไทย) จำกัด|151|Industrial|0.0000|627.65|0.004|AMR
12-26-2019|0010012320|0030021481|บริษัท พีทีที โกลบอล เคมิคอล จำกัด(มหาชน)|151|Industrial|26.83629|627.65|26.055|ADQ
12-26-2019|0010020698|0030038224|บริษัท สตาร์คอร์ จำกัด|151|Industrial|0.0004237|627.65|0.127|AMR
12-26-2019|0010020836|0030038183|บริษัท กรุงเทพ ซินธิติกส์ จำกัด|151|Industrial|0.0234842|627.65|0.024|AMR
12-26-2019|0010021842|0030023236|บริษัท คอทโก้ เมททอลเวอร์คส จำกัด|151|Industrial|0.2143249|627.65|0.119|AMR
12-26-2019|0010021910|0030042490|บริษัท คาเนมิทสึ พูลเล่ย์ จำกัด|151|Industrial|0.0109475|627.65|0.008|AMR
12-26-2019|0010022869|0030045768|บริษัท ยามาโมริ (ประเทศไทย) จำกัด|151|Industrial|0.0013772|627.65|0.021|AMR
12-26-2019|0010023379|0030049270|บริษัท ลาบิกซ์ จำกัด|151|Industrial|6.3768813|627.65|6.464|AMR
12-26-2019|0010025615|0030053102|บริษัท เอ็นจีเค เซรามิคส์ (ประเทศไทย) จำกัด|151|Industrial|0.0000|627.65|0.326|AMR
12-26-2019|0010026111|0030055031|บริษัท กบินทร์บุรีกล๊าส อินดัสทรีจำกัด|151|Industrial|3.181925|627.65|2.782|AMR
12-26-2019|0010026153|0030054741|บริษัท นิคเคอิ เอ็มซี อลูมินัม (ประเทศไทย) จำกัด|151|Industrial|0.0000|627.65|0.218|AMR
12-26-2019|0010027861|0030000018|บริษัท เอสซีจี เซรามิกส์ จำกัด (มหาชน)|151|Industrial|1.056192|627.65|2.695|AMR
12-26-2019|0010000003|0030000003|บริษัท เขาช่องอุตสาหกรรม 1979 จำกัด|151|Industrial|0.5614331|627.65|0.455|AMR
12-26-2019|0010000016|0030000016|บริษัท ลิกซิล (ประเทศไทย) จำกัด (มหาชน)|151|Industrial|0.0185049|627.65|0.847|AMR
12-26-2019|0010000016|0030000100|บริษัท ลิกซิล (ประเทศไทย) จำกัด (มหาชน)|151|Industrial|0.354277|627.65|0.376|AMR
12-26-2019|0010000033|0030000104|บริษัท โรแยล ซีรามิค อุตสาหกรรม จำกัด (มหาชน)|151|Industrial|1.3002166|627.65|2.088|AMR
12-26-2019|0010000047|0030000047|บริษัท โพสโค-ไทยน๊อคซ์ จำกัด (มหาชน)|151|Industrial|0.883715|627.65|1.308|AMR
12-26-2019|0010000056|0030000059|บริษัท โอเอสซี สยามซิลิกา จำกัด|151|Industrial|1.58058|627.65|1.617|AMR
