Date|Sold to|Ship to|Ship to name|ContractType|Description|Volume(MMSCFD)|DemandPlan(BI)|MDCQ(BW)|Billing Type
12-08-2019|0010000035|0030000035|บริษัท สยามซานิทารีแวร์อินดัสทรี จำกัด|151|Industrial|0.6659292|627.65|0.887|AMR
12-08-2019|0010000036|0030000036|บริษัท สยามฟูรูกาวา จำกัด|151|Industrial|0.2151018|627.65|0.25|AMR
12-08-2019|0010000049|0030000049|บริษัท ไทยผลิตภัณฑ์ยิบซั่ม จำกัด(มหาชน)|152|Industrial-CoGen|1.1183459|627.65|0.783|AMR
12-08-2019|0010000050|0030000050|บริษัท ไทยพลาสติกและเคมีภัณฑ์ จำกัด(มหาชน)|151|Industrial|5.6498222|627.65|5.273|AMR
12-08-2019|0010000062|0030000062|บริษัท สตาร์ ปิโตรเลียม รีไฟน์นิ่งจำกัด (มหาชน)|152|Industrial-CoGen|8.4959|627.65|13.688|ADQ
12-08-2019|0010000062|0030000062|บริษัท สตาร์ ปิโตรเลียม รีไฟน์นิ่งจำกัด (มหาชน)|151|Industrial|1.3379375|627.65|11.212|ADQ/AMR
12-08-2019|0010000074|0030000074|บริษัท ไทยเบเวอร์เรจแคน จำกัด|151|Industrial|0.605753|627.65|0.541|AMR
12-08-2019|0010000089|0030000089|บริษัท ธนเสริมอุตสาหกรรมฝาขวด จำกัด|151|Industrial|0.0488755|627.65|0.057|AMR
12-08-2019|0010000108|0030000112|บริษัท ยูนิตี้ อินดัสเตรียล จำกัด|151|Industrial|0.0000|627.65|0.017|AMR
12-08-2019|0010000109|0030000113|บริษัท ระยองไวร์ อินดัสตรีส์ จำกัด(มหาชน)|151|Industrial|0.0166685|627.65|0.028|AMR
12-08-2019|0010000125|0030000129|บริษัท อาร์พีที เอเซีย จำกัด|151|Industrial|0.0149381|627.65|0.019|AMR
12-08-2019|0010000137|0030000142|บริษัท วาลเมท จำกัด|151|Industrial|0.0000|627.65|0.006|AMR
12-08-2019|0010000139|0030000144|บริษัท ยูเนี่ยนไพโอเนียร์ จำกัด(มหาชน)|151|Industrial|0.0399409|627.65|0.116|AMR
12-08-2019|0010000151|0030000156|บริษัท มิตซูบิชิ อีเล็คทริค ออโตเมชั่น (ประเทศไทย) จำกัด|151|Industrial|0.1114885|627.65|0.216|AMR
12-08-2019|0010000178|0030016267|บริษัท โกลว์ เอสพีพี 11 จำกัด|152|Industrial-CoGen|0.0025073|627.65|0.89051|AMR
12-08-2019|0010000206|0030000239|บริษัท เฮลซ์เทรดดิ้ง (ประเทศไทย) จำกัด|151|Industrial|0.0000|627.65|0.035|AMR
12-08-2019|0010000228|0030000254|บริษัท ไทย เพ็ท เรซิน จำกัด|151|Industrial|1.1230427|627.65|1.072|AMR
12-08-2019|0010001609|0030015621|บริษัท โตโยต้า มอเตอร์ ประเทศไทย จำกัด|151|Industrial|0.4001861|627.65|0.506|AMR
12-08-2019|0010001922|0030022692|บริษัท ฟู้ดแอนด์ดริ๊งส์ จำกัด (มหาชน)|151|Industrial|0.14068|627.65|0.156|ADQ
12-08-2019|0010006548|0030009620|บริษัท อีเลคโทรลักซ์ ประเทศไทย จำกัด|151|Industrial|0.017057|627.65|0.035|AMR
12-08-2019|0010006939|0030011133|บริษัท นิเด็ค ค็อมโปเน็นท์ เทคโนโลยี (ไทยแลนด์) จำกัด|151|Industrial|0.5370306|627.65|0.408|AMR
12-08-2019|0010006940|0030011137|บริษัท เอส ที บี เท็กซ์ไทล์ อินดัสตรี จำกัด|151|Industrial|0.026486|627.65|0.035|AMR
12-08-2019|0010007765|0030013679|บริษัท เอ.พี.ซี อุตสาหกรรม จำกัด|151|Industrial|0.0000|627.65|0.019|AMR
12-08-2019|0010007766|0030000094|บริษัท อินโดรามา ปิโตรเคม จำกัด|152|Industrial-CoGen|0.287285|627.65|0.054|AMR
12-08-2019|0010008356|0030047608|บริษัท แสงไทยเมตัลดรัม จำกัด|151|Industrial|0.0000|627.65|0.03|AMR
12-08-2019|0010009040|0030022254|บริษัท ไทยเรยอน จำกัด (มหาชน)|151|Industrial|0.9005248|627.65|0.905|AMR
12-08-2019|0010009357|0030020016|บริษัท ซีพี-เมจิ จำกัด|152|Industrial-CoGen|0.112442|627.65|0.307|AMR
12-08-2019|0010009357|0030020016|บริษัท ซีพี-เมจิ จำกัด|151|Industrial|0.4561246|627.65|0.498|AMR
12-08-2019|0010010116|0030022714|บริษัท ยัสปาลแอนด์ซันส์ จำกัด|151|Industrial|0.0299468|627.65|0.087|AMR
12-08-2019|0010011367|0030027987|บริษัท มิลลิเมด จำกัด|151|Industrial|0.0117951|627.65|0.03|AMR
12-08-2019|0010012320|0030021481|บริษัท พีทีที โกลบอล เคมิคอล จำกัด(มหาชน)|151|Industrial|26.83629|627.65|26.055|ADQ
12-08-2019|0010020698|0030038224|บริษัท สตาร์คอร์ จำกัด|151|Industrial|0.0842961|627.65|0.127|AMR
12-08-2019|0010020836|0030038183|บริษัท กรุงเทพ ซินธิติกส์ จำกัด|151|Industrial|0.0251087|627.65|0.024|AMR
12-08-2019|0010021842|0030023236|บริษัท คอทโก้ เมททอลเวอร์คส จำกัด|151|Industrial|0.2000224|627.65|0.119|AMR
12-08-2019|0010021910|0030042490|บริษัท คาเนมิทสึ พูลเล่ย์ จำกัด|151|Industrial|0.0038846|627.65|0.008|AMR
12-08-2019|0010022869|0030045768|บริษัท ยามาโมริ (ประเทศไทย) จำกัด|151|Industrial|0.0000|627.65|0.021|AMR
12-08-2019|0010023379|0030049270|บริษัท ลาบิกซ์ จำกัด|151|Industrial|6.7532653|627.65|6.464|AMR
12-08-2019|0010026372|0030024061|บริษัท เคมีแมน จำกัด (มหาชน)|151|Industrial|1.5647237|627.65|1.12|AMR
12-08-2019|0010027861|0030000018|บริษัท เอสซีจี เซรามิกส์ จำกัด (มหาชน)|151|Industrial|3.790468|627.65|2.695|AMR
12-08-2019|0010000008|0030000008|บริษัท ไมโครไฟเบอร์อุตสาหกรรม จำกัด|151|Industrial|0.1791161|627.65|0.291|AMR
12-08-2019|0010000022|0030000022|บริษัท ไทยบริดจสโตน จำกัด|152|Industrial-CoGen|0.011336|627.65|0.436|AMR
12-08-2019|0010000023|0030000023|บริษัท ไทยเปอร์อ๊อกไซด์ จำกัด|151|Industrial|1.6161772|627.65|0.908|AMR
12-08-2019|0010000037|0030000037|บริษัท สยามไฟเบอร์กลาส จำกัด|151|Industrial|0.3146186|627.65|0.34|AMR
12-08-2019|0010000051|0030000051|บริษัท ไทยไวร์โพรดัคท์ จำกัด (มหาชน)|151|Industrial|0.015715|627.65|0.038|AMR
12-08-2019|0010000063|0030000063|บริษัท สยามมิชลิน จำกัด|151|Industrial|0.0000|627.65|0.20|AMR
12-08-2019|0010000063|0030000075|บริษัท สยามมิชลิน จำกัด|151|Industrial|0.0926304|627.65|0.07|AMR
12-08-2019|0010000076|0030000076|บริษัท สยามสไตรีนโมโนเมอร์ จำกัด|151|Industrial|3.3047849|627.65|3.276|AMR
12-08-2019|0010000091|0030000091|บริษัท สยาม เอ็นจีเค เทคโนเซรา จำกัด|151|Industrial|0.295584|627.65|0.181|AMR
12-08-2019|0010000092|0030000092|บริษัท ไทย-สแกนดิค สตีล จำกัด|151|Industrial|0.0515594|627.65|0.067|AMR
12-08-2019|0010000110|0030000114|บริษัท ระยอง กัลวาไนซิ่ง จำกัด|151|Industrial|0.0488755|627.65|0.071|AMR
12-08-2019|0010000128|0030000132|บริษัท เซกิซุย เอส-เล็ค (ประเทศไทย)จำกัด|151|Industrial|0.0710884|627.65|0.07|AMR
12-08-2019|0010000140|0030000145|บริษัท สยามลวดเหล็กอุตสาหกรรม จำกัด|151|Industrial|0.0882514|627.65|0.068|AMR
12-08-2019|0010000153|0030000159|บริษัท เกทส์ ยูนิทตะ (ประเทศไทย) จำกัด|151|Industrial|0.0000|627.65|0.088|AMR
12-08-2019|0010000154|0030000160|บริษัท แม็กซิออน วีลส์ (ประเทศไทย)จำกัด|151|Industrial|0.6445285|627.65|0.788|AMR
12-08-2019|0010000191|0030043704|บริษัท ศักดิ์ไชยสิทธิ จำกัด|151|Industrial|0.9293769|627.65|0.623|AMR
12-08-2019|0010000192|0030043881|บริษัท แอร์ ลิควิด (ประเทศไทย) จำกัด|151|Industrial|2.6416101|627.65|2.561|AMR
12-08-2019|0010000207|0030000240|บริษัท สตาร์ส เทคโนโลยี อินดัสเตรียล จำกัด|151|Industrial|0.0682986|627.65|0.262|AMR
12-08-2019|0010000216|0030030499|บริษัท ไออาร์พีซี จำกัด (มหาชน)|152|Industrial-CoGen|50.5320348|627.65|50.907|FlowComp
12-08-2019|0010000916|0030044950|บริษัท ดาน่า สไปเซอร์ (ประเทศไทย) จำกัด|151|Industrial|0.0728189|627.65|0.105|AMR
12-08-2019|0010000925|0030022478|บริษัท ไทยสตีลโปรไฟล์ จำกัด (มหาชน)|151|Industrial|1.1950141|627.65|0.899|AMR
12-08-2019|0010001609|0030015621|บริษัท โตโยต้า มอเตอร์ ประเทศไทย จำกัด|152|Industrial-CoGen|0.0000|627.65|0.802|AMR
12-08-2019|0010001714|0030016192|บริษัท ออลเน็กซ์ (ประเทศไทย) จำกัด|151|Industrial|0.0000|627.65|0.14|AMR
12-08-2019|0010001998|0030025768|บริษัท อินโดรามา โพลีเอสเตอร์ อินดัสตรี้ส์ จำกัด (มหาชน)|151|Industrial|1.9372938|627.65|1.849|AMR
12-08-2019|0010002048|0030021234|บริษัท ด๊อกเตอร์ บู จำกัด|151|Industrial|0.1915469|627.65|0.217|AMR
12-08-2019|0010006616|0030010020|บริษัท บริดจสโตน คาร์บอน แบล็ค (ประเทศไทย) จำกัด|151|Industrial|0.0054737|627.65|0.201|AMR
12-08-2019|0010006733|0030023785|บริษัท เดลี่ฟู้ดส์ จำกัด|151|Industrial|0.0794227|627.65|0.05|AMR
12-08-2019|0010006972|0030011249|บริษัท สยาม ยามาโมริ จำกัด|151|Industrial|0.0000|627.65|0.024|AMR
12-08-2019|0010007766|0030013680|บริษัท อินโดรามา ปิโตรเคม จำกัด|152|Industrial-CoGen|0.0000|627.65|3.70|AMR
12-08-2019|0010008509|0030016162|บริษัท ผลิตภัณฑ์ตราเพชร จำกัด (มหาชน)|151|Industrial|0.367626|627.65|0.087|AMR
12-08-2019|0010009070|0030018984|บริษัท โมเดอร์น ไดสตัฟส์ แอนด์พิคเมนท์ส จำกัด|151|Industrial|0.0000|627.65|0.189|AMR
12-08-2019|0010009085|0030056942|บจ.แดรี่ พลัส|151|Industrial|0.2545483|627.65|0.659|AMR
12-08-2019|0010009390|0030020154|บริษัท อัลวา อะลูมิเนียม จำกัด|151|Industrial|0.3167375|627.65|0.215|AMR
12-08-2019|0010010156|0030022920|บริษัท ไทยเคมีภัณฑ์ จำกัด|151|Industrial|0.2999983|627.65|0.264|AMR
12-08-2019|0010010216|0030023098|บริษัท สยามพรีเสิร์ฟ ฟู้ดส์ จำกัด|151|Industrial|0.1379392|627.65|0.146|AMR
12-08-2019|0010011538|0030028841|บริษัท ผลิตไฟฟ้าและพลังงานร่วม จำกัด|154|Commercial–CoGen|0.0000|627.65||ADQ
12-08-2019|0010011735|0030030004|บริษัท เนเชอรัล ก๊าซ ไซลินเดอร์ (ประเทศไทย) จำกัด|151|Industrial|0.0000|627.65|0.004|AMR
12-08-2019|0010012320|0030021767|บริษัท พีทีที โกลบอล เคมิคอล จำกัด(มหาชน)|153|Commercial|0.0000|627.65|0.015|AMR
12-08-2019|0010012320|0030021767|บริษัท พีทีที โกลบอล เคมิคอล จำกัด(มหาชน)|154|Commercial–CoGen|0.0002825|627.65|0.073|AMR
12-08-2019|0010020998|0030039159||151|Industrial|0.0000|627.65|0.011|ADQ
12-08-2019|0010022253|0030043488|บริษัท ที.ที.เซรามิค จำกัด (มหาชน)|151|Industrial|1.0195353|627.65|0.836|AMR
12-08-2019|0010023436|0030052175|บริษัท ซันโทรี่ เป๊ปซี่โค เบเวอเรจ(ประเทศไทย) จำกัด|151|Industrial|0.2016116|627.65|0.167|AMR
12-08-2019|0010023548|0030000131|บริษัท โคเวสโตร (ประเทศไทย) จำกัด|151|Industrial|0.5095204|627.65|0.517|AMR
12-08-2019|0010026634|0030054698|บริษัท คานายามา คาเซอิ (ประเทศไทย)จำกัด|158|NG by Truck|0.61779|627.65|0.661|ADQ
12-08-2019|0010026674|0030017326|บริษัท ไทยเพรซิเดนท์ฟูดส์ จำกัด(มหาชน)|151|Industrial|0.5529928|627.65|0.586|AMR
12-08-2019|0010027861|0030000246|บริษัท เอสซีจี เซรามิกส์ จำกัด (มหาชน)|151|Industrial|2.2128544|627.65|2.495|AMR
12-08-2019|0010027861|0030046657|บริษัท เอสซีจี เซรามิกส์ จำกัด (มหาชน)|151|Industrial|0.297491|627.65|0.244|AMR
12-08-2019|0010000011|0030000011|บริษัท อลูคอน จำกัด (มหาชน)|151|Industrial|0.5554649|627.65|1.203|AMR
12-08-2019|0010000026|0030000026|บริษัท บางกอกแคน แมนนูแฟคเจอริ่ง จำกัด|151|Industrial|0.3401158|627.65|0.281|AMR
12-08-2019|0010000027|0030000027|บริษัท ฝาจีบ จำกัด (มหาชน)|152|Industrial-CoGen|0.0027898|627.65|0.38|AMR
12-08-2019|0010000038|0030000102|บริษัท สหโมเสคอุตสาหกรรม จำกัด (มหาชน)|151|Industrial|0.0000|627.65|2.111|AMR
12-08-2019|0010000039|0030000039|บริษัท โสสุโก้ เซรามิค จำกัด|151|Industrial|2.3617765|627.65|2.211|AMR
12-08-2019|0010000053|0030020331|บริษัท ไทยอาซาฮีเคมีภัณฑ์ จำกัด|151|Industrial|0.4596914|627.65|0.396|AMR
12-08-2019|0010000065|0030000065|บริษัท สยามโพลีสไตรีน จำกัด|151|Industrial|0.0000|627.65|0.066|AMR
12-08-2019|0010000067|0030000067|บริษัท มิลล์คอน บูรพา จำกัด|151|Industrial|1.6307269|627.65|1.26|AMR
12-08-2019|0010000082|0030000082|บริษัท สยามโทซู เซรามิกส์ จำกัด|151|Industrial|0.0280398|627.65|0.056|AMR
12-08-2019|0010000096|0030000096|บริษัท ระยองโอเลฟินส์ จำกัด|151|Industrial|0.0000|627.65|0.717|AMR
12-08-2019|0010000097|0030000097|บริษัท สายไฟฟ้าบางกอกเคเบิ้ล จำกัด|151|Industrial|0.1896752|627.65|0.199|AMR
12-08-2019|0010000113|0030000117|บริษัท คาร์ดิแนล เฮลท์ 222 (ประเทศไทย) จำกัด|151|Industrial|1.7647108|627.65|1.493|AMR
12-08-2019|0010000130|0030052374|บริษัท กรีนสปอต จำกัด|151|Industrial|0.0661091|627.65|0.251|AMR
12-08-2019|0010000131|0030000136|บริษัท การ์เดียนอินดัสทรีส์ ระยองจำกัด|151|Industrial|3.1300478|627.65|3.364|AMR
12-08-2019|0010000143|0030000148|บริษัท สยาม พุงซาน เมทัล จำกัด|151|Industrial|0.2878501|627.65|0.18|AMR
12-08-2019|0010000144|0030000149|บริษัท เบอร์ลี่ ยุคเกอร์ เซลล็อกซ์จำกัด|151|Industrial|0.3488386|627.65|0.462|AMR
12-08-2019|0010000156|0030000162|บริษัท เวลโกรว์กล๊าส อินดัสทรี จำกัด|151|Industrial|1.9435798|627.65|1.801|AMR
12-08-2019|0010000157|0030000163|บริษัท ไทยอะครีลิค จำกัด|151|Industrial|0.0000|627.65|0.004|AMR
12-08-2019|0010000197|0030025358|บริษัท บางจาก คอร์ปอเรชั่น จำกัด (มหาชน)|152|Industrial-CoGen|8.291503|627.65|6.90|AMR
12-08-2019|0010000197|0030025358|บริษัท บางจาก คอร์ปอเรชั่น จำกัด (มหาชน)|151|Industrial|29.5671767|627.65|23.481|FlowComp
12-08-2019|0010000220|0030000249|บริษัท เอเชีย ซิลิโคนส์ โมโนเมอร์จำกัด|151|Industrial|3.9031219|627.65|3.544|AMR
12-08-2019|0010001013|0030023306|บริษัท เนสท์เล่ (ไทย) จำกัด|151|Industrial|0.0204825|627.65|0.037|AMR
12-08-2019|0010001125|0030039301|บริษัท ไทยโพลีอะซีทัล จำกัด|151|Industrial|0.0874391|627.65|0.081|AMR
12-08-2019|0010001727|0030020317|บริษัท ไทยเซ็นทรัลเคมี จำกัด (มหาชน)|152|Industrial-CoGen|0.0000|627.65|0.337|AMR
12-08-2019|0010001740|0030022424|บริษัท โรงงานเหล็กกรุงเทพฯ จำกัด|151|Industrial|0.9435381|627.65|1.244|AMR
12-08-2019|0010002094|0030018793|บริษัท พ้อตเตอร์ส (ประเทศไทย) จำกัด|151|Industrial|0.0000|627.65|0.26|AMR
12-08-2019|0010002109|0030030514|บริษัท ลักกี้กลาส จำกัด|151|Industrial|0.8741094|627.65|0.623|AMR
12-08-2019|0010006755|0030027897|บริษัท ปูนซิเมนต์ไทย (ท่าหลวง) จำกัด|151|Industrial|0.0000|627.65|0.03|AMR
12-08-2019|0010006758|0030010658|บริษัท คอฟโค่ ไบโอเคมิคอล (ประเทศไทย) จำกัด|151|Industrial|0.8793007|627.65|0.722|AMR
12-08-2019|0010007151|0030011752|บริษัท เอ็มซีแอลเอส เอเชีย จำกัด|151|Industrial|0.9300126|627.65|0.865|AMR
12-08-2019|0010007982|0030014211|บริษัท จีซี ไกลคอล จำกัด|151|Industrial|0.1260734|627.65|0.113|AMR
12-08-2019|0010008657|0030016715|บริษัท คิริว (ประเทศไทย) จำกัด|151|Industrial|0.0008828|627.65|0.035|AMR
12-08-2019|0010009151|0030019200|บริษัท ไทย เกลซ อุตสาหกรรม จำกัด|151|Industrial|0.1780567|627.65|0.307|AMR
12-08-2019|0010009176|0030019559|บริษัท พูแรค (ประเทศไทย) จำกัด|151|Industrial|0.1139958|627.65|2.128|AMR
12-08-2019|0010009582|0030020738|บริษัท คอทโก้ พลาสติกส์ จำกัด|151|Industrial|0.0153618|627.65|0.067|AMR
12-08-2019|0010010355|0030023468|บริษัท เคียวเด็น (ประเทศไทย) จำกัด|151|Industrial|0.0240846|627.65|0.033|AMR
12-08-2019|0010010358|0030023471|บริษัท เซ้าท์ ซิตี้ ปิโตรเคม จำกัด|151|Industrial|0.0460856|627.65|0.12|AMR
12-08-2019|0010011784|0030030288|บริษัท สยามเลเทกซ์ สังเคราะห์ จำกัด|151|Industrial|0.8993241|627.65|1.129|AMR
12-08-2019|0010012320|0030026468|บริษัท พีทีที โกลบอล เคมิคอล จำกัด(มหาชน)|151|Industrial|0.5011155|627.65|2.531|AMR
12-08-2019|0010012320|0030040549|บริษัท พีทีที โกลบอล เคมิคอล จำกัด(มหาชน)|152|Industrial-CoGen|17.4125831|627.65|14.738|FlowComp
12-08-2019|0010021112|0030041494|บริษัท เจเอสอาร์ บีเอสที อิลาสโตเมอร์ จำกัด|151|Industrial|0.2094514|627.65|0.125|AMR
12-08-2019|0010021117|0030000123|บริษัท ซีพีเอฟ (ประเทศไทย) จำกัด(มหาชน)|152|Industrial-CoGen|0.4486026|627.65|1.361|AMR
12-08-2019|0010022317|0030043685|บริษัท ไซมีส อีโคไลท์ จำกัด|151|Industrial|0.0000|627.65|0.074|AMR
12-08-2019|0010022333|0030043703|บริษัท เอเชียแปซิฟิกกลาส จำกัด|151|Industrial|2.3181628|627.65|2.025|AMR
12-08-2019|0010023651|0030048793|บริษัท ไคฮาระ (ประเทศไทย) จำกัด|151|Industrial|0.1255437|627.65|0.235|AMR
12-08-2019|0010026752|0030055984|บริษัท เซกิซุย คาเซอิ (ไทยแลนด์) จำกัด|151|Industrial|0.0062507|627.65|0.063|AMR
12-08-2019|0010027130|0030056963|บริษัท แคนาเดียน โซลาร์ แมนูแฟคเจอริ่ง (ประเทศไทย) จำกัด|158|NG by Truck|0.01134|627.65|0.01|ADQ
12-08-2019|0010027938|0030059837|บริษัท ราชบุรีกล๊าส อินดัสทรี จำกัด|151|Industrial|1.8561759|627.65|1.485|AMR
12-08-2019|0010000012|0030000012|บริษัท อีสเทิร์นไชน่าแวร์ จำกัด|151|Industrial|0.2543364|627.65|0.305|AMR
12-08-2019|0010000013|0030000013|บริษัท ทาทา สตีล การผลิต (ประเทศไทย) จำกัด (มหาชน)|151|Industrial|3.9219446|627.65|2.252|AMR
12-08-2019|0010000027|0030000027|บริษัท ฝาจีบ จำกัด (มหาชน)|151|Industrial|0.4602211|627.65|0.501|AMR
12-08-2019|0010000028|0030000028|บริษัท เฟอร์โร (ประเทศไทย) จำกัด|151|Industrial|0.4437292|627.65|0.551|AMR
12-08-2019|0010000041|0030000041|บริษัท สยามอุตสาหกรรมยิปซัม (สระบุรี) จำกัด|151|Industrial|1.8222385|627.65|2.897|AMR
12-08-2019|0010000054|0030000054|บริษัท บางกอก คริสตัล จำกัด|151|Industrial|0.8574409|627.65|0.834|AMR
12-08-2019|0010000056|0030000056|บริษัท โอเอสซี สยามซิลิกา จำกัด|151|Industrial|2.0260396|627.65|1.855|AMR
12-08-2019|0010000068|0030000068|บริษัท เหล็กสยามยามาโตะ จำกัด|151|Industrial|3.1082586|627.65|2.882|AMR
12-08-2019|0010000083|0030000083|บริษัท เอจีซี แฟลทกลาส (ประเทศไทย)จำกัด (มหาชน)|151|Industrial|3.0877761|627.65|2.947|AMR
12-08-2019|0010000083|0030021634|บริษัท เอจีซี แฟลทกลาส (ประเทศไทย)จำกัด (มหาชน)|151|Industrial|4.5286158|627.65|3.778|AMR
12-08-2019|0010000098|0030000098|บริษัท อีโอซีโพลิเมอร์ส (ไทยแลนด์)จำกัด|151|Industrial|0.0000|627.65|0.031|AMR
12-08-2019|0010000114|0030000118|บริษัท อิเมอร์สัน อิเล็คทริค (ประเทศไทย) จำกัด|151|Industrial|0.0305472|627.65|0.147|AMR
12-08-2019|0010000116|0030000120|บริษัท มิตซูบิชิ มอเตอร์ส (ประเทศไทย) จำกัด|151|Industrial|0.1301699|627.65|0.296|AMR
12-08-2019|0010000132|0030000137|บริษัท การ์เดียนอินดัสทรีส์ คอร์ปจำกัด|151|Industrial|3.8894904|627.65|3.735|AMR
12-08-2019|0010000145|0030000150|บริษัท แสตนดาร์ดแคน จำกัด|151|Industrial|0.1807759|627.65|0.26|AMR
12-08-2019|0010000158|0030000164|บริษัท นิวพลัสนิตติ้ง จำกัด (มหาชน)|151|Industrial|0.0000|627.65|0.007|AMR
12-08-2019|0010000201|0030000021|บริษัท อดิตยา เบอร์ล่า เคมีคัลส์ (ประเทศไทย) จำกัด (ซัลไฟท์ส ดีวิชั่น)|151|Industrial|0.0802349|627.65|0.08|AMR
12-08-2019|0010000221|0030011437|บริษัท วีนิไทย จำกัด (มหาชน)|151|Industrial|2.9838096|627.65|2.438|AMR
