Date|Sold to|Ship to|Ship to name|ContractType|Description|Volume(MMSCFD)|DemandPlan(BI)|MDCQ(BW)|Billing Type
12-08-2019|0010000224|0030000250|บริษัท ออมโนวา เอ็นจิเนียร์ด เซอร์เฟสเซส (ประเทศไทย) จำกัด|151|Industrial|0.1658378|627.65|0.304|AMR
12-08-2019|0010001131|0030044478|บริษัท นอริตาเก้ เอสซีจี พลาสเตอร์จำกัด|151|Industrial|0.1825769|627.65|0.163|AMR
12-08-2019|0010001741|0030022479|บริษัท อลูมิเนียม ฉื่อ จิ้น ฮั้ว จำกัด|151|Industrial|0.3236945|627.65|0.441|AMR
12-08-2019|0010002201|0030011779|บริษัท ควอลิตี้ คอฟฟี่ โปรดักท์ส จำกัด|151|Industrial|1.254484|627.65|0.886|AMR
12-08-2019|0010006772|0030010740|บริษัท ไซเดน (ประเทศไทย) จำกัด|151|Industrial|0.0000|627.65|0.018|AMR
12-08-2019|0010007306|0030012309||151|Industrial|0.4649533|627.65|0.297|AMR
12-08-2019|0010007330|0030013313|บริษัท โกรเวล แอบเบรซีพ (ไทยแลนด์)จำกัด|151|Industrial|0.0375042|627.65|0.041|AMR
12-08-2019|0010008022|0030033708|บริษัท สยามอุตสาหกรรมเกษตรอาหารจำกัด (มหาชน)|151|Industrial|0.0000|627.65|0.30|AMR
12-08-2019|0010008739|0030000237|บริษัท สยามไฟเบอร์ซีเมนต์กรุ๊ป จำกัด|151|Industrial|0.1036839|627.65|0.122|AMR
12-08-2019|0010009177|0030019562|บริษัท สยามโกชิ มานูแฟคเชอริ่ง จำกั|151|Industrial|0.0437549|627.65|0.094|AMR
12-08-2019|0010009584|0030020740|บริษัท เจลลี เบลลี แคนดี้ คอมปานี (ประเทศไทย) จำกัด|151|Industrial|0.064979|627.65|0.083|AMR
12-08-2019|0010009598|0030053139|บมจ.เอเชียน อินซูเลเตอร์|151|Industrial|0.2911343|627.65|0.30|AMR
12-08-2019|0010010423|0030024015|บริษัท ศานติบรรจุภัณฑ์ จำกัด|151|Industrial|0.085285|627.65|0.182|AMR
12-08-2019|0010012118|0030062578|บริษัท พีทีที แอลเอ็นจี จำกัด|152|Industrial-CoGen|1.8314143|627.65|4.30|FlowComp
12-08-2019|0010012146|0030032044||151|Industrial|0.6822093|627.65|0.797|AMR
12-08-2019|0010012326|0030032885|บริษัท สายไฟฟ้าไทย-ยาซากิ จำกัด|151|Industrial|0.0000|627.65|0.066|AMR
12-08-2019|0010012361|0030033177|บริษัท โตโต้ (ประเทศไทย) จำกัด|151|Industrial|0.6039519|627.65|0.714|AMR
12-08-2019|0010021117|0030022988|บริษัท ซีพีเอฟ (ประเทศไทย) จำกัด(มหาชน)|152|Industrial-CoGen|0.0155031|627.65|0.261|AMR
12-08-2019|0010021117|0030022988|บริษัท ซีพีเอฟ (ประเทศไทย) จำกัด(มหาชน)|151|Industrial|0.1843074|627.65|0.45|AMR
12-08-2019|0010022812|0030014300|บริษัท โกลบอล เพาเวอร์ ซินเนอร์ยี่จำกัด (มหาชน)|152|Industrial-CoGen|59.4109125|627.65|49.94|FlowComp
12-08-2019|0010024039|0030050402|บริษัท สุเพิร์บ พาวเวอร์ จำกัด|152|Industrial-CoGen|0.0000|627.65|0.382|AMR
12-08-2019|0010024055|0030057123|บจ.โอจีพี เอนเนอร์ยี่ โซลูชั่นส์ (สำหรับ บจ.ซึชิโยชิ สมบูรณ์ โคเตทแซนด์)|151|Industrial|0.1323594|627.65|0.13|AMR
12-08-2019|0010027459|0030011637|บริษัท โอสถสภา จำกัด (มหาชน)|151|Industrial|2.560351|627.65|2.438|AMR
12-08-2019|0010027591|0030000157|บริษัท ซีพีเอฟ ฟู้ด แอนด์ เบฟเวอร์เรจ จำกัด|151|Industrial|0.228592|627.65|0.209|AMR
12-08-2019|0010000009|0030000009|บริษัท ล.ไลท์ติ้งกลาส จำกัด|151|Industrial|4.1826024|627.65|4.026|AMR
12-08-2019|0010000010|0030000010|บริษัท สยามกลาส อินดัสทรี จำกัด|151|Industrial|1.7239577|627.65|1.975|AMR
12-08-2019|0010000024|0030000024|บริษัท ไทล์ท้อป อินดัสตรี้ จำกัด (มหาชน)|151|Industrial|4.2337734|627.65|5.749|AMR
12-08-2019|0010000038|0030000038|บริษัท สหโมเสคอุตสาหกรรม จำกัด (มหาชน)|151|Industrial|0.1147021|627.65|0.40|AMR
12-08-2019|0010000052|0030000052|บริษัท ไทยออยล์ จำกัด (มหาชน)|151|Industrial|25.8533105|627.65|16.473|AMR/FlowComp
12-08-2019|0010000053|0030000053|บริษัท ไทยอาซาฮีเคมีภัณฑ์ จำกัด|151|Industrial|0.2162319|627.65|0.211|AMR
12-08-2019|0010000064|0030000243|บริษัท ลี่ไท่ อัลลอย จำกัด|151|Industrial|0.2398927|627.65|0.203|AMR
12-08-2019|0010000077|0030000077||151|Industrial|1.527502|627.65|1.675|AMR
12-08-2019|0010000078|0030000078|บริษัท ไทเท็กซ์ เอเซีย จำกัด|151|Industrial|0.0633898|627.65|0.162|AMR
12-08-2019|0010000080|0030000080|บริษัท เอ็นเอส บลูสโคป (ประเทศไทย)จำกัด|151|Industrial|0.4672487|627.65|1.06|AMR
12-08-2019|0010000093|0030000093|บริษัท จีซี-เอ็ม พีทีเอ จำกัด|151|Industrial|2.6833168|627.65|2.794|AMR
12-08-2019|0010000111|0030000115|บริษัท อิวอนิก ยูไนเต็ด ซิลิกา (สยาม) จำกัด|151|Industrial|0.7670705|627.65|0.942|AMR
12-08-2019|0010000129|0030000133|บริษัท ทีพีซี เพสต์ เรซิน จำกัด|151|Industrial|0.2872144|627.65|0.28|AMR
12-08-2019|0010000130|0030000134|บริษัท กรีนสปอต จำกัด|151|Industrial|0.0000|627.65|0.591|AMR
12-08-2019|0010000141|0030000146|บริษัท สยามสตีล กัลวาไนซิ่ง จำกัด|151|Industrial|0.1010|627.65|0.186|AMR
12-08-2019|0010000155|0030000161|บริษัท มาเล่ย์ เอ็นจิ่น คอมโพเน็นท์(ประเทศไทย) จำกัด|151|Industrial|0.0685458|627.65|0.089|AMR
12-08-2019|0010000195|0030033440|บริษัท ไทยลู้บเบส จำกัด (มหาชน)|151|Industrial|3.1794177|627.65|5.14|AMR
12-08-2019|0010000216|0030049389|บริษัท ไออาร์พีซี จำกัด (มหาชน)|151|Industrial|7.7167563|627.65|7.866|AMR
12-08-2019|0010000934|0030046753|บริษัท ฮอนด้า ออโตโมบิล (ประเทศไทย) จำกัด|151|Industrial|0.1567266|627.65|0.304|AMR
12-08-2019|0010001727|0030020317|บริษัท ไทยเซ็นทรัลเคมี จำกัด (มหาชน)|151|Industrial|0.0000|627.65|0.29|AMR
12-08-2019|0010002092|0030016062|บริษัท สยามแผ่นเหล็กวิลาส จำกัด|151|Industrial|0.0000|627.65|0.119|AMR
12-08-2019|0010006748|0030010640|บริษัท ยูเนี่ยนโชจิรุชิ จำกัด|151|Industrial|0.0038846|627.65|0.013|AMR
12-08-2019|0010007060|0030011444|บริษัท สยามร่วมมิตร จำกัด|151|Industrial|0.0081576|627.65|0.094|AMR
12-08-2019|0010007112|0030011636|บริษัท ไทยซัมมิท อีสเทิร์น ซีบอร์ดโอโตพาร์ท อินดัสตรี จำกัด|151|Industrial|0.0010241|627.65|0.039|AMR
12-08-2019|0010007812|0030013764|บริษัท กรุงเทพสลักภัณฑ์ จำกัด|151|Industrial|0.0348909|627.65|0.068|AMR
12-08-2019|0010007875|0030013765|บริษัท วนชัย เคมีคอล อินดัสทรี่ส์จำกัด|151|Industrial|0.0871213|627.65|0.117|AMR
12-08-2019|0010008509|0030044231|บริษัท ผลิตภัณฑ์ตราเพชร จำกัด (มหาชน)|151|Industrial|0.4189736|627.65|0.369|AMR
12-08-2019|0010008606|0030016564|บริษัท ซังโกะ ไดคาชติ้ง (ประเทศไทย)จำกัด (มหาชน)|151|Industrial|0.0475335|627.65|0.174|AMR
12-08-2019|0010009093|0030019105|บริษัท ยูเนียน ออโตพาร์ทส มานูแฟคเชอริ่ง จำกัด|151|Industrial|0.0067097|627.65|0.10|AMR
12-08-2019|0010009392|0030020182|บริษัท มิตร สตีล จำกัด|151|Industrial|0.0000|627.65|0.046|AMR
12-08-2019|0010009442|0030020288|บริษัท อายิโนะโมะโต๊ะเซลส์ (ประเทศไทย) จำกัด|151|Industrial|0.0818594|627.65|0.057|AMR
12-08-2019|0010010220|0030023100|บริษัท เอส ไอ ดับบลิว (ไทยแลนด์) จำกัด|151|Industrial|0.1315119|627.65|0.082|AMR
12-08-2019|0010011882|0030031074|บริษัท พีทีที อาซาฮี เคมิคอล จำกัด|151|Industrial|4.9580779|627.65|4.404|AMR
12-08-2019|0010012059|0030045449|บริษัท พีทีที เอ็มซีซี ไบโอเคม จำกัด|151|Industrial|0.0000|627.65|0.322|AMR
12-08-2019|0010012323|0030032849|บริษัท โตโยอิ๊งค์ (ประเทศไทย) จำกัด|151|Industrial|0.00861|627.65|0.009|ADQ
12-08-2019|0010021117|0030000123|บริษัท ซีพีเอฟ (ประเทศไทย) จำกัด(มหาชน)|151|Industrial|0.1183042|627.65|0.447|AMR
12-08-2019|0010022444|0030044003|บริษัท ทีวาย สตีล จำกัด|151|Industrial|0.1665088|627.65|0.247|AMR
12-08-2019|0010023667|0030000034|บริษัท สตาร์ ซานิทารี่แวร์ (ประเทศไทย) จำกัด|151|Industrial|0.1030482|627.65|0.092|AMR
12-08-2019|0010023967|0030050118|บริษัท โอซาก้า แก๊ส (ประเทศไทย) จำกัด|151|Industrial|0.2302518|627.65|0.194|AMR
12-08-2019|0010027295|0030059173|บมจ.ปตท. น้ำมันและการค้าปลีก|158|NG by Truck|0.13919|627.65|0.139|ADQ
12-08-2019|0010027315|0030057427|บริษัท นิชินโบะ สมบูรณ์ ออโตโมทีฟ จำกัด|151|Industrial|0.0135608|627.65|0.003|AMR
12-08-2019|0010028705|0030017241|บริษัท บีจี โฟลต กล๊าส จำกัด|151|Industrial|0.1857906|627.65|0.184|AMR
12-08-2019|0010029277|0030062577|บริษัท โรม เมคะเทค (ประเทศไทย) จำกัด|151|Industrial|0.01208|627.65|0.018|ADQ
12-08-2019|0010029951|0030064789|บริษัท สยามเพลเล็ทพาวเวอร์ จำกัด|152|Industrial-CoGen|0.0000|627.65|0.819|AMR
