Date|Sold to|Ship to|Ship to name|ContractType|Description|Volume(MMSCFD)|DemandPlan(BI)|MDCQ(BW)|Billing Type
12-26-2019|0010000071|0030000071|บริษัท เอสโซ่ (ประเทศไทย) จำกัด (มหาชน)|152|Industrial-CoGen|7.75268|627.65|10.502|ADQ
12-26-2019|0010000088|0030000088|บริษัท ไทยฟิล์มอินดัสตรี่ จำกัด (มหาชน)|151|Industrial|0.0000|627.65|0.016|AMR
12-26-2019|0010000104|0030000107|บริษัท สยามโพลิเอททีลีน จำกัด|151|Industrial|1.5830873|627.65|1.79|AMR
12-26-2019|0010000114|0030000118|บริษัท อิเมอร์สัน อิเล็คทริค (ประเทศไทย) จำกัด|151|Industrial|0.1369504|627.65|0.147|AMR
12-26-2019|0010000116|0030000120|บริษัท มิตซูบิชิ มอเตอร์ส (ประเทศไทย) จำกัด|151|Industrial|0.4329935|627.65|0.296|AMR
12-26-2019|0010000135|0030000140|บริษัท รอนเด็กซ์ (ประเทศไทย) จำกัด|151|Industrial|0.0000|627.65|0.03|AMR
12-26-2019|0010000136|0030000141|บริษัท ยูเนี่ยนไทย-นิจิบัน จำกัด|151|Industrial|0.3593977|627.65|0.363|AMR
12-26-2019|0010000151|0030000156|บริษัท มิตซูบิชิ อีเล็คทริค ออโตเมชั่น (ประเทศไทย) จำกัด|151|Industrial|0.1886864|627.65|0.216|AMR
12-26-2019|0010000161|0030000167|บริษัท ไทยซัมซุง อิเลคโทรนิคส์ จำกัด|151|Industrial|0.0000706|627.65|0.311|AMR
12-26-2019|0010000206|0030000239|บริษัท เฮลซ์เทรดดิ้ง (ประเทศไทย) จำกัด|151|Industrial|0.0209063|627.65|0.035|AMR
12-26-2019|0010000227|0030000253|บริษัท จี เจ สตีล จำกัด (มหาชน)|151|Industrial|0.0000|627.65|1.779|AMR
12-26-2019|0010001217|0030021463|บริษัท แอมคอล อินเตอร์เนชั่นแนล (ไทยแลนด์) จำกัด|151|Industrial|0.0000|627.65|0.082|AMR
12-26-2019|0010001431|0030053506|บริษัท คาราบาวตะวันแดง จำกัด|151|Industrial|0.275949|627.65|0.238|AMR
12-26-2019|0010001747|0030042303|บริษัท สุนทรเมทัลอินดัสทรี้ส์ จำกัด|151|Industrial|0.4703211|627.65|0.378|AMR
12-26-2019|0010001787|0030024766|บริษัท เพรซิเดนท์ เบเกอรี่ จำกัด(มหาชน)|151|Industrial|0.3237651|627.65|0.281|AMR
12-26-2019|0010002094|0030018793|บริษัท พ้อตเตอร์ส (ประเทศไทย) จำกัด|151|Industrial|0.2100871|627.65|0.26|AMR
12-26-2019|0010002109|0030030514|บริษัท ลักกี้กลาส จำกัด|151|Industrial|0.9142269|627.65|0.623|AMR
12-26-2019|0010006772|0030010740|บริษัท ไซเดน (ประเทศไทย) จำกัด|151|Industrial|0.0259209|627.65|0.018|AMR
12-26-2019|0010007151|0030011752|บริษัท เอ็มซีแอลเอส เอเชีย จำกัด|151|Industrial|0.9805479|627.65|0.865|AMR
12-26-2019|0010007765|0030013679|บริษัท เอ.พี.ซี อุตสาหกรรม จำกัด|151|Industrial|0.0000|627.65|0.019|AMR
12-26-2019|0010007766|0030000094|บริษัท อินโดรามา ปิโตรเคม จำกัด|152|Industrial-CoGen|0.5389729|627.65|0.054|AMR
12-26-2019|0010008356|0030047608|บริษัท แสงไทยเมตัลดรัม จำกัด|151|Industrial|0.045344|627.65|0.03|AMR
12-26-2019|0010008739|0030013343|บริษัท สยามไฟเบอร์ซีเมนต์กรุ๊ป จำกัด|151|Industrial|0.8803601|627.65|0.92|AMR
12-26-2019|0010009196|0030019599|บริษัท ราชราตัน ไทย ไวร์ จำกัด|151|Industrial|0.0003884|627.65|0.177|AMR
12-26-2019|0010009228|0030019659|บริษัท ไทย เอ็มเอฟซี จำกัด|151|Industrial|0.1470857|627.65|0.149|AMR
12-26-2019|0010010005|0030022294|บริษัท คอทโก้ เอ็นซีอาร์ เปเปอร์ จำกัด|151|Industrial|0.032207|627.65|0.035|AMR
12-26-2019|0010010061|0030022473|บริษัท แอมคอร์ เฟล็กซิเบิ้ล ระยองจำกัด|151|Industrial|0.0351381|627.65|0.032|AMR
12-26-2019|0010010605|0030024817|บริษัท มาบตาพุดโอเลฟินส์ จำกัด|151|Industrial|2.122025|627.65|2.422|AMR
12-26-2019|0010010925|0030025431|บริษัท เน็กซ์ แคน อินโนเวชั่น จำกัด|151|Industrial|0.4188676|627.65|0.367|AMR
12-26-2019|0010012320|0030000055|บริษัท พีทีที โกลบอล เคมิคอล จำกัด(มหาชน)|151|Industrial|0.0013419|627.65|0.002|AMR
12-26-2019|0010012320|0030000069|บริษัท พีทีที โกลบอล เคมิคอล จำกัด(มหาชน)|151|Industrial|6.8688857|627.65|6.038|AMR
12-26-2019|0010012440|0030033600|บริษัท นูทริกซ์ จำกัด (มหาชน)|151|Industrial|0.1805287|627.65|0.208|AMR
12-26-2019|0010012506|0030000025|บริษัท ปทุมธานีกล๊าส อินดัสทรี จำกัด|151|Industrial|2.595136|627.65|2.674|AMR
12-26-2019|0010021265|0030040855|บริษัท เอ็นเอส-สยามยูไนเต็ดสตีล จำกัด|151|Industrial|0.0000|627.65|1.275|AMR
12-26-2019|0010021577|0030041863|บริษัท นำวัฒนา แพ็คแอนด์พริ้นท์ จำกัด|151|Industrial|0.5124516|627.65|0.278|AMR
12-26-2019|0010022868|0030047048|บริษัท ไออาร์พีซี คลีน พาวเวอร์ จำกัด|151|Industrial|2.5862367|627.65|2.145|AMR
12-26-2019|0010024871|0030053591|บริษัท เอ็นเอส-โอจี เอนเนอร์จี โซลูชั่นส์ (ไทยแลนด์) จำกัด|152|Industrial-CoGen|1.1303529|627.65|0.814|AMR
12-26-2019|0010025332|0030052476|บริษัท ไอที ฟอร์จิ้ง (ประเทศไทย) จำกัด|151|Industrial|0.0768801|627.65|0.134|AMR
12-26-2019|0010027591|0030024290|บริษัท ซีพีเอฟ ฟู้ด แอนด์ เบฟเวอร์เรจ จำกัด|151|Industrial|0.8090597|627.65|0.753|AMR
12-26-2019|0010027600|0030058148|บริษัท เอเชีย แคน แมนูแฟคเจอริ่ง จำกัด|151|Industrial|0.1162559|627.65|0.125|AMR
12-26-2019|0010027807|0030064609|บริษัท เช่วเฉิน ซิลิก้า (ไทยแลนด์)จำกัด|151|Industrial|0.09148|627.65|1.00|ADQ
12-26-2019|0010000012|0030000012|บริษัท อีสเทิร์นไชน่าแวร์ จำกัด|151|Industrial|0.2828707|627.65|0.305|AMR
12-26-2019|0010000013|0030000013|บริษัท ทาทา สตีล การผลิต (ประเทศไทย) จำกัด (มหาชน)|151|Industrial|0.8579706|627.65|2.252|AMR
12-26-2019|0010000027|0030000027|บริษัท ฝาจีบ จำกัด (มหาชน)|151|Industrial|0.5273544|627.65|0.501|AMR
12-26-2019|0010000028|0030000028|บริษัท เฟอร์โร (ประเทศไทย) จำกัด|151|Industrial|0.0015891|627.65|0.551|AMR
12-26-2019|0010000038|0030000102|บริษัท สหโมเสคอุตสาหกรรม จำกัด (มหาชน)|151|Industrial|0.0000|627.65|2.111|AMR
12-26-2019|0010000039|0030000039|บริษัท โสสุโก้ เซรามิค จำกัด|151|Industrial|1.0489172|627.65|2.211|AMR
12-26-2019|0010000053|0030020331|บริษัท ไทยอาซาฮีเคมีภัณฑ์ จำกัด|151|Industrial|0.5165481|627.65|0.396|AMR
12-26-2019|0010000064|0030000243|บริษัท ลี่ไท่ อัลลอย จำกัด|151|Industrial|0.2539833|627.65|0.203|AMR
12-26-2019|0010000074|0030000074|บริษัท ไทยเบเวอร์เรจแคน จำกัด|151|Industrial|0.576018|627.65|0.541|AMR
12-26-2019|0010000089|0030000089|บริษัท ธนเสริมอุตสาหกรรมฝาขวด จำกัด|151|Industrial|0.063072|627.65|0.057|AMR
12-26-2019|0010000106|0030000109|บริษัท ไมย์เออร์ อลูมิเนียม (ประเทศไทย) จำกัด|151|Industrial|0.302435|627.65|0.23|AMR
12-26-2019|0010000107|0030000111|บริษัท จี สตีล จำกัด (มหาชน)|151|Industrial|0.0000|627.65|1.969|AMR
12-26-2019|0010000122|0030000126|บริษัท บี เอ เอส เอฟ (ไทย) จำกัด|151|Industrial|0.5902498|627.65|0.446|AMR
12-26-2019|0010000140|0030000145|บริษัท สยามลวดเหล็กอุตสาหกรรม จำกัด|151|Industrial|0.0706647|627.65|0.068|AMR
12-26-2019|0010000153|0030000159|บริษัท เกทส์ ยูนิทตะ (ประเทศไทย) จำกัด|151|Industrial|0.0000|627.65|0.088|AMR
12-26-2019|0010000154|0030000160|บริษัท แม็กซิออน วีลส์ (ประเทศไทย)จำกัด|151|Industrial|0.5511565|627.65|0.788|AMR
12-26-2019|0010000164|0030019231|บริษัท โกลว์ พลังงาน จำกัด (มหาชน)|151|Industrial|0.0000|627.65|0.187|ADQ
12-26-2019|0010000202|0030042681|บริษัท สมบูรณ์ โซมิค แมนูแฟคเจอริ่งจำกัด|151|Industrial|0.0012006|627.65|0.01|AMR
12-26-2019|0010000225|0030000251|บริษัท ซีพีพีซี จำกัด (มหาชน)|151|Industrial|0.1386101|627.65|0.142|AMR
12-26-2019|0010001146|0030042053|บริษัท เคลล็อก (ประเทศไทย) จำกัด|151|Industrial|0.0000|627.65|0.178|AMR
12-26-2019|0010001196|0030029791|บริษัท ไทยคูน เวิลด์ไวด์ กรุ๊ป (ประเทศไทย) จำกัด (มหาชน)|151|Industrial|0.0000|627.65|1.55|AMR
12-26-2019|0010001922|0030022692|บริษัท ฟู้ดแอนด์ดริ๊งส์ จำกัด (มหาชน)|151|Industrial|0.14068|627.65|0.156|ADQ
12-26-2019|0010006257|0030022426|บริษัท ออโต้อัลลายแอนซ์ (ประเทศไทย)จำกัด|151|Industrial|0.0000|627.65|0.482|AMR
12-26-2019|0010006271|0030008801|บริษัท ริเวอร์โปร์ พัลพ แอนด์เพเพอร์ จำกัด|151|Industrial|0.0000|627.65|0.12|AMR
12-26-2019|0010006922|0030020406|บริษัท อายิโนะโมะโต๊ะ (ประเทศไทย)จำกัด|151|Industrial|1.5807212|627.65|2.212|AMR
12-26-2019|0010007812|0030013764|บริษัท กรุงเทพสลักภัณฑ์ จำกัด|151|Industrial|0.0691108|627.65|0.068|AMR
12-26-2019|0010007875|0030013765|บริษัท วนชัย เคมีคอล อินดัสทรี่ส์จำกัด|151|Industrial|0.0276514|627.65|0.117|AMR
12-26-2019|0010009040|0030022254|บริษัท ไทยเรยอน จำกัด (มหาชน)|151|Industrial|0.1588102|627.65|0.905|AMR
12-26-2019|0010009582|0030020738|บริษัท คอทโก้ พลาสติกส์ จำกัด|151|Industrial|0.040965|627.65|0.067|AMR
12-26-2019|0010011029|0030026047|บริษัท เอ็น ซี อาร์ รับเบอร์อินดัสตรี้ จำกัด|151|Industrial|0.0725717|627.65|0.066|AMR
12-26-2019|0010011163|0030026631|บริษัท ไทย อกริ เพาเวอร์ จำกัด|152|Industrial-CoGen|0.0646965|627.65|0.378|AMR
12-26-2019|0010012393|0030033336|บริษัท จรุงไทยไวร์แอนด์เคเบิ้ล จำกัด (มหาชน)|151|Industrial|0.0000|627.65|0.056|AMR
12-26-2019|0010021265|0030000095|บริษัท เอ็นเอส-สยามยูไนเต็ดสตีล จำกัด|151|Industrial|0.0000|627.65|1.977|AMR
12-26-2019|0010022812|0030024457|บริษัท โกลบอล เพาเวอร์ ซินเนอร์ยี่จำกัด (มหาชน)|151|Industrial|10.2665836|627.65|3.848|AMR
12-26-2019|0010022812|0030063296|บริษัท โกลบอล เพาเวอร์ ซินเนอร์ยี่จำกัด (มหาชน)|152|Industrial-CoGen|10.2528893|627.65|16.00|FlowComp
12-26-2019|0010026372|0030024061|บริษัท เคมีแมน จำกัด (มหาชน)|151|Industrial|1.4754834|627.65|1.12|AMR
12-26-2019|0010027861|0030000017|บริษัท เอสซีจี เซรามิกส์ จำกัด (มหาชน)|151|Industrial|1.2669148|627.65|4.00|AMR
12-26-2019|0010000009|0030000009|บริษัท ล.ไลท์ติ้งกลาส จำกัด|151|Industrial|3.6978375|627.65|4.026|AMR
12-26-2019|0010000010|0030000010|บริษัท สยามกลาส อินดัสทรี จำกัด|151|Industrial|1.493388|627.65|1.975|AMR
12-26-2019|0010000024|0030000024|บริษัท ไทล์ท้อป อินดัสตรี้ จำกัด (มหาชน)|151|Industrial|3.8057945|627.65|5.749|AMR
12-26-2019|0010000035|0030000035|บริษัท สยามซานิทารีแวร์อินดัสทรี จำกัด|151|Industrial|0.2095927|627.65|0.887|AMR
12-26-2019|0010000036|0030000036|บริษัท สยามฟูรูกาวา จำกัด|151|Industrial|0.113678|627.65|0.25|AMR
12-26-2019|0010000049|0030000049|บริษัท ไทยผลิตภัณฑ์ยิบซั่ม จำกัด(มหาชน)|151|Industrial|0.4423519|627.65|1.568|AMR
12-26-2019|0010000057|0030000057|บริษัท พี เอส เมททอลเวอกส์ จำกัด|151|Industrial|0.0412828|627.65|0.017|AMR
12-26-2019|0010000058|0030000058|บริษัท พีคิว เคมิคอลส์ (ประเทศไทย)จำกัด|151|Industrial|0.0000|627.65|0.159|AMR
12-26-2019|0010000068|0030025580|บริษัท เหล็กสยามยามาโตะ จำกัด|151|Industrial|2.4763373|627.65|2.307|AMR
12-26-2019|0010000070|0030000070|บริษัท ทานิโอบิส จำกัด|151|Industrial|0.0167391|627.65|0.157|AMR
12-26-2019|0010000082|0030000082|บริษัท สยามโทซู เซรามิกส์ จำกัด|151|Industrial|0.0526895|627.65|0.056|AMR
12-26-2019|0010000093|0030000093|บริษัท จีซี-เอ็ม พีทีเอ จำกัด|151|Industrial|2.9345809|627.65|2.794|AMR
12-26-2019|0010000110|0030000114|บริษัท ระยอง กัลวาไนซิ่ง จำกัด|151|Industrial|0.0482398|627.65|0.071|AMR
12-26-2019|0010000116|0030034491|บริษัท มิตซูบิชิ มอเตอร์ส (ประเทศไทย) จำกัด|151|Industrial|0.1763616|627.65|0.132|AMR
12-26-2019|0010000132|0030000137|บริษัท การ์เดียนอินดัสทรีส์ คอร์ปจำกัด|151|Industrial|3.6598036|627.65|3.735|AMR
12-26-2019|0010000143|0030000148|บริษัท สยาม พุงซาน เมทัล จำกัด|151|Industrial|0.0280751|627.65|0.18|AMR
12-26-2019|0010000144|0030000149|บริษัท เบอร์ลี่ ยุคเกอร์ เซลล็อกซ์จำกัด|151|Industrial|0.3805512|627.65|0.462|AMR
12-26-2019|0010000156|0030000162|บริษัท เวลโกรว์กล๊าส อินดัสทรี จำกัด|151|Industrial|1.8422619|627.65|1.801|AMR
12-26-2019|0010000157|0030000163|บริษัท ไทยอะครีลิค จำกัด|151|Industrial|0.0000|627.65|0.004|AMR
12-26-2019|0010000195|0030033440|บริษัท ไทยลู้บเบส จำกัด (มหาชน)|151|Industrial|2.6953238|627.65|5.14|AMR
12-26-2019|0010000203|0030000236|บริษัท สิงห์ คาเมดะ (ประเทศไทย) จำกัด|151|Industrial|0.1815175|627.65|0.229|AMR
12-26-2019|0010000205|0030000238|บริษัท ไทยอาซาคาวา จำกัด|151|Industrial|0.0673804|627.65|0.068|AMR
12-26-2019|0010000221|0030011437|บริษัท วีนิไทย จำกัด (มหาชน)|151|Industrial|2.6460245|627.65|2.438|AMR
12-26-2019|0010000224|0030000250|บริษัท ออมโนวา เอ็นจิเนียร์ด เซอร์เฟสเซส (ประเทศไทย) จำกัด|151|Industrial|0.2307109|627.65|0.304|AMR
12-26-2019|0010001131|0030044478|บริษัท นอริตาเก้ เอสซีจี พลาสเตอร์จำกัด|151|Industrial|0.17562|627.65|0.163|AMR
12-26-2019|0010001727|0030020317|บริษัท ไทยเซ็นทรัลเคมี จำกัด (มหาชน)|151|Industrial|0.0000|627.65|0.29|AMR
12-26-2019|0010002092|0030016062|บริษัท สยามแผ่นเหล็กวิลาส จำกัด|151|Industrial|0.0000|627.65|0.119|AMR
12-26-2019|0010006748|0030010640|บริษัท ยูเนี่ยนโชจิรุชิ จำกัด|151|Industrial|0.0163153|627.65|0.013|AMR
12-26-2019|0010007306|0030012309||151|Industrial|0.2555724|627.65|0.297|AMR
12-26-2019|0010007330|0030013313|บริษัท โกรเวล แอบเบรซีพ (ไทยแลนด์)จำกัด|151|Industrial|0.0165625|627.65|0.041|AMR
12-26-2019|0010007982|0030014211|บริษัท จีซี ไกลคอล จำกัด|151|Industrial|0.0892755|627.65|0.113|AMR
12-26-2019|0010008509|0030016162|บริษัท ผลิตภัณฑ์ตราเพชร จำกัด (มหาชน)|151|Industrial|0.0000|627.65|0.087|AMR
12-26-2019|0010008926|0030018384|บริษัท อินเตอร์เนชั่นแนล แลบบอราทอรีส์ จำกัด|151|Industrial|0.0211535|627.65|0.016|AMR
12-26-2019|0010008928|0030018387|บริษัท หลุยส์ผลิตภัณท์กาวเทป จำกัด|151|Industrial|0.4357833|627.65|0.299|AMR
12-26-2019|0010009180|0030044623|บริษัท ไทย มาลายา กลาส จำกัด|151|Industrial|4.3797997|627.65|4.443|AMR
12-26-2019|0010009604|0030020797|บริษัท เจ.พี ยูไนเต็ด จำกัด|151|Industrial|0.0000|627.65|0.031|AMR
12-26-2019|0010009784|0030021478|บริษัท แคททาเลอร์ (ประเทศไทย) จำกัด|151|Industrial|0.1139252|627.65|0.119|AMR
12-26-2019|0010010423|0030024015|บริษัท ศานติบรรจุภัณฑ์ จำกัด|151|Industrial|0.1618119|627.65|0.182|AMR
12-26-2019|0010012118|0030062578|บริษัท พีทีที แอลเอ็นจี จำกัด|152|Industrial-CoGen|2.1101465|627.65|4.30|FlowComp
12-26-2019|0010012146|0030032044||151|Industrial|0.8092716|627.65|0.797|AMR
12-26-2019|0010012320|0030026468|บริษัท พีทีที โกลบอล เคมิคอล จำกัด(มหาชน)|151|Industrial|5.7187918|627.65|2.531|AMR
12-26-2019|0010012320|0030040549|บริษัท พีทีที โกลบอล เคมิคอล จำกัด(มหาชน)|152|Industrial-CoGen|16.7224042|627.65|14.738|FlowComp
12-26-2019|0010021117|0030000123|บริษัท ซีพีเอฟ (ประเทศไทย) จำกัด(มหาชน)|151|Industrial|0.5387963|627.65|0.447|AMR
12-26-2019|0010022317|0030043685|บริษัท ไซมีส อีโคไลท์ จำกัด|151|Industrial|0.0000|627.65|0.074|AMR
12-26-2019|0010022333|0030043703|บริษัท เอเชียแปซิฟิกกลาส จำกัด|151|Industrial|1.9891711|627.65|2.025|AMR
12-26-2019|0010023651|0030048793|บริษัท ไคฮาระ (ประเทศไทย) จำกัด|151|Industrial|0.415654|627.65|0.235|AMR
12-26-2019|0010026634|0030054698|บริษัท คานายามา คาเซอิ (ประเทศไทย)จำกัด|158|NG by Truck|0.61779|627.65|0.661|ADQ
12-26-2019|0010026674|0030017326|บริษัท ไทยเพรซิเดนท์ฟูดส์ จำกัด(มหาชน)|151|Industrial|0.0000|627.65|0.586|AMR
12-26-2019|0010027861|0030000246|บริษัท เอสซีจี เซรามิกส์ จำกัด (มหาชน)|151|Industrial|1.6111978|627.65|2.495|AMR
12-26-2019|0010027861|0030046657|บริษัท เอสซีจี เซรามิกส์ จำกัด (มหาชน)|151|Industrial|0.0211535|627.65|0.244|AMR
12-26-2019|0010000001|0030000001|บริษัท กระจกลายสยาม จำกัด|151|Industrial|0.32074|627.65|0.34|ADQ
12-26-2019|0010000015|0030000015|บริษัท โคห์เลอร์ (ประเทศไทย) จำกัด(มหาชน)|151|Industrial|2.089712|627.65|2.341|AMR
12-26-2019|0010000030|0030000030|บริษัท ภัทราพอร์ซเลน จำกัด|151|Industrial|0.2803634|627.65|0.664|AMR
12-26-2019|0010000052|0030000052|บริษัท ไทยออยล์ จำกัด (มหาชน)|151|Industrial|19.6562432|627.65|16.473|AMR/FlowComp
12-26-2019|0010000053|0030000053|บริษัท ไทยอาซาฮีเคมีภัณฑ์ จำกัด|151|Industrial|0.2749955|627.65|0.211|AMR
12-26-2019|0010000076|0030000076|บริษัท สยามสไตรีนโมโนเมอร์ จำกัด|151|Industrial|3.1317429|627.65|3.276|AMR
12-26-2019|0010000098|0030000098|บริษัท อีโอซีโพลิเมอร์ส (ไทยแลนด์)จำกัด|151|Industrial|0.0000|627.65|0.031|AMR
12-26-2019|0010000130|0030052374|บริษัท กรีนสปอต จำกัด|151|Industrial|0.2839301|627.65|0.251|AMR
12-26-2019|0010000131|0030000136|บริษัท การ์เดียนอินดัสทรีส์ ระยองจำกัด|151|Industrial|2.9683417|627.65|3.364|AMR
12-26-2019|0010000148|0030000153|บริษัท เคนไซซีรามิคส์ อินดัสตรี้ จำกัด|151|Industrial|0.1383276|627.65|0.203|AMR
12-26-2019|0010000197|0030025358|บริษัท บางจาก คอร์ปอเรชั่น จำกัด (มหาชน)|152|Industrial-CoGen|8.0081379|627.65|6.90|AMR
12-26-2019|0010000197|0030025358|บริษัท บางจาก คอร์ปอเรชั่น จำกัด (มหาชน)|151|Industrial|23.3930389|627.65|23.481|FlowComp
12-26-2019|0010000934|0030046753|บริษัท ฮอนด้า ออโตโมบิล (ประเทศไทย) จำกัด|151|Industrial|0.3577732|627.65|0.304|AMR
12-26-2019|0010001727|0030020317|บริษัท ไทยเซ็นทรัลเคมี จำกัด (มหาชน)|152|Industrial-CoGen|0.0000|627.65|0.337|AMR
12-26-2019|0010001740|0030022424|บริษัท โรงงานเหล็กกรุงเทพฯ จำกัด|151|Industrial|2.2165624|627.65|1.244|AMR
12-26-2019|0010003880|0030008767|บริษัท กังวาลเท็กซ์ไทล์ จำกัด|152|Industrial-CoGen|1.8476297|627.65|1.367|AMR
12-26-2019|0010006972|0030011249|บริษัท สยาม ยามาโมริ จำกัด|151|Industrial|0.0117597|627.65|0.024|AMR
12-26-2019|0010008022|0030033708|บริษัท สยามอุตสาหกรรมเกษตรอาหารจำกัด (มหาชน)|151|Industrial|0.1883332|627.65|0.30|AMR
12-26-2019|0010009070|0030018984|บริษัท โมเดอร์น ไดสตัฟส์ แอนด์พิคเมนท์ส จำกัด|151|Industrial|0.0140199|627.65|0.189|AMR
12-26-2019|0010009085|0030056942|บจ.แดรี่ พลัส|151|Industrial|0.7039279|627.65|0.659|AMR
12-26-2019|0010009584|0030020740|บริษัท เจลลี เบลลี แคนดี้ คอมปานี (ประเทศไทย) จำกัด|151|Industrial|0.0739842|627.65|0.083|AMR
12-26-2019|0010009598|0030053139|บมจ.เอเชียน อินซูเลเตอร์|151|Industrial|0.4080613|627.65|0.30|AMR
12-26-2019|0010010355|0030023468|บริษัท เคียวเด็น (ประเทศไทย) จำกัด|151|Industrial|0.0280751|627.65|0.033|AMR
