Date|Sold to|Ship to|Ship to name|ContractType|Description|Volume(MMSCFD)|DemandPlan(BI)|MDCQ(BW)|Billing Type
09-27-2019|0010000009|0030000009|บริษัท ล.ไลท์ติ้งกลาส จำกัด|151|Industrial|3.8589785|665.69|4.026|AMR
09-27-2019|0010000010|0030000010|บริษัท สยามกลาส อินดัสทรี จำกัด|151|Industrial|1.8499605|665.69|1.975|AMR
09-27-2019|0010000026|0030000026|บริษัท บางกอกแคน แมนนูแฟคเจอริ่ง จำกัด|151|Industrial|0.3058253|665.69|0.281|AMR
09-27-2019|0010000027|0030000027|บริษัท ฝาจีบ จำกัด (มหาชน)|152|Industrial-CoGen|1.0723308|665.69|0.38|AMR
09-27-2019|0010000038|0030000038|บริษัท สหโมเสคอุตสาหกรรม จำกัด (มหาชน)|151|Industrial|0.4580316|665.69|0.40|AMR
09-27-2019|0010000052|0030000052|บริษัท ไทยออยล์ จำกัด (มหาชน)|151|Industrial|38.0067854|665.69|16.473|AMR/FlowComp
09-27-2019|0010000053|0030000053|บริษัท ไทยอาซาฮีเคมีภัณฑ์ จำกัด|151|Industrial|0.2093808|665.69|0.211|AMR
09-27-2019|0010000068|0030000068|บริษัท เหล็กสยามยามาโตะ จำกัด|151|Industrial|0.7690835|665.69|2.882|AMR
09-27-2019|0010000082|0030000082|บริษัท สยามโทซู เซรามิกส์ จำกัด|151|Industrial|0.0512063|665.69|0.056|AMR
09-27-2019|0010000096|0030000096|บริษัท ระยองโอเลฟินส์ จำกัด|151|Industrial|0.59251|665.69|0.717|AMR
09-27-2019|0010000097|0030000097|บริษัท สายไฟฟ้าบางกอกเคเบิ้ล จำกัด|151|Industrial|0.0000|665.69|0.199|AMR
09-27-2019|0010000113|0030000117|บริษัท คาร์ดิแนล เฮลท์ 222 (ประเทศไทย) จำกัด|151|Industrial|2.0035088|665.69|1.493|AMR
09-27-2019|0010000114|0030000118|บริษัท อิเมอร์สัน อิเล็คทริค (ประเทศไทย) จำกัด|151|Industrial|0.1930654|665.69|0.147|AMR
09-27-2019|0010000125|0030000129|บริษัท อาร์พีที เอเซีย จำกัด|151|Industrial|0.0773038|665.69|0.019|AMR
09-27-2019|0010000135|0030000140|บริษัท รอนเด็กซ์ (ประเทศไทย) จำกัด|151|Industrial|0.086415|665.69|0.03|AMR
09-27-2019|0010000136|0030000141|บริษัท ยูเนี่ยนไทย-นิจิบัน จำกัด|151|Industrial|0.5595614|665.69|0.363|AMR
09-27-2019|0010000153|0030000159|บริษัท เกทส์ ยูนิทตะ (ประเทศไทย) จำกัด|151|Industrial|0.0887811|665.69|0.088|AMR
09-27-2019|0010000154|0030000160|บริษัท แม็กซิออน วีลส์ (ประเทศไทย)จำกัด|151|Industrial|0.9185353|665.69|0.788|AMR
09-27-2019|0010000164|0030019231|บริษัท โกลว์ พลังงาน จำกัด (มหาชน)|151|Industrial|0.0000|665.69|0.187|ADQ
09-27-2019|0010000164|0030030778|บริษัท โกลว์ พลังงาน จำกัด (มหาชน)|152|Industrial-CoGen|57.0562942|665.69|53.967|FlowComp
09-27-2019|0010000202|0030042681|บริษัท สมบูรณ์ โซมิค แมนูแฟคเจอริ่งจำกัด|151|Industrial|0.0117951|665.69|0.01|AMR
09-27-2019|0010000225|0030000251|บริษัท ซีพีพีซี จำกัด (มหาชน)|151|Industrial|0.1338427|665.69|0.142|AMR
09-27-2019|0010001146|0030042053|บริษัท เคลล็อก (ประเทศไทย) จำกัด|151|Industrial|0.1891455|665.69|0.178|AMR
09-27-2019|0010001196|0030029791|บริษัท ไทยคูน เวิลด์ไวด์ กรุ๊ป (ประเทศไทย) จำกัด (มหาชน)|151|Industrial|1.7172126|665.69|1.55|AMR
09-27-2019|0010001747|0030042303|บริษัท สุนทรเมทัลอินดัสทรี้ส์ จำกัด|151|Industrial|0.550874|665.69|0.378|AMR
09-27-2019|0010001787|0030024766|บริษัท เพรซิเดนท์ เบเกอรี่ จำกัด(มหาชน)|151|Industrial|0.301199|665.69|0.281|AMR
09-27-2019|0010003880|0030008767|บริษัท กังวาลเท็กซ์ไทล์ จำกัด|152|Industrial-CoGen|2.3861789|665.69|1.367|AMR
09-27-2019|0010006894|0030020321|บริษัท อาร์ต อุตสาหกรรม จำกัด|151|Industrial|0.0029311|665.69|0.021|AMR
09-27-2019|0010007151|0030011752|บริษัท เอ็มซีแอลเอส เอเชีย จำกัด|151|Industrial|0.9694591|665.69|0.865|AMR
09-27-2019|0010007766|0030013680|บริษัท อินโดรามา ปิโตรเคม จำกัด|152|Industrial-CoGen|4.1259576|665.69|3.75|AMR
09-27-2019|0010008288|0030015470|บริษัท อุตสาหกรรมทำเครื่องแก้วไทยจำกัด (มหาชน)|151|Industrial|5.9658535|665.69|6.401|AMR
09-27-2019|0010008289|0030015477|บริษัท ดี-รับเบอร์ โปรดักส์ จำกัด|151|Industrial|0.0756794|665.69|0.031|AMR
09-27-2019|0010009040|0030022254|บริษัท ไทยเรยอน จำกัด (มหาชน)|151|Industrial|1.2148963|665.69|0.905|AMR
09-27-2019|0010009180|0030019567|บริษัท ไทย มาลายา กลาส จำกัด|151|Industrial|2.6030818|665.69|2.719|AMR
09-27-2019|0010009841|0030021637|บริษัท โอวาริ เซกิ (ไทยแลนด์) จำกัด|151|Industrial|0.0035667|665.69|0.006|AMR
09-27-2019|0010010355|0030023468|บริษัท เคียวเด็น (ประเทศไทย) จำกัด|151|Industrial|0.0425542|665.69|0.033|AMR
09-27-2019|0010010358|0030023471|บริษัท เซ้าท์ ซิตี้ ปิโตรเคม จำกัด|151|Industrial|0.1256497|665.69|0.12|AMR
09-27-2019|0010012118|0030062578|บริษัท พีทีที แอลเอ็นจี จำกัด|152|Industrial-CoGen|0.0000236|665.69|4.30|FlowComp
09-27-2019|0010012146|0030032044||151|Industrial|1.0075283|665.69|0.797|AMR
09-27-2019|0010012323|0030032849|บริษัท โตโยอิ๊งค์ (ประเทศไทย) จำกัด|151|Industrial|0.00897|665.69|0.009|ADQ
09-27-2019|0010020698|0030038224|บริษัท สตาร์คอร์ จำกัด|151|Industrial|0.1507231|665.69|0.127|AMR
09-27-2019|0010020836|0030038183|บริษัท กรุงเทพ ซินธิติกส์ จำกัด|151|Industrial|0.0248615|665.69|0.024|AMR
09-27-2019|0010021842|0030023236|บริษัท คอทโก้ เมททอลเวอร์คส จำกัด|151|Industrial|0.1994574|665.69|0.119|AMR
09-27-2019|0010021910|0030042490|บริษัท คาเนมิทสึ พูลเล่ย์ จำกัด|151|Industrial|0.0108769|665.69|0.008|AMR
09-27-2019|0010022868|0030047048|บริษัท ไออาร์พีซี คลีน พาวเวอร์ จำกัด|151|Industrial|0.2461787|665.69|2.145|AMR
09-27-2019|0010024055|0030064940|บริษัท โอจีพี เอนเนอร์ยี่ โซลูชั่นส์ จำกัด (สำหรับ บริษัท คันไซ เรซิน(ประเทศไทย) จำกัด)|151|Industrial|0.0000|665.69||ADQ
09-27-2019|0010024055|0030064941|บริษัท โอจีพี เอนเนอร์ยี่ โซลูชั่นส์ จำกัด (สำหรับ บริษัท นิปปอน สตีลไพพ์ (ประเทศไทย) จำกัด โรงงาน 1)|151|Industrial|0.0000|665.69||ADQ
09-27-2019|0010027459|0030011637|บริษัท โอสถสภา จำกัด (มหาชน)|151|Industrial|2.5024349|665.69|2.438|AMR
09-27-2019|0010027591|0030000157|บริษัท ซีพีเอฟ ฟู้ด แอนด์ เบฟเวอร์เรจ จำกัด|151|Industrial|0.2713581|665.69|0.209|AMR
09-27-2019|0010000003|0030000003|บริษัท เขาช่องอุตสาหกรรม 1979 จำกัด|151|Industrial|0.510933|665.69|0.455|AMR
09-27-2019|0010000016|0030000016|บริษัท ลิกซิล (ประเทศไทย) จำกัด (มหาชน)|151|Industrial|0.8991828|665.69|0.847|AMR
09-27-2019|0010000016|0030000100|บริษัท ลิกซิล (ประเทศไทย) จำกัด (มหาชน)|151|Industrial|0.50666|665.69|0.376|AMR
09-27-2019|0010000031|0030000031|บริษัท วิลเลรอย แอนด์ บอค (ประเทศไทย) จำกัด|151|Industrial|0.5988313|665.69|0.613|AMR
09-27-2019|0010000032|0030000032|บริษัท รอยัลปอร์ซเลน จำกัด (มหาชน)|151|Industrial|1.0848675|665.69|0.99|AMR
09-27-2019|0010000047|0030000047|บริษัท โพสโค-ไทยน๊อคซ์ จำกัด (มหาชน)|151|Industrial|1.2960848|665.69|1.308|AMR
09-27-2019|0010000056|0030000059|บริษัท โอเอสซี สยามซิลิกา จำกัด|151|Industrial|1.8316322|665.69|1.617|AMR
09-27-2019|0010000067|0030000067|บริษัท มิลล์คอน บูรพา จำกัด|151|Industrial|1.6332342|665.69|1.26|AMR
09-27-2019|0010000076|0030000076|บริษัท สยามสไตรีนโมโนเมอร์ จำกัด|151|Industrial|3.2237023|665.69|3.276|AMR
09-27-2019|0010000091|0030000091|บริษัท สยาม เอ็นจีเค เทคโนเซรา จำกัด|151|Industrial|0.1255084|665.69|0.181|AMR
09-27-2019|0010000092|0030000092|บริษัท ไทย-สแกนดิค สตีล จำกัด|151|Industrial|0.0714063|665.69|0.067|AMR
09-27-2019|0010000108|0030000112|บริษัท ยูนิตี้ อินดัสเตรียล จำกัด|151|Industrial|0.0000|665.69|0.017|AMR
09-27-2019|0010000109|0030000113|บริษัท ระยองไวร์ อินดัสตรีส์ จำกัด(มหาชน)|151|Industrial|0.0084402|665.69|0.028|AMR
09-27-2019|0010000128|0030000132|บริษัท เซกิซุย เอส-เล็ค (ประเทศไทย)จำกัด|151|Industrial|0.070594|665.69|0.07|AMR
09-27-2019|0010000140|0030000145|บริษัท สยามลวดเหล็กอุตสาหกรรม จำกัด|151|Industrial|0.0000|665.69|0.068|AMR
09-27-2019|0010000151|0030000156|บริษัท มิตซูบิชิ อีเล็คทริค ออโตเมชั่น (ประเทศไทย) จำกัด|151|Industrial|0.22725|665.69|0.216|AMR
09-27-2019|0010000161|0030000167|บริษัท ไทยซัมซุง อิเลคโทรนิคส์ จำกัด|151|Industrial|0.3848242|665.69|0.311|AMR
09-27-2019|0010000203|0030000236|บริษัท สิงห์ คาเมดะ (ประเทศไทย) จำกัด|151|Industrial|0.2502399|665.69|0.229|AMR
09-27-2019|0010000205|0030000238|บริษัท ไทยอาซาคาวา จำกัด|151|Industrial|0.0690049|665.69|0.068|AMR
09-27-2019|0010000221|0030011437|บริษัท วีนิไทย จำกัด (มหาชน)|151|Industrial|2.5915692|665.69|2.438|AMR
09-27-2019|0010000224|0030000250|บริษัท ออมโนวา เอ็นจิเนียร์ด เซอร์เฟสเซส (ประเทศไทย) จำกัด|151|Industrial|0.1854728|665.69|0.304|AMR
09-27-2019|0010001131|0030044478|บริษัท นอริตาเก้ เอสซีจี พลาสเตอร์จำกัด|151|Industrial|0.1227538|665.69|0.163|AMR
09-27-2019|0010001727|0030020317|บริษัท ไทยเซ็นทรัลเคมี จำกัด (มหาชน)|151|Industrial|0.4829285|665.69|0.29|AMR
09-27-2019|0010002092|0030016062|บริษัท สยามแผ่นเหล็กวิลาส จำกัด|151|Industrial|0.0000|665.69|0.119|AMR
09-27-2019|0010006616|0030010020|บริษัท บริดจสโตน คาร์บอน แบล็ค (ประเทศไทย) จำกัด|151|Industrial|0.7425975|665.69|0.201|AMR
09-27-2019|0010006733|0030023785|บริษัท เดลี่ฟู้ดส์ จำกัด|151|Industrial|0.0634605|665.69|0.05|AMR
09-27-2019|0010006972|0030011249|บริษัท สยาม ยามาโมริ จำกัด|151|Industrial|0.040294|665.69|0.024|AMR
09-27-2019|0010007875|0030013765|บริษัท วนชัย เคมีคอล อินดัสทรี่ส์จำกัด|151|Industrial|0.115585|665.69|0.117|AMR
09-27-2019|0010008509|0030016162|บริษัท ผลิตภัณฑ์ตราเพชร จำกัด (มหาชน)|151|Industrial|0.1230364|665.69|0.087|AMR
09-27-2019|0010009070|0030018984|บริษัท โมเดอร์น ไดสตัฟส์ แอนด์พิคเมนท์ส จำกัด|151|Industrial|0.1840955|665.69|0.189|AMR
09-27-2019|0010009085|0030056942|บจ.แดรี่ พลัส|151|Industrial|0.7692601|665.69|0.659|AMR
09-27-2019|0010009180|0030044623|บริษัท ไทย มาลายา กลาส จำกัด|151|Industrial|4.368499|665.69|4.443|AMR
09-27-2019|0010009196|0030019599|บริษัท ราชราตัน ไทย ไวร์ จำกัด|151|Industrial|0.0000|665.69|0.177|AMR
09-27-2019|0010009604|0030020797|บริษัท เจ.พี ยูไนเต็ด จำกัด|151|Industrial|0.0583751|665.69|0.031|AMR
09-27-2019|0010009784|0030021478|บริษัท แคททาเลอร์ (ประเทศไทย) จำกัด|151|Industrial|0.1351846|665.69|0.119|AMR
09-27-2019|0010010423|0030024015|บริษัท ศานติบรรจุภัณฑ์ จำกัด|151|Industrial|0.1853668|665.69|0.182|AMR
09-27-2019|0010011784|0030030288|บริษัท สยามเลเทกซ์ สังเคราะห์ จำกัด|151|Industrial|0.9316017|665.69|1.129|AMR
09-27-2019|0010012320|0030026468|บริษัท พีทีที โกลบอล เคมิคอล จำกัด(มหาชน)|151|Industrial|4.9347349|665.69|2.531|AMR
09-27-2019|0010021112|0030041494|บริษัท เจเอสอาร์ บีเอสที อิลาสโตเมอร์ จำกัด|151|Industrial|0.1134661|665.69|0.125|AMR
09-27-2019|0010021117|0030000123|บริษัท ซีพีเอฟ (ประเทศไทย) จำกัด(มหาชน)|152|Industrial-CoGen|1.3249722|665.69|1.361|AMR
09-27-2019|0010022317|0030043685|บริษัท ไซมีส อีโคไลท์ จำกัด|151|Industrial|0.0000|665.69|0.074|AMR
09-27-2019|0010022333|0030043703|บริษัท เอเชียแปซิฟิกกลาส จำกัด|151|Industrial|2.173761|665.69|2.025|AMR
09-27-2019|0010023651|0030048793|บริษัท ไคฮาระ (ประเทศไทย) จำกัด|151|Industrial|0.4076375|665.69|0.235|AMR
09-27-2019|0010025615|0030053102|บริษัท เอ็นจีเค เซรามิคส์ (ประเทศไทย) จำกัด|151|Industrial|0.4095445|665.69|0.326|AMR
09-27-2019|0010026111|0030055031|บริษัท กบินทร์บุรีกล๊าส อินดัสทรีจำกัด|151|Industrial|2.8995487|665.69|2.782|AMR
09-27-2019|0010026153|0030054741|บริษัท นิคเคอิ เอ็มซี อลูมินัม (ประเทศไทย) จำกัด|151|Industrial|0.0000|665.69|0.218|AMR
09-27-2019|0010027861|0030000018|บริษัท เอสซีจี เซรามิกส์ จำกัด (มหาชน)|151|Industrial|1.5213219|665.69|2.695|AMR
09-27-2019|0010000004|0030000004|บริษัท ไทย คอปเปอร์ ร็อด จำกัด|151|Industrial|0.2151724|665.69|0.198|AMR
09-27-2019|0010000005|0030000005|บริษัท ไทยเมทัลโพรเซสซิ่ง จำกัด|151|Industrial|0.2735123|665.69|0.404|AMR
09-27-2019|0010000019|0030000019|บริษัท ไดนาสตี้ เซรามิค จำกัด (มหาชน)|151|Industrial|4.55097|665.69|4.982|AMR
09-27-2019|0010000033|0030000104|บริษัท โรแยล ซีรามิค อุตสาหกรรม จำกัด (มหาชน)|151|Industrial|2.2066743|665.69|2.088|AMR
09-27-2019|0010000043|0030000043|บริษัท ไทย จีซีไอ เรซิท็อป จำกัด|151|Industrial|0.2862256|665.69|0.289|AMR
09-27-2019|0010000046|0030000046|บริษัท ไทยแทฟฟิต้า จำกัด|151|Industrial|0.0000|665.69|0.006|AMR
09-27-2019|0010000054|0030000054|บริษัท บางกอก คริสตัล จำกัด|151|Industrial|0.8339566|665.69|0.834|AMR
09-27-2019|0010000056|0030000056|บริษัท โอเอสซี สยามซิลิกา จำกัด|151|Industrial|2.1826956|665.69|1.855|AMR
09-27-2019|0010000064|0030000243|บริษัท ลี่ไท่ อัลลอย จำกัด|151|Industrial|0.2749249|665.69|0.203|AMR
09-27-2019|0010000065|0030000065|บริษัท สยามโพลีสไตรีน จำกัด|151|Industrial|0.0489108|665.69|0.066|AMR
09-27-2019|0010000077|0030000077||151|Industrial|1.0925661|665.69|1.675|AMR
09-27-2019|0010000078|0030000078|บริษัท ไทเท็กซ์ เอเซีย จำกัด|151|Industrial|0.0817182|665.69|0.162|AMR
09-27-2019|0010000080|0030000080|บริษัท เอ็นเอส บลูสโคป (ประเทศไทย)จำกัด|151|Industrial|0.4440117|665.69|1.06|AMR
09-27-2019|0010000093|0030000093|บริษัท จีซี-เอ็ม พีทีเอ จำกัด|151|Industrial|2.7322277|665.69|2.794|AMR
09-27-2019|0010000110|0030000114|บริษัท ระยอง กัลวาไนซิ่ง จำกัด|151|Industrial|0.0632839|665.69|0.071|AMR
09-27-2019|0010000120|0030000124|บริษัท ลอยัล ไฮ่เหลียง คอปเปอร์ (ประเทศไทย) จำกัด|151|Industrial|0.0331251|665.69|0.029|AMR
09-27-2019|0010000134|0030000139|บริษัท วันไทยอุตสาหกรรมการอาหาร จำกัด|151|Industrial|1.2493281|665.69|1.068|AMR
09-27-2019|0010000145|0030000150|บริษัท แสตนดาร์ดแคน จำกัด|151|Industrial|0.359998|665.69|0.26|AMR
09-27-2019|0010000158|0030000164|บริษัท นิวพลัสนิตติ้ง จำกัด (มหาชน)|151|Industrial|0.0062507|665.69|0.007|AMR
09-27-2019|0010000195|0030033440|บริษัท ไทยลู้บเบส จำกัด (มหาชน)|151|Industrial|5.6973911|665.69|5.14|AMR
09-27-2019|0010000216|0030049389|บริษัท ไออาร์พีซี จำกัด (มหาชน)|151|Industrial|7.3119086|665.69|7.866|AMR
09-27-2019|0010000228|0030000254|บริษัท ไทย เพ็ท เรซิน จำกัด|151|Industrial|1.0739553|665.69|1.072|AMR
09-27-2019|0010001217|0030021463|บริษัท แอมคอล อินเตอร์เนชั่นแนล (ไทยแลนด์) จำกัด|151|Industrial|0.1929948|665.69|0.082|AMR
09-27-2019|0010001431|0030053506|บริษัท คาราบาวตะวันแดง จำกัด|151|Industrial|0.2604105|665.69|0.238|AMR
09-27-2019|0010001741|0030022479|บริษัท อลูมิเนียม ฉื่อ จิ้น ฮั้ว จำกัด|151|Industrial|0.4355008|665.69|0.441|AMR
09-27-2019|0010002201|0030011779|บริษัท ควอลิตี้ คอฟฟี่ โปรดักท์ส จำกัด|151|Industrial|0.0000|665.69|0.886|AMR
09-27-2019|0010006548|0030009620|บริษัท อีเลคโทรลักซ์ ประเทศไทย จำกัด|151|Industrial|0.0311122|665.69|0.035|AMR
09-27-2019|0010006939|0030011133|บริษัท นิเด็ค ค็อมโปเน็นท์ เทคโนโลยี (ไทยแลนด์) จำกัด|151|Industrial|0.4707802|665.69|0.408|AMR
09-27-2019|0010006940|0030011137|บริษัท เอส ที บี เท็กซ์ไทล์ อินดัสตรี จำกัด|151|Industrial|0.061271|665.69|0.035|AMR
09-27-2019|0010007512|0030040636|บริษัท คราวน์ เบ็บแคน แอนด์ โคลสเชอร์ส (ประเทศไทย) จำกัด|151|Industrial|0.0000|665.69|0.148|AMR
09-27-2019|0010007561|0030013097|บริษัท บางชันเยนเนอเรลเอเซมบลี จำกัด|151|Industrial|0.0021895|665.69|0.015|AMR
09-27-2019|0010008206|0030033172|บริษัท เอ็นเนซอล จำกัด|152|Industrial-CoGen|1.4291859|665.69|1.186|AMR
09-27-2019|0010008657|0030016715|บริษัท คิริว (ประเทศไทย) จำกัด|151|Industrial|0.0221776|665.69|0.035|AMR
09-27-2019|0010009151|0030019200|บริษัท ไทย เกลซ อุตสาหกรรม จำกัด|151|Industrial|0.3857424|665.69|0.307|AMR
09-27-2019|0010009176|0030019559|บริษัท พูแรค (ประเทศไทย) จำกัด|151|Industrial|2.3645663|665.69|2.128|AMR
09-27-2019|0010009390|0030020154|บริษัท อัลวา อะลูมิเนียม จำกัด|151|Industrial|0.305684|665.69|0.215|AMR
09-27-2019|0010010116|0030022714|บริษัท ยัสปาลแอนด์ซันส์ จำกัด|151|Industrial|0.0898405|665.69|0.087|AMR
09-27-2019|0010011367|0030027987|บริษัท มิลลิเมด จำกัด|151|Industrial|0.0430133|665.69|0.03|AMR
09-27-2019|0010012320|0030000055|บริษัท พีทีที โกลบอล เคมิคอล จำกัด(มหาชน)|151|Industrial|0.0019776|665.69|0.002|AMR
09-27-2019|0010012320|0030000069|บริษัท พีทีที โกลบอล เคมิคอล จำกัด(มหาชน)|151|Industrial|2.7298969|665.69|6.038|AMR
09-27-2019|0010012393|0030033336|บริษัท จรุงไทยไวร์แอนด์เคเบิ้ล จำกัด (มหาชน)|151|Industrial|0.2088511|665.69|0.056|AMR
09-27-2019|0010021117|0030022988|บริษัท ซีพีเอฟ (ประเทศไทย) จำกัด(มหาชน)|152|Industrial-CoGen|0.0000|665.69|0.261|AMR
09-27-2019|0010021117|0030022988|บริษัท ซีพีเอฟ (ประเทศไทย) จำกัด(มหาชน)|151|Industrial|0.6345698|665.69|0.45|AMR
09-27-2019|0010022444|0030044003|บริษัท ทีวาย สตีล จำกัด|151|Industrial|0.1517472|665.69|0.247|AMR
09-27-2019|0010023436|0030052175|บริษัท ซันโทรี่ เป๊ปซี่โค เบเวอเรจ(ประเทศไทย) จำกัด|151|Industrial|0.0739136|665.69|0.167|AMR
09-27-2019|0010023548|0030000131|บริษัท โคเวสโตร (ประเทศไทย) จำกัด|151|Industrial|0.5070131|665.69|0.517|AMR
09-27-2019|0010026634|0030054698|บริษัท คานายามา คาเซอิ (ประเทศไทย)จำกัด|158|NG by Truck|0.5940|665.69|0.661|ADQ
09-27-2019|0010026674|0030017326|บริษัท ไทยเพรซิเดนท์ฟูดส์ จำกัด(มหาชน)|151|Industrial|0.8179237|665.69|0.586|AMR
09-27-2019|0010027591|0030024290|บริษัท ซีพีเอฟ ฟู้ด แอนด์ เบฟเวอร์เรจ จำกัด|151|Industrial|0.7974059|665.69|0.753|AMR
09-27-2019|0010027600|0030058148|บริษัท เอเชีย แคน แมนูแฟคเจอริ่ง จำกัด|151|Industrial|0.1167503|665.69|0.125|AMR
09-27-2019|0010027807|0030064609|บริษัท เช่วเฉิน ซิลิก้า (ไทยแลนด์)จำกัด|151|Industrial|0.00009|665.69|0.40|ADQ
09-27-2019|0010000006|0030000006|บริษัท ธนอินเตอร์ จำกัด|151|Industrial|0.0139139|665.69|0.005|AMR
09-27-2019|0010000007|0030000007|บริษัท บี เอ็น เอส เอส สตีลกรุ๊ป จำกัด|151|Industrial|0.0000|665.69|0.351|AMR
09-27-2019|0010000022|0030000022|บริษัท ไทยบริดจสโตน จำกัด|151|Industrial|0.461775|665.69|1.324|AMR
