Date|Sold to|Ship to|Ship to name|ContractType|Description|Volume(MMSCFD)|DemandPlan(BI)|MDCQ(BW)|Billing Type
09-27-2019|0010000022|0030000022|บริษัท ไทยบริดจสโตน จำกัด|152|Industrial-CoGen|1.9330913|665.69|0.436|AMR
09-27-2019|0010000035|0030000035|บริษัท สยามซานิทารีแวร์อินดัสทรี จำกัด|151|Industrial|1.1325071|665.69|0.887|AMR
09-27-2019|0010000036|0030000036|บริษัท สยามฟูรูกาวา จำกัด|151|Industrial|0.2927941|665.69|0.25|AMR
09-27-2019|0010000049|0030000049|บริษัท ไทยผลิตภัณฑ์ยิบซั่ม จำกัด(มหาชน)|151|Industrial|2.4298279|665.69|1.568|AMR
09-27-2019|0010000057|0030000057|บริษัท พี เอส เมททอลเวอกส์ จำกัด|151|Industrial|0.0503587|665.69|0.017|AMR
09-27-2019|0010000058|0030000058|บริษัท พีคิว เคมิคอลส์ (ประเทศไทย)จำกัด|151|Industrial|0.1773857|665.69|0.159|AMR
09-27-2019|0010000074|0030000074|บริษัท ไทยเบเวอร์เรจแคน จำกัด|151|Industrial|0.5233991|665.69|0.541|AMR
09-27-2019|0010000089|0030000089|บริษัท ธนเสริมอุตสาหกรรมฝาขวด จำกัด|151|Industrial|0.0918888|665.69|0.057|AMR
09-27-2019|0010000098|0030000098|บริษัท อีโอซีโพลิเมอร์ส (ไทยแลนด์)จำกัด|151|Industrial|0.0694993|665.69|0.031|AMR
09-27-2019|0010000116|0030034491|บริษัท มิตซูบิชิ มอเตอร์ส (ประเทศไทย) จำกัด|151|Industrial|0.2047899|665.69|0.132|AMR
09-27-2019|0010000117|0030000121|บริษัท ไทยซิลิเกตเคมิคัล จำกัด|151|Industrial|0.6733453|665.69|0.731|AMR
09-27-2019|0010000133|0030000138|บริษัท เอ.เจ. พลาสท์ จำกัด (มหาชน)|151|Industrial|0.6308618|665.69|0.648|AMR
09-27-2019|0010000141|0030000146|บริษัท สยามสตีล กัลวาไนซิ่ง จำกัด|151|Industrial|0.1455671|665.69|0.186|AMR
09-27-2019|0010000155|0030000161|บริษัท มาเล่ย์ เอ็นจิ่น คอมโพเน็นท์(ประเทศไทย) จำกัด|151|Industrial|0.0834133|665.69|0.089|AMR
09-27-2019|0010000178|0030016267|บริษัท โกลว์ เอสพีพี 11 จำกัด|152|Industrial-CoGen|1.8283479|665.69|1.34978|AMR
09-27-2019|0010000206|0030000239|บริษัท เฮลซ์เทรดดิ้ง (ประเทศไทย) จำกัด|151|Industrial|0.0481692|665.69|0.035|AMR
09-27-2019|0010000225|0030011191|บริษัท ซีพีพีซี จำกัด (มหาชน) (Coating Plant)|151|Industrial|0.0000|665.69|0.01|AMR
09-27-2019|0010000226|0030000252|บริษัท ซัมมิท โชว่าแมนูแฟคเจอริ่งจำกัด|151|Industrial|0.1292164|665.69|0.109|AMR
09-27-2019|0010001609|0030015621|บริษัท โตโยต้า มอเตอร์ ประเทศไทย จำกัด|151|Industrial|0.5651764|665.69|0.506|AMR
09-27-2019|0010001727|0030020317|บริษัท ไทยเซ็นทรัลเคมี จำกัด (มหาชน)|152|Industrial-CoGen|0.0000|665.69|0.337|AMR
09-27-2019|0010001740|0030022424|บริษัท โรงงานเหล็กกรุงเทพฯ จำกัด|151|Industrial|2.3036838|665.69|1.244|AMR
09-27-2019|0010002094|0030018793|บริษัท พ้อตเตอร์ส (ประเทศไทย) จำกัด|151|Industrial|0.2518997|665.69|0.26|AMR
09-27-2019|0010002109|0030030514|บริษัท ลักกี้กลาส จำกัด|151|Industrial|0.8134034|665.69|0.623|AMR
09-27-2019|0010006748|0030010640|บริษัท ยูเนี่ยนโชจิรุชิ จำกัด|151|Industrial|0.0161388|665.69|0.013|AMR
09-27-2019|0010007060|0030011444|บริษัท สยามร่วมมิตร จำกัด|151|Industrial|0.1894633|665.69|0.094|AMR
09-27-2019|0010007112|0030011636|บริษัท ไทยซัมมิท อีสเทิร์น ซีบอร์ดโอโตพาร์ท อินดัสตรี จำกัด|151|Industrial|0.048593|665.69|0.039|AMR
09-27-2019|0010007982|0030014211|บริษัท จีซี ไกลคอล จำกัด|151|Industrial|0.1147727|665.69|0.113|AMR
09-27-2019|0010008356|0030047608|บริษัท แสงไทยเมตัลดรัม จำกัด|151|Industrial|0.0315007|665.69|0.03|AMR
09-27-2019|0010008926|0030018384|บริษัท อินเตอร์เนชั่นแนล แลบบอราทอรีส์ จำกัด|151|Industrial|0.0173395|665.69|0.016|AMR
09-27-2019|0010008928|0030018387|บริษัท หลุยส์ผลิตภัณท์กาวเทป จำกัด|151|Industrial|0.5151708|665.69|0.299|AMR
09-27-2019|0010009228|0030019659|บริษัท ไทย เอ็มเอฟซี จำกัด|151|Industrial|0.1460262|665.69|0.149|AMR
09-27-2019|0010010005|0030022294|บริษัท คอทโก้ เอ็นซีอาร์ เปเปอร์ จำกัด|151|Industrial|0.0339021|665.69|0.035|AMR
09-27-2019|0010010061|0030022473|บริษัท แอมคอร์ เฟล็กซิเบิ้ล ระยองจำกัด|151|Industrial|0.0290286|665.69|0.032|AMR
09-27-2019|0010010605|0030024817|บริษัท มาบตาพุดโอเลฟินส์ จำกัด|151|Industrial|5.1174531|665.69|2.422|AMR
09-27-2019|0010010925|0030025431|บริษัท เน็กซ์ แคน อินโนเวชั่น จำกัด|151|Industrial|0.303106|665.69|0.367|AMR
09-27-2019|0010012227|0030032353|บริษัท เอ็มทีพี เอชพี เจวี (ประเทศไทย) จำกัด|151|Industrial|7.3733915|665.69|7.922|AMR
09-27-2019|0010012320|0030021767|บริษัท พีทีที โกลบอล เคมิคอล จำกัด(มหาชน)|153|Commercial|0.0128898|665.69|0.015|AMR
09-27-2019|0010012320|0030021767|บริษัท พีทีที โกลบอล เคมิคอล จำกัด(มหาชน)|154|Commercial–CoGen|0.1113472|665.69|0.073|AMR
09-27-2019|0010021117|0030000123|บริษัท ซีพีเอฟ (ประเทศไทย) จำกัด(มหาชน)|151|Industrial|0.449768|665.69|0.447|AMR
09-27-2019|0010022253|0030043488|บริษัท ที.ที.เซรามิค จำกัด (มหาชน)|151|Industrial|1.0534728|665.69|0.836|AMR
09-27-2019|0010022869|0030045768|บริษัท ยามาโมริ (ประเทศไทย) จำกัด|151|Industrial|0.0376454|665.69|0.021|AMR
09-27-2019|0010023379|0030049270|บริษัท ลาบิกซ์ จำกัด|151|Industrial|6.3701715|665.69|6.464|AMR
09-27-2019|0010026372|0030024061|บริษัท เคมีแมน จำกัด (มหาชน)|151|Industrial|1.5131642|665.69|1.12|AMR
09-27-2019|0010027861|0030000017|บริษัท เอสซีจี เซรามิกส์ จำกัด (มหาชน)|151|Industrial|3.6769665|665.69|4.00|AMR
09-27-2019|0010000012|0030000012|บริษัท อีสเทิร์นไชน่าแวร์ จำกัด|151|Industrial|0.2960431|665.69|0.305|AMR
09-27-2019|0010000013|0030000013|บริษัท ทาทา สตีล การผลิต (ประเทศไทย) จำกัด (มหาชน)|151|Industrial|2.4943832|665.69|2.252|AMR
09-27-2019|0010000027|0030000027|บริษัท ฝาจีบ จำกัด (มหาชน)|151|Industrial|0.4927106|665.69|0.501|AMR
09-27-2019|0010000028|0030000028|บริษัท เฟอร์โร (ประเทศไทย) จำกัด|151|Industrial|0.4678138|665.69|0.551|AMR
09-27-2019|0010000038|0030000102|บริษัท สหโมเสคอุตสาหกรรม จำกัด (มหาชน)|151|Industrial|2.0099714|665.69|2.111|AMR
09-27-2019|0010000039|0030000039|บริษัท โสสุโก้ เซรามิค จำกัด|151|Industrial|1.993656|665.69|2.211|AMR
09-27-2019|0010000053|0030020331|บริษัท ไทยอาซาฮีเคมีภัณฑ์ จำกัด|151|Industrial|0.3195627|665.69|0.396|AMR
09-27-2019|0010000062|0030000062|บริษัท สตาร์ ปิโตรเลียม รีไฟน์นิ่งจำกัด (มหาชน)|152|Industrial-CoGen|13.37469|665.69|13.688|ADQ
09-27-2019|0010000062|0030000062|บริษัท สตาร์ ปิโตรเลียม รีไฟน์นิ่งจำกัด (มหาชน)|151|Industrial|6.0124463|665.69|11.212|ADQ/AMR
09-27-2019|0010000071|0030000071|บริษัท เอสโซ่ (ประเทศไทย) จำกัด (มหาชน)|151|Industrial|3.7713|665.69|5.127|ADQ
09-27-2019|0010000073|0030000073|บริษัท ไฟน์ เม็ททัล เทคโนโลยีส์จำกัด (มหาชน)|151|Industrial|0.1350434|665.69|0.326|AMR
09-27-2019|0010000084|0030000084|บริษัท สยามอุตสาหกรรมวัสดุทนไฟ จำกัด|151|Industrial|1.1173924|665.69|1.261|AMR
09-27-2019|0010000099|0030000099|บริษัท เกรท วอลล์ มอเตอร์ แมนูแฟคเจอริ่ง (ประเทศไทย) จำกัด|151|Industrial|0.4353949|665.69|0.434|AMR
09-27-2019|0010000101|0030000103|บริษัท ร็อควูล (ประเทศไทย) จำกัด|151|Industrial|0.2350193|665.69|0.127|AMR
09-27-2019|0010000116|0030000120|บริษัท มิตซูบิชิ มอเตอร์ส (ประเทศไทย) จำกัด|151|Industrial|0.4403389|665.69|0.296|AMR
09-27-2019|0010000130|0030052374|บริษัท กรีนสปอต จำกัด|151|Industrial|0.3156781|665.69|0.251|AMR
09-27-2019|0010000131|0030000136|บริษัท การ์เดียนอินดัสทรีส์ ระยองจำกัด|151|Industrial|3.3808174|665.69|3.364|AMR
09-27-2019|0010000143|0030000148|บริษัท สยาม พุงซาน เมทัล จำกัด|151|Industrial|0.1915469|665.69|0.18|AMR
09-27-2019|0010000144|0030000149|บริษัท เบอร์ลี่ ยุคเกอร์ เซลล็อกซ์จำกัด|151|Industrial|0.5238935|665.69|0.462|AMR
09-27-2019|0010000156|0030000162|บริษัท เวลโกรว์กล๊าส อินดัสทรี จำกัด|151|Industrial|1.7676773|665.69|1.801|AMR
09-27-2019|0010000157|0030000163|บริษัท ไทยอะครีลิค จำกัด|151|Industrial|0.0000|665.69|0.004|AMR
09-27-2019|0010000191|0030043704|บริษัท ศักดิ์ไชยสิทธิ จำกัด|151|Industrial|0.9598182|665.69|0.623|AMR
09-27-2019|0010000192|0030043881|บริษัท แอร์ ลิควิด (ประเทศไทย) จำกัด|151|Industrial|2.7723098|665.69|2.561|AMR
09-27-2019|0010000207|0030000240|บริษัท สตาร์ส เทคโนโลยี อินดัสเตรียล จำกัด|151|Industrial|0.4018812|665.69|0.262|AMR
09-27-2019|0010000216|0030030499|บริษัท ไออาร์พีซี จำกัด (มหาชน)|152|Industrial-CoGen|49.1440417|665.69|50.907|FlowComp
09-27-2019|0010000227|0030000253|บริษัท จี เจ สตีล จำกัด (มหาชน)|151|Industrial|1.9470053|665.69|1.779|AMR
09-27-2019|0010001488|0030016945|บริษัท โพลีเพล็กซ์ (ประเทศไทย) จำกัด (มหาชน)|151|Industrial|1.0823955|665.69|1.071|AMR
09-27-2019|0010001605|0030051931||151|Industrial|0.2616466|665.69|0.261|AMR
09-27-2019|0010001879|0030026184|บริษัท เอ็ชเอ็มซี โปลีเมอส์ จำกัด|151|Industrial|0.4617043|665.69|0.491|AMR
09-27-2019|0010001913|0030020312|บริษัท เหล่าธงสิงห์ จำกัด|151|Industrial|0.2249546|665.69|0.105|AMR
09-27-2019|0010002964|0030024050|บริษัท สยามบราเดอร์ จำกัด|151|Industrial|0.1165738|665.69|0.08|AMR
09-27-2019|0010003009|0030053395|บริษัท มิตซูบิชิ อีเล็คทริค คอนซูมเมอร์ โปรดักส์ (ประเทศไทย) จำกัด|158|NG by Truck|0.0181|665.69|0.022|ADQ
09-27-2019|0010006922|0030011105|บริษัท อายิโนะโมะโต๊ะ (ประเทศไทย)จำกัด|151|Industrial|0.0000|665.69|0.069|AMR
09-27-2019|0010006922|0030020406|บริษัท อายิโนะโมะโต๊ะ (ประเทศไทย)จำกัด|152|Industrial-CoGen|0.0000|665.69|0.813|AMR
09-27-2019|0010007489|0030043669|บจ.ไซมีส เมอร์ชานไดส์|151|Industrial|0.0000|665.69|0.003|AMR
09-27-2019|0010008114|0030024767|บริษัท ทุนเท็กซ์ เท็กซ์ไทล์ (ประเทศไทย) จำกัด|151|Industrial|0.3345008|665.69|0.191|AMR
09-27-2019|0010008206|0030015236|บริษัท เอ็นเนซอล จำกัด|152|Industrial-CoGen|1.685959|665.69|1.175|AMR
09-27-2019|0010008739|0030038490|บริษัท สยามไฟเบอร์ซีเมนต์กรุ๊ป จำกัด|151|Industrial|0.0074867|665.69||AMR
09-27-2019|0010008758|0030016949|บริษัท คล็อกเนอร์ เพนทาพลาสท์ (ไทยแลนด์) จำกัด|151|Industrial|0.0202706|665.69|0.021|AMR
09-27-2019|0010009177|0030019562|บริษัท สยามโกชิ มานูแฟคเชอริ่ง จำกั|151|Industrial|0.1143843|665.69|0.094|AMR
09-27-2019|0010009582|0030020738|บริษัท คอทโก้ พลาสติกส์ จำกัด|151|Industrial|0.0934073|665.69|0.067|AMR
09-27-2019|0010010156|0030022920|บริษัท ไทยเคมีภัณฑ์ จำกัด|151|Industrial|0.1886511|665.69|0.264|AMR
09-27-2019|0010010216|0030023098|บริษัท สยามพรีเสิร์ฟ ฟู้ดส์ จำกัด|151|Industrial|0.1928182|665.69|0.146|AMR
09-27-2019|0010011538|0030028841|บริษัท ผลิตไฟฟ้าและพลังงานร่วม จำกัด|154|Commercial–CoGen|0.0000|665.69||ADQ
09-27-2019|0010011735|0030030004|บริษัท เนเชอรัล ก๊าซ ไซลินเดอร์ (ประเทศไทย) จำกัด|151|Industrial|0.0000|665.69|0.004|AMR
09-27-2019|0010012320|0030000072|บริษัท พีทีที โกลบอล เคมิคอล จำกัด(มหาชน)|152|Industrial-CoGen|12.33868|665.69|16.255|ADQ
09-27-2019|0010012320|0030000072|บริษัท พีทีที โกลบอล เคมิคอล จำกัด(มหาชน)|151|Industrial|31.2288913|665.69|22.844|ADQ/AMR
09-27-2019|0010012320|0030000168|บริษัท พีทีที โกลบอล เคมิคอล จำกัด(มหาชน)|151|Industrial|0.0000353|665.69|0.459|AMR
09-27-2019|0010015560|0030040907|บริษัท ลินเด้ ไฮโค จำกัด|151|Industrial|1.9976819|665.69|1.505|AMR
09-27-2019|0010021151|0030040140|บริษัท คนอฟ ยิปซั่ม (ประเทศไทย) จำกัด|151|Industrial|0.8713902|665.69|0.437|AMR
09-27-2019|0010022812|0030020778|บริษัท โกลบอล เพาเวอร์ ซินเนอร์ยี่จำกัด (มหาชน)|152|Industrial-CoGen|22.03516|665.69|21.505|FlowComp
09-27-2019|0010022812|0030020778|บริษัท โกลบอล เพาเวอร์ ซินเนอร์ยี่จำกัด (มหาชน)|151|Industrial|3.0096674|665.69|2.424|FlowComp
09-27-2019|0010024039|0030050402|บริษัท สุเพิร์บ พาวเวอร์ จำกัด|152|Industrial-CoGen|0.6130985|665.69|0.382|AMR
09-27-2019|0010024055|0030057123|บจ.โอจีพี เอนเนอร์ยี่ โซลูชั่นส์ (สำหรับ บจ.ซึชิโยชิ สมบูรณ์ โคเตทแซนด์)|151|Industrial|0.1864616|665.69|0.13|AMR
09-27-2019|0010027295|0030059173|บมจ.ปตท. น้ำมันและการค้าปลีก|158|NG by Truck|0.1480|665.69|0.139|ADQ
09-27-2019|0010027315|0030057427|บริษัท นิชินโบะ สมบูรณ์ ออโตโมทีฟ จำกัด|151|Industrial|0.0222482|665.69|0.003|AMR
09-27-2019|0010027861|0030000246|บริษัท เอสซีจี เซรามิกส์ จำกัด (มหาชน)|151|Industrial|1.8497839|665.69|2.495|AMR
09-27-2019|0010027861|0030046657|บริษัท เอสซีจี เซรามิกส์ จำกัด (มหาชน)|151|Industrial|0.2499221|665.69|0.244|AMR
09-27-2019|0010000008|0030000008|บริษัท ไมโครไฟเบอร์อุตสาหกรรม จำกัด|151|Industrial|0.3357721|665.69|0.291|AMR
09-27-2019|0010000023|0030000023|บริษัท ไทยเปอร์อ๊อกไซด์ จำกัด|151|Industrial|1.6552353|665.69|0.908|AMR
09-27-2019|0010000049|0030000049|บริษัท ไทยผลิตภัณฑ์ยิบซั่ม จำกัด(มหาชน)|152|Industrial-CoGen|1.1391109|665.69|0.783|AMR
09-27-2019|0010000050|0030000050|บริษัท ไทยพลาสติกและเคมีภัณฑ์ จำกัด(มหาชน)|151|Industrial|5.4687284|665.69|5.273|AMR
09-27-2019|0010000068|0030025580|บริษัท เหล็กสยามยามาโตะ จำกัด|151|Industrial|2.7565948|665.69|2.307|AMR
09-27-2019|0010000070|0030000070|บริษัท ทานิโอบิส จำกัด|151|Industrial|0.1765028|665.69|0.157|AMR
09-27-2019|0010000088|0030000088|บริษัท ไทยฟิล์มอินดัสตรี่ จำกัด (มหาชน)|151|Industrial|0.0000|665.69|0.016|AMR
09-27-2019|0010000111|0030000115|บริษัท อิวอนิก ยูไนเต็ด ซิลิกา (สยาม) จำกัด|151|Industrial|0.9415605|665.69|0.942|AMR
09-27-2019|0010000132|0030000137|บริษัท การ์เดียนอินดัสทรีส์ คอร์ปจำกัด|151|Industrial|3.6524934|665.69|3.735|AMR
09-27-2019|0010000148|0030000153|บริษัท เคนไซซีรามิคส์ อินดัสตรี้ จำกัด|151|Industrial|0.5871068|665.69|0.203|AMR
09-27-2019|0010000149|0030000154|บริษัท เอเวอรี่ เดนนิสสัน (ประเทศไทย) จำกัด|151|Industrial|0.0821419|665.69|0.067|AMR
09-27-2019|0010000197|0030025358|บริษัท บางจาก คอร์ปอเรชั่น จำกัด (มหาชน)|152|Industrial-CoGen|7.0632225|665.69|6.90|AMR
09-27-2019|0010000197|0030025358|บริษัท บางจาก คอร์ปอเรชั่น จำกัด (มหาชน)|151|Industrial|25.1785497|665.69|23.481|FlowComp
09-27-2019|0010000934|0030046753|บริษัท ฮอนด้า ออโตโมบิล (ประเทศไทย) จำกัด|151|Industrial|0.4070725|665.69|0.304|AMR
09-27-2019|0010001827|0030021652|บริษัท กรไทย จำกัด|151|Industrial|1.0290703|665.69|0.806|AMR
09-27-2019|0010006772|0030010740|บริษัท ไซเดน (ประเทศไทย) จำกัด|151|Industrial|0.0238021|665.69|0.018|AMR
09-27-2019|0010007594|0030013168|บริษัท ไลอ้อน (ประเทศไทย) จำกัด|151|Industrial|0.6056471|665.69|0.555|AMR
09-27-2019|0010008739|0030013343|บริษัท สยามไฟเบอร์ซีเมนต์กรุ๊ป จำกัด|151|Industrial|0.7107789|665.69||AMR
09-27-2019|0010009357|0030020016|บริษัท ซีพี-เมจิ จำกัด|152|Industrial-CoGen|0.4116634|665.69|0.307|AMR
09-27-2019|0010009357|0030020016|บริษัท ซีพี-เมจิ จำกัด|151|Industrial|0.4677078|665.69|0.498|AMR
09-27-2019|0010010998|0030026291|บริษัท งามดีอุตสาหกรรม จำกัด|151|Industrial|0.1333836|665.69|0.065|AMR
09-27-2019|0010012320|0030021481|บริษัท พีทีที โกลบอล เคมิคอล จำกัด(มหาชน)|151|Industrial|25.86319|665.69|26.055|ADQ
09-27-2019|0010021265|0030000095|บริษัท เอ็นเอส-สยามยูไนเต็ดสตีล จำกัด|151|Industrial|0.0000|665.69|1.977|AMR
09-27-2019|0010023667|0030000034|บริษัท สตาร์ ซานิทารี่แวร์ (ประเทศไทย) จำกัด|151|Industrial|0.0984573|665.69|0.092|AMR
09-27-2019|0010023967|0030050118|บริษัท โอซาก้า แก๊ส (ประเทศไทย) จำกัด|151|Industrial|0.2389039|665.69|0.194|AMR
09-27-2019|0010027591|0030024290|บริษัท ซีพีเอฟ ฟู้ด แอนด์ เบฟเวอร์เรจ จำกัด|152|Industrial-CoGen|0.3248599|665.69|0.197|AMR
09-27-2019|0010000001|0030000001|บริษัท กระจกลายสยาม จำกัด|151|Industrial|0.33293|665.69|0.34|ADQ
09-27-2019|0010000015|0030000015|บริษัท โคห์เลอร์ (ประเทศไทย) จำกัด(มหาชน)|151|Industrial|2.439151|665.69|2.341|AMR
09-27-2019|0010000030|0030000030|บริษัท ภัทราพอร์ซเลน จำกัด|151|Industrial|0.4552771|665.69|0.664|AMR
09-27-2019|0010000037|0030000037|บริษัท สยามไฟเบอร์กลาส จำกัด|151|Industrial|0.3556543|665.69|0.34|AMR
09-27-2019|0010000051|0030000051|บริษัท ไทยไวร์โพรดัคท์ จำกัด (มหาชน)|151|Industrial|0.0494758|665.69|0.038|AMR
09-27-2019|0010000061|0030000061|บริษัท ไมย์เออร์ อินดัสตรีส์ จำกัด|151|Industrial|0.5310977|665.69|0.383|AMR
09-27-2019|0010000071|0030000071|บริษัท เอสโซ่ (ประเทศไทย) จำกัด (มหาชน)|152|Industrial-CoGen|3.90093|665.69|10.502|ADQ
09-27-2019|0010000085|0030000085|บริษัท บางกอกอินดัสเทรียลแก๊ส จำกัด|151|Industrial|0.0352793|665.69|0.043|AMR
09-27-2019|0010000086|0030000086|บริษัท สยามคอมเพรสเซอร์อุตสาหกรรม จำกัด|151|Industrial|0.1383983|665.69|0.151|AMR
09-27-2019|0010000106|0030000109|บริษัท ไมย์เออร์ อลูมิเนียม (ประเทศไทย) จำกัด|151|Industrial|0.1453553|665.69|0.23|AMR
09-27-2019|0010000107|0030000111|บริษัท จี สตีล จำกัด (มหาชน)|151|Industrial|0.0000|665.69|1.969|AMR
09-27-2019|0010000122|0030000126|บริษัท บี เอ เอส เอฟ (ไทย) จำกัด|151|Industrial|0.6224922|665.69|0.446|AMR
09-27-2019|0010000123|0030000127|บริษัท สยามซานิทารีแวร์อินดัสทรี (หนองแค) จำกัด|151|Industrial|0.6786072|665.69|0.533|AMR
09-27-2019|0010000137|0030000142|บริษัท วาลเมท จำกัด|151|Industrial|0.0000|665.69|0.006|AMR
09-27-2019|0010000139|0030000144|บริษัท ยูเนี่ยนไพโอเนียร์ จำกัด(มหาชน)|151|Industrial|0.1167857|665.69|0.116|AMR
09-27-2019|0010000150|0030000155|บริษัท บริดจสโตน เมตัลฟา(ประเทศไทย) จำกัด|151|Industrial|0.2617525|665.69|0.307|AMR
09-27-2019|0010000159|0030000165|บริษัท ไทย-เยอรมัน สเปเชียลตี้ กลาสจำกัด|151|Industrial|0.0388814|665.69|0.038|AMR
09-27-2019|0010000160|0030000166|บริษัท คอนวูด จำกัด|151|Industrial|0.2835417|665.69|0.258|AMR
09-27-2019|0010000201|0030000021|บริษัท อดิตยา เบอร์ล่า เคมีคัลส์ (ประเทศไทย) จำกัด (ซัลไฟท์ส ดีวิชั่น)|151|Industrial|0.0830601|665.69|0.08|AMR
09-27-2019|0010000220|0030000249|บริษัท เอเชีย ซิลิโคนส์ โมโนเมอร์จำกัด|151|Industrial|3.8668537|665.69|3.544|AMR
