Date|Sold to|Ship to|Ship to name|ContractType|Description|Volume(MMSCFD)|DemandPlan(BI)|MDCQ(BW)|Billing Type
07-27-2019|0010023436|0030052175|บริษัท ซันโทรี่ เป๊ปซี่โค เบเวอเรจ(ประเทศไทย) จำกัด|151|Industrial|0.1337014|662.1|0.167|AMR
07-27-2019|0010023548|0030000131|บริษัท โคเวสโตร (ประเทศไทย) จำกัด|151|Industrial|0.5240348|662.1|0.517|AMR
07-27-2019|0010026752|0030055984|บริษัท เซกิซุย คาเซอิ (ไทยแลนด์) จำกัด|151|Industrial|0.0317479|662.1|0.063|AMR
07-27-2019|0010027130|0030056963|บริษัท แคนาเดียน โซลาร์ แมนูแฟคเจอริ่ง (ประเทศไทย) จำกัด|158|NG by Truck|0.02703|662.1|0.01|ADQ
07-27-2019|0010027938|0030059837|บริษัท ราชบุรีกล๊าส อินดัสทรี จำกัด|151|Industrial|1.7944458|662.1|1.485|AMR
07-27-2019|0010000011|0030000011|บริษัท อลูคอน จำกัด (มหาชน)|151|Industrial|0.9165577|662.1|1.203|AMR
07-27-2019|0010000026|0030000026|บริษัท บางกอกแคน แมนนูแฟคเจอริ่ง จำกัด|151|Industrial|0.1988923|662.1|0.281|AMR
07-27-2019|0010000027|0030000027|บริษัท ฝาจีบ จำกัด (มหาชน)|152|Industrial-CoGen|0.0192465|662.1|0.38|AMR
07-27-2019|0010000038|0030000038|บริษัท สหโมเสคอุตสาหกรรม จำกัด (มหาชน)|151|Industrial|0.4425285|662.1|0.40|AMR
07-27-2019|0010000052|0030000052|บริษัท ไทยออยล์ จำกัด (มหาชน)|151|Industrial|31.0672459|662.1|16.473|AMR/FlowComp
07-27-2019|0010000053|0030000053|บริษัท ไทยอาซาฮีเคมีภัณฑ์ จำกัด|151|Industrial|0.2188098|662.1|0.211|AMR
07-27-2019|0010000064|0030000243|บริษัท ลี่ไท่ อัลลอย จำกัด|151|Industrial|0.2807871|662.1|0.203|AMR
07-27-2019|0010000065|0030000065|บริษัท สยามโพลีสไตรีน จำกัด|151|Industrial|0.0520891|662.1|0.066|AMR
07-27-2019|0010000071|0030000071|บริษัท เอสโซ่ (ประเทศไทย) จำกัด (มหาชน)|151|Industrial|3.88445|662.1|5.127|ADQ
07-27-2019|0010000073|0030000073|บริษัท ไฟน์ เม็ททัล เทคโนโลยีส์จำกัด (มหาชน)|151|Industrial|0.0779042|662.1|0.326|AMR
07-27-2019|0010000088|0030000088|บริษัท ไทยฟิล์มอินดัสตรี่ จำกัด (มหาชน)|151|Industrial|0.0000|662.1|0.016|AMR
07-27-2019|0010000098|0030000098|บริษัท อีโอซีโพลิเมอร์ส (ไทยแลนด์)จำกัด|151|Industrial|0.0000|662.1|0.031|AMR
07-27-2019|0010000116|0030000120|บริษัท มิตซูบิชิ มอเตอร์ส (ประเทศไทย) จำกัด|151|Industrial|0.1149493|662.1|0.296|AMR
07-27-2019|0010000129|0030000133|บริษัท ทีพีซี เพสต์ เรซิน จำกัด|151|Industrial|0.3180088|662.1|0.28|AMR
07-27-2019|0010000130|0030000134|บริษัท กรีนสปอต จำกัด|151|Industrial|0.6242226|662.1|0.591|AMR
07-27-2019|0010000140|0030000145|บริษัท สยามลวดเหล็กอุตสาหกรรม จำกัด|151|Industrial|0.0746905|662.1|0.068|AMR
07-27-2019|0010000150|0030000155|บริษัท บริดจสโตน เมตัลฟา(ประเทศไทย) จำกัด|151|Industrial|0.3741945|662.1|0.307|AMR
07-27-2019|0010000156|0030000162|บริษัท เวลโกรว์กล๊าส อินดัสทรี จำกัด|151|Industrial|1.8258406|662.1|1.801|AMR
07-27-2019|0010000157|0030000163|บริษัท ไทยอะครีลิค จำกัด|151|Industrial|0.0000|662.1|0.004|AMR
07-27-2019|0010000201|0030000021|บริษัท อดิตยา เบอร์ล่า เคมีคัลส์ (ประเทศไทย) จำกัด (ซัลไฟท์ส ดีวิชั่น)|151|Industrial|0.0857794|662.1|0.08|AMR
07-27-2019|0010000207|0030000240|บริษัท สตาร์ส เทคโนโลยี อินดัสเตรียล จำกัด|151|Industrial|0.2230123|662.1|0.262|AMR
07-27-2019|0010000216|0030030499|บริษัท ไออาร์พีซี จำกัด (มหาชน)|152|Industrial-CoGen|50.0432341|662.1|50.907|FlowComp
07-27-2019|0010000228|0030000254|บริษัท ไทย เพ็ท เรซิน จำกัด|151|Industrial|1.0913654|662.1|1.072|AMR
07-27-2019|0010001217|0030021463|บริษัท แอมคอล อินเตอร์เนชั่นแนล (ไทยแลนด์) จำกัด|151|Industrial|0.0448143|662.1|0.082|AMR
07-27-2019|0010001431|0030053506|บริษัท คาราบาวตะวันแดง จำกัด|151|Industrial|0.2527826|662.1|0.238|AMR
07-27-2019|0010001827|0030021652|บริษัท กรไทย จำกัด|151|Industrial|0.7902017|662.1|0.806|AMR
07-27-2019|0010002201|0030011779|บริษัท ควอลิตี้ คอฟฟี่ โปรดักท์ส จำกัด|151|Industrial|0.8601954|662.1|0.886|AMR
07-27-2019|0010006616|0030010020|บริษัท บริดจสโตน คาร์บอน แบล็ค (ประเทศไทย) จำกัด|151|Industrial|0.0074514|662.1|0.201|AMR
07-27-2019|0010006733|0030023785|บริษัท เดลี่ฟู้ดส์ จำกัด|151|Industrial|0.0658972|662.1|0.05|AMR
07-27-2019|0010006939|0030011133|บริษัท นิเด็ค ค็อมโปเน็นท์ เทคโนโลยี (ไทยแลนด์) จำกัด|151|Industrial|0.4851886|662.1|0.408|AMR
07-27-2019|0010006940|0030011137|บริษัท เอส ที บี เท็กซ์ไทล์ อินดัสตรี จำกัด|151|Industrial|0.0020129|662.1|0.035|AMR
07-27-2019|0010007594|0030013168|บริษัท ไลอ้อน (ประเทศไทย) จำกัด|151|Industrial|0.7553108|662.1|0.555|AMR
07-27-2019|0010008288|0030015470|บริษัท อุตสาหกรรมทำเครื่องแก้วไทยจำกัด (มหาชน)|151|Industrial|6.3742327|662.1|6.401|AMR
07-27-2019|0010008289|0030015477|บริษัท ดี-รับเบอร์ โปรดักส์ จำกัด|151|Industrial|0.0352087|662.1|0.031|AMR
07-27-2019|0010009070|0030018984|บริษัท โมเดอร์น ไดสตัฟส์ แอนด์พิคเมนท์ส จำกัด|151|Industrial|0.074514|662.1|0.189|AMR
07-27-2019|0010009085|0030056942|บจ.แดรี่ พลัส|151|Industrial|0.0000|662.1|0.659|AMR
07-27-2019|0010009180|0030044623|บริษัท ไทย มาลายา กลาส จำกัด|151|Industrial|4.5178448|662.1|4.443|AMR
07-27-2019|0010009196|0030019599|บริษัท ราชราตัน ไทย ไวร์ จำกัด|151|Industrial|0.224778|662.1|0.177|AMR
07-27-2019|0010009841|0030021637|บริษัท โอวาริ เซกิ (ไทยแลนด์) จำกัด|151|Industrial|0.0055797|662.1|0.006|AMR
07-27-2019|0010010423|0030024015|บริษัท ศานติบรรจุภัณฑ์ จำกัด|151|Industrial|0.0003884|662.1|0.182|AMR
07-27-2019|0010011882|0030031074|บริษัท พีทีที อาซาฮี เคมิคอล จำกัด|151|Industrial|4.0951279|662.1|4.404|AMR
07-27-2019|0010012059|0030045449|บริษัท พีทีที เอ็มซีซี ไบโอเคม จำกัด|151|Industrial|0.5897554|662.1|0.322|AMR
07-27-2019|0010012393|0030033336|บริษัท จรุงไทยไวร์แอนด์เคเบิ้ล จำกัด (มหาชน)|151|Industrial|0.0000|662.1|0.056|AMR
07-27-2019|0010021117|0030022988|บริษัท ซีพีเอฟ (ประเทศไทย) จำกัด(มหาชน)|152|Industrial-CoGen|0.0003884|662.1|0.261|AMR
07-27-2019|0010021117|0030022988|บริษัท ซีพีเอฟ (ประเทศไทย) จำกัด(มหาชน)|151|Industrial|0.6256352|662.1|0.45|AMR
07-27-2019|0010022812|0030014300|บริษัท โกลบอล เพาเวอร์ ซินเนอร์ยี่จำกัด (มหาชน)|152|Industrial-CoGen|65.6563539|662.1|56.448|FlowComp
07-27-2019|0010024039|0030050402|บริษัท สุเพิร์บ พาวเวอร์ จำกัด|152|Industrial-CoGen|0.0000|662.1|0.382|AMR
07-27-2019|0010024055|0030057123|บจ.โอจีพี เอนเนอร์ยี่ โซลูชั่นส์ (สำหรับ บจ.ซึชิโยชิ สมบูรณ์ โคเตทแซนด์)|151|Industrial|0.1501934|662.1|0.13|AMR
07-27-2019|0010027295|0030059173|บมจ.ปตท. น้ำมันและการค้าปลีก|158|NG by Truck|0.14918|662.1|0.139|ADQ
07-27-2019|0010027315|0030057427|บริษัท นิชินโบะ สมบูรณ์ ออโตโมทีฟ จำกัด|151|Industrial|0.0070629|662.1|0.003|AMR
07-27-2019|0010028705|0030017241|บริษัท บีจี โฟลต กล๊าส จำกัด|151|Industrial|0.2364672|662.1|0.184|AMR
07-27-2019|0010029277|0030062577|บริษัท โรม เมคะเทค (ประเทศไทย) จำกัด|151|Industrial|0.0000|662.1||ADQ
