Date|Sold to|Ship to|Ship to name|ContractType|Description|Volume(MMSCFD)|DemandPlan(BI)|MDCQ(BW)|Billing Type
07-16-2019|0010000050|0030000050|บริษัท ไทยพลาสติกและเคมีภัณฑ์ จำกัด(มหาชน)|151|Industrial|5.4195704|662.1|5.273|AMR
07-16-2019|0010000061|0030000061|บริษัท ไมย์เออร์ อินดัสตรีส์ จำกัด|151|Industrial|0.5534872|662.1|0.383|AMR
07-16-2019|0010000068|0030025580|บริษัท เหล็กสยามยามาโตะ จำกัด|151|Industrial|2.1190585|662.1|2.307|AMR
07-16-2019|0010000070|0030000070|บริษัท ทานิโอบิส จำกัด|151|Industrial|0.1983979|662.1|0.157|AMR
07-16-2019|0010000083|0030000083|บริษัท เอจีซี แฟลทกลาส (ประเทศไทย)จำกัด (มหาชน)|151|Industrial|2.8167004|662.1|2.947|AMR
07-16-2019|0010000083|0030021634|บริษัท เอจีซี แฟลทกลาส (ประเทศไทย)จำกัด (มหาชน)|151|Industrial|4.4363738|662.1|3.778|AMR
07-16-2019|0010000091|0030000091|บริษัท สยาม เอ็นจีเค เทคโนเซรา จำกัด|151|Industrial|0.4477903|662.1|0.181|AMR
07-16-2019|0010000092|0030000092|บริษัท ไทย-สแกนดิค สตีล จำกัด|151|Industrial|0.0482398|662.1|0.067|AMR
07-16-2019|0010000108|0030000112|บริษัท ยูนิตี้ อินดัสเตรียล จำกัด|151|Industrial|0.0462622|662.1|0.017|AMR
07-16-2019|0010000109|0030000113|บริษัท ระยองไวร์ อินดัสตรีส์ จำกัด(มหาชน)|151|Industrial|0.0145143|662.1|0.028|AMR
07-16-2019|0010000122|0030000126|บริษัท บี เอ เอส เอฟ (ไทย) จำกัด|151|Industrial|0.6128513|662.1|0.446|AMR
07-16-2019|0010000123|0030000127|บริษัท สยามซานิทารีแวร์อินดัสทรี (หนองแค) จำกัด|151|Industrial|0.4103568|662.1|0.533|AMR
07-16-2019|0010000134|0030000139|บริษัท วันไทยอุตสาหกรรมการอาหาร จำกัด|151|Industrial|0.9838322|662.1|1.068|AMR
07-16-2019|0010000135|0030000140|บริษัท รอนเด็กซ์ (ประเทศไทย) จำกัด|151|Industrial|0.0000|662.1|0.03|AMR
07-16-2019|0010000146|0030000151|บริษัท จีเอฟพีที จำกัด (มหาชน)|151|Industrial|0.0337961|662.1|0.463|AMR
07-16-2019|0010000147|0030000152|บริษัท แมคคีย์ ฟู้ด เซอร์วิสเซส (ประเทศไทย) จำกัด|151|Industrial|0.3300511|662.1|0.262|AMR
07-16-2019|0010000156|0030000162|บริษัท เวลโกรว์กล๊าส อินดัสทรี จำกัด|151|Industrial|1.8523266|662.1|1.801|AMR
07-16-2019|0010000157|0030000163|บริษัท ไทยอะครีลิค จำกัด|151|Industrial|0.0000|662.1|0.004|AMR
07-16-2019|0010000161|0030000167|บริษัท ไทยซัมซุง อิเลคโทรนิคส์ จำกัด|151|Industrial|0.030865|662.1|0.311|AMR
07-16-2019|0010000197|0030025358|บริษัท บางจาก คอร์ปอเรชั่น จำกัด (มหาชน)|152|Industrial-CoGen|7.9938001|662.1|6.90|AMR
07-16-2019|0010000197|0030025358|บริษัท บางจาก คอร์ปอเรชั่น จำกัด (มหาชน)|151|Industrial|22.0851932|662.1|23.481|FlowComp
07-16-2019|0010000207|0030000240|บริษัท สตาร์ส เทคโนโลยี อินดัสเตรียล จำกัด|151|Industrial|0.0306178|662.1|0.262|AMR
07-16-2019|0010000216|0030030499|บริษัท ไออาร์พีซี จำกัด (มหาชน)|152|Industrial-CoGen|49.3306329|662.1|50.907|FlowComp
07-16-2019|0010000225|0030011191|บริษัท ซีพีพีซี จำกัด (มหาชน) (Coating Plant)|151|Industrial|0.0000|662.1|0.01|AMR
07-16-2019|0010000226|0030000252|บริษัท ซัมมิท โชว่าแมนูแฟคเจอริ่งจำกัด|151|Industrial|0.0228839|662.1|0.109|AMR
07-16-2019|0010001146|0030042053|บริษัท เคลล็อก (ประเทศไทย) จำกัด|151|Industrial|0.0043083|662.1|0.178|AMR
07-16-2019|0010001196|0030029791|บริษัท ไทยคูน เวิลด์ไวด์ กรุ๊ป (ประเทศไทย) จำกัด (มหาชน)|151|Industrial|1.7727979|662.1|1.55|AMR
07-16-2019|0010001727|0030020317|บริษัท ไทยเซ็นทรัลเคมี จำกัด (มหาชน)|152|Industrial-CoGen|0.4000449|662.1|0.337|AMR
07-16-2019|0010001740|0030022424|บริษัท โรงงานเหล็กกรุงเทพฯ จำกัด|151|Industrial|0.1856846|662.1|1.244|AMR
07-16-2019|0010001922|0030022692|บริษัท ฟู้ดแอนด์ดริ๊งส์ จำกัด (มหาชน)|151|Industrial|0.17124|662.1|0.156|ADQ
07-16-2019|0010003880|0030008767|บริษัท กังวาลเท็กซ์ไทล์ จำกัด|152|Industrial-CoGen|0.0000|662.1|1.367|AMR
07-16-2019|0010006755|0030027897|บริษัท ปูนซิเมนต์ไทย (ท่าหลวง) จำกัด|151|Industrial|0.0000|662.1|0.03|AMR
07-16-2019|0010006758|0030010658|บริษัท คอฟโค่ ไบโอเคมิคอล (ประเทศไทย) จำกัด|151|Industrial|0.698666|662.1|0.722|AMR
07-16-2019|0010006939|0030011133|บริษัท นิเด็ค ค็อมโปเน็นท์ เทคโนโลยี (ไทยแลนด์) จำกัด|151|Industrial|0.1757612|662.1|0.408|AMR
07-16-2019|0010006940|0030011137|บริษัท เอส ที บี เท็กซ์ไทล์ อินดัสตรี จำกัด|151|Industrial|0.0000|662.1|0.035|AMR
07-16-2019|0010007306|0030012309||151|Industrial|0.4460246|662.1|0.297|AMR
07-16-2019|0010007330|0030013313|บริษัท โกรเวล แอบเบรซีพ (ไทยแลนด์)จำกัด|151|Industrial|0.0476748|662.1|0.041|AMR
07-16-2019|0010007765|0030013679|บริษัท เอ.พี.ซี อุตสาหกรรม จำกัด|151|Industrial|0.0000|662.1|0.019|AMR
07-16-2019|0010007766|0030000094|บริษัท อินโดรามา ปิโตรเคม จำกัด|152|Industrial-CoGen|0.0000|662.1|0.054|AMR
07-16-2019|0010008289|0030015477|บริษัท ดี-รับเบอร์ โปรดักส์ จำกัด|151|Industrial|0.0000|662.1|0.031|AMR
07-16-2019|0010008739|0030013343|บริษัท สยามไฟเบอร์ซีเมนต์กรุ๊ป จำกัด|151|Industrial|0.4234938|662.1||AMR
07-16-2019|0010009151|0030019200|บริษัท ไทย เกลซ อุตสาหกรรม จำกัด|151|Industrial|0.3729585|662.1|0.307|AMR
07-16-2019|0010009176|0030019559|บริษัท พูแรค (ประเทศไทย) จำกัด|151|Industrial|2.5700979|662.1|2.128|AMR
07-16-2019|0010009228|0030019659|บริษัท ไทย เอ็มเอฟซี จำกัด|151|Industrial|0.0930189|662.1|0.149|AMR
07-16-2019|0010009604|0030020797|บริษัท เจ.พี ยูไนเต็ด จำกัด|151|Industrial|0.0658266|662.1|0.031|AMR
07-16-2019|0010009784|0030021478|บริษัท แคททาเลอร์ (ประเทศไทย) จำกัด|151|Industrial|0.0045555|662.1|0.119|AMR
07-16-2019|0010010116|0030022714|บริษัท ยัสปาลแอนด์ซันส์ จำกัด|151|Industrial|0.0909353|662.1|0.087|AMR
07-16-2019|0010011029|0030026047|บริษัท เอ็น ซี อาร์ รับเบอร์อินดัสตรี้ จำกัด|151|Industrial|0.0838724|662.1|0.066|AMR
07-16-2019|0010011163|0030026631|บริษัท ไทย อกริ เพาเวอร์ จำกัด|152|Industrial-CoGen|0.5411977|662.1|0.378|AMR
07-16-2019|0010012227|0030032353|บริษัท เอ็มทีพี เอชพี เจวี (ประเทศไทย) จำกัด|151|Industrial|8.1099502|662.1|7.922|AMR
07-16-2019|0010012393|0030033336|บริษัท จรุงไทยไวร์แอนด์เคเบิ้ล จำกัด (มหาชน)|151|Industrial|0.0000|662.1|0.056|AMR
07-16-2019|0010020998|0030039159||151|Industrial|0.0000|662.1|0.011|ADQ
07-16-2019|0010022253|0030043488|บริษัท ที.ที.เซรามิค จำกัด (มหาชน)|151|Industrial|0.7327447|662.1|0.836|AMR
07-16-2019|0010022868|0030047048|บริษัท ไออาร์พีซี คลีน พาวเวอร์ จำกัด|151|Industrial|2.4915227|662.1|2.145|AMR
07-16-2019|0010024055|0030064940|บริษัท โอจีพี เอนเนอร์ยี่ โซลูชั่นส์ จำกัด (สำหรับ บริษัท คันไซ เรซิน(ประเทศไทย) จำกัด)|151|Industrial|0.0000|662.1||ADQ
07-16-2019|0010024055|0030064941|บริษัท โอจีพี เอนเนอร์ยี่ โซลูชั่นส์ จำกัด (สำหรับ บริษัท นิปปอน สตีลไพพ์ (ประเทศไทย) จำกัด โรงงาน 1)|151|Industrial|0.0000|662.1||ADQ
07-16-2019|0010027459|0030011637|บริษัท โอสถสภา จำกัด (มหาชน)|151|Industrial|2.4611167|662.1|2.438|AMR
07-16-2019|0010027591|0030000157|บริษัท ซีพีเอฟ ฟู้ด แอนด์ เบฟเวอร์เรจ จำกัด|151|Industrial|0.2340658|662.1|0.209|AMR
07-16-2019|0010027861|0030000246|บริษัท เอสซีจี เซรามิกส์ จำกัด (มหาชน)|151|Industrial|2.3143488|662.1|2.495|AMR
07-16-2019|0010027861|0030046657|บริษัท เอสซีจี เซรามิกส์ จำกัด (มหาชน)|151|Industrial|0.2727001|662.1|0.244|AMR
07-16-2019|0010000006|0030000006|บริษัท ธนอินเตอร์ จำกัด|151|Industrial|0.0000|662.1|0.005|AMR
07-16-2019|0010000007|0030000007|บริษัท บี เอ็น เอส เอส สตีลกรุ๊ป จำกัด|151|Industrial|0.5511918|662.1|0.351|AMR
07-16-2019|0010000023|0030000023|บริษัท ไทยเปอร์อ๊อกไซด์ จำกัด|151|Industrial|0.8991828|662.1|0.908|AMR
07-16-2019|0010000037|0030000037|บริษัท สยามไฟเบอร์กลาส จำกัด|151|Industrial|0.3521581|662.1|0.34|AMR
07-16-2019|0010000049|0030000049|บริษัท ไทยผลิตภัณฑ์ยิบซั่ม จำกัด(มหาชน)|151|Industrial|0.0192818|662.1|1.568|AMR
07-16-2019|0010000057|0030000057|บริษัท พี เอส เมททอลเวอกส์ จำกัด|151|Industrial|0.0118657|662.1|0.017|AMR
07-16-2019|0010000058|0030000058|บริษัท พีคิว เคมิคอลส์ (ประเทศไทย)จำกัด|151|Industrial|0.1844839|662.1|0.159|AMR
07-16-2019|0010000071|0030000071|บริษัท เอสโซ่ (ประเทศไทย) จำกัด (มหาชน)|151|Industrial|3.88445|662.1|5.127|ADQ
07-16-2019|0010000073|0030000073|บริษัท ไฟน์ เม็ททัล เทคโนโลยีส์จำกัด (มหาชน)|151|Industrial|0.0646612|662.1|0.326|AMR
07-16-2019|0010000085|0030000085|บริษัท บางกอกอินดัสเทรียลแก๊ส จำกัด|151|Industrial|0.034114|662.1|0.043|AMR
07-16-2019|0010000086|0030000086|บริษัท สยามคอมเพรสเซอร์อุตสาหกรรม จำกัด|151|Industrial|0.0420244|662.1|0.151|AMR
07-16-2019|0010000106|0030000109|บริษัท ไมย์เออร์ อลูมิเนียม (ประเทศไทย) จำกัด|151|Industrial|0.3983145|662.1|0.23|AMR
07-16-2019|0010000107|0030000111|บริษัท จี สตีล จำกัด (มหาชน)|151|Industrial|2.771992|662.1|1.969|AMR
07-16-2019|0010000128|0030000132|บริษัท เซกิซุย เอส-เล็ค (ประเทศไทย)จำกัด|151|Industrial|0.0706647|662.1|0.07|AMR
07-16-2019|0010000136|0030000141|บริษัท ยูเนี่ยนไทย-นิจิบัน จำกัด|151|Industrial|0.4094386|662.1|0.363|AMR
07-16-2019|0010000148|0030000153|บริษัท เคนไซซีรามิคส์ อินดัสตรี้ จำกัด|151|Industrial|0.236114|662.1|0.203|AMR
07-16-2019|0010000149|0030000154|บริษัท เอเวอรี่ เดนนิสสัน (ประเทศไทย) จำกัด|151|Industrial|0.004944|662.1|0.067|AMR
07-16-2019|0010000201|0030000234|บริษัท อดิตยา เบอร์ล่า เคมีคัลส์ (ประเทศไทย) จำกัด(คลออัลคาลีดีวิชั่น)|151|Industrial|0.0202|662.1|0.024|AMR
07-16-2019|0010000201|0030020965|บริษัท อดิตยา เบอร์ล่า เคมีคัลส์ (ประเทศไทย) จำกัด (แอดวานซ์ แมททีเรียลส์)|151|Industrial|0.0741608|662.1|0.075|AMR
07-16-2019|0010000220|0030000249|บริษัท เอเชีย ซิลิโคนส์ โมโนเมอร์จำกัด|151|Industrial|3.5599689|662.1|3.544|AMR
07-16-2019|0010001013|0030023306|บริษัท เนสท์เล่ (ไทย) จำกัด|151|Industrial|0.0435077|662.1|0.037|AMR
07-16-2019|0010001125|0030039301|บริษัท ไทยโพลีอะซีทัล จำกัด|151|Industrial|0.0670273|662.1|0.081|AMR
07-16-2019|0010001741|0030022479|บริษัท อลูมิเนียม ฉื่อ จิ้น ฮั้ว จำกัด|151|Industrial|0.4093326|662.1|0.441|AMR
07-16-2019|0010002201|0030011779|บริษัท ควอลิตี้ คอฟฟี่ โปรดักท์ส จำกัด|151|Industrial|1.0223252|662.1|0.886|AMR
07-16-2019|0010006894|0030020321|บริษัท อาร์ต อุตสาหกรรม จำกัด|151|Industrial|0.0000|662.1|0.021|AMR
07-16-2019|0010007489|0030043669|บจ.ไซมีส เมอร์ชานไดส์|151|Industrial|0.0000|662.1|0.003|AMR
07-16-2019|0010008206|0030033172|บริษัท เอ็นเนซอล จำกัด|152|Industrial-CoGen|1.4342712|662.1|1.186|AMR
07-16-2019|0010008288|0030015470|บริษัท อุตสาหกรรมทำเครื่องแก้วไทยจำกัด (มหาชน)|151|Industrial|6.3818606|662.1|6.401|AMR
07-16-2019|0010009040|0030022254|บริษัท ไทยเรยอน จำกัด (มหาชน)|151|Industrial|1.2592162|662.1|0.905|AMR
07-16-2019|0010009442|0030020288|บริษัท อายิโนะโมะโต๊ะเซลส์ (ประเทศไทย) จำกัด|151|Industrial|0.0740196|662.1|0.057|AMR
07-16-2019|0010010605|0030024817|บริษัท มาบตาพุดโอเลฟินส์ จำกัด|151|Industrial|3.1059984|662.1|2.422|AMR
07-16-2019|0010010925|0030025431|บริษัท เน็กซ์ แคน อินโนเวชั่น จำกัด|151|Industrial|0.3913575|662.1|0.367|AMR
07-16-2019|0010012320|0030000055|บริษัท พีทีที โกลบอล เคมิคอล จำกัด(มหาชน)|151|Industrial|0.002366|662.1|0.002|AMR
07-16-2019|0010012320|0030026468|บริษัท พีทีที โกลบอล เคมิคอล จำกัด(มหาชน)|151|Industrial|4.4753259|662.1|2.531|AMR
07-16-2019|0010015560|0030040907|บริษัท ลินเด้ ไฮโค จำกัด|151|Industrial|1.1868917|662.1|1.505|AMR
07-16-2019|0010021265|0030040855|บริษัท เอ็นเอส-สยามยูไนเต็ดสตีล จำกัด|151|Industrial|1.6383195|662.1|1.275|AMR
07-16-2019|0010021577|0030041863|บริษัท นำวัฒนา แพ็คแอนด์พริ้นท์ จำกัด|151|Industrial|0.6501789|662.1|0.278|AMR
07-16-2019|0010022812|0030024457|บริษัท โกลบอล เพาเวอร์ ซินเนอร์ยี่จำกัด (มหาชน)|151|Industrial|3.5134948|662.1|3.848|AMR
07-16-2019|0010022812|0030063296|บริษัท โกลบอล เพาเวอร์ ซินเนอร์ยี่จำกัด (มหาชน)|152|Industrial-CoGen|1.5337509|662.1|16.00|FlowComp
07-16-2019|0010025615|0030053102|บริษัท เอ็นจีเค เซรามิคส์ (ประเทศไทย) จำกัด|151|Industrial|0.4064015|662.1|0.326|AMR
07-16-2019|0010026111|0030055031|บริษัท กบินทร์บุรีกล๊าส อินดัสทรีจำกัด|151|Industrial|2.7780661|662.1|2.782|AMR
07-16-2019|0010026153|0030054741|บริษัท นิคเคอิ เอ็มซี อลูมินัม (ประเทศไทย) จำกัด|151|Industrial|0.2556077|662.1|0.218|AMR
07-16-2019|0010027938|0030059837|บริษัท ราชบุรีกล๊าส อินดัสทรี จำกัด|151|Industrial|1.809949|662.1|1.485|AMR
07-16-2019|0010000011|0030000011|บริษัท อลูคอน จำกัด (มหาชน)|151|Industrial|0.9255982|662.1|1.203|AMR
07-16-2019|0010000026|0030000026|บริษัท บางกอกแคน แมนนูแฟคเจอริ่ง จำกัด|151|Industrial|0.2019647|662.1|0.281|AMR
07-16-2019|0010000027|0030000027|บริษัท ฝาจีบ จำกัด (มหาชน)|152|Industrial-CoGen|0.003037|662.1|0.38|AMR
07-16-2019|0010000038|0030000102|บริษัท สหโมเสคอุตสาหกรรม จำกัด (มหาชน)|151|Industrial|0.7912964|662.1|2.111|AMR
07-16-2019|0010000039|0030000039|บริษัท โสสุโก้ เซรามิค จำกัด|151|Industrial|2.4785622|662.1|2.211|AMR
07-16-2019|0010000053|0030020331|บริษัท ไทยอาซาฮีเคมีภัณฑ์ จำกัด|151|Industrial|0.4290736|662.1|0.396|AMR
07-16-2019|0010000062|0030000062|บริษัท สตาร์ ปิโตรเลียม รีไฟน์นิ่งจำกัด (มหาชน)|152|Industrial-CoGen|16.79382|662.1|13.688|ADQ
07-16-2019|0010000062|0030000062|บริษัท สตาร์ ปิโตรเลียม รีไฟน์นิ่งจำกัด (มหาชน)|151|Industrial|-16.7917272|662.1|11.212|ADQ/AMR
07-16-2019|0010000074|0030000074|บริษัท ไทยเบเวอร์เรจแคน จำกัด|151|Industrial|0.5537698|662.1|0.541|AMR
07-16-2019|0010000088|0030000088|บริษัท ไทยฟิล์มอินดัสตรี่ จำกัด (มหาชน)|151|Industrial|0.0000|662.1|0.016|AMR
07-16-2019|0010000098|0030000098|บริษัท อีโอซีโพลิเมอร์ส (ไทยแลนด์)จำกัด|151|Industrial|0.0000|662.1|0.031|AMR
07-16-2019|0010000113|0030000117|บริษัท คาร์ดิแนล เฮลท์ 222 (ประเทศไทย) จำกัด|151|Industrial|1.3650897|662.1|1.493|AMR
07-16-2019|0010000114|0030000118|บริษัท อิเมอร์สัน อิเล็คทริค (ประเทศไทย) จำกัด|151|Industrial|0.0292405|662.1|0.147|AMR
07-16-2019|0010000125|0030000129|บริษัท อาร์พีที เอเซีย จำกัด|151|Industrial|0.0259916|662.1|0.019|AMR
07-16-2019|0010000133|0030000138|บริษัท เอ.เจ. พลาสท์ จำกัด (มหาชน)|151|Industrial|0.6102733|662.1|0.648|AMR
07-16-2019|0010000143|0030000148|บริษัท สยาม พุงซาน เมทัล จำกัด|151|Industrial|0.0973273|662.1|0.18|AMR
07-16-2019|0010000144|0030000149|บริษัท เบอร์ลี่ ยุคเกอร์ เซลล็อกซ์จำกัด|151|Industrial|0.5044704|662.1|0.462|AMR
07-16-2019|0010000155|0030000161|บริษัท มาเล่ย์ เอ็นจิ่น คอมโพเน็นท์(ประเทศไทย) จำกัด|151|Industrial|0.1046727|662.1|0.089|AMR
07-16-2019|0010000191|0030043704|บริษัท ศักดิ์ไชยสิทธิ จำกัด|151|Industrial|1.0211951|662.1|0.623|AMR
07-16-2019|0010000192|0030043881|บริษัท แอร์ ลิควิด (ประเทศไทย) จำกัด|151|Industrial|2.7926864|662.1|2.561|AMR
07-16-2019|0010000216|0030049389|บริษัท ไออาร์พีซี จำกัด (มหาชน)|151|Industrial|8.0144592|662.1|7.866|AMR
07-16-2019|0010000916|0030044950|บริษัท ดาน่า สไปเซอร์ (ประเทศไทย) จำกัด|151|Industrial|0.0706647|662.1|0.105|AMR
07-16-2019|0010000925|0030022478|บริษัท ไทยสตีลโปรไฟล์ จำกัด (มหาชน)|151|Industrial|0.0000|662.1|0.899|AMR
07-16-2019|0010001727|0030020317|บริษัท ไทยเซ็นทรัลเคมี จำกัด (มหาชน)|151|Industrial|0.3339358|662.1|0.29|AMR
07-16-2019|0010002094|0030018793|บริษัท พ้อตเตอร์ส (ประเทศไทย) จำกัด|151|Industrial|0.2558903|662.1|0.26|AMR
07-16-2019|0010002109|0030030514|บริษัท ลักกี้กลาส จำกัด|151|Industrial|0.8352985|662.1|0.623|AMR
07-16-2019|0010006748|0030010640|บริษัท ยูเนี่ยนโชจิรุชิ จำกัด|151|Industrial|0.013243|662.1|0.013|AMR
07-16-2019|0010006922|0030011105|บริษัท อายิโนะโมะโต๊ะ (ประเทศไทย)จำกัด|151|Industrial|0.0000|662.1|0.069|AMR
07-16-2019|0010006922|0030020406|บริษัท อายิโนะโมะโต๊ะ (ประเทศไทย)จำกัด|152|Industrial-CoGen|0.0000|662.1|0.813|AMR
07-16-2019|0010007512|0030040636|บริษัท คราวน์ เบ็บแคน แอนด์ โคลสเชอร์ส (ประเทศไทย) จำกัด|151|Industrial|0.1510056|662.1|0.148|AMR
07-16-2019|0010007561|0030013097|บริษัท บางชันเยนเนอเรลเอเซมบลี จำกัด|151|Industrial|0.0016951|662.1|0.015|AMR
07-16-2019|0010007875|0030013765|บริษัท วนชัย เคมีคอล อินดัสทรี่ส์จำกัด|151|Industrial|0.1917588|662.1|0.117|AMR
07-16-2019|0010008356|0030047608|บริษัท แสงไทยเมตัลดรัม จำกัด|151|Industrial|0.0369744|662.1|0.03|AMR
07-16-2019|0010008739|0030038490|บริษัท สยามไฟเบอร์ซีเมนต์กรุ๊ป จำกัด|151|Industrial|0.0000|662.1||AMR
07-16-2019|0010008758|0030016949|บริษัท คล็อกเนอร์ เพนทาพลาสท์ (ไทยแลนด์) จำกัด|151|Industrial|0.0215419|662.1|0.021|AMR
07-16-2019|0010009177|0030019562|บริษัท สยามโกชิ มานูแฟคเชอริ่ง จำกั|151|Industrial|0.0000|662.1|0.094|AMR
07-16-2019|0010009357|0030020016|บริษัท ซีพี-เมจิ จำกัด|152|Industrial-CoGen|0.3769844|662.1|0.307|AMR
07-16-2019|0010009357|0030020016|บริษัท ซีพี-เมจิ จำกัด|151|Industrial|0.4211984|662.1|0.498|AMR
07-16-2019|0010009841|0030021637|บริษัท โอวาริ เซกิ (ไทยแลนด์) จำกัด|151|Industrial|0.00505|662.1|0.006|AMR
07-16-2019|0010010423|0030024015|บริษัท ศานติบรรจุภัณฑ์ จำกัด|151|Industrial|0.0000|662.1|0.182|AMR
07-16-2019|0010012118|0030062578|บริษัท พีทีที แอลเอ็นจี จำกัด|152|Industrial-CoGen|0.0000113|662.1|4.30|FlowComp
07-16-2019|0010012146|0030032044||151|Industrial|0.6109089|662.1|0.797|AMR
07-16-2019|0010012320|0030021767|บริษัท พีทีที โกลบอล เคมิคอล จำกัด(มหาชน)|153|Commercial|0.0000|662.1|0.015|AMR
07-16-2019|0010012320|0030021767|บริษัท พีทีที โกลบอล เคมิคอล จำกัด(มหาชน)|154|Commercial–CoGen|0.0000|662.1|0.073|AMR
