Date|Sold to|Ship to|Ship to name|ContractType|Description|Volume(MMSCFD)|DemandPlan(BI)|MDCQ(BW)|Billing Type
07-16-2019|0010021117|0030000123|บริษัท ซีพีเอฟ (ประเทศไทย) จำกัด(มหาชน)|151|Industrial|0.0915357|662.1|0.447|AMR
07-16-2019|0010022444|0030044003|บริษัท ทีวาย สตีล จำกัด|151|Industrial|0.2185273|662.1|0.247|AMR
07-16-2019|0010023651|0030048793|บริษัท ไคฮาระ (ประเทศไทย) จำกัด|151|Industrial|0.0438961|662.1|0.235|AMR
07-16-2019|0010026372|0030024061|บริษัท เคมีแมน จำกัด (มหาชน)|151|Industrial|1.485089|662.1|1.12|AMR
07-16-2019|0010027861|0030000017|บริษัท เอสซีจี เซรามิกส์ จำกัด (มหาชน)|151|Industrial|3.2690817|662.1|4.00|AMR
07-16-2019|0010000008|0030000008|บริษัท ไมโครไฟเบอร์อุตสาหกรรม จำกัด|151|Industrial|0.2929707|662.1|0.291|AMR
07-16-2019|0010000022|0030000022|บริษัท ไทยบริดจสโตน จำกัด|151|Industrial|0.5389023|662.1|1.324|AMR
07-16-2019|0010000022|0030000022|บริษัท ไทยบริดจสโตน จำกัด|152|Industrial-CoGen|0.0000|662.1|0.436|AMR
07-16-2019|0010000033|0030000104|บริษัท โรแยล ซีรามิค อุตสาหกรรม จำกัด (มหาชน)|151|Industrial|1.7345521|662.1|2.088|AMR
07-16-2019|0010000047|0030000047|บริษัท โพสโค-ไทยน๊อคซ์ จำกัด (มหาชน)|151|Industrial|1.7508321|662.1|1.308|AMR
07-16-2019|0010000056|0030000059|บริษัท โอเอสซี สยามซิลิกา จำกัด|151|Industrial|1.8196252|662.1|1.617|AMR
07-16-2019|0010000068|0030000068|บริษัท เหล็กสยามยามาโตะ จำกัด|151|Industrial|2.8623976|662.1|2.882|AMR
07-16-2019|0010000078|0030000078|บริษัท ไทเท็กซ์ เอเซีย จำกัด|151|Industrial|0.0810119|662.1|0.162|AMR
07-16-2019|0010000080|0030000080|บริษัท เอ็นเอส บลูสโคป (ประเทศไทย)จำกัด|151|Industrial|0.8998185|662.1|1.06|AMR
07-16-2019|0010000093|0030000093|บริษัท จีซี-เอ็ม พีทีเอ จำกัด|151|Industrial|2.9061172|662.1|2.794|AMR
07-16-2019|0010000110|0030000114|บริษัท ระยอง กัลวาไนซิ่ง จำกัด|151|Industrial|0.0455912|662.1|0.071|AMR
07-16-2019|0010000120|0030000124|บริษัท ลอยัล ไฮ่เหลียง คอปเปอร์ (ประเทศไทย) จำกัด|151|Industrial|0.0322776|662.1|0.029|AMR
07-16-2019|0010000132|0030000137|บริษัท การ์เดียนอินดัสทรีส์ คอร์ปจำกัด|151|Industrial|3.7271487|662.1|3.735|AMR
07-16-2019|0010000141|0030000146|บริษัท สยามสตีล กัลวาไนซิ่ง จำกัด|151|Industrial|0.1901343|662.1|0.186|AMR
07-16-2019|0010000151|0030000156|บริษัท มิตซูบิชิ อีเล็คทริค ออโตเมชั่น (ประเทศไทย) จำกัด|151|Industrial|0.1033661|662.1|0.216|AMR
07-16-2019|0010000159|0030000165|บริษัท ไทย-เยอรมัน สเปเชียลตี้ กลาสจำกัด|151|Industrial|0.0000|662.1|0.038|AMR
07-16-2019|0010000160|0030000166|บริษัท คอนวูด จำกัด|151|Industrial|0.3062137|662.1|0.258|AMR
07-16-2019|0010000164|0030019231|บริษัท โกลว์ พลังงาน จำกัด (มหาชน)|151|Industrial|0.0000|662.1|0.036|ADQ
07-16-2019|0010000201|0030000021|บริษัท อดิตยา เบอร์ล่า เคมีคัลส์ (ประเทศไทย) จำกัด (ซัลไฟท์ส ดีวิชั่น)|151|Industrial|0.0856381|662.1|0.08|AMR
07-16-2019|0010000203|0030000236|บริษัท สิงห์ คาเมดะ (ประเทศไทย) จำกัด|151|Industrial|0.2393983|662.1|0.229|AMR
07-16-2019|0010000205|0030000238|บริษัท ไทยอาซาคาวา จำกัด|151|Industrial|0.0723951|662.1|0.068|AMR
07-16-2019|0010000225|0030000251|บริษัท ซีพีพีซี จำกัด (มหาชน)|151|Industrial|0.1623063|662.1|0.142|AMR
07-16-2019|0010000934|0030046753|บริษัท ฮอนด้า ออโตโมบิล (ประเทศไทย) จำกัด|151|Industrial|0.0004944|662.1|0.304|AMR
07-16-2019|0010001488|0030016945|บริษัท โพลีเพล็กซ์ (ประเทศไทย) จำกัด (มหาชน)|151|Industrial|0.8463521|662.1|1.071|AMR
07-16-2019|0010001605|0030051931||151|Industrial|0.0631779|662.1|0.261|AMR
07-16-2019|0010001879|0030026184|บริษัท เอ็ชเอ็มซี โปลีเมอส์ จำกัด|151|Industrial|0.4340176|662.1|0.491|AMR
07-16-2019|0010001913|0030020312|บริษัท เหล่าธงสิงห์ จำกัด|151|Industrial|0.0000|662.1|0.105|AMR
07-16-2019|0010002964|0030024050|บริษัท สยามบราเดอร์ จำกัด|151|Industrial|0.0000|662.1|0.08|AMR
07-16-2019|0010003009|0030053395|บริษัท มิตซูบิชิ อีเล็คทริค คอนซูมเมอร์ โปรดักส์ (ประเทศไทย) จำกัด|158|NG by Truck|0.02527|662.1|0.022|ADQ
07-16-2019|0010008022|0030033708|บริษัท สยามอุตสาหกรรมเกษตรอาหารจำกัด (มหาชน)|151|Industrial|0.0000|662.1|0.30|AMR
07-16-2019|0010008114|0030024767|บริษัท ทุนเท็กซ์ เท็กซ์ไทล์ (ประเทศไทย) จำกัด|151|Industrial|0.0124307|662.1|0.191|AMR
07-16-2019|0010008509|0030044231|บริษัท ผลิตภัณฑ์ตราเพชร จำกัด (มหาชน)|151|Industrial|0.3339358|662.1|0.369|AMR
07-16-2019|0010008606|0030016564|บริษัท ซังโกะ ไดคาชติ้ง (ประเทศไทย)จำกัด (มหาชน)|151|Industrial|0.2038717|662.1|0.174|AMR
07-16-2019|0010008926|0030018384|บริษัท อินเตอร์เนชั่นแนล แลบบอราทอรีส์ จำกัด|151|Industrial|0.0228132|662.1|0.016|AMR
07-16-2019|0010008928|0030018387|บริษัท หลุยส์ผลิตภัณท์กาวเทป จำกัด|151|Industrial|0.5019631|662.1|0.299|AMR
07-16-2019|0010009180|0030019567|บริษัท ไทย มาลายา กลาส จำกัด|151|Industrial|2.6404801|662.1|2.719|AMR
07-16-2019|0010009584|0030020740|บริษัท เจลลี เบลลี แคนดี้ คอมปานี (ประเทศไทย) จำกัด|151|Industrial|0.0747259|662.1|0.083|AMR
07-16-2019|0010009598|0030053139|บมจ.เอเชียน อินซูเลเตอร์|151|Industrial|0.0000|662.1|0.30|AMR
07-16-2019|0010010355|0030023468|บริษัท เคียวเด็น (ประเทศไทย) จำกัด|151|Industrial|0.0410003|662.1|0.033|AMR
07-16-2019|0010010358|0030023471|บริษัท เซ้าท์ ซิตี้ ปิโตรเคม จำกัด|151|Industrial|0.0848612|662.1|0.12|AMR
07-16-2019|0010011367|0030027987|บริษัท มิลลิเมด จำกัด|151|Industrial|0.0368685|662.1|0.03|AMR
07-16-2019|0010012320|0030021481|บริษัท พีทีที โกลบอล เคมิคอล จำกัด(มหาชน)|151|Industrial|27.55094|662.1|26.055|ADQ
07-16-2019|0010012440|0030033600|บริษัท นูทริกซ์ จำกัด (มหาชน)|151|Industrial|0.2041189|662.1|0.208|AMR
07-16-2019|0010012506|0030000025|บริษัท ปทุมธานีกล๊าส อินดัสทรี จำกัด|151|Industrial|2.5663192|662.1|2.674|AMR
07-16-2019|0010021151|0030040140|บริษัท คนอฟ ยิปซั่ม (ประเทศไทย) จำกัด|151|Industrial|0.1155143|662.1|0.437|AMR
07-16-2019|0010022317|0030043685|บริษัท ไซมีส อีโคไลท์ จำกัด|151|Industrial|0.0890989|662.1|0.074|AMR
07-16-2019|0010022333|0030043703|บริษัท เอเชียแปซิฟิกกลาส จำกัด|151|Industrial|2.0253333|662.1|2.025|AMR
07-16-2019|0010024039|0030050402|บริษัท สุเพิร์บ พาวเวอร์ จำกัด|152|Industrial-CoGen|0.0000|662.1|0.382|AMR
07-16-2019|0010024055|0030057123|บจ.โอจีพี เอนเนอร์ยี่ โซลูชั่นส์ (สำหรับ บจ.ซึชิโยชิ สมบูรณ์ โคเตทแซนด์)|151|Industrial|0.0000|662.1|0.13|AMR
07-16-2019|0010027295|0030059173|บมจ.ปตท. น้ำมันและการค้าปลีก|158|NG by Truck|0.14918|662.1|0.139|ADQ
07-16-2019|0010027315|0030057427|บริษัท นิชินโบะ สมบูรณ์ ออโตโมทีฟ จำกัด|151|Industrial|0.0000|662.1|0.003|AMR
07-16-2019|0010028705|0030017241|บริษัท บีจี โฟลต กล๊าส จำกัด|151|Industrial|0.3466844|662.1|0.184|AMR
07-16-2019|0010029277|0030062577|บริษัท โรม เมคะเทค (ประเทศไทย) จำกัด|151|Industrial|0.0000|662.1||ADQ
