Date|Sold to|Ship to|Ship to name|ContractType|Description|Volume(MMSCFD)|DemandPlan(BI)|MDCQ(BW)|Billing Type
02-22-2021|0010000004|0030000004|บริษัท ไทย คอปเปอร์ ร็อด จำกัด|151|Industrial|0.0000|603.88||AMR
02-22-2021|0010000005|0030000005|บริษัท ไทยเมทัลโพรเซสซิ่ง จำกัด|151|Industrial|0.0000|603.88||AMR
02-22-2021|0010000016|0030000100|บริษัท ลิกซิล (ประเทศไทย) จำกัด (มหาชน)|151|Industrial|0.3539239|603.88||AMR
02-22-2021|0010000031|0030000031|บริษัท วิลเลรอย แอนด์ บอค (ประเทศไทย) จำกัด|151|Industrial|0.5580782|603.88||AMR
02-22-2021|0010000046|0030000046|บริษัท ไทยแทฟฟิต้า จำกัด|151|Industrial|0.0000|603.88||AMR
02-22-2021|0010000047|0030000047|บริษัท โพสโค-ไทยน๊อคซ์ จำกัด (มหาชน)|151|Industrial|1.711315|603.88||AMR
02-22-2021|0010000057|0030000057|บริษัท พี เอส เมททอลเวอกส์ จำกัด|151|Industrial|0.0009888|603.88||AMR
02-22-2021|0010000073|0030000073|บริษัท ไฟน์ เม็ททัล เทคโนโลยีส์จำกัด (มหาชน)|151|Industrial|0.4218694|603.88||AMR
02-22-2021|0010000074|0030000074|บริษัท ไทยเบเวอร์เรจแคน จำกัด|151|Industrial|0.4052361|603.88||AMR
02-22-2021|0010000088|0030000088|บริษัท ไทยฟิล์มอินดัสตรี่ จำกัด (มหาชน)|151|Industrial|0.0000|603.88||AMR
02-22-2021|0010000110|0030000114|บริษัท ระยอง กัลวาไนซิ่ง จำกัด|151|Industrial|0.0511356|603.88||AMR
02-22-2021|0010000122|0030000126|บริษัท บี เอ เอส เอฟ (ไทย) จำกัด|151|Industrial|0.6438929|603.88||AMR
02-22-2021|0010000137|0030000142|บริษัท วาลเมท จำกัด|151|Industrial|0.008193|603.88||AMR
02-22-2021|0010000150|0030000155|บริษัท บริดจสโตน เมตัลฟา(ประเทศไทย) จำกัด|151|Industrial|0.1079217|603.88||AMR
02-22-2021|0010000151|0030000156|บริษัท มิตซูบิชิ อีเล็คทริค ออโตเมชั่น (ประเทศไทย) จำกัด|151|Industrial|0.2106521|603.88||AMR
02-22-2021|0010000164|0030019231|บริษัท โกลว์ พลังงาน จำกัด (มหาชน)|151|Industrial|0.0000|603.88||ADQ
02-22-2021|0010000226|0030000252|บริษัท ซัมมิท โชว่าแมนูแฟคเจอริ่งจำกัด|151|Industrial|0.1253318|603.88||AMR
02-22-2021|0010000227|0030000253|บริษัท จี เจ สตีล จำกัด (มหาชน)|151|Industrial|1.9200955|603.88||AMR
02-22-2021|0010001196|0030029791|บริษัท ไทยคูน เวิลด์ไวด์ กรุ๊ป (ประเทศไทย) จำกัด (มหาชน)|151|Industrial|1.9596833|603.88||AMR
02-22-2021|0010001217|0030021463|บริษัท แอมคอล อินเตอร์เนชั่นแนล (ไทยแลนด์) จำกัด|151|Industrial|0.0438961|603.88||AMR
02-22-2021|0010001913|0030020312|บริษัท เหล่าธงสิงห์ จำกัด|151|Industrial|0.0266625|603.88||AMR
02-22-2021|0010001922|0030022692|บริษัท ฟู้ดแอนด์ดริ๊งส์ จำกัด (มหาชน)|151|Industrial|0.15957|603.88||ADQ
02-22-2021|0010006616|0030010020|บริษัท บริดจสโตน คาร์บอน แบล็ค (ประเทศไทย) จำกัด|151|Industrial|0.2222|603.88||AMR
02-22-2021|0010006922|0030020406|บริษัท อายิโนะโมะโต๊ะ (ประเทศไทย)จำกัด|151|Industrial|0.0266272|603.88||AMR
02-22-2021|0010007330|0030013313|บริษัท โกรเวล แอบเบรซีพ (ไทยแลนด์)จำกัด|151|Industrial|0.0437195|603.88||AMR
02-22-2021|0010008022|0030033708|บริษัท สยามอุตสาหกรรมเกษตรอาหารจำกัด (มหาชน)|151|Industrial|0.2281329|603.88||AMR
02-22-2021|0010008509|0030044231|บริษัท ผลิตภัณฑ์ตราเพชร จำกัด (มหาชน)|151|Industrial|0.3763487|603.88||AMR
02-22-2021|0010009085|0030056942|บจ.แดรี่ พลัส|151|Industrial|0.8208902|603.88||AMR
02-22-2021|0010009093|0030019105|บริษัท ยูเนียน ออโตพาร์ทส มานูแฟคเชอริ่ง จำกัด|151|Industrial|0.1398108|603.88||AMR
02-22-2021|0010009357|0030020016|บริษัท ซีพี-เมจิ จำกัด|151|Industrial|0.4921456|603.88||AMR
02-22-2021|0010010061|0030022473|บริษัท แอมคอร์ เฟล็กซิเบิ้ล ระยองจำกัด|151|Industrial|0.0199881|603.88||AMR
02-22-2021|0010010116|0030022714|บริษัท ยัสปาลแอนด์ซันส์ จำกัด|151|Industrial|0.0780101|603.88||AMR
02-22-2021|0010011367|0030027987|บริษัท มิลลิเมด จำกัด|151|Industrial|0.0397643|603.88||AMR
02-22-2021|0010012320|0030000072|บริษัท พีทีที โกลบอล เคมิคอล จำกัด(มหาชน)|151|Industrial|31.7782274|603.88||ADQ/AMR
02-22-2021|0010012320|0030000168|บริษัท พีทีที โกลบอล เคมิคอล จำกัด(มหาชน)|151|Industrial|0.0000353|603.88||AMR
02-22-2021|0010012361|0030033177|บริษัท โตโต้ (ประเทศไทย) จำกัด|151|Industrial|0.781938|603.88||AMR
02-22-2021|0010012393|0030033336|บริษัท จรุงไทยไวร์แอนด์เคเบิ้ล จำกัด (มหาชน)|151|Industrial|0.2482976|603.88||AMR
02-22-2021|0010021265|0030000095|บริษัท เอ็นเอส-สยามยูไนเต็ดสตีล จำกัด|151|Industrial|3.2614891|603.88||AMR
02-22-2021|0010022812|0030020778|บริษัท โกลบอล เพาเวอร์ ซินเนอร์ยี่จำกัด (มหาชน)|152|Industrial-CoGen|23.2366488|603.88||FlowComp
02-22-2021|0010024055|0030064941|บริษัท โอจีพี เอนเนอร์ยี่ โซลูชั่นส์ จำกัด (สำหรับ บริษัท นิปปอน สตีลไพพ์ (ประเทศไทย) จำกัด โรงงาน 1)|151|Industrial|0.07397|603.88||ADQ
02-22-2021|0010024055|0030064942|บริษัท โอจีพี เอนเนอร์ยี่ โซลูชั่นส์ จำกัด (สำหรับ บริษัท นิปปอน สตีลไพพ์ (ประเทศไทย) จำกัด โรงงาน 2)|151|Industrial|0.07724|603.88||ADQ
02-22-2021|0010024871|0030053591|บริษัท เอ็นเอส-โอจี เอนเนอร์จี โซลูชั่นส์ (ไทยแลนด์) จำกัด|152|Industrial-CoGen|0.8317671|603.88||AMR
02-22-2021|0010027591|0030000157|บริษัท ซีพีเอฟ ฟู้ด แอนด์ เบฟเวอร์เรจ จำกัด|151|Industrial|0.2365025|603.88||AMR
02-22-2021|0010027591|0030024290|บริษัท ซีพีเอฟ ฟู้ด แอนด์ เบฟเวอร์เรจ จำกัด|152|Industrial-CoGen|0.222977|603.88||AMR
02-22-2021|0010000011|0030000011|บริษัท อลูคอน จำกัด (มหาชน)|151|Industrial|0.6761705|603.88||AMR
02-22-2021|0010000026|0030000026|บริษัท บางกอกแคน แมนนูแฟคเจอริ่ง จำกัด|151|Industrial|0.1635423|603.88||AMR
02-22-2021|0010000027|0030000027|บริษัท ฝาจีบ จำกัด (มหาชน)|152|Industrial-CoGen|0.4594442|603.88||AMR
02-22-2021|0010000039|0030000039|บริษัท โสสุโก้ เซรามิค จำกัด|151|Industrial|2.6194325|603.88||AMR
02-22-2021|0010000041|0030000041|บริษัท สยามอุตสาหกรรมยิปซัม (สระบุรี) จำกัด|151|Industrial|1.172342|603.88||AMR
02-22-2021|0010000054|0030000054|บริษัท บางกอก คริสตัล จำกัด|151|Industrial|0.8920846|603.88||AMR
02-22-2021|0010000071|0030000071|บริษัท เอสโซ่ (ประเทศไทย) จำกัด (มหาชน)|152|Industrial-CoGen|8.9199|603.88||ADQ
02-22-2021|0010000082|0030000082|บริษัท สยามโทซู เซรามิกส์ จำกัด|151|Industrial|0.0416713|603.88||AMR
02-22-2021|0010000083|0030000083|บริษัท เอจีซี แฟลทกลาส (ประเทศไทย)จำกัด (มหาชน)|151|Industrial|3.0924023|603.88||AMR
02-22-2021|0010000093|0030000093|บริษัท จีซี-เอ็ม พีทีเอ จำกัด|151|Industrial|3.2749793|603.88||AMR
02-22-2021|0010000111|0030000115|บริษัท อิวอนิก ยูไนเต็ด ซิลิกา (สยาม) จำกัด|151|Industrial|0.0000|603.88||AMR
02-22-2021|0010000113|0030000117|บริษัท คาร์ดิแนล เฮลท์ 222 (ประเทศไทย) จำกัด|151|Industrial|2.4942419|603.88||AMR
02-22-2021|0010000123|0030000127|บริษัท สยามซานิทารีแวร์อินดัสทรี (หนองแค) จำกัด|151|Industrial|0.2693099|603.88||AMR
02-22-2021|0010000125|0030000129|บริษัท อาร์พีที เอเซีย จำกัด|151|Industrial|0.0603175|603.88||AMR
02-22-2021|0010000135|0030000140|บริษัท รอนเด็กซ์ (ประเทศไทย) จำกัด|151|Industrial|0.0205178|603.88||AMR
02-22-2021|0010000136|0030000141|บริษัท ยูเนี่ยนไทย-นิจิบัน จำกัด|151|Industrial|0.4034351|603.88||AMR
02-22-2021|0010000149|0030000154|บริษัท เอเวอรี่ เดนนิสสัน (ประเทศไทย) จำกัด|151|Industrial|0.0793521|603.88||AMR
02-22-2021|0010000160|0030000166|บริษัท คอนวูด จำกัด|151|Industrial|0.3098158|603.88||AMR
02-22-2021|0010000161|0030000167|บริษัท ไทยซัมซุง อิเลคโทรนิคส์ จำกัด|151|Industrial|0.3412812|603.88||AMR
02-22-2021|0010000202|0030042681|บริษัท สมบูรณ์ โซมิค แมนูแฟคเจอริ่งจำกัด|151|Industrial|0.0113007|603.88||AMR
02-22-2021|0010000225|0030011191|บริษัท ซีพีพีซี จำกัด (มหาชน) (Coating Plant)|151|Industrial|0.0113713|603.88||AMR
02-22-2021|0010001431|0030053506|บริษัท คาราบาวตะวันแดง จำกัด|151|Industrial|0.2648955|603.88||AMR
02-22-2021|0010001488|0030016945|บริษัท โพลีเพล็กซ์ (ประเทศไทย) จำกัด (มหาชน)|151|Industrial|1.1666564|603.88||AMR
02-22-2021|0010001787|0030024766|บริษัท เพรซิเดนท์ เบเกอรี่ จำกัด(มหาชน)|151|Industrial|0.3021878|603.88||AMR
02-22-2021|0010001827|0030021652|บริษัท กรไทย จำกัด|151|Industrial|0.8961105|603.88||AMR
02-22-2021|0010003009|0030053395|บริษัท มิตซูบิชิ อีเล็คทริค คอนซูมเมอร์ โปรดักส์ (ประเทศไทย) จำกัด|158|NG by Truck|0.03107|603.88||ADQ
02-22-2021|0010003880|0030008767|บริษัท กังวาลเท็กซ์ไทล์ จำกัด|152|Industrial-CoGen|2.5041653|603.88||AMR
02-22-2021|0010006894|0030020321|บริษัท อาร์ต อุตสาหกรรม จำกัด|151|Industrial|0.0000|603.88||AMR
02-22-2021|0010007151|0030011752|บริษัท เอ็มซีแอลเอส เอเชีย จำกัด|151|Industrial|0.0770213|603.88||AMR
02-22-2021|0010008114|0030024767|บริษัท ทุนเท็กซ์ เท็กซ์ไทล์ (ประเทศไทย) จำกัด|151|Industrial|0.183036|603.88||AMR
02-22-2021|0010008206|0030015236|บริษัท เอ็นเนซอล จำกัด|152|Industrial-CoGen|1.8521853|603.88||AMR
02-22-2021|0010008739|0030000237|บริษัท สยามไฟเบอร์ซีเมนต์กรุ๊ป จำกัด|151|Industrial|0.1641427|603.88||AMR
02-22-2021|0010008739|0030013343|บริษัท สยามไฟเบอร์ซีเมนต์กรุ๊ป จำกัด|151|Industrial|1.1546141|603.88||AMR
02-22-2021|0010009176|0030019559|บริษัท พูแรค (ประเทศไทย) จำกัด|151|Industrial|1.7965294|603.88||AMR
02-22-2021|0010009177|0030019562|บริษัท สยามโกชิ มานูแฟคเชอริ่ง จำกั|151|Industrial|0.1064031|603.88||AMR
02-22-2021|0010009442|0030020288|บริษัท อายิโนะโมะโต๊ะเซลส์ (ประเทศไทย) จำกัด|151|Industrial|0.0594346|603.88||AMR
02-22-2021|0010010156|0030022920|บริษัท ไทยเคมีภัณฑ์ จำกัด|151|Industrial|0.4054127|603.88||AMR
02-22-2021|0010011163|0030026631|บริษัท ไทย อกริ เพาเวอร์ จำกัด|152|Industrial-CoGen|0.104814|603.88||AMR
02-22-2021|0010012320|0030000055|บริษัท พีทีที โกลบอล เคมิคอล จำกัด(มหาชน)|151|Industrial|0.0014832|603.88||AMR
02-22-2021|0010012320|0030000069|บริษัท พีทีที โกลบอล เคมิคอล จำกัด(มหาชน)|151|Industrial|0.312076|603.88||AMR
02-22-2021|0010012320|0030000072|บริษัท พีทีที โกลบอล เคมิคอล จำกัด(มหาชน)|152|Industrial-CoGen|10.80383|603.88||ADQ
02-22-2021|0010012440|0030033600|บริษัท นูทริกซ์ จำกัด (มหาชน)|151|Industrial|0.2201871|603.88||AMR
02-22-2021|0010021842|0030023236|บริษัท คอทโก้ เมททอลเวอร์คส จำกัด|151|Industrial|0.259563|603.88||AMR
02-22-2021|0010022869|0030045768|บริษัท ยามาโมริ (ประเทศไทย) จำกัด|151|Industrial|0.0318538|603.88||AMR
02-22-2021|0010025332|0030052476|บริษัท ไอที ฟอร์จิ้ง (ประเทศไทย) จำกัด|151|Industrial|0.1548902|603.88||AMR
02-22-2021|0010025615|0030053102|บริษัท เอ็นจีเค เซรามิคส์ (ประเทศไทย) จำกัด|151|Industrial|0.3480616|603.88||AMR
02-22-2021|0010026111|0030055031|บริษัท กบินทร์บุรีกล๊าส อินดัสทรีจำกัด|151|Industrial|3.2590877|603.88||AMR
02-22-2021|0010027591|0030024290|บริษัท ซีพีเอฟ ฟู้ด แอนด์ เบฟเวอร์เรจ จำกัด|151|Industrial|0.7131097|603.88||AMR
02-22-2021|0010027600|0030058148|บริษัท เอเชีย แคน แมนูแฟคเจอริ่ง จำกัด|151|Industrial|0.0967622|603.88||AMR
02-22-2021|0010000001|0030000001|บริษัท กระจกลายสยาม จำกัด|151|Industrial|0.2839|603.88||ADQ
02-22-2021|0010000015|0030000015|บริษัท โคห์เลอร์ (ประเทศไทย) จำกัด(มหาชน)|151|Industrial|2.3706758|603.88||AMR
02-22-2021|0010000028|0030000028|บริษัท เฟอร์โร (ประเทศไทย) จำกัด|151|Industrial|0.3153602|603.88||AMR
02-22-2021|0010000030|0030000030|บริษัท ภัทราพอร์ซเลน จำกัด|151|Industrial|0.5312743|603.88||AMR
02-22-2021|0010000038|0030000038|บริษัท สหโมเสคอุตสาหกรรม จำกัด (มหาชน)|151|Industrial|0.2666259|603.88||AMR
02-22-2021|0010000038|0030000102|บริษัท สหโมเสคอุตสาหกรรม จำกัด (มหาชน)|151|Industrial|2.8662469|603.88||AMR
02-22-2021|0010000052|0030000052|บริษัท ไทยออยล์ จำกัด (มหาชน)|151|Industrial|21.9960681|603.88||AMR/FlowComp
02-22-2021|0010000053|0030000053|บริษัท ไทยอาซาฮีเคมีภัณฑ์ จำกัด|151|Industrial|0.212771|603.88||AMR
02-22-2021|0010000068|0030025580|บริษัท เหล็กสยามยามาโตะ จำกัด|151|Industrial|2.3098638|603.88||AMR
02-22-2021|0010000083|0030021634|บริษัท เอจีซี แฟลทกลาส (ประเทศไทย)จำกัด (มหาชน)|151|Industrial|0.0000|603.88||AMR
02-22-2021|0010000104|0030000107|บริษัท สยามโพลิเอททีลีน จำกัด|151|Industrial|2.3123006|603.88||AMR
02-22-2021|0010000120|0030000124|บริษัท ลอยัล ไฮ่เหลียง คอปเปอร์ (ประเทศไทย) จำกัด|151|Industrial|0.0304059|603.88||AMR
02-22-2021|0010000134|0030000139|บริษัท วันไทยอุตสาหกรรมการอาหาร จำกัด|151|Industrial|0.9888822|603.88||AMR
02-22-2021|0010000134|0030056618|บริษัท วันไทยอุตสาหกรรมการอาหาร จำกัด|151|Industrial|0.2749602|603.88||AMR
02-22-2021|0010000148|0030000153|บริษัท เคนไซซีรามิคส์ อินดัสตรี้ จำกัด|151|Industrial|0.2020353|603.88||AMR
02-22-2021|0010000164|0030030778|บริษัท โกลว์ พลังงาน จำกัด (มหาชน)|152|Industrial-CoGen|0.0000|603.88||FlowComp
02-22-2021|0010000178|0030016267|บริษัท โกลว์ เอสพีพี 11 จำกัด|152|Industrial-CoGen|1.3270911|603.88||AMR
02-22-2021|0010000216|0030030499|บริษัท ไออาร์พีซี จำกัด (มหาชน)|152|Industrial-CoGen|52.0948381|603.88||FlowComp
02-22-2021|0010000216|0030049389|บริษัท ไออาร์พีซี จำกัด (มหาชน)|151|Industrial|6.3333029|603.88||AMR
02-22-2021|0010001125|0030039301|บริษัท ไทยโพลีอะซีทัล จำกัด|151|Industrial|0.0903703|603.88||AMR
02-22-2021|0010001131|0030044478|บริษัท นอริตาเก้ เอสซีจี พลาสเตอร์จำกัด|151|Industrial|0.1905934|603.88||AMR
02-22-2021|0010001740|0030022424|บริษัท โรงงานเหล็กกรุงเทพฯ จำกัด|151|Industrial|1.429645|603.88||AMR
02-22-2021|0010001741|0030022479|บริษัท อลูมิเนียม ฉื่อ จิ้น ฮั้ว จำกัด|151|Industrial|0.6043404|603.88||AMR
02-22-2021|0010002201|0030011779|บริษัท ควอลิตี้ คอฟฟี่ โปรดักท์ส จำกัด|151|Industrial|0.9175818|603.88||AMR
02-22-2021|0010006755|0030027897|บริษัท ปูนซิเมนต์ไทย (ท่าหลวง) จำกัด|151|Industrial|0.0000|603.88||AMR
02-22-2021|0010007112|0030011636|บริษัท ไทยซัมมิท อีสเทิร์น ซีบอร์ดโอโตพาร์ท อินดัสตรี จำกัด|151|Industrial|0.0734192|603.88||AMR
02-22-2021|0010007982|0030014211|บริษัท จีซี ไกลคอล จำกัด|151|Industrial|0.2944539|603.88||AMR
02-22-2021|0010008509|0030016162|บริษัท ผลิตภัณฑ์ตราเพชร จำกัด (มหาชน)|151|Industrial|0.0000|603.88||AMR
02-22-2021|0010009228|0030019659|บริษัท ไทย เอ็มเอฟซี จำกัด|151|Industrial|0.1783392|603.88||AMR
02-22-2021|0010009357|0030020016|บริษัท ซีพี-เมจิ จำกัด|152|Industrial-CoGen|0.0000|603.88||AMR
02-22-2021|0010009841|0030021637|บริษัท โอวาริ เซกิ (ไทยแลนด์) จำกัด|151|Industrial|0.0076632|603.88||AMR
02-22-2021|0010011029|0030026047|บริษัท เอ็น ซี อาร์ รับเบอร์อินดัสตรี้ จำกัด|151|Industrial|0.0744433|603.88||AMR
02-22-2021|0010012227|0030032353|บริษัท เอ็มทีพี เอชพี เจวี (ประเทศไทย) จำกัด|151|Industrial|9.8974037|603.88||AMR
02-22-2021|0010012506|0030000025|บริษัท ปทุมธานีกล๊าส อินดัสทรี จำกัด|151|Industrial|2.90474|603.88||AMR
02-22-2021|0010015560|0030040907|บริษัท ลินเด้ ไฮโค จำกัด|151|Industrial|1.9788945|603.88||AMR
02-22-2021|0010021117|0030022988|บริษัท ซีพีเอฟ (ประเทศไทย) จำกัด(มหาชน)|151|Industrial|0.3268375|603.88||AMR
02-22-2021|0010021151|0030040140|บริษัท คนอฟ ยิปซั่ม (ประเทศไทย) จำกัด|151|Industrial|0.0000|603.88||AMR
02-22-2021|0010023967|0030050118|บริษัท โอซาก้า แก๊ส (ประเทศไทย) จำกัด|151|Industrial|0.2511581|603.88||AMR
02-22-2021|0010024039|0030050402|บริษัท สุเพิร์บ พาวเวอร์ จำกัด|152|Industrial-CoGen|0.2950543|603.88||AMR
02-22-2021|0010027861|0030000018|บริษัท เอสซีจี เซรามิกส์ จำกัด (มหาชน)|151|Industrial|2.9263879|603.88||AMR
02-22-2021|0010027861|0030000246|บริษัท เอสซีจี เซรามิกส์ จำกัด (มหาชน)|151|Industrial|2.9174533|603.88||AMR
02-22-2021|0010000006|0030000006|บริษัท ธนอินเตอร์ จำกัด|151|Industrial|0.0000|603.88||AMR
02-22-2021|0010000007|0030000007|บริษัท บี เอ็น เอส เอส สตีลกรุ๊ป จำกัด|151|Industrial|0.8892594|603.88||AMR
02-22-2021|0010000019|0030000019|บริษัท ไดนาสตี้ เซรามิค จำกัด (มหาชน)|151|Industrial|4.798738|603.88||AMR
02-22-2021|0010000022|0030000022|บริษัท ไทยบริดจสโตน จำกัด|151|Industrial|0.6134869|603.88||AMR
02-22-2021|0010000035|0030000035|บริษัท สยามซานิทารีแวร์อินดัสทรี จำกัด|151|Industrial|0.6197376|603.88||AMR
02-22-2021|0010000036|0030000036|บริษัท สยามฟูรูกาวา จำกัด|151|Industrial|0.2213525|603.88||AMR
02-22-2021|0010000051|0030000051|บริษัท ไทยไวร์โพรดัคท์ จำกัด (มหาชน)|151|Industrial|0.0188227|603.88||AMR
02-22-2021|0010000062|0030000062|บริษัท สตาร์ ปิโตรเลียม รีไฟน์นิ่งจำกัด (มหาชน)|152|Industrial-CoGen|12.43593|603.88||ADQ
02-22-2021|0010000076|0030000076|บริษัท สยามสไตรีนโมโนเมอร์ จำกัด|151|Industrial|3.3043964|603.88||AMR
02-22-2021|0010000092|0030000092|บริษัท ไทย-สแกนดิค สตีล จำกัด|151|Industrial|0.0818241|603.88||AMR
02-22-2021|0010000106|0030000109|บริษัท ไมย์เออร์ อลูมิเนียม (ประเทศไทย) จำกัด|151|Industrial|0.3599627|603.88||AMR
02-22-2021|0010000107|0030000111|บริษัท จี สตีล จำกัด (มหาชน)|151|Industrial|2.3239544|603.88||AMR
02-22-2021|0010000128|0030000132|บริษัท เซกิซุย เอส-เล็ค (ประเทศไทย)จำกัด|151|Industrial|0.064414|603.88||AMR
02-22-2021|0010000139|0030000144|บริษัท ยูเนี่ยนไพโอเนียร์ จำกัด(มหาชน)|151|Industrial|0.0886045|603.88||AMR
02-22-2021|0010000140|0030000145|บริษัท สยามลวดเหล็กอุตสาหกรรม จำกัด|151|Industrial|0.0664622|603.88||AMR
02-22-2021|0010000153|0030000159|บริษัท เกทส์ ยูนิทตะ (ประเทศไทย) จำกัด|151|Industrial|0.1316885|603.88||AMR
