Date|Sold to|Ship to|Ship to name|ContractType|Description|Volume(MMSCFD)|DemandPlan(BI)|MDCQ(BW)|Billing Type
02-01-2021|0010000011|0030000011|บริษัท อลูคอน จำกัด (มหาชน)|151|Industrial|1.0210539|603.88||AMR
02-01-2021|0010000026|0030000026|บริษัท บางกอกแคน แมนนูแฟคเจอริ่ง จำกัด|151|Industrial|0.1648843|603.88||AMR
02-01-2021|0010000027|0030000027|บริษัท ฝาจีบ จำกัด (มหาชน)|152|Industrial-CoGen|0.4887907|603.88||AMR
02-01-2021|0010000046|0030000046|บริษัท ไทยแทฟฟิต้า จำกัด|151|Industrial|0.0000|603.88||AMR
02-01-2021|0010000047|0030000047|บริษัท โพสโค-ไทยน๊อคซ์ จำกัด (มหาชน)|151|Industrial|1.7358234|603.88||AMR
02-01-2021|0010000057|0030000057|บริษัท พี เอส เมททอลเวอกส์ จำกัด|151|Industrial|0.009429|603.88||AMR
02-01-2021|0010000071|0030000071|บริษัท เอสโซ่ (ประเทศไทย) จำกัด (มหาชน)|151|Industrial|6.39371|603.88||ADQ
02-01-2021|0010000085|0030000085|บริษัท บางกอกอินดัสเทรียลแก๊ส จำกัด|151|Industrial|0.049264|603.88||AMR
02-01-2021|0010000086|0030000086|บริษัท สยามคอมเพรสเซอร์อุตสาหกรรม จำกัด|151|Industrial|0.1277685|603.88||AMR
02-01-2021|0010000099|0030000099|บริษัท เกรท วอลล์ มอเตอร์ แมนูแฟคเจอริ่ง (ประเทศไทย) จำกัด|151|Industrial|0.1892867|603.88||AMR
02-01-2021|0010000101|0030000103|บริษัท ร็อควูล (ประเทศไทย) จำกัด|151|Industrial|0.0155737|603.88||AMR
02-01-2021|0010000116|0030000120|บริษัท มิตซูบิชิ มอเตอร์ส (ประเทศไทย) จำกัด|151|Industrial|0.3320994|603.88||AMR
02-01-2021|0010000116|0030034491|บริษัท มิตซูบิชิ มอเตอร์ส (ประเทศไทย) จำกัด|151|Industrial|0.181129|603.88||AMR
02-01-2021|0010000131|0030000136|บริษัท การ์เดียนอินดัสทรีส์ ระยองจำกัด|151|Industrial|3.7901854|603.88||AMR
02-01-2021|0010000132|0030000137|บริษัท การ์เดียนอินดัสทรีส์ คอร์ปจำกัด|151|Industrial|3.4834066|603.88||AMR
02-01-2021|0010000143|0030000148|บริษัท สยาม พุงซาน เมทัล จำกัด|151|Industrial|0.0661797|603.88||AMR
02-01-2021|0010000144|0030000149|บริษัท เบอร์ลี่ ยุคเกอร์ เซลล็อกซ์จำกัด|151|Industrial|0.5248117|603.88||AMR
02-01-2021|0010000154|0030000160|บริษัท แม็กซิออน วีลส์ (ประเทศไทย)จำกัด|151|Industrial|0.5017159|603.88||AMR
02-01-2021|0010000155|0030000161|บริษัท มาเล่ย์ เอ็นจิ่น คอมโพเน็นท์(ประเทศไทย) จำกัด|151|Industrial|0.0837311|603.88||AMR
02-01-2021|0010000197|0030025358|บริษัท บางจาก คอร์ปอเรชั่น จำกัด (มหาชน)|152|Industrial-CoGen|8.6527724|603.88||AMR
02-01-2021|0010000197|0030025358|บริษัท บางจาก คอร์ปอเรชั่น จำกัด (มหาชน)|151|Industrial|24.9203647|603.88||FlowComp
02-01-2021|0010000221|0030011437|บริษัท วีนิไทย จำกัด (มหาชน)|151|Industrial|2.2906527|603.88||AMR
02-01-2021|0010000916|0030044950|บริษัท ดาน่า สไปเซอร์ (ประเทศไทย) จำกัด|151|Industrial|0.0800584|603.88||AMR
02-01-2021|0010000925|0030022478|บริษัท ไทยสตีลโปรไฟล์ จำกัด (มหาชน)|151|Industrial|0.5039407|603.88||AMR
02-01-2021|0010001609|0030015621|บริษัท โตโยต้า มอเตอร์ ประเทศไทย จำกัด|151|Industrial|0.7190072|603.88||AMR
02-01-2021|0010001747|0030042303|บริษัท สุนทรเมทัลอินดัสทรี้ส์ จำกัด|151|Industrial|0.4250124|603.88||AMR
02-01-2021|0010006271|0030008801|บริษัท ริเวอร์โปร์ พัลพ แอนด์เพเพอร์ จำกัด|151|Industrial|0.1643192|603.88||AMR
02-01-2021|0010006548|0030009620|บริษัท อีเลคโทรลักซ์ ประเทศไทย จำกัด|151|Industrial|0.0387049|603.88||AMR
02-01-2021|0010006939|0030011133|บริษัท นิเด็ค ค็อมโปเน็นท์ เทคโนโลยี (ไทยแลนด์) จำกัด|151|Industrial|0.4916865|603.88||AMR
02-01-2021|0010007765|0030013679|บริษัท เอ.พี.ซี อุตสาหกรรม จำกัด|151|Industrial|0.0000|603.88||AMR
02-01-2021|0010008288|0030015470|บริษัท อุตสาหกรรมทำเครื่องแก้วไทยจำกัด (มหาชน)|151|Industrial|6.6889926|603.88||AMR
02-01-2021|0010008289|0030015477|บริษัท ดี-รับเบอร์ โปรดักส์ จำกัด|151|Industrial|0.0539608|603.88||AMR
02-01-2021|0010008926|0030018384|บริษัท อินเตอร์เนชั่นแนล แลบบอราทอรีส์ จำกัด|151|Industrial|0.0262388|603.88||AMR
02-01-2021|0010009196|0030019599|บริษัท ราชราตัน ไทย ไวร์ จำกัด|151|Industrial|0.1684511|603.88||AMR
02-01-2021|0010009604|0030020797|บริษัท เจ.พี ยูไนเต็ด จำกัด|151|Industrial|0.0568566|603.88||AMR
02-01-2021|0010009784|0030021478|บริษัท แคททาเลอร์ (ประเทศไทย) จำกัด|151|Industrial|0.133207|603.88||AMR
02-01-2021|0010010605|0030024817|บริษัท มาบตาพุดโอเลฟินส์ จำกัด|151|Industrial|2.6157598|603.88||AMR
02-01-2021|0010010925|0030025431|บริษัท เน็กซ์ แคน อินโนเวชั่น จำกัด|151|Industrial|0.2618938|603.88||AMR
02-01-2021|0010012118|0030062578|บริษัท พีทีที แอลเอ็นจี จำกัด|152|Industrial-CoGen|2.2854956|603.88||FlowComp
02-01-2021|0010012323|0030032849|บริษัท โตโยอิ๊งค์ (ประเทศไทย) จำกัด|151|Industrial|0.00742|603.88||ADQ
02-01-2021|0010020836|0030038183|บริษัท กรุงเทพ ซินธิติกส์ จำกัด|151|Industrial|0.0115479|603.88||AMR
02-01-2021|0010022317|0030043685|บริษัท ไซมีส อีโคไลท์ จำกัด|151|Industrial|0.089664|603.88||AMR
02-01-2021|0010024055|0030057123|บจ.โอจีพี เอนเนอร์ยี่ โซลูชั่นส์ (สำหรับ บจ.ซึชิโยชิ สมบูรณ์ โคเตทแซนด์)|151|Industrial|0.1553846|603.88||AMR
02-01-2021|0010024055|0030064939|บริษัท โอจีพี เอนเนอร์ยี่ โซลูชั่นส์ จำกัด (สำหรับ บริษัท ยามาดะ สมบูรณ์ จำกัด)|151|Industrial|0.20213|603.88||ADQ
02-01-2021|0010024055|0030064940|บริษัท โอจีพี เอนเนอร์ยี่ โซลูชั่นส์ จำกัด (สำหรับ บริษัท คันไซ เรซิน(ประเทศไทย) จำกัด)|151|Industrial|0.0685|603.88||ADQ
02-01-2021|0010027591|0030000157|บริษัท ซีพีเอฟ ฟู้ด แอนด์ เบฟเวอร์เรจ จำกัด|151|Industrial|0.2608696|603.88||AMR
02-01-2021|0010027591|0030024290|บริษัท ซีพีเอฟ ฟู้ด แอนด์ เบฟเวอร์เรจ จำกัด|152|Industrial-CoGen|0.2041542|603.88||AMR
02-01-2021|0010000006|0030000006|บริษัท ธนอินเตอร์ จำกัด|151|Industrial|0.0000|603.88||AMR
02-01-2021|0010000007|0030000007|บริษัท บี เอ็น เอส เอส สตีลกรุ๊ป จำกัด|151|Industrial|0.7826796|603.88||AMR
02-01-2021|0010000016|0030000016|บริษัท ลิกซิล (ประเทศไทย) จำกัด (มหาชน)|151|Industrial|0.709437|603.88||AMR
02-01-2021|0010000028|0030000028|บริษัท เฟอร์โร (ประเทศไทย) จำกัด|151|Industrial|0.3600333|603.88||AMR
02-01-2021|0010000030|0030000030|บริษัท ภัทราพอร์ซเลน จำกัด|151|Industrial|0.4917571|603.88||AMR
02-01-2021|0010000039|0030000039|บริษัท โสสุโก้ เซรามิค จำกัด|151|Industrial|1.9029679|603.88||AMR
02-01-2021|0010000041|0030000041|บริษัท สยามอุตสาหกรรมยิปซัม (สระบุรี) จำกัด|151|Industrial|0.0003884|603.88||AMR
02-01-2021|0010000056|0030000056|บริษัท โอเอสซี สยามซิลิกา จำกัด|151|Industrial|2.2623656|603.88||AMR
02-01-2021|0010000056|0030000059|บริษัท โอเอสซี สยามซิลิกา จำกัด|151|Industrial|1.9153633|603.88||AMR
02-01-2021|0010000065|0030000065|บริษัท สยามโพลีสไตรีน จำกัด|151|Industrial|0.0591874|603.88||AMR
02-01-2021|0010000080|0030000080|บริษัท เอ็นเอส บลูสโคป (ประเทศไทย)จำกัด|151|Industrial|0.9264811|603.88||AMR
02-01-2021|0010000093|0030000093|บริษัท จีซี-เอ็ม พีทีเอ จำกัด|151|Industrial|1.8184598|603.88||AMR
02-01-2021|0010000108|0030000112|บริษัท ยูนิตี้ อินดัสเตรียล จำกัด|151|Industrial|0.0290639|603.88||AMR
02-01-2021|0010000109|0030000113|บริษัท ระยองไวร์ อินดัสตรีส์ จำกัด(มหาชน)|151|Industrial|0.0458384|603.88||AMR
02-01-2021|0010000123|0030000127|บริษัท สยามซานิทารีแวร์อินดัสทรี (หนองแค) จำกัด|151|Industrial|0.3030001|603.88||AMR
02-01-2021|0010000134|0030000139|บริษัท วันไทยอุตสาหกรรมการอาหาร จำกัด|151|Industrial|1.1265742|603.88||AMR
02-01-2021|0010000134|0030056618|บริษัท วันไทยอุตสาหกรรมการอาหาร จำกัด|151|Industrial|0.4362778|603.88||AMR
02-01-2021|0010000148|0030000153|บริษัท เคนไซซีรามิคส์ อินดัสตรี้ จำกัด|151|Industrial|0.2119235|603.88||AMR
02-01-2021|0010000160|0030000166|บริษัท คอนวูด จำกัด|151|Industrial|0.2761256|603.88||AMR
02-01-2021|0010000161|0030000167|บริษัท ไทยซัมซุง อิเลคโทรนิคส์ จำกัด|151|Industrial|0.2932532|603.88||AMR
02-01-2021|0010001727|0030020317|บริษัท ไทยเซ็นทรัลเคมี จำกัด (มหาชน)|152|Industrial-CoGen|0.0000|603.88||AMR
02-01-2021|0010002048|0030021234|บริษัท ด๊อกเตอร์ บู จำกัด|151|Industrial|0.3453424|603.88||AMR
02-01-2021|0010002092|0030016062|บริษัท สยามแผ่นเหล็กวิลาส จำกัด|151|Industrial|0.1896752|603.88||AMR
02-01-2021|0010006755|0030027897|บริษัท ปูนซิเมนต์ไทย (ท่าหลวง) จำกัด|151|Industrial|0.0000|603.88||AMR
02-01-2021|0010007330|0030013313|บริษัท โกรเวล แอบเบรซีพ (ไทยแลนด์)จำกัด|151|Industrial|0.0445318|603.88||AMR
02-01-2021|0010008114|0030024767|บริษัท ทุนเท็กซ์ เท็กซ์ไทล์ (ประเทศไทย) จำกัด|151|Industrial|0.1532657|603.88||AMR
02-01-2021|0010008206|0030015236|บริษัท เอ็นเนซอล จำกัด|152|Industrial-CoGen|1.868642|603.88||AMR
02-01-2021|0010008671|0030021639|บริษัท พีทีที ฟีนอล จำกัด|151|Industrial|0.3306515|603.88||AMR
02-01-2021|0010009180|0030019567|บริษัท ไทย มาลายา กลาส จำกัด|151|Industrial|2.6388909|603.88||AMR
02-01-2021|0010010220|0030023100|บริษัท เอส ไอ ดับบลิว (ไทยแลนด์) จำกัด|151|Industrial|0.1441899|603.88||AMR
02-01-2021|0010011784|0030030288|บริษัท สยามเลเทกซ์ สังเคราะห์ จำกัด|151|Industrial|1.5651475|603.88||AMR
02-01-2021|0010012320|0030021767|บริษัท พีทีที โกลบอล เคมิคอล จำกัด(มหาชน)|154|Commercial–CoGen|0.0863091|603.88||AMR
02-01-2021|0010012320|0030026468|บริษัท พีทีที โกลบอล เคมิคอล จำกัด(มหาชน)|151|Industrial|4.0138334|603.88||AMR
02-01-2021|0010012320|0030040549|บริษัท พีทีที โกลบอล เคมิคอล จำกัด(มหาชน)|152|Industrial-CoGen|20.0208537|603.88||FlowComp
02-01-2021|0010012506|0030000025|บริษัท ปทุมธานีกล๊าส อินดัสทรี จำกัด|151|Industrial|2.7705088|603.88||AMR
02-01-2021|0010015560|0030040907|บริษัท ลินเด้ ไฮโค จำกัด|151|Industrial|1.9271584|603.88||AMR
02-01-2021|0010021265|0030000095|บริษัท เอ็นเอส-สยามยูไนเต็ดสตีล จำกัด|151|Industrial|2.9903781|603.88||AMR
02-01-2021|0010023379|0030049270|บริษัท ลาบิกซ์ จำกัด|151|Industrial|6.2941036|603.88||AMR
02-01-2021|0010023436|0030052175|บริษัท ซันโทรี่ เป๊ปซี่โค เบเวอเรจ(ประเทศไทย) จำกัด|151|Industrial|0.1579273|603.88||AMR
02-01-2021|0010025332|0030052476|บริษัท ไอที ฟอร์จิ้ง (ประเทศไทย) จำกัด|151|Industrial|0.1226479|603.88||AMR
02-01-2021|0010025615|0030053102|บริษัท เอ็นจีเค เซรามิคส์ (ประเทศไทย) จำกัด|151|Industrial|0.3791033|603.88||AMR
02-01-2021|0010026111|0030055031|บริษัท กบินทร์บุรีกล๊าส อินดัสทรีจำกัด|151|Industrial|2.7561004|603.88||AMR
02-01-2021|0010027591|0030024290|บริษัท ซีพีเอฟ ฟู้ด แอนด์ เบฟเวอร์เรจ จำกัด|151|Industrial|0.6313562|603.88||AMR
02-01-2021|0010027600|0030058148|บริษัท เอเชีย แคน แมนูแฟคเจอริ่ง จำกัด|151|Industrial|0.1221535|603.88||AMR
02-01-2021|0010000008|0030000008|บริษัท ไมโครไฟเบอร์อุตสาหกรรม จำกัด|151|Industrial|0.2606578|603.88||AMR
02-01-2021|0010000022|0030000022|บริษัท ไทยบริดจสโตน จำกัด|152|Industrial-CoGen|1.9650864|603.88||AMR
02-01-2021|0010000023|0030000023|บริษัท ไทยเปอร์อ๊อกไซด์ จำกัด|151|Industrial|1.4357544|603.88||AMR
02-01-2021|0010000038|0030000038|บริษัท สหโมเสคอุตสาหกรรม จำกัด (มหาชน)|151|Industrial|0.1238133|603.88||AMR
02-01-2021|0010000052|0030000052|บริษัท ไทยออยล์ จำกัด (มหาชน)|151|Industrial|5.9832523|603.88||AMR/FlowComp
02-01-2021|0010000053|0030000053|บริษัท ไทยอาซาฮีเคมีภัณฑ์ จำกัด|151|Industrial|0.2864375|603.88||AMR
02-01-2021|0010000068|0030025580|บริษัท เหล็กสยามยามาโตะ จำกัด|151|Industrial|1.9159284|603.88||AMR
02-01-2021|0010000082|0030000082|บริษัท สยามโทซู เซรามิกส์ จำกัด|151|Industrial|0.0467919|603.88||AMR
02-01-2021|0010000083|0030000083|บริษัท เอจีซี แฟลทกลาส (ประเทศไทย)จำกัด (มหาชน)|151|Industrial|3.0825142|603.88||AMR
02-01-2021|0010000096|0030000096|บริษัท ระยองโอเลฟินส์ จำกัด|151|Industrial|0.6364062|603.88||AMR
02-01-2021|0010000097|0030000097|บริษัท สายไฟฟ้าบางกอกเคเบิ้ล จำกัด|151|Industrial|0.0334783|603.88||AMR
02-01-2021|0010000114|0030000118|บริษัท อิเมอร์สัน อิเล็คทริค (ประเทศไทย) จำกัด|151|Industrial|0.1069329|603.88||AMR
02-01-2021|0010000141|0030000146|บริษัท สยามสตีล กัลวาไนซิ่ง จำกัด|151|Industrial|0.1693339|603.88||AMR
02-01-2021|0010000157|0030000163|บริษัท ไทยอะครีลิค จำกัด|151|Industrial|0.0047321|603.88||AMR
02-01-2021|0010000158|0030000164|บริษัท นิวพลัสนิตติ้ง จำกัด (มหาชน)|151|Industrial|0.0110888|603.88||AMR
02-01-2021|0010000201|0030000234|บริษัท อดิตยา เบอร์ล่า เคมีคัลส์ (ประเทศไทย) จำกัด(คลออัลคาลีดีวิชั่น)|151|Industrial|0.0000|603.88||AMR
02-01-2021|0010000201|0030020965|บริษัท อดิตยา เบอร์ล่า เคมีคัลส์ (ประเทศไทย) จำกัด (แอดวานซ์ แมททีเรียลส์)|151|Industrial|0.0794227|603.88||AMR
02-01-2021|0010000224|0030000250|บริษัท ออมโนวา เอ็นจิเนียร์ด เซอร์เฟสเซส (ประเทศไทย) จำกัด|151|Industrial|0.243071|603.88||AMR
02-01-2021|0010000225|0030000251|บริษัท ซีพีพีซี จำกัด (มหาชน)|151|Industrial|0.1080982|603.88||AMR
02-01-2021|0010001146|0030042053|บริษัท เคลล็อก (ประเทศไทย) จำกัด|151|Industrial|0.1821532|603.88||AMR
02-01-2021|0010001787|0030024766|บริษัท เพรซิเดนท์ เบเกอรี่ จำกัด(มหาชน)|151|Industrial|0.3414578|603.88||AMR
02-01-2021|0010001827|0030021652|บริษัท กรไทย จำกัด|151|Industrial|0.9177584|603.88||AMR
02-01-2021|0010002964|0030024050|บริษัท สยามบราเดอร์ จำกัด|151|Industrial|0.1149493|603.88||AMR
02-01-2021|0010006922|0030011105|บริษัท อายิโนะโมะโต๊ะ (ประเทศไทย)จำกัด|151|Industrial|0.0000|603.88||AMR
02-01-2021|0010007561|0030013097|บริษัท บางชันเยนเนอเรลเอเซมบลี จำกัด|151|Industrial|0.0369038|603.88||AMR
02-01-2021|0010007594|0030013168|บริษัท ไลอ้อน (ประเทศไทย) จำกัด|151|Industrial|0.4545001|603.88||AMR
02-01-2021|0010008206|0030033172|บริษัท เอ็นเนซอล จำกัด|152|Industrial-CoGen|1.4571551|603.88||AMR
02-01-2021|0010008739|0030000237|บริษัท สยามไฟเบอร์ซีเมนต์กรุ๊ป จำกัด|151|Industrial|0.0862384|603.88||AMR
02-01-2021|0010008739|0030013343|บริษัท สยามไฟเบอร์ซีเมนต์กรุ๊ป จำกัด|151|Industrial|1.0892819|603.88||AMR
02-01-2021|0010009180|0030044623|บริษัท ไทย มาลายา กลาส จำกัด|151|Industrial|4.5017766|603.88||AMR
02-01-2021|0010009584|0030020740|บริษัท เจลลี เบลลี แคนดี้ คอมปานี (ประเทศไทย) จำกัด|151|Industrial|0.0831308|603.88||AMR
02-01-2021|0010009598|0030053139|บมจ.เอเชียน อินซูเลเตอร์|151|Industrial|0.0788224|603.88||AMR
02-01-2021|0010010423|0030024015|บริษัท ศานติบรรจุภัณฑ์ จำกัด|151|Industrial|0.2554312|603.88||AMR
02-01-2021|0010011882|0030031074|บริษัท พีทีที อาซาฮี เคมิคอล จำกัด|151|Industrial|5.2505895|603.88||AMR
02-01-2021|0010012059|0030045449|บริษัท พีทีที เอ็มซีซี ไบโอเคม จำกัด|151|Industrial|0.1596577|603.88||AMR
02-01-2021|0010012361|0030033177|บริษัท โตโต้ (ประเทศไทย) จำกัด|151|Industrial|0.7922852|603.88||AMR
02-01-2021|0010012393|0030033336|บริษัท จรุงไทยไวร์แอนด์เคเบิ้ล จำกัด (มหาชน)|151|Industrial|0.3049777|603.88||AMR
02-01-2021|0010021117|0030022988|บริษัท ซีพีเอฟ (ประเทศไทย) จำกัด(มหาชน)|151|Industrial|0.4083791|603.88||AMR
02-01-2021|0010021151|0030040140|บริษัท คนอฟ ยิปซั่ม (ประเทศไทย) จำกัด|151|Industrial|0.0000|603.88||AMR
02-01-2021|0010022333|0030043703|บริษัท เอเชียแปซิฟิกกลาส จำกัด|151|Industrial|2.5145478|603.88||AMR
02-01-2021|0010022444|0030044003|บริษัท ทีวาย สตีล จำกัด|151|Industrial|0.3212931|603.88||AMR
02-01-2021|0010023548|0030000131|บริษัท โคเวสโตร (ประเทศไทย) จำกัด|151|Industrial|0.4920397|603.88||AMR
02-01-2021|0010026153|0030054741|บริษัท นิคเคอิ เอ็มซี อลูมินัม (ประเทศไทย) จำกัด|151|Industrial|0.2960078|603.88||AMR
02-01-2021|0010026372|0030024061|บริษัท เคมีแมน จำกัด (มหาชน)|151|Industrial|1.4117051|603.88||AMR
02-01-2021|0010027861|0030000017|บริษัท เอสซีจี เซรามิกส์ จำกัด (มหาชน)|151|Industrial|2.2419184|603.88||AMR
02-01-2021|0010000009|0030000009|บริษัท ล.ไลท์ติ้งกลาส จำกัด|151|Industrial|2.9843393|603.88||AMR
02-01-2021|0010000010|0030000010|บริษัท สยามกลาส อินดัสทรี จำกัด|151|Industrial|1.7497727|603.88||AMR
02-01-2021|0010000024|0030000024|บริษัท ไทล์ท้อป อินดัสตรี้ จำกัด (มหาชน)|151|Industrial|5.6005582|603.88||AMR
02-01-2021|0010000036|0030000036|บริษัท สยามฟูรูกาวา จำกัด|151|Industrial|0.2246721|603.88||AMR
02-01-2021|0010000037|0030000037|บริษัท สยามไฟเบอร์กลาส จำกัด|151|Industrial|0.2496042|603.88||AMR
02-01-2021|0010000049|0030000049|บริษัท ไทยผลิตภัณฑ์ยิบซั่ม จำกัด(มหาชน)|151|Industrial|1.3394865|603.88||AMR
02-01-2021|0010000058|0030000058|บริษัท พีคิว เคมิคอลส์ (ประเทศไทย)จำกัด|151|Industrial|0.1655199|603.88||AMR
02-01-2021|0010000061|0030000061|บริษัท ไมย์เออร์ อินดัสตรีส์ จำกัด|151|Industrial|0.4806683|603.88||AMR
02-01-2021|0010000071|0030000071|บริษัท เอสโซ่ (ประเทศไทย) จำกัด (มหาชน)|152|Industrial-CoGen|8.95265|603.88||ADQ
02-01-2021|0010000089|0030000089|บริษัท ธนเสริมอุตสาหกรรมฝาขวด จำกัด|151|Industrial|0.085179|603.88||AMR
02-01-2021|0010000091|0030000091|บริษัท สยาม เอ็นจีเค เทคโนเซรา จำกัด|151|Industrial|0.029629|603.88||AMR
02-01-2021|0010000106|0030000109|บริษัท ไมย์เออร์ อลูมิเนียม (ประเทศไทย) จำกัด|151|Industrial|0.2908518|603.88||AMR
02-01-2021|0010000107|0030000111|บริษัท จี สตีล จำกัด (มหาชน)|151|Industrial|2.898913|603.88||AMR
02-01-2021|0010000125|0030000129|บริษัท อาร์พีที เอเซีย จำกัด|151|Industrial|0.0303706|603.88||AMR
