Date|Sold to|Ship to|Ship to name|ContractType|Description|Volume(MMSCFD)|DemandPlan(BI)|MDCQ(BW)|Billing Type
02-01-2021|0010000128|0030000132|บริษัท เซกิซุย เอส-เล็ค (ประเทศไทย)จำกัด|151|Industrial|0.0361269|603.88||AMR
02-01-2021|0010000139|0030000144|บริษัท ยูเนี่ยนไพโอเนียร์ จำกัด(มหาชน)|151|Industrial|0.097751|603.88||AMR
02-01-2021|0010000140|0030000145|บริษัท สยามลวดเหล็กอุตสาหกรรม จำกัด|151|Industrial|0.0824951|603.88||AMR
02-01-2021|0010000153|0030000159|บริษัท เกทส์ ยูนิทตะ (ประเทศไทย) จำกัด|151|Industrial|0.0933367|603.88||AMR
02-01-2021|0010000191|0030043704|บริษัท ศักดิ์ไชยสิทธิ จำกัด|151|Industrial|0.8977703|603.88||AMR
02-01-2021|0010000220|0030000249|บริษัท เอเชีย ซิลิโคนส์ โมโนเมอร์จำกัด|151|Industrial|4.117694|603.88||AMR
02-01-2021|0010000934|0030046753|บริษัท ฮอนด้า ออโตโมบิล (ประเทศไทย) จำกัด|151|Industrial|0.4317222|603.88||AMR
02-01-2021|0010001714|0030016192|บริษัท ออลเน็กซ์ (ประเทศไทย) จำกัด|151|Industrial|0.183036|603.88||AMR
02-01-2021|0010001727|0030020317|บริษัท ไทยเซ็นทรัลเคมี จำกัด (มหาชน)|151|Industrial|0.0000|603.88||AMR
02-01-2021|0010002201|0030011779|บริษัท ควอลิตี้ คอฟฟี่ โปรดักท์ส จำกัด|151|Industrial|1.358733|603.88||AMR
02-01-2021|0010006758|0030010658|บริษัท คอฟโค่ ไบโอเคมิคอล (ประเทศไทย) จำกัด|151|Industrial|0.6841516|603.88||AMR
02-01-2021|0010006772|0030010740|บริษัท ไซเดน (ประเทศไทย) จำกัด|151|Industrial|0.0289227|603.88||AMR
02-01-2021|0010007060|0030011444|บริษัท สยามร่วมมิตร จำกัด|151|Industrial|0.0935133|603.88||AMR
02-01-2021|0010007812|0030013764|บริษัท กรุงเทพสลักภัณฑ์ จำกัด|151|Industrial|0.1031895|603.88||AMR
02-01-2021|0010007875|0030013765|บริษัท วนชัย เคมีคอล อินดัสทรี่ส์จำกัด|151|Industrial|0.0791049|603.88||AMR
02-01-2021|0010008509|0030044231|บริษัท ผลิตภัณฑ์ตราเพชร จำกัด (มหาชน)|151|Industrial|0.3992679|603.88||AMR
02-01-2021|0010009085|0030056942|บจ.แดรี่ พลัส|151|Industrial|0.5390788|603.88||AMR
02-01-2021|0010009093|0030019105|บริษัท ยูเนียน ออโตพาร์ทส มานูแฟคเชอริ่ง จำกัด|151|Industrial|0.1375154|603.88||AMR
02-01-2021|0010009582|0030020738|บริษัท คอทโก้ พลาสติกส์ จำกัด|151|Industrial|0.0000|603.88||AMR
02-01-2021|0010010355|0030023468|บริษัท เคียวเด็น (ประเทศไทย) จำกัด|151|Industrial|0.058693|603.88||AMR
02-01-2021|0010010358|0030023471|บริษัท เซ้าท์ ซิตี้ ปิโตรเคม จำกัด|151|Industrial|0.0874391|603.88||AMR
02-01-2021|0010012320|0030021767|บริษัท พีทีที โกลบอล เคมิคอล จำกัด(มหาชน)|153|Commercial|0.0000|603.88||AMR
02-01-2021|0010020698|0030038224|บริษัท สตาร์คอร์ จำกัด|151|Industrial|0.1681332|603.88||AMR
02-01-2021|0010021842|0030023236|บริษัท คอทโก้ เมททอลเวอร์คส จำกัด|151|Industrial|0.2886976|603.88||AMR
02-01-2021|0010022869|0030045768|บริษัท ยามาโมริ (ประเทศไทย) จำกัด|151|Industrial|0.037716|603.88||AMR
02-01-2021|0010027130|0030056963|บริษัท แคนาเดียน โซลาร์ แมนูแฟคเจอริ่ง (ประเทศไทย) จำกัด|158|NG by Truck|0.00018|603.88||ADQ
02-01-2021|0010027295|0030059173|บมจ.ปตท. น้ำมันและการค้าปลีก|158|NG by Truck|0.15963|603.88||ADQ
02-01-2021|0010027315|0030057427|บริษัท นิชินโบะ สมบูรณ์ ออโตโมทีฟ จำกัด|151|Industrial|0.0203059|603.88||AMR
02-01-2021|0010027861|0030046657|บริษัท เอสซีจี เซรามิกส์ จำกัด (มหาชน)|151|Industrial|0.0000|603.88||AMR
02-01-2021|0010000019|0030000019|บริษัท ไดนาสตี้ เซรามิค จำกัด (มหาชน)|151|Industrial|5.020373|603.88||AMR
02-01-2021|0010000022|0030000022|บริษัท ไทยบริดจสโตน จำกัด|151|Industrial|0.6312502|603.88||AMR
02-01-2021|0010000035|0030000035|บริษัท สยามซานิทารีแวร์อินดัสทรี จำกัด|151|Industrial|0.6116152|603.88||AMR
02-01-2021|0010000049|0030000049|บริษัท ไทยผลิตภัณฑ์ยิบซั่ม จำกัด(มหาชน)|152|Industrial-CoGen|0.3922756|603.88||AMR
02-01-2021|0010000050|0030000050|บริษัท ไทยพลาสติกและเคมีภัณฑ์ จำกัด(มหาชน)|151|Industrial|5.6172974|603.88||AMR
02-01-2021|0010000067|0030000067|บริษัท มิลล์คอน บูรพา จำกัด|151|Industrial|0.498361|603.88||AMR
02-01-2021|0010000068|0030000068|บริษัท เหล็กสยามยามาโตะ จำกัด|151|Industrial|2.3403757|603.88||AMR
02-01-2021|0010000083|0030021634|บริษัท เอจีซี แฟลทกลาส (ประเทศไทย)จำกัด (มหาชน)|151|Industrial|0.0000|603.88||AMR
02-01-2021|0010000111|0030000115|บริษัท อิวอนิก ยูไนเต็ด ซิลิกา (สยาม) จำกัด|151|Industrial|0.6156764|603.88||AMR
02-01-2021|0010000113|0030000117|บริษัท คาร์ดิแนล เฮลท์ 222 (ประเทศไทย) จำกัด|151|Industrial|2.8662823|603.88||AMR
02-01-2021|0010000130|0030000134|บริษัท กรีนสปอต จำกัด|151|Industrial|0.6711911|603.88||AMR
02-01-2021|0010000130|0030052374|บริษัท กรีนสปอต จำกัด|151|Industrial|0.2813522|603.88||AMR
02-01-2021|0010000146|0030000151|บริษัท จีเอฟพีที จำกัด (มหาชน)|151|Industrial|0.3917106|603.88||AMR
02-01-2021|0010000147|0030000152|บริษัท แมคคีย์ ฟู้ด เซอร์วิสเซส (ประเทศไทย) จำกัด|151|Industrial|0.2919466|603.88||AMR
02-01-2021|0010000159|0030000165|บริษัท ไทย-เยอรมัน สเปเชียลตี้ กลาสจำกัด|151|Industrial|0.0460856|603.88||AMR
02-01-2021|0010000201|0030000021|บริษัท อดิตยา เบอร์ล่า เคมีคัลส์ (ประเทศไทย) จำกัด (ซัลไฟท์ส ดีวิชั่น)|151|Industrial|0.0643786|603.88||AMR
02-01-2021|0010000216|0030030499|บริษัท ไออาร์พีซี จำกัด (มหาชน)|152|Industrial-CoGen|52.9797913|603.88||FlowComp
02-01-2021|0010000216|0030049389|บริษัท ไออาร์พีซี จำกัด (มหาชน)|151|Industrial|7.6627601|603.88||AMR
02-01-2021|0010000226|0030000252|บริษัท ซัมมิท โชว่าแมนูแฟคเจอริ่งจำกัด|151|Industrial|0.1273094|603.88||AMR
02-01-2021|0010000227|0030000253|บริษัท จี เจ สตีล จำกัด (มหาชน)|151|Industrial|2.0370931|603.88||AMR
02-01-2021|0010001196|0030029791|บริษัท ไทยคูน เวิลด์ไวด์ กรุ๊ป (ประเทศไทย) จำกัด (มหาชน)|151|Industrial|2.0526316|603.88||AMR
02-01-2021|0010001217|0030021463|บริษัท แอมคอล อินเตอร์เนชั่นแนล (ไทยแลนด์) จำกัด|151|Industrial|0.0140552|603.88||AMR
02-01-2021|0010001879|0030026184|บริษัท เอ็ชเอ็มซี โปลีเมอส์ จำกัด|151|Industrial|0.2032714|603.88||AMR
02-01-2021|0010003009|0030053395|บริษัท มิตซูบิชิ อีเล็คทริค คอนซูมเมอร์ โปรดักส์ (ประเทศไทย) จำกัด|158|NG by Truck|0.02373|603.88||ADQ
02-01-2021|0010003880|0030008767|บริษัท กังวาลเท็กซ์ไทล์ จำกัด|152|Industrial-CoGen|2.478315|603.88||AMR
02-01-2021|0010006922|0030020406|บริษัท อายิโนะโมะโต๊ะ (ประเทศไทย)จำกัด|151|Industrial|0.0259563|603.88||AMR
02-01-2021|0010007489|0030043669|บจ.ไซมีส เมอร์ชานไดส์|151|Industrial|0.0000|603.88||AMR
02-01-2021|0010007512|0030040636|บริษัท คราวน์ เบ็บแคน แอนด์ โคลสเชอร์ส (ประเทศไทย) จำกัด|151|Industrial|0.1837776|603.88||AMR
02-01-2021|0010009357|0030020016|บริษัท ซีพี-เมจิ จำกัด|151|Industrial|0.5197264|603.88||AMR
02-01-2021|0010010005|0030022294|บริษัท คอทโก้ เอ็นซีอาร์ เปเปอร์ จำกัด|151|Industrial|0.0342199|603.88||AMR
02-01-2021|0010010061|0030022473|บริษัท แอมคอร์ เฟล็กซิเบิ้ล ระยองจำกัด|151|Industrial|0.0136314|603.88||AMR
02-01-2021|0010011029|0030026047|บริษัท เอ็น ซี อาร์ รับเบอร์อินดัสตรี้ จำกัด|151|Industrial|0.0000|603.88||AMR
02-01-2021|0010011163|0030026631|บริษัท ไทย อกริ เพาเวอร์ จำกัด|152|Industrial-CoGen|0.0923832|603.88||AMR
02-01-2021|0010012320|0030000168|บริษัท พีทีที โกลบอล เคมิคอล จำกัด(มหาชน)|151|Industrial|0.0000|603.88||AMR
02-01-2021|0010012320|0030021481|บริษัท พีทีที โกลบอล เคมิคอล จำกัด(มหาชน)|151|Industrial|20.02358|603.88||ADQ
02-01-2021|0010021117|0030000123|บริษัท ซีพีเอฟ (ประเทศไทย) จำกัด(มหาชน)|152|Industrial-CoGen|1.7980126|603.88||AMR
02-01-2021|0010021117|0030000123|บริษัท ซีพีเอฟ (ประเทศไทย) จำกัด(มหาชน)|151|Industrial|0.5663418|603.88||AMR
02-01-2021|0010022812|0030014300|บริษัท โกลบอล เพาเวอร์ ซินเนอร์ยี่จำกัด (มหาชน)|152|Industrial-CoGen|68.5593381|603.88||FlowComp
02-01-2021|0010023651|0030048793|บริษัท ไคฮาระ (ประเทศไทย) จำกัด|151|Industrial|0.229934|603.88||AMR
02-01-2021|0010023667|0030000034|บริษัท สตาร์ ซานิทารี่แวร์ (ประเทศไทย) จำกัด|151|Industrial|0.0000|603.88||AMR
02-01-2021|0010026634|0030054698|บริษัท คานายามา คาเซอิ (ประเทศไทย)จำกัด|158|NG by Truck|0.64876|603.88||ADQ
02-01-2021|0010026674|0030017326|บริษัท ไทยเพรซิเดนท์ฟูดส์ จำกัด(มหาชน)|151|Industrial|0.6243638|603.88||AMR
02-01-2021|0010027861|0030000018|บริษัท เอสซีจี เซรามิกส์ จำกัด (มหาชน)|151|Industrial|3.1583348|603.88||AMR
02-01-2021|0010027861|0030000246|บริษัท เอสซีจี เซรามิกส์ จำกัด (มหาชน)|151|Industrial|3.0446568|603.88||AMR
02-01-2021|0010000004|0030000004|บริษัท ไทย คอปเปอร์ ร็อด จำกัด|151|Industrial|0.0000|603.88||AMR
02-01-2021|0010000005|0030000005|บริษัท ไทยเมทัลโพรเซสซิ่ง จำกัด|151|Industrial|0.0000|603.88||AMR
02-01-2021|0010000016|0030000100|บริษัท ลิกซิล (ประเทศไทย) จำกัด (มหาชน)|151|Industrial|0.3824228|603.88||AMR
02-01-2021|0010000031|0030000031|บริษัท วิลเลรอย แอนด์ บอค (ประเทศไทย) จำกัด|151|Industrial|0.5291554|603.88||AMR
02-01-2021|0010000032|0030000032|บริษัท รอยัลปอร์ซเลน จำกัด (มหาชน)|151|Industrial|0.9661395|603.88||AMR
02-01-2021|0010000043|0030000043|บริษัท ไทย จีซีไอ เรซิท็อป จำกัด|151|Industrial|0.2261906|603.88||AMR
02-01-2021|0010000053|0030020331|บริษัท ไทยอาซาฮีเคมีภัณฑ์ จำกัด|151|Industrial|0.427555|603.88||AMR
02-01-2021|0010000062|0030000062|บริษัท สตาร์ ปิโตรเลียม รีไฟน์นิ่งจำกัด (มหาชน)|151|Industrial|8.268007|603.88||ADQ/AMR
02-01-2021|0010000063|0030000063|บริษัท สยามมิชลิน จำกัด|151|Industrial|0.0000|603.88||AMR
02-01-2021|0010000073|0030000073|บริษัท ไฟน์ เม็ททัล เทคโนโลยีส์จำกัด (มหาชน)|151|Industrial|0.1465206|603.88||AMR
02-01-2021|0010000074|0030000074|บริษัท ไทยเบเวอร์เรจแคน จำกัด|151|Industrial|0.4426344|603.88||AMR
02-01-2021|0010000084|0030000084|บริษัท สยามอุตสาหกรรมวัสดุทนไฟ จำกัด|151|Industrial|1.3404753|603.88||AMR
02-01-2021|0010000098|0030000098|บริษัท อีโอซีโพลิเมอร์ส (ไทยแลนด์)จำกัด|151|Industrial|0.0295937|603.88||AMR
02-01-2021|0010000117|0030000121|บริษัท ไทยซิลิเกตเคมิคัล จำกัด|151|Industrial|1.0101769|603.88||AMR
02-01-2021|0010000120|0030000124|บริษัท ลอยัล ไฮ่เหลียง คอปเปอร์ (ประเทศไทย) จำกัด|151|Industrial|0.0298056|603.88||AMR
02-01-2021|0010000133|0030000138|บริษัท เอ.เจ. พลาสท์ จำกัด (มหาชน)|151|Industrial|0.7557345|603.88||AMR
02-01-2021|0010000145|0030000150|บริษัท แสตนดาร์ดแคน จำกัด|151|Industrial|0.3296274|603.88||AMR
02-01-2021|0010000156|0030000162|บริษัท เวลโกรว์กล๊าส อินดัสทรี จำกัด|151|Industrial|1.8085717|603.88||AMR
02-01-2021|0010000192|0030043881|บริษัท แอร์ ลิควิด (ประเทศไทย) จำกัด|151|Industrial|2.9750515|603.88||AMR
02-01-2021|0010000195|0030033440|บริษัท ไทยลู้บเบส จำกัด (มหาชน)|151|Industrial|1.9309371|603.88||AMR
02-01-2021|0010000207|0030000240|บริษัท สตาร์ส เทคโนโลยี อินดัสเตรียล จำกัด|151|Industrial|0.335313|603.88||AMR
02-01-2021|0010000228|0030000254|บริษัท ไทย เพ็ท เรซิน จำกัด|151|Industrial|1.1041847|603.88||AMR
02-01-2021|0010001431|0030053506|บริษัท คาราบาวตะวันแดง จำกัด|151|Industrial|0.0000|603.88||AMR
02-01-2021|0010001488|0030016945|บริษัท โพลีเพล็กซ์ (ประเทศไทย) จำกัด (มหาชน)|151|Industrial|1.1814532|603.88||AMR
02-01-2021|0010001913|0030020312|บริษัท เหล่าธงสิงห์ จำกัด|151|Industrial|0.0092877|603.88||AMR
02-01-2021|0010001922|0030022692|บริษัท ฟู้ดแอนด์ดริ๊งส์ จำกัด (มหาชน)|151|Industrial|0.15973|603.88||ADQ
02-01-2021|0010006257|0030022426|บริษัท ออโต้อัลลายแอนซ์ (ประเทศไทย)จำกัด|151|Industrial|0.5755589|603.88||AMR
02-01-2021|0010006894|0030020321|บริษัท อาร์ต อุตสาหกรรม จำกัด|151|Industrial|0.023908|603.88||AMR
02-01-2021|0010007151|0030011752|บริษัท เอ็มซีแอลเอส เอเชีย จำกัด|151|Industrial|0.8858692|603.88||AMR
02-01-2021|0010008022|0030033708|บริษัท สยามอุตสาหกรรมเกษตรอาหารจำกัด (มหาชน)|151|Industrial|0.2586448|603.88||AMR
02-01-2021|0010008606|0030016564|บริษัท ซังโกะ ไดคาชติ้ง (ประเทศไทย)จำกัด (มหาชน)|151|Industrial|0.1869913|603.88||AMR
02-01-2021|0010008657|0030016715|บริษัท คิริว (ประเทศไทย) จำกัด|151|Industrial|0.0445671|603.88||AMR
02-01-2021|0010009151|0030019200|บริษัท ไทย เกลซ อุตสาหกรรม จำกัด|151|Industrial|0.3979966|603.88||AMR
02-01-2021|0010009390|0030020154|บริษัท อัลวา อะลูมิเนียม จำกัด|151|Industrial|0.2960431|603.88||AMR
02-01-2021|0010009392|0030020182|บริษัท มิตร สตีล จำกัด|151|Industrial|0.0000|603.88||AMR
02-01-2021|0010010116|0030022714|บริษัท ยัสปาลแอนด์ซันส์ จำกัด|151|Industrial|0.082707|603.88||AMR
02-01-2021|0010011367|0030027987|บริษัท มิลลิเมด จำกัด|151|Industrial|0.034114|603.88||AMR
02-01-2021|0010012320|0030000072|บริษัท พีทีที โกลบอล เคมิคอล จำกัด(มหาชน)|152|Industrial-CoGen|10.04007|603.88||ADQ
02-01-2021|0010012320|0030000072|บริษัท พีทีที โกลบอล เคมิคอล จำกัด(มหาชน)|151|Industrial|26.5622462|603.88||ADQ/AMR
02-01-2021|0010012440|0030033600|บริษัท นูทริกซ์ จำกัด (มหาชน)|151|Industrial|0.2182095|603.88||AMR
02-01-2021|0010021265|0030040855|บริษัท เอ็นเอส-สยามยูไนเต็ดสตีล จำกัด|151|Industrial|1.5240411|603.88||AMR
02-01-2021|0010021577|0030041863|บริษัท นำวัฒนา แพ็คแอนด์พริ้นท์ จำกัด|151|Industrial|0.2063437|603.88||AMR
02-01-2021|0010022812|0030020778|บริษัท โกลบอล เพาเวอร์ ซินเนอร์ยี่จำกัด (มหาชน)|152|Industrial-CoGen|23.5391527|603.88||FlowComp
02-01-2021|0010026752|0030055984|บริษัท เซกิซุย คาเซอิ (ไทยแลนด์) จำกัด|151|Industrial|0.0420951|603.88||AMR
02-01-2021|0010029277|0030062577|บริษัท โรม เมคะเทค (ประเทศไทย) จำกัด|151|Industrial|0.0079|603.88||ADQ
02-01-2021|0010029951|0030064789|บริษัท สยามเพลเล็ทพาวเวอร์ จำกัด|152|Industrial-CoGen|0.8637269|603.88||AMR
02-01-2021|0010030938|0030000014|บริษัท เอสซีจี รูฟฟิ่ง จำกัด|151|Industrial|0.69981|603.88||ADQ
02-01-2021|0010000001|0030000001|บริษัท กระจกลายสยาม จำกัด|151|Industrial|0.27794|603.88||ADQ
02-01-2021|0010000012|0030000012|บริษัท อีสเทิร์นไชน่าแวร์ จำกัด|151|Industrial|0.3029648|603.88||AMR
02-01-2021|0010000013|0030000013|บริษัท ทาทา สตีล การผลิต (ประเทศไทย) จำกัด (มหาชน)|151|Industrial|3.3263975|603.88||AMR
02-01-2021|0010000027|0030000027|บริษัท ฝาจีบ จำกัด (มหาชน)|151|Industrial|0.3489092|603.88||AMR
02-01-2021|0010000038|0030000102|บริษัท สหโมเสคอุตสาหกรรม จำกัด (มหาชน)|151|Industrial|2.7822333|603.88||AMR
02-01-2021|0010000054|0030000054|บริษัท บางกอก คริสตัล จำกัด|151|Industrial|0.9043741|603.88||AMR
02-01-2021|0010000063|0030000075|บริษัท สยามมิชลิน จำกัด|151|Industrial|0.0722538|603.88||AMR
02-01-2021|0010000064|0030000243|บริษัท ลี่ไท่ อัลลอย จำกัด|151|Industrial|0.2076151|603.88||AMR
02-01-2021|0010000078|0030000078|บริษัท ไทเท็กซ์ เอเซีย จำกัด|151|Industrial|0.1621651|603.88||AMR
02-01-2021|0010000088|0030000088|บริษัท ไทยฟิล์มอินดัสตรี่ จำกัด (มหาชน)|151|Industrial|0.0000|603.88||AMR
02-01-2021|0010000104|0030000107|บริษัท สยามโพลิเอททีลีน จำกัด|151|Industrial|1.9783648|603.88||AMR
02-01-2021|0010000122|0030000126|บริษัท บี เอ เอส เอฟ (ไทย) จำกัด|151|Industrial|0.6148642|603.88||AMR
02-01-2021|0010000135|0030000140|บริษัท รอนเด็กซ์ (ประเทศไทย) จำกัด|151|Industrial|0.0000|603.88||AMR
02-01-2021|0010000136|0030000141|บริษัท ยูเนี่ยนไทย-นิจิบัน จำกัด|151|Industrial|0.3703099|603.88||AMR
02-01-2021|0010000149|0030000154|บริษัท เอเวอรี่ เดนนิสสัน (ประเทศไทย) จำกัด|151|Industrial|0.1418238|603.88||AMR
02-01-2021|0010000164|0030019231|บริษัท โกลว์ พลังงาน จำกัด (มหาชน)|151|Industrial|0.0000|603.88||ADQ
02-01-2021|0010000202|0030042681|บริษัท สมบูรณ์ โซมิค แมนูแฟคเจอริ่งจำกัด|151|Industrial|0.0090052|603.88||AMR
02-01-2021|0010001125|0030039301|บริษัท ไทยโพลีอะซีทัล จำกัด|151|Industrial|0.0910766|603.88||AMR
02-01-2021|0010001131|0030044478|บริษัท นอริตาเก้ เอสซีจี พลาสเตอร์จำกัด|151|Industrial|0.2003049|603.88||AMR
02-01-2021|0010001740|0030022424|บริษัท โรงงานเหล็กกรุงเทพฯ จำกัด|151|Industrial|2.0289354|603.88||AMR
02-01-2021|0010001741|0030022479|บริษัท อลูมิเนียม ฉื่อ จิ้น ฮั้ว จำกัด|151|Industrial|0.4966659|603.88||AMR
02-01-2021|0010002094|0030018793|บริษัท พ้อตเตอร์ส (ประเทศไทย) จำกัด|151|Industrial|0.3310753|603.88||AMR
02-01-2021|0010002109|0030030514|บริษัท ลักกี้กลาส จำกัด|151|Industrial|0.7361349|603.88||AMR
02-01-2021|0010006616|0030010020|บริษัท บริดจสโตน คาร์บอน แบล็ค (ประเทศไทย) จำกัด|151|Industrial|0.0715475|603.88||AMR
02-01-2021|0010006940|0030011137|บริษัท เอส ที บี เท็กซ์ไทล์ อินดัสตรี จำกัด|151|Industrial|0.0455559|603.88||AMR
02-01-2021|0010006972|0030011249|บริษัท สยาม ยามาโมริ จำกัด|151|Industrial|0.0272276|603.88||AMR
02-01-2021|0010007766|0030000094|บริษัท อินโดรามา ปิโตรเคม จำกัด|152|Industrial-CoGen|0.4973016|603.88||AMR
02-01-2021|0010007766|0030013680|บริษัท อินโดรามา ปิโตรเคม จำกัด|152|Industrial-CoGen|4.0968583|603.88||AMR
02-01-2021|0010008356|0030047608|บริษัท แสงไทยเมตัลดรัม จำกัด|151|Industrial|0.0500056|603.88||AMR
02-01-2021|0010008739|0030038490|บริษัท สยามไฟเบอร์ซีเมนต์กรุ๊ป จำกัด|151|Industrial|0.0188227|603.88||AMR
02-01-2021|0010008758|0030016949|บริษัท คล็อกเนอร์ เพนทาพลาสท์ (ไทยแลนด์) จำกัด|151|Industrial|0.0218951|603.88||AMR
02-01-2021|0010009176|0030019559|บริษัท พูแรค (ประเทศไทย) จำกัด|151|Industrial|1.9228854|603.88||AMR
02-01-2021|0010009177|0030019562|บริษัท สยามโกชิ มานูแฟคเชอริ่ง จำกั|151|Industrial|0.1102878|603.88||AMR
