Date|Sold to|Ship to|Ship to name|ContractType|Description|Volume(MMSCFD)|DemandPlan(BI)|MDCQ(BW)|Billing Type
02-22-2021|0010000191|0030043704|บริษัท ศักดิ์ไชยสิทธิ จำกัด|151|Industrial|0.4549239|603.88||AMR
02-22-2021|0010000205|0030000238|บริษัท ไทยอาซาคาวา จำกัด|151|Industrial|0.0716888|603.88||AMR
02-22-2021|0010000206|0030000239|บริษัท เฮลซ์เทรดดิ้ง (ประเทศไทย) จำกัด|151|Industrial|0.0331251|603.88||AMR
02-22-2021|0010000228|0030000254|บริษัท ไทย เพ็ท เรซิน จำกัด|151|Industrial|1.0952147|603.88||AMR
02-22-2021|0010001609|0030015621|บริษัท โตโยต้า มอเตอร์ ประเทศไทย จำกัด|152|Industrial-CoGen|1.4076086|603.88||AMR
02-22-2021|0010002094|0030018793|บริษัท พ้อตเตอร์ส (ประเทศไทย) จำกัด|151|Industrial|0.321399|603.88||AMR
02-22-2021|0010002109|0030030514|บริษัท ลักกี้กลาส จำกัด|151|Industrial|0.7736744|603.88||AMR
02-22-2021|0010006940|0030011137|บริษัท เอส ที บี เท็กซ์ไทล์ อินดัสตรี จำกัด|151|Industrial|0.0525129|603.88||AMR
02-22-2021|0010006972|0030011249|บริษัท สยาม ยามาโมริ จำกัด|151|Industrial|0.0286049|603.88||AMR
02-22-2021|0010007812|0030013764|บริษัท กรุงเทพสลักภัณฑ์ จำกัด|151|Industrial|0.1084867|603.88||AMR
02-22-2021|0010007875|0030013765|บริษัท วนชัย เคมีคอล อินดัสทรี่ส์จำกัด|151|Industrial|0.0904409|603.88||AMR
02-22-2021|0010008606|0030016564|บริษัท ซังโกะ ไดคาชติ้ง (ประเทศไทย)จำกัด (มหาชน)|151|Industrial|0.1822238|603.88||AMR
02-22-2021|0010008657|0030016715|บริษัท คิริว (ประเทศไทย) จำกัด|151|Industrial|0.0387755|603.88||AMR
02-22-2021|0010009151|0030019200|บริษัท ไทย เกลซ อุตสาหกรรม จำกัด|151|Industrial|0.2651074|603.88||AMR
02-22-2021|0010009582|0030020738|บริษัท คอทโก้ พลาสติกส์ จำกัด|151|Industrial|0.0000|603.88||AMR
02-22-2021|0010010355|0030023468|บริษัท เคียวเด็น (ประเทศไทย) จำกัด|151|Industrial|0.0533605|603.88||AMR
02-22-2021|0010011784|0030030288|บริษัท สยามเลเทกซ์ สังเคราะห์ จำกัด|151|Industrial|0.7160761|603.88||AMR
02-22-2021|0010011882|0030031074|บริษัท พีทีที อาซาฮี เคมิคอล จำกัด|151|Industrial|4.7107337|603.88||AMR
02-22-2021|0010012326|0030032885|บริษัท สายไฟฟ้าไทย-ยาซากิ จำกัด|151|Industrial|0.2206815|603.88||AMR
02-22-2021|0010021117|0030022988|บริษัท ซีพีเอฟ (ประเทศไทย) จำกัด(มหาชน)|152|Industrial-CoGen|0.0000|603.88||AMR
02-22-2021|0010021910|0030042490|บริษัท คาเนมิทสึ พูลเล่ย์ จำกัด|151|Industrial|0.008087|603.88||AMR
02-22-2021|0010022253|0030043488|บริษัท ที.ที.เซรามิค จำกัด (มหาชน)|151|Industrial|1.383983|603.88||AMR
02-22-2021|0010022812|0030063296|บริษัท โกลบอล เพาเวอร์ ซินเนอร์ยี่จำกัด (มหาชน)|152|Industrial-CoGen|12.2296575|603.88||FlowComp
02-22-2021|0010022868|0030047048|บริษัท ไออาร์พีซี คลีน พาวเวอร์ จำกัด|151|Industrial|2.3305583|603.88||AMR
02-22-2021|0010026153|0030054741|บริษัท นิคเคอิ เอ็มซี อลูมินัม (ประเทศไทย) จำกัด|151|Industrial|0.2723116|603.88||AMR
02-22-2021|0010026372|0030024061|บริษัท เคมีแมน จำกัด (มหาชน)|151|Industrial|1.4038652|603.88||AMR
02-22-2021|0010027861|0030046657|บริษัท เอสซีจี เซรามิกส์ จำกัด (มหาชน)|151|Industrial|0.0000|603.88||AMR
02-22-2021|0010000008|0030000008|บริษัท ไมโครไฟเบอร์อุตสาหกรรม จำกัด|151|Industrial|0.2602693|603.88||AMR
02-22-2021|0010000022|0030000022|บริษัท ไทยบริดจสโตน จำกัด|152|Industrial-CoGen|1.9479235|603.88||AMR
02-22-2021|0010000023|0030000023|บริษัท ไทยเปอร์อ๊อกไซด์ จำกัด|151|Industrial|1.4151306|603.88||AMR
02-22-2021|0010000037|0030000037|บริษัท สยามไฟเบอร์กลาส จำกัด|151|Industrial|0.3110165|603.88||AMR
02-22-2021|0010000053|0030020331|บริษัท ไทยอาซาฮีเคมีภัณฑ์ จำกัด|151|Industrial|0.077657|603.88||AMR
02-22-2021|0010000065|0030000065|บริษัท สยามโพลีสไตรีน จำกัด|151|Industrial|0.0544905|603.88||AMR
02-22-2021|0010000080|0030000080|บริษัท เอ็นเอส บลูสโคป (ประเทศไทย)จำกัด|151|Industrial|1.2200875|603.88||AMR
02-22-2021|0010000096|0030000096|บริษัท ระยองโอเลฟินส์ จำกัด|151|Industrial|5.1536507|603.88||AMR
02-22-2021|0010000097|0030000097|บริษัท สายไฟฟ้าบางกอกเคเบิ้ล จำกัด|151|Industrial|0.212877|603.88||AMR
02-22-2021|0010000114|0030000118|บริษัท อิเมอร์สัน อิเล็คทริค (ประเทศไทย) จำกัด|151|Industrial|0.1237427|603.88||AMR
02-22-2021|0010000130|0030000134|บริษัท กรีนสปอต จำกัด|151|Industrial|0.5210683|603.88||AMR
02-22-2021|0010000130|0030052374|บริษัท กรีนสปอต จำกัด|151|Industrial|0.3130295|603.88||AMR
02-22-2021|0010000146|0030000151|บริษัท จีเอฟพีที จำกัด (มหาชน)|151|Industrial|0.387155|603.88||AMR
02-22-2021|0010000147|0030000152|บริษัท แมคคีย์ ฟู้ด เซอร์วิสเซส (ประเทศไทย) จำกัด|151|Industrial|0.3159606|603.88||AMR
02-22-2021|0010000157|0030000163|บริษัท ไทยอะครีลิค จำกัด|151|Industrial|0.0000|603.88||AMR
02-22-2021|0010000201|0030000021|บริษัท อดิตยา เบอร์ล่า เคมีคัลส์ (ประเทศไทย) จำกัด (ซัลไฟท์ส ดีวิชั่น)|151|Industrial|0.061165|603.88||AMR
02-22-2021|0010000221|0030011437|บริษัท วีนิไทย จำกัด (มหาชน)|151|Industrial|2.1005183|603.88||AMR
02-22-2021|0010000934|0030046753|บริษัท ฮอนด้า ออโตโมบิล (ประเทศไทย) จำกัด|151|Industrial|0.3601039|603.88||AMR
02-22-2021|0010001714|0030016192|บริษัท ออลเน็กซ์ (ประเทศไทย) จำกัด|151|Industrial|0.1560909|603.88||AMR
02-22-2021|0010001727|0030020317|บริษัท ไทยเซ็นทรัลเคมี จำกัด (มหาชน)|151|Industrial|0.0000|603.88||AMR
02-22-2021|0010002048|0030021234|บริษัท ด๊อกเตอร์ บู จำกัด|151|Industrial|0.3497921|603.88||AMR
02-22-2021|0010002092|0030016062|บริษัท สยามแผ่นเหล็กวิลาส จำกัด|151|Industrial|0.0982101|603.88||AMR
02-22-2021|0010006733|0030023785|บริษัท เดลี่ฟู้ดส์ จำกัด|151|Industrial|0.0739136|603.88||AMR
02-22-2021|0010006748|0030010640|บริษัท ยูเนี่ยนโชจิรุชิ จำกัด|151|Industrial|0.0162447|603.88||AMR
02-22-2021|0010007060|0030011444|บริษัท สยามร่วมมิตร จำกัด|151|Industrial|0.0915357|603.88||AMR
02-22-2021|0010007561|0030013097|บริษัท บางชันเยนเนอเรลเอเซมบลี จำกัด|151|Industrial|0.0468626|603.88||AMR
02-22-2021|0010007594|0030013168|บริษัท ไลอ้อน (ประเทศไทย) จำกัด|151|Industrial|0.4507568|603.88||AMR
02-22-2021|0010008288|0030015470|บริษัท อุตสาหกรรมทำเครื่องแก้วไทยจำกัด (มหาชน)|151|Industrial|6.7997395|603.88||AMR
02-22-2021|0010008289|0030015477|บริษัท ดี-รับเบอร์ โปรดักส์ จำกัด|151|Industrial|0.0223188|603.88||AMR
02-22-2021|0010008739|0030038490|บริษัท สยามไฟเบอร์ซีเมนต์กรุ๊ป จำกัด|151|Industrial|0.0408591|603.88||AMR
02-22-2021|0010008758|0030016949|บริษัท คล็อกเนอร์ เพนทาพลาสท์ (ไทยแลนด์) จำกัด|151|Industrial|0.0263094|603.88||AMR
02-22-2021|0010009196|0030019599|บริษัท ราชราตัน ไทย ไวร์ จำกัด|151|Industrial|0.2508403|603.88||AMR
02-22-2021|0010010005|0030022294|บริษัท คอทโก้ เอ็นซีอาร์ เปเปอร์ จำกัด|151|Industrial|0.0251793|603.88||AMR
02-22-2021|0010010925|0030025431|บริษัท เน็กซ์ แคน อินโนเวชั่น จำกัด|151|Industrial|0.3393389|603.88||AMR
02-22-2021|0010010998|0030026291|บริษัท งามดีอุตสาหกรรม จำกัด|151|Industrial|0.0776923|603.88||AMR
02-22-2021|0010012323|0030032849|บริษัท โตโยอิ๊งค์ (ประเทศไทย) จำกัด|151|Industrial|0.00842|603.88||ADQ
02-22-2021|0010021112|0030041494|บริษัท เจเอสอาร์ บีเอสที อิลาสโตเมอร์ จำกัด|151|Industrial|0.107851|603.88||AMR
02-22-2021|0010022333|0030043703|บริษัท เอเชียแปซิฟิกกลาส จำกัด|151|Industrial|2.4450132|603.88||AMR
02-22-2021|0010022444|0030044003|บริษัท ทีวาย สตีล จำกัด|151|Industrial|0.5341348|603.88||AMR
02-22-2021|0010023379|0030049270|บริษัท ลาบิกซ์ จำกัด|151|Industrial|5.1879766|603.88||AMR
02-22-2021|0010023436|0030052175|บริษัท ซันโทรี่ เป๊ปซี่โค เบเวอเรจ(ประเทศไทย) จำกัด|151|Industrial|0.1923238|603.88||AMR
02-22-2021|0010026752|0030055984|บริษัท เซกิซุย คาเซอิ (ไทยแลนด์) จำกัด|151|Industrial|0.0478161|603.88||AMR
02-22-2021|0010027807|0030064609|บริษัท เช่วเฉิน ซิลิก้า (ไทยแลนด์)จำกัด|151|Industrial|0.23013|603.88||ADQ
02-22-2021|0010027860|0030059153|บริษัท เค.เอ็ม.เค.(ไทยแลนด์) จำกัด|151|Industrial|0.0374688|603.88||AMR
02-22-2021|0010000012|0030000012|บริษัท อีสเทิร์นไชน่าแวร์ จำกัด|151|Industrial|0.0000|603.88||AMR
02-22-2021|0010000013|0030000013|บริษัท ทาทา สตีล การผลิต (ประเทศไทย) จำกัด (มหาชน)|151|Industrial|2.9684477|603.88||AMR
02-22-2021|0010000027|0030000027|บริษัท ฝาจีบ จำกัด (มหาชน)|151|Industrial|0.1710644|603.88||AMR
02-22-2021|0010000043|0030000043|บริษัท ไทย จีซีไอ เรซิท็อป จำกัด|151|Industrial|0.3741945|603.88||AMR
02-22-2021|0010000056|0030000056|บริษัท โอเอสซี สยามซิลิกา จำกัด|151|Industrial|2.2168802|603.88||AMR
02-22-2021|0010000056|0030000059|บริษัท โอเอสซี สยามซิลิกา จำกัด|151|Industrial|1.7847696|603.88||AMR
02-22-2021|0010000063|0030000075|บริษัท สยามมิชลิน จำกัด|151|Industrial|0.0765975|603.88||AMR
02-22-2021|0010000064|0030000243|บริษัท ลี่ไท่ อัลลอย จำกัด|151|Industrial|0.2772203|603.88||AMR
02-22-2021|0010000078|0030000078|บริษัท ไทเท็กซ์ เอเซีย จำกัด|151|Industrial|0.186285|603.88||AMR
02-22-2021|0010000089|0030000089|บริษัท ธนเสริมอุตสาหกรรมฝาขวด จำกัด|151|Industrial|0.0881808|603.88||AMR
02-22-2021|0010000091|0030000091|บริษัท สยาม เอ็นจีเค เทคโนเซรา จำกัด|151|Industrial|0.1564088|603.88||AMR
02-22-2021|0010000108|0030000112|บริษัท ยูนิตี้ อินดัสเตรียล จำกัด|151|Industrial|0.0313947|603.88||AMR
02-22-2021|0010000109|0030000113|บริษัท ระยองไวร์ อินดัสตรีส์ จำกัด(มหาชน)|151|Industrial|0.0277926|603.88||AMR
02-22-2021|0010000129|0030000133|บริษัท ทีพีซี เพสต์ เรซิน จำกัด|151|Industrial|0.2821291|603.88||AMR
02-22-2021|0010000141|0030000146|บริษัท สยามสตีล กัลวาไนซิ่ง จำกัด|151|Industrial|0.1552787|603.88||AMR
02-22-2021|0010000158|0030000164|บริษัท นิวพลัสนิตติ้ง จำกัด (มหาชน)|151|Industrial|0.0000|603.88||AMR
02-22-2021|0010000159|0030000165|บริษัท ไทย-เยอรมัน สเปเชียลตี้ กลาสจำกัด|151|Industrial|0.0470744|603.88||AMR
02-22-2021|0010000201|0030000234|บริษัท อดิตยา เบอร์ล่า เคมีคัลส์ (ประเทศไทย) จำกัด(คลออัลคาลีดีวิชั่น)|151|Industrial|0.028287|603.88||AMR
02-22-2021|0010000201|0030020965|บริษัท อดิตยา เบอร์ล่า เคมีคัลส์ (ประเทศไทย) จำกัด (แอดวานซ์ แมททีเรียลส์)|151|Industrial|0.1176332|603.88||AMR
02-22-2021|0010000224|0030000250|บริษัท ออมโนวา เอ็นจิเนียร์ด เซอร์เฟสเซส (ประเทศไทย) จำกัด|151|Industrial|0.2592805|603.88||AMR
02-22-2021|0010000225|0030000251|บริษัท ซีพีพีซี จำกัด (มหาชน)|151|Industrial|0.1124773|603.88||AMR
02-22-2021|0010001146|0030042053|บริษัท เคลล็อก (ประเทศไทย) จำกัด|151|Industrial|0.1895693|603.88||AMR
02-22-2021|0010001747|0030042303|บริษัท สุนทรเมทัลอินดัสทรี้ส์ จำกัด|151|Industrial|0.4009631|603.88||AMR
02-22-2021|0010002964|0030024050|บริษัท สยามบราเดอร์ จำกัด|151|Industrial|0.1114531|603.88||AMR
02-22-2021|0010006922|0030011105|บริษัท อายิโนะโมะโต๊ะ (ประเทศไทย)จำกัด|151|Industrial|0.0009181|603.88||AMR
02-22-2021|0010007489|0030043669|บจ.ไซมีส เมอร์ชานไดส์|151|Industrial|0.0000|603.88||AMR
02-22-2021|0010007512|0030040636|บริษัท คราวน์ เบ็บแคน แอนด์ โคลสเชอร์ส (ประเทศไทย) จำกัด|151|Industrial|0.1792221|603.88||AMR
02-22-2021|0010008206|0030033172|บริษัท เอ็นเนซอล จำกัด|152|Industrial-CoGen|1.4366373|603.88||AMR
02-22-2021|0010008671|0030021639|บริษัท พีทีที ฟีนอล จำกัด|151|Industrial|0.3310046|603.88||AMR
02-22-2021|0010009180|0030019567|บริษัท ไทย มาลายา กลาส จำกัด|151|Industrial|0.0000|603.88||AMR
02-22-2021|0010009604|0030020797|บริษัท เจ.พี ยูไนเต็ด จำกัด|151|Industrial|0.0000|603.88||AMR
02-22-2021|0010009784|0030021478|บริษัท แคททาเลอร์ (ประเทศไทย) จำกัด|151|Industrial|0.1380451|603.88||AMR
02-22-2021|0010010605|0030024817|บริษัท มาบตาพุดโอเลฟินส์ จำกัด|151|Industrial|18.4037261|603.88||AMR
02-22-2021|0010012059|0030045449|บริษัท พีทีที เอ็มซีซี ไบโอเคม จำกัด|151|Industrial|0.6404673|603.88||AMR
02-22-2021|0010012118|0030062578|บริษัท พีทีที แอลเอ็นจี จำกัด|152|Industrial-CoGen|2.4020772|603.88||FlowComp
02-22-2021|0010012320|0030021767|บริษัท พีทีที โกลบอล เคมิคอล จำกัด(มหาชน)|154|Commercial–CoGen|0.087651|603.88||AMR
02-22-2021|0010012320|0030026468|บริษัท พีทีที โกลบอล เคมิคอล จำกัด(มหาชน)|151|Industrial|11.8995353|603.88||AMR
02-22-2021|0010021117|0030000123|บริษัท ซีพีเอฟ (ประเทศไทย) จำกัด(มหาชน)|152|Industrial-CoGen|1.8006259|603.88||AMR
02-22-2021|0010021117|0030000123|บริษัท ซีพีเอฟ (ประเทศไทย) จำกัด(มหาชน)|151|Industrial|0.7660464|603.88||AMR
02-22-2021|0010022812|0030014300|บริษัท โกลบอล เพาเวอร์ ซินเนอร์ยี่จำกัด (มหาชน)|152|Industrial-CoGen|65.6268703|603.88||FlowComp
02-22-2021|0010023651|0030048793|บริษัท ไคฮาระ (ประเทศไทย) จำกัด|151|Industrial|0.135679|603.88||AMR
02-22-2021|0010023667|0030000034|บริษัท สตาร์ ซานิทารี่แวร์ (ประเทศไทย) จำกัด|151|Industrial|0.1027304|603.88||AMR
02-22-2021|0010026634|0030054698|บริษัท คานายามา คาเซอิ (ประเทศไทย)จำกัด|158|NG by Truck|0.5240|603.88||ADQ
02-22-2021|0010026674|0030017326|บริษัท ไทยเพรซิเดนท์ฟูดส์ จำกัด(มหาชน)|151|Industrial|0.4576431|603.88||AMR
02-22-2021|0010027861|0030000017|บริษัท เอสซีจี เซรามิกส์ จำกัด (มหาชน)|151|Industrial|2.1781753|603.88||AMR
02-22-2021|0010000003|0030000003|บริษัท เขาช่องอุตสาหกรรม 1979 จำกัด|151|Industrial|0.563446|603.88||AMR
02-22-2021|0010000016|0030000016|บริษัท ลิกซิล (ประเทศไทย) จำกัด (มหาชน)|151|Industrial|0.618325|603.88||AMR
02-22-2021|0010000032|0030000032|บริษัท รอยัลปอร์ซเลน จำกัด (มหาชน)|151|Industrial|0.722574|603.88||AMR
02-22-2021|0010000049|0030000049|บริษัท ไทยผลิตภัณฑ์ยิบซั่ม จำกัด(มหาชน)|151|Industrial|1.4714929|603.88||AMR
02-22-2021|0010000058|0030000058|บริษัท พีคิว เคมิคอลส์ (ประเทศไทย)จำกัด|151|Industrial|0.1615647|603.88||AMR
02-22-2021|0010000061|0030000061|บริษัท ไมย์เออร์ อินดัสตรีส์ จำกัด|151|Industrial|0.51284|603.88||AMR
02-22-2021|0010000067|0030000067|บริษัท มิลล์คอน บูรพา จำกัด|151|Industrial|1.0045266|603.88||AMR
02-22-2021|0010000068|0030000068|บริษัท เหล็กสยามยามาโตะ จำกัด|151|Industrial|2.5069905|603.88||AMR
02-22-2021|0010000084|0030000084|บริษัท สยามอุตสาหกรรมวัสดุทนไฟ จำกัด|151|Industrial|1.3279739|603.88||AMR
02-22-2021|0010000098|0030000098|บริษัท อีโอซีโพลิเมอร์ส (ไทยแลนด์)จำกัด|151|Industrial|0.0359503|603.88||AMR
02-22-2021|0010000116|0030034491|บริษัท มิตซูบิชิ มอเตอร์ส (ประเทศไทย) จำกัด|151|Industrial|0.1621651|603.88||AMR
02-22-2021|0010000117|0030000121|บริษัท ไทยซิลิเกตเคมิคัล จำกัด|151|Industrial|1.1297172|603.88||AMR
02-22-2021|0010000133|0030000138|บริษัท เอ.เจ. พลาสท์ จำกัด (มหาชน)|151|Industrial|0.7779828|603.88||AMR
02-22-2021|0010000143|0030000148|บริษัท สยาม พุงซาน เมทัล จำกัด|151|Industrial|0.1096521|603.88||AMR
02-22-2021|0010000144|0030000149|บริษัท เบอร์ลี่ ยุคเกอร์ เซลล็อกซ์จำกัด|151|Industrial|0.3541711|603.88||AMR
02-22-2021|0010000154|0030000160|บริษัท แม็กซิออน วีลส์ (ประเทศไทย)จำกัด|151|Industrial|0.5455768|603.88||AMR
02-22-2021|0010000155|0030000161|บริษัท มาเล่ย์ เอ็นจิ่น คอมโพเน็นท์(ประเทศไทย) จำกัด|151|Industrial|0.0717241|603.88||AMR
02-22-2021|0010000197|0030025358|บริษัท บางจาก คอร์ปอเรชั่น จำกัด (มหาชน)|152|Industrial-CoGen|0.0687577|603.88||AMR
02-22-2021|0010000197|0030025358|บริษัท บางจาก คอร์ปอเรชั่น จำกัด (มหาชน)|151|Industrial|8.8627183|603.88||FlowComp
02-22-2021|0010000220|0030000249|บริษัท เอเชีย ซิลิโคนส์ โมโนเมอร์จำกัด|151|Industrial|4.2080996|603.88||AMR
02-22-2021|0010001013|0030023306|บริษัท เนสท์เล่ (ไทย) จำกัด|151|Industrial|0.0379986|603.88||AMR
02-22-2021|0010001727|0030020317|บริษัท ไทยเซ็นทรัลเคมี จำกัด (มหาชน)|152|Industrial-CoGen|0.0000|603.88||AMR
02-22-2021|0010001998|0030025768|บริษัท อินโดรามา โพลีเอสเตอร์ อินดัสตรี้ส์ จำกัด (มหาชน)|151|Industrial|1.8833329|603.88||AMR
02-22-2021|0010006257|0030022426|บริษัท ออโต้อัลลายแอนซ์ (ประเทศไทย)จำกัด|151|Industrial|0.5318393|603.88||AMR
02-22-2021|0010006758|0030010658|บริษัท คอฟโค่ ไบโอเคมิคอล (ประเทศไทย) จำกัด|151|Industrial|0.6544873|603.88||AMR
02-22-2021|0010006772|0030010740|บริษัท ไซเดน (ประเทศไทย) จำกัด|151|Industrial|0.0409297|603.88||AMR
02-22-2021|0010007765|0030013679|บริษัท เอ.พี.ซี อุตสาหกรรม จำกัด|151|Industrial|0.0000|603.88||AMR
02-22-2021|0010008928|0030018387|บริษัท หลุยส์ผลิตภัณท์กาวเทป จำกัด|151|Industrial|0.1844486|603.88||AMR
02-22-2021|0010009040|0030022254|บริษัท ไทยเรยอน จำกัด (มหาชน)|151|Industrial|0.7769587|603.88||AMR
02-22-2021|0010009390|0030020154|บริษัท อัลวา อะลูมิเนียม จำกัด|151|Industrial|0.2429651|603.88||AMR
02-22-2021|0010009392|0030020182|บริษัท มิตร สตีล จำกัด|151|Industrial|0.0000|603.88||AMR
02-22-2021|0010010216|0030023098|บริษัท สยามพรีเสิร์ฟ ฟู้ดส์ จำกัด|151|Industrial|0.1490986|603.88||AMR
02-22-2021|0010010220|0030023100|บริษัท เอส ไอ ดับบลิว (ไทยแลนด์) จำกัด|151|Industrial|0.1440839|603.88||AMR
02-22-2021|0010012320|0030021767|บริษัท พีทีที โกลบอล เคมิคอล จำกัด(มหาชน)|153|Commercial|0.0000|603.88||AMR
02-22-2021|0010020836|0030038183|บริษัท กรุงเทพ ซินธิติกส์ จำกัด|151|Industrial|0.1492399|603.88||AMR
02-22-2021|0010021265|0030040855|บริษัท เอ็นเอส-สยามยูไนเต็ดสตีล จำกัด|151|Industrial|1.6646643|603.88||AMR
02-22-2021|0010021577|0030041863|บริษัท นำวัฒนา แพ็คแอนด์พริ้นท์ จำกัด|151|Industrial|0.4761481|603.88||AMR
02-22-2021|0010022812|0030020778|บริษัท โกลบอล เพาเวอร์ ซินเนอร์ยี่จำกัด (มหาชน)|151|Industrial|2.5712428|603.88||FlowComp
