Date|Sold to|Ship to|Ship to name|ContractType|Description|Volume(MMSCFD)|DemandPlan(BI)|MDCQ(BW)|Billing Type
02-01-2021|0010009442|0030020288|บริษัท อายิโนะโมะโต๊ะเซลส์ (ประเทศไทย) จำกัด|151|Industrial|0.0040611|603.88||AMR
02-01-2021|0010010156|0030022920|บริษัท ไทยเคมีภัณฑ์ จำกัด|151|Industrial|0.1119122|603.88||AMR
02-01-2021|0010010216|0030023098|บริษัท สยามพรีเสิร์ฟ ฟู้ดส์ จำกัด|151|Industrial|0.1133601|603.88||AMR
02-01-2021|0010012320|0030000055|บริษัท พีทีที โกลบอล เคมิคอล จำกัด(มหาชน)|151|Industrial|0.0015891|603.88||AMR
02-01-2021|0010012320|0030000069|บริษัท พีทีที โกลบอล เคมิคอล จำกัด(มหาชน)|151|Industrial|10.2155538|603.88||AMR
02-01-2021|0010021117|0030022988|บริษัท ซีพีเอฟ (ประเทศไทย) จำกัด(มหาชน)|152|Industrial-CoGen|0.0000|603.88||AMR
02-01-2021|0010022812|0030020778|บริษัท โกลบอล เพาเวอร์ ซินเนอร์ยี่จำกัด (มหาชน)|151|Industrial|2.6631097|603.88||FlowComp
02-01-2021|0010022812|0030024457|บริษัท โกลบอล เพาเวอร์ ซินเนอร์ยี่จำกัด (มหาชน)|151|Industrial|3.7302564|603.88||AMR
02-01-2021|0010023967|0030050118|บริษัท โอซาก้า แก๊ส (ประเทศไทย) จำกัด|151|Industrial|0.2548308|603.88||AMR
02-01-2021|0010024039|0030050402|บริษัท สุเพิร์บ พาวเวอร์ จำกัด|152|Industrial-CoGen|0.3835529|603.88||AMR
02-01-2021|0010027807|0030064609|บริษัท เช่วเฉิน ซิลิก้า (ไทยแลนด์)จำกัด|151|Industrial|0.29684|603.88||ADQ
02-01-2021|0010027860|0030059153|บริษัท เค.เอ็ม.เค.(ไทยแลนด์) จำกัด|151|Industrial|0.0421657|603.88||AMR
02-01-2021|0010000003|0030000003|บริษัท เขาช่องอุตสาหกรรม 1979 จำกัด|151|Industrial|0.3610221|603.88||AMR
02-01-2021|0010000015|0030000015|บริษัท โคห์เลอร์ (ประเทศไทย) จำกัด(มหาชน)|151|Industrial|2.2396582|603.88||AMR
02-01-2021|0010000033|0030000104|บริษัท โรแยล ซีรามิค อุตสาหกรรม จำกัด (มหาชน)|151|Industrial|1.4533411|603.88||AMR
02-01-2021|0010000051|0030000051|บริษัท ไทยไวร์โพรดัคท์ จำกัด (มหาชน)|151|Industrial|0.0074514|603.88||AMR
02-01-2021|0010000062|0030000062|บริษัท สตาร์ ปิโตรเลียม รีไฟน์นิ่งจำกัด (มหาชน)|152|Industrial-CoGen|9.89434|603.88||ADQ
02-01-2021|0010000076|0030000076|บริษัท สยามสไตรีนโมโนเมอร์ จำกัด|151|Industrial|3.3366741|603.88||AMR
02-01-2021|0010000092|0030000092|บริษัท ไทย-สแกนดิค สตีล จำกัด|151|Industrial|0.0830954|603.88||AMR
02-01-2021|0010000110|0030000114|บริษัท ระยอง กัลวาไนซิ่ง จำกัด|151|Industrial|0.0502881|603.88||AMR
02-01-2021|0010000129|0030000133|บริษัท ทีพีซี เพสต์ เรซิน จำกัด|151|Industrial|0.3345714|603.88||AMR
02-01-2021|0010000137|0030000142|บริษัท วาลเมท จำกัด|151|Industrial|0.0003178|603.88||AMR
02-01-2021|0010000150|0030000155|บริษัท บริดจสโตน เมตัลฟา(ประเทศไทย) จำกัด|151|Industrial|0.3091801|603.88||AMR
02-01-2021|0010000151|0030000156|บริษัท มิตซูบิชิ อีเล็คทริค ออโตเมชั่น (ประเทศไทย) จำกัด|151|Industrial|0.2246721|603.88||AMR
02-01-2021|0010000164|0030030778|บริษัท โกลว์ พลังงาน จำกัด (มหาชน)|152|Industrial-CoGen|0.0000|603.88||FlowComp
02-01-2021|0010000178|0030016267|บริษัท โกลว์ เอสพีพี 11 จำกัด|152|Industrial-CoGen|1.1499525|603.88||AMR
02-01-2021|0010000205|0030000238|บริษัท ไทยอาซาคาวา จำกัด|151|Industrial|0.0715475|603.88||AMR
02-01-2021|0010000206|0030000239|บริษัท เฮลซ์เทรดดิ้ง (ประเทศไทย) จำกัด|151|Industrial|0.0049793|603.88||AMR
02-01-2021|0010000225|0030011191|บริษัท ซีพีพีซี จำกัด (มหาชน) (Coating Plant)|151|Industrial|0.0090405|603.88||AMR
02-01-2021|0010001013|0030023306|บริษัท เนสท์เล่ (ไทย) จำกัด|151|Industrial|0.0317832|603.88||AMR
02-01-2021|0010001609|0030015621|บริษัท โตโยต้า มอเตอร์ ประเทศไทย จำกัด|152|Industrial-CoGen|1.3796393|603.88||AMR
02-01-2021|0010001998|0030025768|บริษัท อินโดรามา โพลีเอสเตอร์ อินดัสตรี้ส์ จำกัด (มหาชน)|151|Industrial|1.8682535|603.88||AMR
02-01-2021|0010006733|0030023785|บริษัท เดลี่ฟู้ดส์ จำกัด|151|Industrial|0.0725363|603.88||AMR
02-01-2021|0010006748|0030010640|บริษัท ยูเนี่ยนโชจิรุชิ จำกัด|151|Industrial|0.0073101|603.88||AMR
02-01-2021|0010007112|0030011636|บริษัท ไทยซัมมิท อีสเทิร์น ซีบอร์ดโอโตพาร์ท อินดัสตรี จำกัด|151|Industrial|0.0710531|603.88||AMR
02-01-2021|0010007982|0030014211|บริษัท จีซี ไกลคอล จำกัด|151|Industrial|0.125579|603.88||AMR
02-01-2021|0010008509|0030016162|บริษัท ผลิตภัณฑ์ตราเพชร จำกัด (มหาชน)|151|Industrial|0.0880395|603.88||AMR
02-01-2021|0010008928|0030018387|บริษัท หลุยส์ผลิตภัณท์กาวเทป จำกัด|151|Industrial|0.2353018|603.88||AMR
02-01-2021|0010009040|0030022254|บริษัท ไทยเรยอน จำกัด (มหาชน)|151|Industrial|0.8572996|603.88||AMR
02-01-2021|0010009228|0030019659|บริษัท ไทย เอ็มเอฟซี จำกัด|151|Industrial|0.1304878|603.88||AMR
02-01-2021|0010009357|0030020016|บริษัท ซีพี-เมจิ จำกัด|152|Industrial-CoGen|0.0000|603.88||AMR
02-01-2021|0010009841|0030021637|บริษัท โอวาริ เซกิ (ไทยแลนด์) จำกัด|151|Industrial|0.0075926|603.88||AMR
02-01-2021|0010010998|0030026291|บริษัท งามดีอุตสาหกรรม จำกัด|151|Industrial|0.0545612|603.88||AMR
02-01-2021|0010012227|0030032353|บริษัท เอ็มทีพี เอชพี เจวี (ประเทศไทย) จำกัด|151|Industrial|9.3318388|603.88||AMR
02-01-2021|0010012326|0030032885|บริษัท สายไฟฟ้าไทย-ยาซากิ จำกัด|151|Industrial|0.209063|603.88||AMR
02-01-2021|0010021112|0030041494|บริษัท เจเอสอาร์ บีเอสที อิลาสโตเมอร์ จำกัด|151|Industrial|0.1081336|603.88||AMR
02-01-2021|0010021910|0030042490|บริษัท คาเนมิทสึ พูลเล่ย์ จำกัด|151|Industrial|0.0096409|603.88||AMR
02-01-2021|0010022253|0030043488|บริษัท ที.ที.เซรามิค จำกัด (มหาชน)|151|Industrial|1.2450197|603.88||AMR
02-01-2021|0010022812|0030063296|บริษัท โกลบอล เพาเวอร์ ซินเนอร์ยี่จำกัด (มหาชน)|152|Industrial-CoGen|12.2565383|603.88||FlowComp
02-01-2021|0010022868|0030047048|บริษัท ไออาร์พีซี คลีน พาวเวอร์ จำกัด|151|Industrial|2.472594|603.88||AMR
02-01-2021|0010024055|0030064941|บริษัท โอจีพี เอนเนอร์ยี่ โซลูชั่นส์ จำกัด (สำหรับ บริษัท นิปปอน สตีลไพพ์ (ประเทศไทย) จำกัด โรงงาน 1)|151|Industrial|0.07643|603.88||ADQ
02-01-2021|0010024055|0030064942|บริษัท โอจีพี เอนเนอร์ยี่ โซลูชั่นส์ จำกัด (สำหรับ บริษัท นิปปอน สตีลไพพ์ (ประเทศไทย) จำกัด โรงงาน 2)|151|Industrial|0.08839|603.88||ADQ
02-01-2021|0010024871|0030053591|บริษัท เอ็นเอส-โอจี เอนเนอร์จี โซลูชั่นส์ (ไทยแลนด์) จำกัด|152|Industrial-CoGen|0.82873|603.88||AMR
02-01-2021|0010027459|0030011637|บริษัท โอสถสภา จำกัด (มหาชน)|151|Industrial|1.611445|603.88||AMR
02-01-2021|0010027938|0030059837|บริษัท ราชบุรีกล๊าส อินดัสทรี จำกัด|151|Industrial|2.0484998|603.88||AMR
02-01-2021|0010028705|0030017241|บริษัท บีจี โฟลต กล๊าส จำกัด|151|Industrial|0.2930766|603.88||AMR
