Date|Sold to|Ship to|Ship to name|ContractType|Description|Volume(MMSCFD)|DemandPlan(BI)|MDCQ(BW)|Billing Type
02-22-2021|0010022812|0030024457|บริษัท โกลบอล เพาเวอร์ ซินเนอร์ยี่จำกัด (มหาชน)|151|Industrial|3.6328231|603.88||AMR
02-22-2021|0010024055|0030057123|บจ.โอจีพี เอนเนอร์ยี่ โซลูชั่นส์ (สำหรับ บจ.ซึชิโยชิ สมบูรณ์ โคเตทแซนด์)|151|Industrial|0.1431657|603.88||AMR
02-22-2021|0010024055|0030064939|บริษัท โอจีพี เอนเนอร์ยี่ โซลูชั่นส์ จำกัด (สำหรับ บริษัท ยามาดะ สมบูรณ์ จำกัด)|151|Industrial|0.16788|603.88||ADQ
02-22-2021|0010024055|0030064940|บริษัท โอจีพี เอนเนอร์ยี่ โซลูชั่นส์ จำกัด (สำหรับ บริษัท คันไซ เรซิน(ประเทศไทย) จำกัด)|151|Industrial|0.05785|603.88||ADQ
02-22-2021|0010027459|0030011637|บริษัท โอสถสภา จำกัด (มหาชน)|151|Industrial|1.6863122|603.88||AMR
02-22-2021|0010029277|0030062577|บริษัท โรม เมคะเทค (ประเทศไทย) จำกัด|151|Industrial|0.01326|603.88||ADQ
02-22-2021|0010029951|0030064789|บริษัท สยามเพลเล็ทพาวเวอร์ จำกัด|152|Industrial-CoGen|0.8578646|603.88||AMR
02-22-2021|0010030938|0030000014|บริษัท เอสซีจี รูฟฟิ่ง จำกัด|151|Industrial|0.81403|603.88||ADQ
02-22-2021|0010000009|0030000009|บริษัท ล.ไลท์ติ้งกลาส จำกัด|151|Industrial|3.0508722|603.88||AMR
02-22-2021|0010000010|0030000010|บริษัท สยามกลาส อินดัสทรี จำกัด|151|Industrial|1.7993899|603.88||AMR
02-22-2021|0010000024|0030000024|บริษัท ไทล์ท้อป อินดัสตรี้ จำกัด (มหาชน)|151|Industrial|5.7991681|603.88||AMR
02-22-2021|0010000033|0030000104|บริษัท โรแยล ซีรามิค อุตสาหกรรม จำกัด (มหาชน)|151|Industrial|1.7311265|603.88||AMR
02-22-2021|0010000049|0030000049|บริษัท ไทยผลิตภัณฑ์ยิบซั่ม จำกัด(มหาชน)|152|Industrial-CoGen|0.6944282|603.88||AMR
02-22-2021|0010000050|0030000050|บริษัท ไทยพลาสติกและเคมีภัณฑ์ จำกัด(มหาชน)|151|Industrial|2.3220121|603.88||AMR
02-22-2021|0010000062|0030000062|บริษัท สตาร์ ปิโตรเลียม รีไฟน์นิ่งจำกัด (มหาชน)|151|Industrial|14.251705|603.88||ADQ/AMR
02-22-2021|0010000063|0030000063|บริษัท สยามมิชลิน จำกัด|151|Industrial|0.0000|603.88||AMR
02-22-2021|0010000071|0030000071|บริษัท เอสโซ่ (ประเทศไทย) จำกัด (มหาชน)|151|Industrial|7.57458|603.88||ADQ
02-22-2021|0010000085|0030000085|บริษัท บางกอกอินดัสเทรียลแก๊ส จำกัด|151|Industrial|0.04658|603.88||AMR
02-22-2021|0010000086|0030000086|บริษัท สยามคอมเพรสเซอร์อุตสาหกรรม จำกัด|151|Industrial|0.1714175|603.88||AMR
02-22-2021|0010000099|0030000099|บริษัท เกรท วอลล์ มอเตอร์ แมนูแฟคเจอริ่ง (ประเทศไทย) จำกัด|151|Industrial|0.1515|603.88||AMR
02-22-2021|0010000101|0030000103|บริษัท ร็อควูล (ประเทศไทย) จำกัด|151|Industrial|0.2424001|603.88||AMR
02-22-2021|0010000116|0030000120|บริษัท มิตซูบิชิ มอเตอร์ส (ประเทศไทย) จำกัด|151|Industrial|0.3215403|603.88||AMR
02-22-2021|0010000131|0030000136|บริษัท การ์เดียนอินดัสทรีส์ ระยองจำกัด|151|Industrial|2.0082057|603.88||AMR
02-22-2021|0010000132|0030000137|บริษัท การ์เดียนอินดัสทรีส์ คอร์ปจำกัด|151|Industrial|3.470093|603.88||AMR
02-22-2021|0010000145|0030000150|บริษัท แสตนดาร์ดแคน จำกัด|151|Industrial|0.2797983|603.88||AMR
02-22-2021|0010000156|0030000162|บริษัท เวลโกรว์กล๊าส อินดัสทรี จำกัด|151|Industrial|1.8476297|603.88||AMR
02-22-2021|0010000192|0030043881|บริษัท แอร์ ลิควิด (ประเทศไทย) จำกัด|151|Industrial|3.0591005|603.88||AMR
02-22-2021|0010000195|0030033440|บริษัท ไทยลู้บเบส จำกัด (มหาชน)|151|Industrial|5.5954376|603.88||AMR
02-22-2021|0010000207|0030000240|บริษัท สตาร์ส เทคโนโลยี อินดัสเตรียล จำกัด|151|Industrial|0.3353483|603.88||AMR
02-22-2021|0010000916|0030044950|บริษัท ดาน่า สไปเซอร์ (ประเทศไทย) จำกัด|151|Industrial|0.0905468|603.88||AMR
02-22-2021|0010000925|0030022478|บริษัท ไทยสตีลโปรไฟล์ จำกัด (มหาชน)|151|Industrial|0.7077419|603.88||AMR
02-22-2021|0010001609|0030015621|บริษัท โตโยต้า มอเตอร์ ประเทศไทย จำกัด|151|Industrial|0.5406327|603.88||AMR
02-22-2021|0010001879|0030026184|บริษัท เอ็ชเอ็มซี โปลีเมอส์ จำกัด|151|Industrial|0.4963127|603.88||AMR
02-22-2021|0010006271|0030008801|บริษัท ริเวอร์โปร์ พัลพ แอนด์เพเพอร์ จำกัด|151|Industrial|0.1577507|603.88||AMR
02-22-2021|0010006548|0030009620|บริษัท อีเลคโทรลักซ์ ประเทศไทย จำกัด|151|Industrial|0.0385989|603.88||AMR
02-22-2021|0010006939|0030011133|บริษัท นิเด็ค ค็อมโปเน็นท์ เทคโนโลยี (ไทยแลนด์) จำกัด|151|Industrial|0.4128994|603.88||AMR
02-22-2021|0010007766|0030000094|บริษัท อินโดรามา ปิโตรเคม จำกัด|152|Industrial-CoGen|0.7946513|603.88||AMR
02-22-2021|0010007766|0030013680|บริษัท อินโดรามา ปิโตรเคม จำกัด|152|Industrial-CoGen|4.0190953|603.88||AMR
02-22-2021|0010008356|0030047608|บริษัท แสงไทยเมตัลดรัม จำกัด|151|Industrial|0.056115|603.88||AMR
02-22-2021|0010008926|0030018384|บริษัท อินเตอร์เนชั่นแนล แลบบอราทอรีส์ จำกัด|151|Industrial|0.0285342|603.88||AMR
02-22-2021|0010009180|0030044623|บริษัท ไทย มาลายา กลาส จำกัด|151|Industrial|4.4491224|603.88||AMR
02-22-2021|0010009584|0030020740|บริษัท เจลลี เบลลี แคนดี้ คอมปานี (ประเทศไทย) จำกัด|151|Industrial|0.0000|603.88||AMR
02-22-2021|0010009598|0030053139|บมจ.เอเชียน อินซูเลเตอร์|151|Industrial|0.1640367|603.88||AMR
02-22-2021|0010010358|0030023471|บริษัท เซ้าท์ ซิตี้ ปิโตรเคม จำกัด|151|Industrial|0.1941602|603.88||AMR
02-22-2021|0010010423|0030024015|บริษัท ศานติบรรจุภัณฑ์ จำกัด|151|Industrial|0.2252371|603.88||AMR
02-22-2021|0010012320|0030021481|บริษัท พีทีที โกลบอล เคมิคอล จำกัด(มหาชน)|151|Industrial|29.55245|603.88||ADQ
02-22-2021|0010020698|0030038224|บริษัท สตาร์คอร์ จำกัด|151|Industrial|0.2246721|603.88||AMR
02-22-2021|0010022317|0030043685|บริษัท ไซมีส อีโคไลท์ จำกัด|151|Industrial|0.0000|603.88||AMR
02-22-2021|0010023548|0030000131|บริษัท โคเวสโตร (ประเทศไทย) จำกัด|151|Industrial|0.541339|603.88||AMR
02-22-2021|0010027130|0030056963|บริษัท แคนาเดียน โซลาร์ แมนูแฟคเจอริ่ง (ประเทศไทย) จำกัด|158|NG by Truck|0.00018|603.88||ADQ
02-22-2021|0010027295|0030059173|บมจ.ปตท. น้ำมันและการค้าปลีก|158|NG by Truck|0.1455|603.88||ADQ
02-22-2021|0010027315|0030057427|บริษัท นิชินโบะ สมบูรณ์ ออโตโมทีฟ จำกัด|151|Industrial|0.0185402|603.88||AMR
02-22-2021|0010027938|0030059837|บริษัท ราชบุรีกล๊าส อินดัสทรี จำกัด|151|Industrial|2.1034141|603.88||AMR
02-22-2021|0010028705|0030017241|บริษัท บีจี โฟลต กล๊าส จำกัด|151|Industrial|0.3568903|603.88||AMR
