Date|Sold to|Ship to|Ship to name|ContractType|Description|Volume(MMSCFD)|DemandPlan(BI)|MDCQ(BW)|Billing Type
03-31-2020|0010000062|0030000062|บริษัท สตาร์ ปิโตรเลียม รีไฟน์นิ่งจำกัด (มหาชน)|152|Industrial-CoGen|8.87166|650.98|11.249|ADQ
03-31-2020|0010000062|0030000062|บริษัท สตาร์ ปิโตรเลียม รีไฟน์นิ่งจำกัด (มหาชน)|151|Industrial|17.2320266|650.98|8.753|ADQ/AMR
03-31-2020|0010000080|0030000080|บริษัท เอ็นเอส บลูสโคป (ประเทศไทย)จำกัด|151|Industrial|0.4200683|650.98|0.759|AMR
03-31-2020|0010000091|0030000091|บริษัท สยาม เอ็นจีเค เทคโนเซรา จำกัด|151|Industrial|0.2302871|650.98|0.191|AMR
03-31-2020|0010000110|0030000114|บริษัท ระยอง กัลวาไนซิ่ง จำกัด|151|Industrial|0.0711944|650.98|0.063|AMR
03-31-2020|0010000130|0030052374|บริษัท กรีนสปอต จำกัด|151|Industrial|0.3030354|650.98|0.233|AMR
03-31-2020|0010000154|0030000160|บริษัท แม็กซิออน วีลส์ (ประเทศไทย)จำกัด|151|Industrial|0.0000|650.98|0.764|AMR
03-31-2020|0010000155|0030000161|บริษัท มาเล่ย์ เอ็นจิ่น คอมโพเน็นท์(ประเทศไทย) จำกัด|151|Industrial|0.075079|650.98|0.084|AMR
03-31-2020|0010000202|0030042681|บริษัท สมบูรณ์ โซมิค แมนูแฟคเจอริ่งจำกัด|151|Industrial|0.0089699|650.98|0.007|AMR
03-31-2020|0010000203|0030000236|บริษัท สิงห์ คาเมดะ (ประเทศไทย) จำกัด|151|Industrial|0.1867088|650.98|0.211|AMR
03-31-2020|0010001131|0030044478|บริษัท นอริตาเก้ เอสซีจี พลาสเตอร์จำกัด|151|Industrial|0.175514|650.98|0.165|AMR
03-31-2020|0010001146|0030042053|บริษัท เคลล็อก (ประเทศไทย) จำกัด|151|Industrial|0.2542658|650.98|0.172|AMR
03-31-2020|0010001787|0030024766|บริษัท เพรซิเดนท์ เบเกอรี่ จำกัด(มหาชน)|151|Industrial|0.3284267|650.98|0.317|AMR
03-31-2020|0010006733|0030023785|บริษัท เดลี่ฟู้ดส์ จำกัด|151|Industrial|0.0863091|650.98|0.066|AMR
03-31-2020|0010007060|0030011444|บริษัท สยามร่วมมิตร จำกัด|151|Industrial|0.1651315|650.98|0.098|AMR
03-31-2020|0010007112|0030011636|บริษัท ไทยซัมมิท อีสเทิร์น ซีบอร์ดโอโตพาร์ท อินดัสตรี จำกัด|151|Industrial|0.0000|650.98|0.041|AMR
03-31-2020|0010007982|0030014211|บริษัท จีซี ไกลคอล จำกัด|151|Industrial|0.1383983|650.98|0.112|AMR
03-31-2020|0010008356|0030047608|บริษัท แสงไทยเมตัลดรัม จำกัด|151|Industrial|0.0288521|650.98|0.034|AMR
03-31-2020|0010008509|0030016162|บริษัท ผลิตภัณฑ์ตราเพชร จำกัด (มหาชน)|151|Industrial|0.1143136|650.98|0.128|AMR
03-31-2020|0010008758|0030016949|บริษัท คล็อกเนอร์ เพนทาพลาสท์ (ไทยแลนด์) จำกัด|151|Industrial|0.0122188|650.98|0.02|AMR
03-31-2020|0010008926|0030018384|บริษัท อินเตอร์เนชั่นแนล แลบบอราทอรีส์ จำกัด|151|Industrial|0.0208003|650.98|0.017|AMR
03-31-2020|0010009180|0030019567|บริษัท ไทย มาลายา กลาส จำกัด|151|Industrial|2.6591615|650.98|2.676|AMR
03-31-2020|0010009604|0030020797|บริษัท เจ.พี ยูไนเต็ด จำกัด|151|Industrial|0.0000|650.98|0.034|AMR
03-31-2020|0010009784|0030021478|บริษัท แคททาเลอร์ (ประเทศไทย) จำกัด|151|Industrial|0.1017416|650.98|0.114|AMR
03-31-2020|0010010423|0030024015|บริษัท ศานติบรรจุภัณฑ์ จำกัด|151|Industrial|0.2246014|650.98|0.168|AMR
03-31-2020|0010011882|0030031074|บริษัท พีทีที อาซาฮี เคมิคอล จำกัด|151|Industrial|4.9676482|650.98|4.68|AMR
03-31-2020|0010012059|0030045449|บริษัท พีทีที เอ็มซีซี ไบโอเคม จำกัด|151|Industrial|0.5906736|650.98|0.389|AMR
03-31-2020|0010012323|0030032849|บริษัท โตโยอิ๊งค์ (ประเทศไทย) จำกัด|151|Industrial|0.01022|650.98|0.009|ADQ
03-31-2020|0010020698|0030038224|บริษัท สตาร์คอร์ จำกัด|151|Industrial|0.0443905|650.98|0.105|AMR
03-31-2020|0010020836|0030038183|บริษัท กรุงเทพ ซินธิติกส์ จำกัด|151|Industrial|0.0109122|650.98|0.024|AMR
03-31-2020|0010022317|0030043685|บริษัท ไซมีส อีโคไลท์ จำกัด|151|Industrial|0.0000|650.98|0.034|AMR
03-31-2020|0010022869|0030045768|บริษัท ยามาโมริ (ประเทศไทย) จำกัด|151|Industrial|0.0177632|650.98|0.022|AMR
03-31-2020|0010023379|0030049270|บริษัท ลาบิกซ์ จำกัด|151|Industrial|6.4637554|650.98|6.47|AMR
03-31-2020|0010024055|0030064942|บริษัท โอจีพี เอนเนอร์ยี่ โซลูชั่นส์ จำกัด (สำหรับ บริษัท นิปปอน สตีลไพพ์ (ประเทศไทย) จำกัด โรงงาน 2)|151|Industrial|0.0000|650.98||ADQ
03-31-2020|0010024871|0030053591|บริษัท เอ็นเอส-โอจี เอนเนอร์จี โซลูชั่นส์ (ไทยแลนด์) จำกัด|152|Industrial-CoGen|0.0000|650.98|0.775|AMR
03-31-2020|0010027591|0030024290|บริษัท ซีพีเอฟ ฟู้ด แอนด์ เบฟเวอร์เรจ จำกัด|152|Industrial-CoGen|0.1890395|650.98|0.197|AMR
03-31-2020|0010028705|0030017241|บริษัท บีจี โฟลต กล๊าส จำกัด|151|Industrial|0.3204809|650.98|0.24|AMR
03-31-2020|0010029277|0030062577|บริษัท โรม เมคะเทค (ประเทศไทย) จำกัด|151|Industrial|0.01034|650.98|0.03|ADQ
03-31-2020|0010029951|0030064789|บริษัท สยามเพลเล็ทพาวเวอร์ จำกัด|152|Industrial-CoGen|0.8625968|650.98|0.819|AMR
03-31-2020|0010030938|0030000014|บริษัท เอสซีจี รูฟฟิ่ง จำกัด|151|Industrial|0.0000|650.98||ADQ
03-31-2020|0010000011|0030000011|บริษัท อลูคอน จำกัด (มหาชน)|151|Industrial|1.3238421|650.98|1.085|AMR
03-31-2020|0010000027|0030000027|บริษัท ฝาจีบ จำกัด (มหาชน)|151|Industrial|0.3323819|650.98|0.423|AMR
03-31-2020|0010000028|0030000028|บริษัท เฟอร์โร (ประเทศไทย) จำกัด|151|Industrial|0.4303096|650.98|0.431|AMR
03-31-2020|0010000051|0030000051|บริษัท ไทยไวร์โพรดัคท์ จำกัด (มหาชน)|151|Industrial|0.0509591|650.98|0.039|AMR
03-31-2020|0010000071|0030000071|บริษัท เอสโซ่ (ประเทศไทย) จำกัด (มหาชน)|152|Industrial-CoGen|7.95035|650.98|7.404|ADQ
03-31-2020|0010000071|0030000071|บริษัท เอสโซ่ (ประเทศไทย) จำกัด (มหาชน)|151|Industrial|4.85629|650.98|4.749|ADQ
03-31-2020|0010000114|0030000118|บริษัท อิเมอร์สัน อิเล็คทริค (ประเทศไทย) จำกัด|151|Industrial|0.1522063|650.98|0.134|AMR
03-31-2020|0010000133|0030000138|บริษัท เอ.เจ. พลาสท์ จำกัด (มหาชน)|151|Industrial|0.7160408|650.98|0.687|AMR
03-31-2020|0010000149|0030000154|บริษัท เอเวอรี่ เดนนิสสัน (ประเทศไทย) จำกัด|151|Industrial|0.1218357|650.98|0.081|AMR
03-31-2020|0010000150|0030000155|บริษัท บริดจสโตน เมตัลฟา(ประเทศไทย) จำกัด|151|Industrial|0.3165609|650.98|0.291|AMR
03-31-2020|0010000195|0030033440|บริษัท ไทยลู้บเบส จำกัด (มหาชน)|151|Industrial|1.8271825|650.98|4.343|AMR
03-31-2020|0010000197|0030025358|บริษัท บางจาก คอร์ปอเรชั่น จำกัด (มหาชน)|152|Industrial-CoGen|6.8944182|650.98|7.329|AMR
03-31-2020|0010000227|0030000253|บริษัท จี เจ สตีล จำกัด (มหาชน)|151|Industrial|2.0174934|650.98|2.002|AMR
03-31-2020|0010001740|0030022424|บริษัท โรงงานเหล็กกรุงเทพฯ จำกัด|151|Industrial|2.2280044|650.98|1.24|AMR
03-31-2020|0010001741|0030022479|บริษัท อลูมิเนียม ฉื่อ จิ้น ฮั้ว จำกัด|151|Industrial|0.5032344|650.98|0.327|AMR
03-31-2020|0010006548|0030009620|บริษัท อีเลคโทรลักซ์ ประเทศไทย จำกัด|151|Industrial|0.0390227|650.98|0.033|AMR
03-31-2020|0010006616|0030010020|บริษัท บริดจสโตน คาร์บอน แบล็ค (ประเทศไทย) จำกัด|151|Industrial|0.0095349|650.98|0.207|AMR
03-31-2020|0010007512|0030040636|บริษัท คราวน์ เบ็บแคน แอนด์ โคลสเชอร์ส (ประเทศไทย) จำกัด|151|Industrial|0.1709937|650.98|0.149|AMR
03-31-2020|0010008671|0030021639|บริษัท พีทีที ฟีนอล จำกัด|151|Industrial|0.0000|650.98|0.265|AMR
03-31-2020|0010009180|0030044623|บริษัท ไทย มาลายา กลาส จำกัด|151|Industrial|4.3527133|650.98|4.463|AMR
03-31-2020|0010009196|0030019599|บริษัท ราชราตัน ไทย ไวร์ จำกัด|151|Industrial|0.224107|650.98|0.171|AMR
03-31-2020|0010010605|0030024817|บริษัท มาบตาพุดโอเลฟินส์ จำกัด|151|Industrial|3.2556975|650.98|2.748|AMR
03-31-2020|0010010925|0030025431|บริษัท เน็กซ์ แคน อินโนเวชั่น จำกัด|151|Industrial|0.3072378|650.98|0.367|AMR
03-31-2020|0010012320|0030021767|บริษัท พีทีที โกลบอล เคมิคอล จำกัด(มหาชน)|153|Commercial|0.0306531|650.98|0.013|AMR
03-31-2020|0010012320|0030021767|บริษัท พีทีที โกลบอล เคมิคอล จำกัด(มหาชน)|154|Commercial–CoGen|0.1266031|650.98|0.079|AMR
03-31-2020|0010021117|0030022988|บริษัท ซีพีเอฟ (ประเทศไทย) จำกัด(มหาชน)|151|Industrial|0.5440229|650.98|0.484|AMR
03-31-2020|0010021151|0030040140|บริษัท คนอฟ ยิปซั่ม (ประเทศไทย) จำกัด|151|Industrial|0.0003178|650.98|0.483|AMR
03-31-2020|0010022812|0030024457|บริษัท โกลบอล เพาเวอร์ ซินเนอร์ยี่จำกัด (มหาชน)|151|Industrial|5.0955227|650.98|3.999|AMR
03-31-2020|0010022812|0030063296|บริษัท โกลบอล เพาเวอร์ ซินเนอร์ยี่จำกัด (มหาชน)|152|Industrial-CoGen|11.9369191|650.98|5.966|FlowComp
03-31-2020|0010027591|0030024290|บริษัท ซีพีเอฟ ฟู้ด แอนด์ เบฟเวอร์เรจ จำกัด|151|Industrial|0.8223027|650.98|0.721|AMR
03-31-2020|0010027600|0030058148|บริษัท เอเชีย แคน แมนูแฟคเจอริ่ง จำกัด|151|Industrial|0.1103584|650.98|0.116|AMR
03-31-2020|0010027807|0030064609|บริษัท เช่วเฉิน ซิลิก้า (ไทยแลนด์)จำกัด|151|Industrial|0.0000|650.98|1.00|ADQ
