Date|Sold to|Ship to|Ship to name|ContractType|Description|Volume(MMSCFD)|DemandPlan(BI)|MDCQ(BW)|Billing Type
03-31-2020|0010012326|0030032885|บริษัท สายไฟฟ้าไทย-ยาซากิ จำกัด|151|Industrial|0.154078|650.98|0.109|AMR
03-31-2020|0010021112|0030041494|บริษัท เจเอสอาร์ บีเอสที อิลาสโตเมอร์ จำกัด|151|Industrial|0.0227779|650.98|0.178|AMR
03-31-2020|0010021117|0030000123|บริษัท ซีพีเอฟ (ประเทศไทย) จำกัด(มหาชน)|152|Industrial-CoGen|1.7283014|650.98|1.161|AMR
03-31-2020|0010022333|0030043703|บริษัท เอเชียแปซิฟิกกลาส จำกัด|151|Industrial|2.3564793|650.98|2.171|AMR
03-31-2020|0010022444|0030044003|บริษัท ทีวาย สตีล จำกัด|151|Industrial|0.175514|650.98|0.175|AMR
03-31-2020|0010023651|0030048793|บริษัท ไคฮาระ (ประเทศไทย) จำกัด|151|Industrial|0.1406937|650.98|0.273|AMR
03-31-2020|0010025332|0030052476|บริษัท ไอที ฟอร์จิ้ง (ประเทศไทย) จำกัด|151|Industrial|0.079458|650.98|0.134|AMR
03-31-2020|0010025615|0030053102|บริษัท เอ็นจีเค เซรามิคส์ (ประเทศไทย) จำกัด|151|Industrial|0.4039648|650.98|0.368|AMR
03-31-2020|0010026111|0030055031|บริษัท กบินทร์บุรีกล๊าส อินดัสทรีจำกัด|151|Industrial|3.3087401|650.98|3.016|AMR
03-31-2020|0010026153|0030054741|บริษัท นิคเคอิ เอ็มซี อลูมินัม (ประเทศไทย) จำกัด|151|Industrial|0.1406584|650.98|0.225|AMR
03-31-2020|0010027861|0030000246|บริษัท เอสซีจี เซรามิกส์ จำกัด (มหาชน)|151|Industrial|1.679779|650.98|2.35|AMR
03-31-2020|0010000009|0030000009|บริษัท ล.ไลท์ติ้งกลาส จำกัด|151|Industrial|3.5058668|650.98|3.884|AMR
03-31-2020|0010000010|0030000010|บริษัท สยามกลาส อินดัสทรี จำกัด|151|Industrial|1.5876429|650.98|1.76|AMR
03-31-2020|0010000024|0030000024|บริษัท ไทล์ท้อป อินดัสตรี้ จำกัด (มหาชน)|151|Industrial|5.4849732|650.98|4.432|AMR
03-31-2020|0010000035|0030000035|บริษัท สยามซานิทารีแวร์อินดัสทรี จำกัด|151|Industrial|0.7412555|650.98|0.889|AMR
03-31-2020|0010000036|0030000036|บริษัท สยามฟูรูกาวา จำกัด|151|Industrial|0.2367497|650.98|0.248|AMR
03-31-2020|0010000046|0030000046|บริษัท ไทยแทฟฟิต้า จำกัด|151|Industrial|0.0000|650.98|0.006|AMR
03-31-2020|0010000047|0030000047|บริษัท โพสโค-ไทยน๊อคซ์ จำกัด (มหาชน)|151|Industrial|1.1925774|650.98|1.304|AMR
03-31-2020|0010000061|0030000061|บริษัท ไมย์เออร์ อินดัสตรีส์ จำกัด|151|Industrial|0.2348074|650.98|0.397|AMR
03-31-2020|0010000070|0030000070|บริษัท ทานิโอบิส จำกัด|151|Industrial|0.0226367|650.98|0.124|AMR
03-31-2020|0010000084|0030000084|บริษัท สยามอุตสาหกรรมวัสดุทนไฟ จำกัด|151|Industrial|1.0050563|650.98|1.128|AMR
03-31-2020|0010000085|0030000085|บริษัท บางกอกอินดัสเทรียลแก๊ส จำกัด|151|Industrial|0.0377867|650.98|0.042|AMR
03-31-2020|0010000128|0030000132|บริษัท เซกิซุย เอส-เล็ค (ประเทศไทย)จำกัด|151|Industrial|0.0659678|650.98|0.066|AMR
03-31-2020|0010000143|0030000148|บริษัท สยาม พุงซาน เมทัล จำกัด|151|Industrial|0.3228116|650.98|0.202|AMR
03-31-2020|0010000153|0030000159|บริษัท เกทส์ ยูนิทตะ (ประเทศไทย) จำกัด|151|Industrial|0.1119475|650.98|0.081|AMR
03-31-2020|0010000178|0030016267|บริษัท โกลว์ เอสพีพี 11 จำกัด|152|Industrial-CoGen|1.7462059|650.98|1.305|AMR
03-31-2020|0010000206|0030000239|บริษัท เฮลซ์เทรดดิ้ง (ประเทศไทย) จำกัด|151|Industrial|0.0384577|650.98|0.028|AMR
03-31-2020|0010000207|0030000240|บริษัท สตาร์ส เทคโนโลยี อินดัสเตรียล จำกัด|151|Industrial|0.1780214|650.98|0.278|AMR
03-31-2020|0010000225|0030011191|บริษัท ซีพีพีซี จำกัด (มหาชน) (Coating Plant)|151|Industrial|0.0000|650.98|0.009|AMR
03-31-2020|0010000226|0030000252|บริษัท ซัมมิท โชว่าแมนูแฟคเจอริ่งจำกัด|151|Industrial|0.0465447|650.98|0.102|AMR
03-31-2020|0010001609|0030015621|บริษัท โตโยต้า มอเตอร์ ประเทศไทย จำกัด|152|Industrial-CoGen|0.729637|650.98|0.939|AMR
03-31-2020|0010002092|0030016062|บริษัท สยามแผ่นเหล็กวิลาส จำกัด|151|Industrial|0.0238727|650.98|0.08|AMR
03-31-2020|0010006271|0030008801|บริษัท ริเวอร์โปร์ พัลพ แอนด์เพเพอร์ จำกัด|151|Industrial|0.0740549|650.98|0.113|AMR
03-31-2020|0010006939|0030011133|บริษัท นิเด็ค ค็อมโปเน็นท์ เทคโนโลยี (ไทยแลนด์) จำกัด|151|Industrial|0.5315568|650.98|0.463|AMR
03-31-2020|0010007765|0030013679|บริษัท เอ.พี.ซี อุตสาหกรรม จำกัด|151|Industrial|0.0000|650.98|0.011|AMR
03-31-2020|0010007766|0030000094|บริษัท อินโดรามา ปิโตรเคม จำกัด|152|Industrial-CoGen|0.3809749|650.98|0.08|AMR
03-31-2020|0010008206|0030033172|บริษัท เอ็นเนซอล จำกัด|152|Industrial-CoGen|1.3405106|650.98|1.232|AMR
03-31-2020|0010008288|0030015470|บริษัท อุตสาหกรรมทำเครื่องแก้วไทยจำกัด (มหาชน)|151|Industrial|6.1414029|650.98|6.385|AMR
03-31-2020|0010009040|0030022254|บริษัท ไทยเรยอน จำกัด (มหาชน)|151|Industrial|1.063714|650.98|1.072|AMR
03-31-2020|0010009070|0030018984|บริษัท โมเดอร์น ไดสตัฟส์ แอนด์พิคเมนท์ส จำกัด|151|Industrial|0.268321|650.98|0.157|AMR
03-31-2020|0010009390|0030020154|บริษัท อัลวา อะลูมิเนียม จำกัด|151|Industrial|0.219834|650.98|0.218|AMR
03-31-2020|0010010005|0030022294|บริษัท คอทโก้ เอ็นซีอาร์ เปเปอร์ จำกัด|151|Industrial|0.0366213|650.98|0.026|AMR
03-31-2020|0010010061|0030022473|บริษัท แอมคอร์ เฟล็กซิเบิ้ล ระยองจำกัด|151|Industrial|0.047357|650.98|0.027|AMR
03-31-2020|0010011029|0030026047|บริษัท เอ็น ซี อาร์ รับเบอร์อินดัสตรี้ จำกัด|151|Industrial|0.0725717|650.98|0.069|AMR
03-31-2020|0010011163|0030026631|บริษัท ไทย อกริ เพาเวอร์ จำกัด|152|Industrial-CoGen|0.0749731|650.98|0.317|AMR
03-31-2020|0010012320|0030026468|บริษัท พีทีที โกลบอล เคมิคอล จำกัด(มหาชน)|151|Industrial|5.1615965|650.98|3.196|AMR
03-31-2020|0010012320|0030040549|บริษัท พีทีที โกลบอล เคมิคอล จำกัด(มหาชน)|152|Industrial-CoGen|16.9852734|650.98|14.452|FlowComp
03-31-2020|0010020998|0030039159||151|Industrial|0.00013|650.98|0.003|ADQ
03-31-2020|0010021265|0030040855|บริษัท เอ็นเอส-สยามยูไนเต็ดสตีล จำกัด|151|Industrial|0.0000|650.98|1.156|AMR
03-31-2020|0010021577|0030041863|บริษัท นำวัฒนา แพ็คแอนด์พริ้นท์ จำกัด|151|Industrial|0.5286257|650.98|0.57|AMR
03-31-2020|0010023667|0030000034|บริษัท สตาร์ ซานิทารี่แวร์ (ประเทศไทย) จำกัด|151|Industrial|0.1045315|650.98|0.103|AMR
03-31-2020|0010023967|0030050118|บริษัท โอซาก้า แก๊ส (ประเทศไทย) จำกัด|151|Industrial|0.1296402|650.98|0.197|AMR
03-31-2020|0010026634|0030054698|บริษัท คานายามา คาเซอิ (ประเทศไทย)จำกัด|158|NG by Truck|0.62303|650.98|0.59|ADQ
03-31-2020|0010026674|0030017326|บริษัท ไทยเพรซิเดนท์ฟูดส์ จำกัด(มหาชน)|151|Industrial|0.8325793|650.98|0.633|AMR
03-31-2020|0010027860|0030059153|บริษัท เค.เอ็ม.เค.(ไทยแลนด์) จำกัด|151|Industrial|0.0835898|650.98|0.058|AMR
03-31-2020|0010027861|0030000017|บริษัท เอสซีจี เซรามิกส์ จำกัด (มหาชน)|151|Industrial|2.4691331|650.98|3.112|AMR
03-31-2020|0010000012|0030000012|บริษัท อีสเทิร์นไชน่าแวร์ จำกัด|151|Industrial|0.2525001|650.98|0.292|AMR
03-31-2020|0010000013|0030000013|บริษัท ทาทา สตีล การผลิต (ประเทศไทย) จำกัด (มหาชน)|151|Industrial|1.8259465|650.98|2.172|AMR
03-31-2020|0010000037|0030000037|บริษัท สยามไฟเบอร์กลาส จำกัด|151|Industrial|0.3402571|650.98|0.287|AMR
03-31-2020|0010000053|0030020331|บริษัท ไทยอาซาฮีเคมีภัณฑ์ จำกัด|151|Industrial|0.4067547|650.98|0.38|AMR
03-31-2020|0010000073|0030000073|บริษัท ไฟน์ เม็ททัล เทคโนโลยีส์จำกัด (มหาชน)|151|Industrial|0.1173507|650.98|0.322|AMR
03-31-2020|0010000074|0030000074|บริษัท ไทยเบเวอร์เรจแคน จำกัด|151|Industrial|0.4283319|650.98|0.483|AMR
03-31-2020|0010000098|0030000098|บริษัท อีโอซีโพลิเมอร์ส (ไทยแลนด์)จำกัด|151|Industrial|0.0545965|650.98|0.029|AMR
03-31-2020|0010000120|0030000124|บริษัท ลอยัล ไฮ่เหลียง คอปเปอร์ (ประเทศไทย) จำกัด|151|Industrial|0.0298409|650.98|0.025|AMR
03-31-2020|0010000139|0030000144|บริษัท ยูเนี่ยนไพโอเนียร์ จำกัด(มหาชน)|151|Industrial|0.1499109|650.98|0.107|AMR
03-31-2020|0010000161|0030000167|บริษัท ไทยซัมซุง อิเลคโทรนิคส์ จำกัด|151|Industrial|0.3858837|650.98|0.277|AMR
03-31-2020|0010000205|0030000238|บริษัท ไทยอาซาคาวา จำกัด|151|Industrial|0.0610238|650.98|0.059|AMR
03-31-2020|0010001196|0030029791|บริษัท ไทยคูน เวิลด์ไวด์ กรุ๊ป (ประเทศไทย) จำกัด (มหาชน)|151|Industrial|0.3379616|650.98|1.16|AMR
03-31-2020|0010001827|0030021652|บริษัท กรไทย จำกัด|151|Industrial|0.8693419|650.98|0.708|AMR
03-31-2020|0010001879|0030026184|บริษัท เอ็ชเอ็มซี โปลีเมอส์ จำกัด|151|Industrial|0.6464002|650.98|0.623|AMR
03-31-2020|0010006758|0030010658|บริษัท คอฟโค่ ไบโอเคมิคอล (ประเทศไทย) จำกัด|151|Industrial|0.7139572|650.98|0.784|AMR
03-31-2020|0010007561|0030013097|บริษัท บางชันเยนเนอเรลเอเซมบลี จำกัด|151|Industrial|0.0526189|650.98|0.015|AMR
03-31-2020|0010007594|0030013168|บริษัท ไลอ้อน (ประเทศไทย) จำกัด|151|Industrial|0.4416809|650.98|0.567|AMR
03-31-2020|0010008739|0030038490|บริษัท สยามไฟเบอร์ซีเมนต์กรุ๊ป จำกัด|151|Industrial|0.0000|650.98|0.013|AMR
03-31-2020|0010009228|0030019659|บริษัท ไทย เอ็มเอฟซี จำกัด|151|Industrial|0.0182223|650.98|0.124|AMR
03-31-2020|0010010355|0030023468|บริษัท เคียวเด็น (ประเทศไทย) จำกัด|151|Industrial|0.039164|650.98|0.033|AMR
03-31-2020|0010010358|0030023471|บริษัท เซ้าท์ ซิตี้ ปิโตรเคม จำกัด|151|Industrial|0.1843074|650.98|0.12|AMR
03-31-2020|0010012320|0030000055|บริษัท พีทีที โกลบอล เคมิคอล จำกัด(มหาชน)|151|Industrial|0.0000|650.98|0.002|AMR
03-31-2020|0010012320|0030000069|บริษัท พีทีที โกลบอล เคมิคอล จำกัด(มหาชน)|151|Industrial|2.4809283|650.98|3.922|AMR
03-31-2020|0010021117|0030000123|บริษัท ซีพีเอฟ (ประเทศไทย) จำกัด(มหาชน)|151|Industrial|0.6732394|650.98|0.438|AMR
03-31-2020|0010022812|0030020778|บริษัท โกลบอล เพาเวอร์ ซินเนอร์ยี่จำกัด (มหาชน)|152|Industrial-CoGen|19.7541475|650.98|21.691|FlowComp
03-31-2020|0010022812|0030020778|บริษัท โกลบอล เพาเวอร์ ซินเนอร์ยี่จำกัด (มหาชน)|151|Industrial|6.2634784|650.98|2.354|FlowComp
03-31-2020|0010026752|0030055984|บริษัท เซกิซุย คาเซอิ (ไทยแลนด์) จำกัด|151|Industrial|0.0078398|650.98|0.059|AMR
03-31-2020|0010027130|0030056963|บริษัท แคนาเดียน โซลาร์ แมนูแฟคเจอริ่ง (ประเทศไทย) จำกัด|158|NG by Truck|0.0000|650.98||ADQ
03-31-2020|0010000003|0030000003|บริษัท เขาช่องอุตสาหกรรม 1979 จำกัด|151|Industrial|0.5517921|650.98|0.507|AMR
03-31-2020|0010000016|0030000016|บริษัท ลิกซิล (ประเทศไทย) จำกัด (มหาชน)|151|Industrial|0.6117565|650.98|0.766|AMR
03-31-2020|0010000030|0030000030|บริษัท ภัทราพอร์ซเลน จำกัด|151|Industrial|0.5927572|650.98|0.56|AMR
03-31-2020|0010000043|0030000043|บริษัท ไทย จีซีไอ เรซิท็อป จำกัด|151|Industrial|0.3469669|650.98|0.263|AMR
03-31-2020|0010000052|0030000052|บริษัท ไทยออยล์ จำกัด (มหาชน)|151|Industrial|5.964573|650.98|23.334|AMR/FlowComp
03-31-2020|0010000053|0030000053|บริษัท ไทยอาซาฮีเคมีภัณฑ์ จำกัด|151|Industrial|0.0000|650.98|0.184|AMR
03-31-2020|0010000064|0030000243|บริษัท ลี่ไท่ อัลลอย จำกัด|151|Industrial|0.1929948|650.98|0.246|AMR
03-31-2020|0010000065|0030000065|บริษัท สยามโพลีสไตรีน จำกัด|151|Industrial|0.0285342|650.98|0.072|AMR
03-31-2020|0010000077|0030000077||151|Industrial|1.421346|650.98|1.589|AMR
03-31-2020|0010000078|0030000078|บริษัท ไทเท็กซ์ เอเซีย จำกัด|151|Industrial|0.2127004|650.98|0.132|AMR
03-31-2020|0010000089|0030000089|บริษัท ธนเสริมอุตสาหกรรมฝาขวด จำกัด|151|Industrial|0.0781514|650.98|0.072|AMR
03-31-2020|0010000101|0030000103|บริษัท ร็อควูล (ประเทศไทย) จำกัด|151|Industrial|0.2677913|650.98|0.156|AMR
03-31-2020|0010000104|0030000107|บริษัท สยามโพลิเอททีลีน จำกัด|151|Industrial|1.9212609|650.98|1.738|AMR
03-31-2020|0010000116|0030000120|บริษัท มิตซูบิชิ มอเตอร์ส (ประเทศไทย) จำกัด|151|Industrial|0.4280494|650.98|0.301|AMR
03-31-2020|0010000129|0030000133|บริษัท ทีพีซี เพสต์ เรซิน จำกัด|151|Industrial|0.233642|650.98|0.292|AMR
03-31-2020|0010000130|0030000134|บริษัท กรีนสปอต จำกัด|151|Industrial|0.9388766|650.98|0.628|AMR
03-31-2020|0010000140|0030000145|บริษัท สยามลวดเหล็กอุตสาหกรรม จำกัด|151|Industrial|0.0000|650.98|0.074|AMR
03-31-2020|0010000141|0030000146|บริษัท สยามสตีล กัลวาไนซิ่ง จำกัด|151|Industrial|0.2036598|650.98|0.152|AMR
03-31-2020|0010000151|0030000156|บริษัท มิตซูบิชิ อีเล็คทริค ออโตเมชั่น (ประเทศไทย) จำกัด|151|Industrial|0.1419297|650.98|0.202|AMR
03-31-2020|0010000164|0030019231|บริษัท โกลว์ พลังงาน จำกัด (มหาชน)|151|Industrial|0.0000|650.98|0.187|ADQ
03-31-2020|0010000164|0030030778|บริษัท โกลว์ พลังงาน จำกัด (มหาชน)|152|Industrial-CoGen|55.4139523|650.98|48.75|FlowComp
03-31-2020|0010000201|0030020965|บริษัท อดิตยา เบอร์ล่า เคมีคัลส์ (ประเทศไทย) จำกัด (แอดวานซ์ แมททีเรียลส์)|151|Industrial|0.0824245|650.98|0.072|AMR
03-31-2020|0010000225|0030000251|บริษัท ซีพีพีซี จำกัด (มหาชน)|151|Industrial|0.094608|650.98|0.139|AMR
03-31-2020|0010000934|0030046753|บริษัท ฮอนด้า ออโตโมบิล (ประเทศไทย) จำกัด|151|Industrial|0.0948552|650.98|0.292|AMR
03-31-2020|0010001013|0030023306|บริษัท เนสท์เล่ (ไทย) จำกัด|151|Industrial|0.0323482|650.98|0.032|AMR
03-31-2020|0010001714|0030016192|บริษัท ออลเน็กซ์ (ประเทศไทย) จำกัด|151|Industrial|0.1506878|650.98|0.12|AMR
03-31-2020|0010001727|0030020317|บริษัท ไทยเซ็นทรัลเคมี จำกัด (มหาชน)|151|Industrial|0.5565243|650.98|0.262|AMR
03-31-2020|0010001998|0030025768|บริษัท อินโดรามา โพลีเอสเตอร์ อินดัสตรี้ส์ จำกัด (มหาชน)|151|Industrial|1.7737867|650.98|1.63|AMR
03-31-2020|0010002048|0030021234|บริษัท ด๊อกเตอร์ บู จำกัด|151|Industrial|0.179328|650.98|0.189|AMR
03-31-2020|0010003880|0030008767|บริษัท กังวาลเท็กซ์ไทล์ จำกัด|152|Industrial-CoGen|1.2334365|650.98|1.275|AMR
03-31-2020|0010006257|0030022426|บริษัท ออโต้อัลลายแอนซ์ (ประเทศไทย)จำกัด|151|Industrial|0.0000|650.98|0.443|AMR
03-31-2020|0010006922|0030020406|บริษัท อายิโนะโมะโต๊ะ (ประเทศไทย)จำกัด|151|Industrial|0.8494951|650.98|2.499|AMR
03-31-2020|0010007306|0030012309||151|Industrial|0.4363484|650.98|0.31|AMR
03-31-2020|0010008114|0030024767|บริษัท ทุนเท็กซ์ เท็กซ์ไทล์ (ประเทศไทย) จำกัด|151|Industrial|0.2748189|650.98|0.252|AMR
03-31-2020|0010008206|0030015236|บริษัท เอ็นเนซอล จำกัด|152|Industrial-CoGen|1.6596849|650.98|1.305|AMR
03-31-2020|0010008739|0030000237|บริษัท สยามไฟเบอร์ซีเมนต์กรุ๊ป จำกัด|151|Industrial|0.0503234|650.98|0.105|AMR
03-31-2020|0010008739|0030013343|บริษัท สยามไฟเบอร์ซีเมนต์กรุ๊ป จำกัด|151|Industrial|0.8702954|650.98|0.861|AMR
03-31-2020|0010009176|0030019559|บริษัท พูแรค (ประเทศไทย) จำกัด|151|Industrial|0.4916512|650.98|2.261|AMR
03-31-2020|0010009177|0030019562|บริษัท สยามโกชิ มานูแฟคเชอริ่ง จำกั|151|Industrial|0.0775157|650.98|0.087|AMR
03-31-2020|0010009584|0030020740|บริษัท เจลลี เบลลี แคนดี้ คอมปานี (ประเทศไทย) จำกัด|151|Industrial|0.0932661|650.98|0.086|AMR
03-31-2020|0010009598|0030053139|บมจ.เอเชียน อินซูเลเตอร์|151|Industrial|0.165414|650.98|0.314|AMR
03-31-2020|0010010220|0030023100|บริษัท เอส ไอ ดับบลิว (ไทยแลนด์) จำกัด|151|Industrial|0.1138545|650.98|0.104|AMR
03-31-2020|0010011735|0030030004|บริษัท เนเชอรัล ก๊าซ ไซลินเดอร์ (ประเทศไทย) จำกัด|151|Industrial|0.0000|650.98||AMR
03-31-2020|0010012320|0030000072|บริษัท พีทีที โกลบอล เคมิคอล จำกัด(มหาชน)|152|Industrial-CoGen|11.91078|650.98|10.296|ADQ
03-31-2020|0010012320|0030000072|บริษัท พีทีที โกลบอล เคมิคอล จำกัด(มหาชน)|151|Industrial|31.4607909|650.98|23.146|ADQ/AMR
03-31-2020|0010012320|0030000168|บริษัท พีทีที โกลบอล เคมิคอล จำกัด(มหาชน)|151|Industrial|0.1095108|650.98|0.339|AMR
03-31-2020|0010012440|0030033600|บริษัท นูทริกซ์ จำกัด (มหาชน)|151|Industrial|0.2114997|650.98|0.208|AMR
03-31-2020|0010012506|0030000025|บริษัท ปทุมธานีกล๊าส อินดัสทรี จำกัด|151|Industrial|2.5900507|650.98|2.627|AMR
03-31-2020|0010021265|0030000095|บริษัท เอ็นเอส-สยามยูไนเต็ดสตีล จำกัด|151|Industrial|2.3117708|650.98|1.685|AMR
03-31-2020|0010022812|0030014300|บริษัท โกลบอล เพาเวอร์ ซินเนอร์ยี่จำกัด (มหาชน)|152|Industrial-CoGen|0.0000|650.98|54.24859|FlowComp
03-31-2020|0010024039|0030050402|บริษัท สุเพิร์บ พาวเวอร์ จำกัด|152|Industrial-CoGen|0.5486138|650.98|0.402|AMR
03-31-2020|0010024055|0030057123|บจ.โอจีพี เอนเนอร์ยี่ โซลูชั่นส์ (สำหรับ บจ.ซึชิโยชิ สมบูรณ์ โคเตทแซนด์)|151|Industrial|0.1852609|650.98|0.114|AMR
03-31-2020|0010027295|0030059173|บมจ.ปตท. น้ำมันและการค้าปลีก|158|NG by Truck|0.14825|650.98|1.6129|ADQ
03-31-2020|0010027315|0030057427|บริษัท นิชินโบะ สมบูรณ์ ออโตโมทีฟ จำกัด|151|Industrial|0.0202353|650.98|0.014|AMR
03-31-2020|0010027861|0030046657|บริษัท เอสซีจี เซรามิกส์ จำกัด (มหาชน)|151|Industrial|0.2353018|650.98|0.245|AMR
03-31-2020|0010027938|0030059837|บริษัท ราชบุรีกล๊าส อินดัสทรี จำกัด|151|Industrial|1.8426504|650.98|1.515|AMR
03-31-2020|0010000004|0030000004|บริษัท ไทย คอปเปอร์ ร็อด จำกัด|151|Industrial|0.0000|650.98|0.17|AMR
03-31-2020|0010000005|0030000005|บริษัท ไทยเมทัลโพรเซสซิ่ง จำกัด|151|Industrial|0.5841404|650.98|0.364|AMR
03-31-2020|0010000016|0030000100|บริษัท ลิกซิล (ประเทศไทย) จำกัด (มหาชน)|151|Industrial|0.0724657|650.98|0.452|AMR
03-31-2020|0010000019|0030000019|บริษัท ไดนาสตี้ เซรามิค จำกัด (มหาชน)|151|Industrial|4.4403291|650.98|3.925|AMR
03-31-2020|0010000031|0030000031|บริษัท วิลเลรอย แอนด์ บอค (ประเทศไทย) จำกัด|151|Industrial|0.3422347|650.98|0.651|AMR
03-31-2020|0010000032|0030000032|บริษัท รอยัลปอร์ซเลน จำกัด (มหาชน)|151|Industrial|0.7949338|650.98|1.053|AMR
03-31-2020|0010000049|0030000049|บริษัท ไทยผลิตภัณฑ์ยิบซั่ม จำกัด(มหาชน)|152|Industrial-CoGen|0.5689904|650.98|0.952|AMR
03-31-2020|0010000050|0030000050|บริษัท ไทยพลาสติกและเคมีภัณฑ์ จำกัด(มหาชน)|151|Industrial|5.2398892|650.98|5.017|AMR
