Date|Sold to|Ship to|Ship to name|ContractType|Description|Volume(MMSCFD)|DemandPlan(BI)|MDCQ(BW)|Billing Type
03-31-2020|0010000008|0030000008|บริษัท ไมโครไฟเบอร์อุตสาหกรรม จำกัด|151|Industrial|0.2635536|650.98|0.267|AMR
03-31-2020|0010000022|0030000022|บริษัท ไทยบริดจสโตน จำกัด|152|Industrial-CoGen|1.9178354|650.98|1.43|AMR
03-31-2020|0010000023|0030000023|บริษัท ไทยเปอร์อ๊อกไซด์ จำกัด|151|Industrial|1.6140936|650.98|1.41|AMR
03-31-2020|0010000038|0030000038|บริษัท สหโมเสคอุตสาหกรรม จำกัด (มหาชน)|151|Industrial|0.1795046|650.98|0.26|AMR
03-31-2020|0010000049|0030000049|บริษัท ไทยผลิตภัณฑ์ยิบซั่ม จำกัด(มหาชน)|151|Industrial|0.6972181|650.98|1.92|AMR
03-31-2020|0010000057|0030000057|บริษัท พี เอส เมททอลเวอกส์ จำกัด|151|Industrial|0.0475335|650.98|0.026|AMR
03-31-2020|0010000058|0030000058|บริษัท พีคิว เคมิคอลส์ (ประเทศไทย)จำกัด|151|Industrial|0.1038252|650.98|0.148|AMR
03-31-2020|0010000068|0030000068|บริษัท เหล็กสยามยามาโตะ จำกัด|151|Industrial|0.1473682|650.98|2.44|AMR
03-31-2020|0010000068|0030025580|บริษัท เหล็กสยามยามาโตะ จำกัด|151|Industrial|0.8328618|650.98|2.074|AMR
03-31-2020|0010000083|0030021634|บริษัท เอจีซี แฟลทกลาส (ประเทศไทย)จำกัด (มหาชน)|151|Industrial|4.0988359|650.98|3.834|AMR
03-31-2020|0010000096|0030000096|บริษัท ระยองโอเลฟินส์ จำกัด|151|Industrial|0.6549464|650.98|0.657|AMR
03-31-2020|0010000097|0030000097|บริษัท สายไฟฟ้าบางกอกเคเบิ้ล จำกัด|151|Industrial|1.0100004|650.98|0.203|AMR
03-31-2020|0010000106|0030000109|บริษัท ไมย์เออร์ อลูมิเนียม (ประเทศไทย) จำกัด|151|Industrial|0.0914297|650.98|0.292|AMR
03-31-2020|0010000107|0030000111|บริษัท จี สตีล จำกัด (มหาชน)|151|Industrial|0.0000|650.98|1.491|AMR
03-31-2020|0010000122|0030000126|บริษัท บี เอ เอส เอฟ (ไทย) จำกัด|151|Industrial|0.5534519|650.98|0.518|AMR
03-31-2020|0010000134|0030000139|บริษัท วันไทยอุตสาหกรรมการอาหาร จำกัด|151|Industrial|1.1505882|650.98|1.087|AMR
03-31-2020|0010000134|0030056618|บริษัท วันไทยอุตสาหกรรมการอาหาร จำกัด|151|Industrial|0.2359728|650.98|0.225|AMR
03-31-2020|0010000135|0030000140|บริษัท รอนเด็กซ์ (ประเทศไทย) จำกัด|151|Industrial|0.0820713|650.98|0.03|AMR
03-31-2020|0010000148|0030000153|บริษัท เคนไซซีรามิคส์ อินดัสตรี้ จำกัด|151|Industrial|0.1904874|650.98|0.246|AMR
03-31-2020|0010000159|0030000165|บริษัท ไทย-เยอรมัน สเปเชียลตี้ กลาสจำกัด|151|Industrial|0.0459091|650.98|0.039|AMR
03-31-2020|0010000160|0030000166|บริษัท คอนวูด จำกัด|151|Industrial|0.1219063|650.98|0.255|AMR
03-31-2020|0010000201|0030000021|บริษัท อดิตยา เบอร์ล่า เคมีคัลส์ (ประเทศไทย) จำกัด (ซัลไฟท์ส ดีวิชั่น)|151|Industrial|0.0828482|650.98|0.084|AMR
03-31-2020|0010000201|0030000234|บริษัท อดิตยา เบอร์ล่า เคมีคัลส์ (ประเทศไทย) จำกัด(คลออัลคาลีดีวิชั่น)|151|Industrial|0.0224248|650.98|0.023|AMR
03-31-2020|0010000216|0030049389|บริษัท ไออาร์พีซี จำกัด (มหาชน)|151|Industrial|7.1712501|650.98|8.175|AMR
03-31-2020|0010000220|0030000249|บริษัท เอเชีย ซิลิโคนส์ โมโนเมอร์จำกัด|151|Industrial|3.4995808|650.98|3.736|AMR
03-31-2020|0010001125|0030039301|บริษัท ไทยโพลีอะซีทัล จำกัด|151|Industrial|0.0880042|650.98|0.08|AMR
03-31-2020|0010001727|0030020317|บริษัท ไทยเซ็นทรัลเคมี จำกัด (มหาชน)|152|Industrial-CoGen|0.505883|650.98|0.176|AMR
03-31-2020|0010001913|0030020312|บริษัท เหล่าธงสิงห์ จำกัด|151|Industrial|0.0301234|650.98|0.065|AMR
03-31-2020|0010002201|0030011779|บริษัท ควอลิตี้ คอฟฟี่ โปรดักท์ส จำกัด|151|Industrial|1.1685281|650.98|0.888|AMR
03-31-2020|0010002964|0030024050|บริษัท สยามบราเดอร์ จำกัด|151|Industrial|0.0971154|650.98|0.082|AMR
03-31-2020|0010006772|0030010740|บริษัท ไซเดน (ประเทศไทย) จำกัด|151|Industrial|0.0220363|650.98|0.018|AMR
03-31-2020|0010006894|0030020321|บริษัท อาร์ต อุตสาหกรรม จำกัด|151|Industrial|0.0000|650.98|0.028|AMR
03-31-2020|0010007151|0030011752|บริษัท เอ็มซีแอลเอส เอเชีย จำกัด|151|Industrial|1.0198532|650.98|0.964|AMR
03-31-2020|0010007766|0030013680|บริษัท อินโดรามา ปิโตรเคม จำกัด|152|Industrial-CoGen|3.6648889|650.98|3.50|AMR
03-31-2020|0010008289|0030015477|บริษัท ดี-รับเบอร์ โปรดักส์ จำกัด|151|Industrial|0.0475689|650.98|0.033|AMR
03-31-2020|0010008928|0030018387|บริษัท หลุยส์ผลิตภัณท์กาวเทป จำกัด|151|Industrial|0.3448833|650.98|0.342|AMR
03-31-2020|0010009151|0030019200|บริษัท ไทย เกลซ อุตสาหกรรม จำกัด|151|Industrial|0.171029|650.98|0.275|AMR
03-31-2020|0010009582|0030020738|บริษัท คอทโก้ พลาสติกส์ จำกัด|151|Industrial|0.0640608|650.98|0.059|AMR
03-31-2020|0010010156|0030022920|บริษัท ไทยเคมีภัณฑ์ จำกัด|151|Industrial|0.0634252|650.98|0.289|AMR
03-31-2020|0010010216|0030023098|บริษัท สยามพรีเสิร์ฟ ฟู้ดส์ จำกัด|151|Industrial|0.1721591|650.98|0.144|AMR
03-31-2020|0010011784|0030030288|บริษัท สยามเลเทกซ์ สังเคราะห์ จำกัด|151|Industrial|1.4135414|650.98|1.032|AMR
03-31-2020|0010012320|0030021481|บริษัท พีทีที โกลบอล เคมิคอล จำกัด(มหาชน)|151|Industrial|18.77464|650.98|23.712|ADQ
03-31-2020|0010015560|0030040907|บริษัท ลินเด้ ไฮโค จำกัด|151|Industrial|2.0118431|650.98|1.466|AMR
03-31-2020|0010021842|0030023236|บริษัท คอทโก้ เมททอลเวอร์คส จำกัด|151|Industrial|0.2256962|650.98|0.199|AMR
03-31-2020|0010022868|0030047048|บริษัท ไออาร์พีซี คลีน พาวเวอร์ จำกัด|151|Industrial|2.5969724|650.98|1.776|AMR
03-31-2020|0010024055|0030064939|บริษัท โอจีพี เอนเนอร์ยี่ โซลูชั่นส์ จำกัด (สำหรับ บริษัท ยามาดะ สมบูรณ์ จำกัด)|151|Industrial|0.12832|650.98|0.191|ADQ
03-31-2020|0010024055|0030064940|บริษัท โอจีพี เอนเนอร์ยี่ โซลูชั่นส์ จำกัด (สำหรับ บริษัท คันไซ เรซิน(ประเทศไทย) จำกัด)|151|Industrial|0.0662|650.98|0.10|ADQ
03-31-2020|0010024055|0030064941|บริษัท โอจีพี เอนเนอร์ยี่ โซลูชั่นส์ จำกัด (สำหรับ บริษัท นิปปอน สตีลไพพ์ (ประเทศไทย) จำกัด โรงงาน 1)|151|Industrial|0.08328|650.98|0.11|ADQ
03-31-2020|0010027459|0030011637|บริษัท โอสถสภา จำกัด (มหาชน)|151|Industrial|2.6052007|650.98|2.506|AMR
03-31-2020|0010027591|0030000157|บริษัท ซีพีเอฟ ฟู้ด แอนด์ เบฟเวอร์เรจ จำกัด|151|Industrial|0.2941714|650.98|0.004|AMR
03-31-2020|0010000001|0030000001|บริษัท กระจกลายสยาม จำกัด|151|Industrial|0.3060|650.98|0.328|ADQ
03-31-2020|0010000015|0030000015|บริษัท โคห์เลอร์ (ประเทศไทย) จำกัด(มหาชน)|151|Industrial|2.4901454|650.98|2.332|AMR
03-31-2020|0010000026|0030000026|บริษัท บางกอกแคน แมนนูแฟคเจอริ่ง จำกัด|151|Industrial|0.1482511|650.98|0.265|AMR
03-31-2020|0010000027|0030000027|บริษัท ฝาจีบ จำกัด (มหาชน)|152|Industrial-CoGen|0.4787613|650.98|0.372|AMR
03-31-2020|0010000038|0030000102|บริษัท สหโมเสคอุตสาหกรรม จำกัด (มหาชน)|151|Industrial|1.0192881|650.98|1.394|AMR
03-31-2020|0010000039|0030000039|บริษัท โสสุโก้ เซรามิค จำกัด|151|Industrial|1.9833088|650.98|1.97|AMR
03-31-2020|0010000054|0030000054|บริษัท บางกอก คริสตัล จำกัด|151|Industrial|0.8301073|650.98|0.842|AMR
03-31-2020|0010000056|0030000056|บริษัท โอเอสซี สยามซิลิกา จำกัด|151|Industrial|1.3385683|650.98|1.843|AMR
03-31-2020|0010000063|0030000063|บริษัท สยามมิชลิน จำกัด|151|Industrial|0.0000|650.98|0.20|AMR
03-31-2020|0010000063|0030000075|บริษัท สยามมิชลิน จำกัด|151|Industrial|0.0611297|650.98|0.077|AMR
03-31-2020|0010000076|0030000076|บริษัท สยามสไตรีนโมโนเมอร์ จำกัด|151|Industrial|2.6900619|650.98|3.23|AMR
03-31-2020|0010000086|0030000086|บริษัท สยามคอมเพรสเซอร์อุตสาหกรรม จำกัด|151|Industrial|0.1643546|650.98|0.144|AMR
03-31-2020|0010000088|0030000088|บริษัท ไทยฟิล์มอินดัสตรี่ จำกัด (มหาชน)|151|Industrial|0.0000|650.98|0.016|AMR
03-31-2020|0010000099|0030000099|บริษัท เกรท วอลล์ มอเตอร์ แมนูแฟคเจอริ่ง (ประเทศไทย) จำกัด|151|Industrial|0.0000|650.98|0.259|AMR
03-31-2020|0010000111|0030000115|บริษัท อิวอนิก ยูไนเต็ด ซิลิกา (สยาม) จำกัด|151|Industrial|0.8385122|650.98|0.683|AMR
03-31-2020|0010000113|0030000117|บริษัท คาร์ดิแนล เฮลท์ 222 (ประเทศไทย) จำกัด|151|Industrial|1.2946369|650.98|1.512|AMR
03-31-2020|0010000123|0030000127|บริษัท สยามซานิทารีแวร์อินดัสทรี (หนองแค) จำกัด|151|Industrial|0.3781851|650.98|0.532|AMR
03-31-2020|0010000125|0030000129|บริษัท อาร์พีที เอเซีย จำกัด|151|Industrial|0.0356325|650.98|0.036|AMR
03-31-2020|0010000136|0030000141|บริษัท ยูเนี่ยนไทย-นิจิบัน จำกัด|151|Industrial|0.5212096|650.98|0.365|AMR
03-31-2020|0010000137|0030000142|บริษัท วาลเมท จำกัด|151|Industrial|0.0012713|650.98|0.006|AMR
03-31-2020|0010000146|0030000151|บริษัท จีเอฟพีที จำกัด (มหาชน)|151|Industrial|0.4092973|650.98|0.505|AMR
03-31-2020|0010000147|0030000152|บริษัท แมคคีย์ ฟู้ด เซอร์วิสเซส (ประเทศไทย) จำกัด|151|Industrial|0.3137711|650.98|0.289|AMR
03-31-2020|0010000156|0030000162|บริษัท เวลโกรว์กล๊าส อินดัสทรี จำกัด|151|Industrial|1.760014|650.98|1.841|AMR
03-31-2020|0010000157|0030000163|บริษัท ไทยอะครีลิค จำกัด|151|Industrial|0.0000|650.98|0.005|AMR
03-31-2020|0010000191|0030043704|บริษัท ศักดิ์ไชยสิทธิ จำกัด|151|Industrial|0.0147615|650.98|0.752|AMR
03-31-2020|0010000192|0030043881|บริษัท แอร์ ลิควิด (ประเทศไทย) จำกัด|151|Industrial|2.35376|650.98|2.547|AMR
03-31-2020|0010000216|0030030499|บริษัท ไออาร์พีซี จำกัด (มหาชน)|152|Industrial-CoGen|51.7948471|650.98|50.675|FlowComp
03-31-2020|0010000228|0030000254|บริษัท ไทย เพ็ท เรซิน จำกัด|151|Industrial|1.0645616|650.98|1.084|AMR
03-31-2020|0010001217|0030021463|บริษัท แอมคอล อินเตอร์เนชั่นแนล (ไทยแลนด์) จำกัด|151|Industrial|0.0941136|650.98|0.074|AMR
03-31-2020|0010001431|0030053506|บริษัท คาราบาวตะวันแดง จำกัด|151|Industrial|0.3173025|650.98|0.24|AMR
03-31-2020|0010001488|0030016945|บริษัท โพลีเพล็กซ์ (ประเทศไทย) จำกัด (มหาชน)|151|Industrial|1.1856557|650.98|1.11|AMR
03-31-2020|0010001747|0030042303|บริษัท สุนทรเมทัลอินดัสทรี้ส์ จำกัด|151|Industrial|0.5487551|650.98|0.383|AMR
03-31-2020|0010002094|0030018793|บริษัท พ้อตเตอร์ส (ประเทศไทย) จำกัด|151|Industrial|0.3169494|650.98|0.185|AMR
03-31-2020|0010002109|0030030514|บริษัท ลักกี้กลาส จำกัด|151|Industrial|0.7985359|650.98|0.704|AMR
03-31-2020|0010006748|0030010640|บริษัท ยูเนี่ยนโชจิรุชิ จำกัด|151|Industrial|0.0120069|650.98|0.014|AMR
03-31-2020|0010006755|0030027897|บริษัท ปูนซิเมนต์ไทย (ท่าหลวง) จำกัด|151|Industrial|0.0000|650.98|0.03|AMR
03-31-2020|0010006940|0030011137|บริษัท เอส ที บี เท็กซ์ไทล์ อินดัสตรี จำกัด|151|Industrial|0.0281458|650.98|0.04|AMR
03-31-2020|0010006972|0030011249|บริษัท สยาม ยามาโมริ จำกัด|151|Industrial|0.0168804|650.98|0.024|AMR
03-31-2020|0010007812|0030013764|บริษัท กรุงเทพสลักภัณฑ์ จำกัด|151|Industrial|0.1154437|650.98|0.068|AMR
03-31-2020|0010007875|0030013765|บริษัท วนชัย เคมีคอล อินดัสทรี่ส์จำกัด|151|Industrial|0.0638489|650.98|0.126|AMR
03-31-2020|0010008509|0030044231|บริษัท ผลิตภัณฑ์ตราเพชร จำกัด (มหาชน)|151|Industrial|0.4241295|650.98|0.348|AMR
03-31-2020|0010009357|0030020016|บริษัท ซีพี-เมจิ จำกัด|152|Industrial-CoGen|0.4129347|650.98|0.345|AMR
03-31-2020|0010009357|0030020016|บริษัท ซีพี-เมจิ จำกัด|151|Industrial|0.4239882|650.98|0.458|AMR
03-31-2020|0010010116|0030022714|บริษัท ยัสปาลแอนด์ซันส์ จำกัด|151|Industrial|0.0521244|650.98|0.083|AMR
03-31-2020|0010011367|0030027987|บริษัท มิลลิเมด จำกัด|151|Industrial|0.0474629|650.98|0.031|AMR
03-31-2020|0010012227|0030032353|บริษัท เอ็มทีพี เอชพี เจวี (ประเทศไทย) จำกัด|151|Industrial|7.0696497|650.98|7.239|AMR
03-31-2020|0010012361|0030033177|บริษัท โตโต้ (ประเทศไทย) จำกัด|151|Industrial|0.7451754|650.98|0.752|AMR
03-31-2020|0010012393|0030033336|บริษัท จรุงไทยไวร์แอนด์เคเบิ้ล จำกัด (มหาชน)|151|Industrial|0.0000|650.98|0.134|AMR
03-31-2020|0010021117|0030022988|บริษัท ซีพีเอฟ (ประเทศไทย) จำกัด(มหาชน)|152|Industrial-CoGen|0.0000|650.98|0.068|AMR
03-31-2020|0010021910|0030042490|บริษัท คาเนมิทสึ พูลเล่ย์ จำกัด|151|Industrial|0.0100646|650.98|0.008|AMR
03-31-2020|0010022253|0030043488|บริษัท ที.ที.เซรามิค จำกัด (มหาชน)|151|Industrial|1.1881277|650.98|0.821|AMR
03-31-2020|0010023436|0030052175|บริษัท ซันโทรี่ เป๊ปซี่โค เบเวอเรจ(ประเทศไทย) จำกัด|151|Industrial|0.1067916|650.98|0.165|AMR
03-31-2020|0010023548|0030000131|บริษัท โคเวสโตร (ประเทศไทย) จำกัด|151|Industrial|0.378962|650.98|0.48|AMR
03-31-2020|0010026372|0030024061|บริษัท เคมีแมน จำกัด (มหาชน)|151|Industrial|1.5220282|650.98|1.504|AMR
03-31-2020|0010027861|0030000018|บริษัท เอสซีจี เซรามิกส์ จำกัด (มหาชน)|151|Industrial|1.5852062|650.98|2.504|AMR
03-31-2020|0010000006|0030000006|บริษัท ธนอินเตอร์ จำกัด|151|Industrial|0.0000|650.98|0.008|AMR
03-31-2020|0010000007|0030000007|บริษัท บี เอ็น เอส เอส สตีลกรุ๊ป จำกัด|151|Industrial|0.2952662|650.98|0.681|AMR
03-31-2020|0010000022|0030000022|บริษัท ไทยบริดจสโตน จำกัด|151|Industrial|0.0000|650.98|0.735|AMR
03-31-2020|0010000033|0030000104|บริษัท โรแยล ซีรามิค อุตสาหกรรม จำกัด (มหาชน)|151|Industrial|2.023391|650.98|1.91|AMR
03-31-2020|0010000041|0030000041|บริษัท สยามอุตสาหกรรมยิปซัม (สระบุรี) จำกัด|151|Industrial|3.4575563|650.98|2.884|AMR
03-31-2020|0010000056|0030000059|บริษัท โอเอสซี สยามซิลิกา จำกัด|151|Industrial|1.6643464|650.98|1.536|AMR
03-31-2020|0010000067|0030000067|บริษัท มิลล์คอน บูรพา จำกัด|151|Industrial|1.6371188|650.98|1.024|AMR
03-31-2020|0010000082|0030000082|บริษัท สยามโทซู เซรามิกส์ จำกัด|151|Industrial|0.0000|650.98|0.047|AMR
03-31-2020|0010000083|0030000083|บริษัท เอจีซี แฟลทกลาส (ประเทศไทย)จำกัด (มหาชน)|151|Industrial|3.0059872|650.98|2.992|AMR
03-31-2020|0010000092|0030000092|บริษัท ไทย-สแกนดิค สตีล จำกัด|151|Industrial|0.0656147|650.98|0.065|AMR
03-31-2020|0010000093|0030000093|บริษัท จีซี-เอ็ม พีทีเอ จำกัด|151|Industrial|2.7907794|650.98|2.60|AMR
03-31-2020|0010000108|0030000112|บริษัท ยูนิตี้ อินดัสเตรียล จำกัด|151|Industrial|0.0367272|650.98|0.019|AMR
03-31-2020|0010000109|0030000113|บริษัท ระยองไวร์ อินดัสตรีส์ จำกัด(มหาชน)|151|Industrial|0.0122188|650.98|0.013|AMR
03-31-2020|0010000116|0030034491|บริษัท มิตซูบิชิ มอเตอร์ส (ประเทศไทย) จำกัด|151|Industrial|0.1623063|650.98|0.147|AMR
03-31-2020|0010000117|0030000121|บริษัท ไทยซิลิเกตเคมิคัล จำกัด|151|Industrial|0.7289307|650.98|0.714|AMR
03-31-2020|0010000131|0030000136|บริษัท การ์เดียนอินดัสทรีส์ ระยองจำกัด|151|Industrial|3.633035|650.98|3.212|AMR
03-31-2020|0010000132|0030000137|บริษัท การ์เดียนอินดัสทรีส์ คอร์ปจำกัด|151|Industrial|3.6845945|650.98|3.698|AMR
03-31-2020|0010000144|0030000149|บริษัท เบอร์ลี่ ยุคเกอร์ เซลล็อกซ์จำกัด|151|Industrial|0.4781257|650.98|0.45|AMR
03-31-2020|0010000145|0030000150|บริษัท แสตนดาร์ดแคน จำกัด|151|Industrial|0.3467903|650.98|0.281|AMR
03-31-2020|0010000158|0030000164|บริษัท นิวพลัสนิตติ้ง จำกัด (มหาชน)|151|Industrial|0.0000|650.98|0.007|AMR
03-31-2020|0010000197|0030025358|บริษัท บางจาก คอร์ปอเรชั่น จำกัด (มหาชน)|151|Industrial|18.853075|650.98|23.00|FlowComp
03-31-2020|0010000221|0030011437|บริษัท วีนิไทย จำกัด (มหาชน)|151|Industrial|2.5503216|650.98|2.544|AMR
03-31-2020|0010000224|0030000250|บริษัท ออมโนวา เอ็นจิเนียร์ด เซอร์เฟสเซส (ประเทศไทย) จำกัด|151|Industrial|0.3082267|650.98|0.243|AMR
03-31-2020|0010000916|0030044950|บริษัท ดาน่า สไปเซอร์ (ประเทศไทย) จำกัด|151|Industrial|0.0123954|650.98|0.079|AMR
03-31-2020|0010000925|0030022478|บริษัท ไทยสตีลโปรไฟล์ จำกัด (มหาชน)|151|Industrial|0.9437147|650.98|1.001|AMR
03-31-2020|0010001605|0030051931||151|Industrial|0.0000|650.98|0.223|AMR
03-31-2020|0010001609|0030015621|บริษัท โตโยต้า มอเตอร์ ประเทศไทย จำกัด|151|Industrial|0.6123568|650.98|0.478|AMR
03-31-2020|0010001922|0030022692|บริษัท ฟู้ดแอนด์ดริ๊งส์ จำกัด (มหาชน)|151|Industrial|0.1720|650.98|0.169|ADQ
03-31-2020|0010003009|0030053395|บริษัท มิตซูบิชิ อีเล็คทริค คอนซูมเมอร์ โปรดักส์ (ประเทศไทย) จำกัด|158|NG by Truck|0.01934|650.98|0.019|ADQ
03-31-2020|0010006922|0030011105|บริษัท อายิโนะโมะโต๊ะ (ประเทศไทย)จำกัด|151|Industrial|0.0000|650.98|0.069|AMR
03-31-2020|0010006922|0030020406|บริษัท อายิโนะโมะโต๊ะ (ประเทศไทย)จำกัด|152|Industrial-CoGen|3.6374847|650.98|0.069|AMR
03-31-2020|0010007330|0030013313|บริษัท โกรเวล แอบเบรซีพ (ไทยแลนด์)จำกัด|151|Industrial|0.0189639|650.98|0.042|AMR
03-31-2020|0010007489|0030043669|บจ.ไซมีส เมอร์ชานไดส์|151|Industrial|0.0000|650.98|0.001|AMR
03-31-2020|0010008022|0030033708|บริษัท สยามอุตสาหกรรมเกษตรอาหารจำกัด (มหาชน)|151|Industrial|0.2208228|650.98|0.08|AMR
03-31-2020|0010008606|0030016564|บริษัท ซังโกะ ไดคาชติ้ง (ประเทศไทย)จำกัด (มหาชน)|151|Industrial|0.2162319|650.98|0.183|AMR
03-31-2020|0010008657|0030016715|บริษัท คิริว (ประเทศไทย) จำกัด|151|Industrial|0.0230604|650.98|0.035|AMR
03-31-2020|0010009085|0030056942|บจ.แดรี่ พลัส|151|Industrial|0.871037|650.98|0.663|AMR
03-31-2020|0010009093|0030019105|บริษัท ยูเนียน ออโตพาร์ทส มานูแฟคเชอริ่ง จำกัด|151|Industrial|0.1142783|650.98|0.099|AMR
03-31-2020|0010009392|0030020182|บริษัท มิตร สตีล จำกัด|151|Industrial|0.0000|650.98|0.046|AMR
03-31-2020|0010009442|0030020288|บริษัท อายิโนะโมะโต๊ะเซลส์ (ประเทศไทย) จำกัด|151|Industrial|0.0000|650.98|0.051|AMR
03-31-2020|0010009841|0030021637|บริษัท โอวาริ เซกิ (ไทยแลนด์) จำกัด|151|Industrial|0.004273|650.98|0.006|AMR
03-31-2020|0010010998|0030026291|บริษัท งามดีอุตสาหกรรม จำกัด|151|Industrial|0.1007175|650.98|0.073|AMR
03-31-2020|0010012118|0030062578|บริษัท พีทีที แอลเอ็นจี จำกัด|152|Industrial-CoGen|3.0572853|650.98|1.536|FlowComp
03-31-2020|0010012146|0030032044||151|Industrial|0.850166|650.98|0.704|AMR
